projects/hipblaslt/library/src/amd_detail/rocblaslt/src/Tensile/Logic/asm_full/aquavanjaram/gfx942/GridBased/aquavanjaram_Cijk_Alik_Bljk_F8NHS_STA_BH_BiasSH_HAS_SAB_SAV_UserArgs.yaml
- {MinimumRequiredVersion: 4.33.0}
- aquavanjaram
- gfx942
- [Device 0049, Device 0050]
    SolutionIndex: 0
    SolutionNameMin: Cijk_Alik_Bljk_F8NHS_STA_BH_BiasSH_HAS_SAB_SAV_UserArgs_MT64x16x128_MI16x16x1_SN_GSU1_GSUC0_GSUWGMRR0_K1_LBSPPB128_MIWT1_1_NLCA2_PLR1_SU0_SUM0_SUS0_VWB1_WG64_4_1_WGM8_WGMXCC8_WGMXCCGn1
    SolutionIndex: 1
    SolutionNameMin: Cijk_Alik_Bljk_F8NHS_STA_BH_BiasSH_HAS_SAB_SAV_UserArgs_MT64x16x128_MI16x16x1_SN_GSU1_GSUC0_GSUWGMRR0_K1_LBSPPB128_MIWT1_1_NLCA2_PLR2_SU0_SUM0_SUS0_VWB1_WG64_4_1_WGM8_WGMXCC8_WGMXCCGn1
    SolutionIndex: 2
    SolutionNameMin: Cijk_Alik_Bljk_F8NHS_STA_BH_BiasSH_HAS_SAB_SAV_UserArgs_MT128x16x128_MI16x16x1_SN_GSU1_GSUC0_GSUWGMRR0_K1_LBSPPB128_MIWT2_1_NLCA2_PLR2_SU0_SUM0_SUS0_VWB1_WG64_4_1_WGM8_WGMXCC8_WGMXCCGn1
    SolutionIndex: 3
    SolutionNameMin: Cijk_Alik_Bljk_F8NHS_STA_BH_BiasSH_HAS_SAB_SAV_UserArgs_MT128x128x128_MI16x16x1_SN_GSU1_GSUC0_GSUWGMRR0_K1_LBSPPB1024_MIWT2_8_NLCA2_PLR1_SU0_SUM0_SUS0_VWB8_WG64_4_1_WGM8_WGMXCC8_WGMXCCGn1
    SolutionIndex: 4
    SolutionNameMin: Cijk_Alik_Bljk_F8NHS_STA_BH_BiasSH_HAS_SAB_SAV_UserArgs_MT128x128x128_MI16x16x1_SN_GSU1_GSUC0_GSUWGMRR0_K1_LBSPPB1024_MIWT2_8_NLCA2_PLR2_SU0_SUM0_SUS0_VWB8_WG64_4_1_WGM8_WGMXCC8_WGMXCCGn1
    SolutionIndex: 5
    SolutionNameMin: Cijk_Alik_Bljk_F8NHS_STA_BH_BiasSH_HAS_SAB_SAV_UserArgs_MT512x128x128_MI16x16x1_SN_GSU1_GSUC0_GSUWGMRR0_K1_LBSPPB1024_MIWT8_8_NLCA2_PLR1_SU0_SUM0_SUS0_VWB8_WG64_4_1_WGM8_WGMXCC8_WGMXCCGn1
    SolutionIndex: 6
    SolutionNameMin: Cijk_Alik_Bljk_F8NHS_STA_BH_BiasSH_HAS_SAB_SAV_UserArgs_MT160x128x128_MI16x16x1_SN_GSU1_GSUC0_GSUWGMRR0_K1_LBSPPB1024_MIWT5_8_NLCA2_PLR1_SU0_SUM0_SUS0_VWB8_WG32_4_1_WGM8_WGMXCC8_WGMXCCGn1
    SolutionIndex: 7
    SolutionNameMin: Cijk_Alik_Bljk_F8NHS_STA_BH_BiasSH_HAS_SAB_SAV_UserArgs_MT48x16x256_MI16x16x1_SN_LDSB0_GRVWB16_GSU1_GSUAMB_GSUC0_GSUWGMRR0_K1_LBSPPB256_MIWT3_1_NLCA4_SU16_SUM0_SUS256_VWB1_WG16_4_1_WGM8_WGMXCC8_WGMXCCG304
    SolutionIndex: 8
    SolutionNameMin: Cijk_Alik_Bljk_F8NHS_STA_BH_BiasSH_HAS_SAB_SAV_UserArgs_MT64x32x256_MI16x16x1_SN_LDSB0_GRVWB16_GSU1_GSUAMB_GSUC0_GSUWGMRR0_K1_LBSPPB512_MIWT1_2_NLCA4_SU16_SUM0_SUS256_VWB2_WG64_4_1_WGM8_WGMXCC8_WGMXCCG304
    SolutionIndex: 9
    SolutionNameMin: Cijk_Alik_Bljk_F8NHS_STA_BH_BiasSH_HAS_SAB_SAV_UserArgs_MT128x48x256_MI16x16x1_SN_LDSB0_GRVWB16_GSU1_GSUAMB_GSUC0_GSUWGMRR0_K1_LBSPPB256_MIWT2_3_NLCA4_SU16_SUM0_SUS256_VWB1_WG64_4_1_WGM8_WGMXCC8_WGMXCCG304
    SolutionIndex: 10
    SolutionNameMin: Cijk_Alik_Bljk_F8NHS_STA_BH_BiasSH_HAS_SAB_SAV_UserArgs_MT128x64x256_MI16x16x1_SN_LDSB1_GRVWB16_GSU1_GSUAMB_GSUC0_GSUWGMRR0_K1_LBSPPB1024_MIWT2_4_NLCA4_SU16_SUM0_SUS256_VWB4_WG64_4_1_WGM8_WGMXCC8_WGMXCCG304
    SolutionIndex: 11
    SolutionNameMin: Cijk_Alik_Bljk_F8NHS_STA_BH_BiasSH_HAS_SAB_SAV_UserArgs_MT128x80x256_MI16x16x1_SN_LDSB1_GRVWB16_GSU1_GSUAMB_GSUC0_GSUWGMRR0_K1_LBSPPB256_MIWT2_5_NLCA4_SU16_SUM0_SUS256_VWB1_WG64_4_1_WGM8_WGMXCC8_WGMXCCG304
    SolutionIndex: 12
    SolutionNameMin: Cijk_Alik_Bljk_F8NHS_STA_BH_BiasSH_HAS_SAB_SAV_UserArgs_MT128x96x256_MI16x16x1_SN_LDSB1_GRVWB16_GSU1_GSUAMB_GSUC0_GSUWGMRR0_K1_LBSPPB512_MIWT2_6_NLCA4_SU16_SUM0_SUS256_VWB2_WG64_4_1_WGM8_WGMXCC8_WGMXCCG304
    SolutionIndex: 13
    SolutionNameMin: Cijk_Alik_Bljk_F8NHS_STA_BH_BiasSH_HAS_SAB_SAV_UserArgs_MT128x112x256_MI16x16x1_SN_LDSB1_GRVWB16_GSU1_GSUAMB_GSUC0_GSUWGMRR0_K1_LBSPPB256_MIWT2_7_NLCA4_SU16_SUM0_SUS256_VWB1_WG64_4_1_WGM8_WGMXCC8_WGMXCCG304
    SolutionIndex: 14
    SolutionNameMin: Cijk_Alik_Bljk_F8NHS_STA_BH_BiasSH_HAS_SAB_SAV_UserArgs_MT192x64x256_MI16x16x1_SN_LDSB1_GRVWB16_GSU1_GSUAMB_GSUC0_GSUWGMRR0_K1_LBSPPB1024_MIWT3_4_NLCA4_SU16_SUM0_SUS256_VWB4_WG64_4_1_WGM8_WGMXCC8_WGMXCCG304
    SolutionIndex: 15
    SolutionNameMin: Cijk_Alik_Bljk_F8NHS_STA_BH_BiasSH_HAS_SAB_SAV_UserArgs_MT192x80x256_MI16x16x1_SN_LDSB1_GRVWB16_GSU1_GSUAMB_GSUC0_GSUWGMRR0_K1_LBSPPB256_MIWT3_5_NLCA4_SU16_SUM0_SUS256_VWB1_WG64_4_1_WGM8_WGMXCC8_WGMXCCG304
    SolutionIndex: 16
    SolutionNameMin: Cijk_Alik_Bljk_F8NHS_STA_BH_BiasSH_HAS_SAB_SAV_UserArgs_MT192x96x128_MI16x16x1_SN_LDSB0_GRVWB16_GSU1_GSUAMB_GSUC0_GSUWGMRR0_K1_LBSPPB256_MIWT3_6_NLCA2_SU16_SUM0_SUS256_VWB2_WG64_4_1_WGM8_WGMXCC8_WGMXCCG304
    SolutionIndex: 17
    SolutionNameMin: Cijk_Alik_Bljk_F8NHS_STA_BH_BiasSH_HAS_SAB_SAV_UserArgs_MT192x112x128_MI16x16x1_SN_LDSB1_GRVWB8_GSU1_GSUAMB_GSUC0_GSUWGMRR0_K1_LBSPPB128_MIWT3_7_NLCA2_SU16_SUM0_SUS256_VWB1_WG64_4_1_WGM8_WGMXCC8_WGMXCCG304
    SolutionIndex: 18
    SolutionNameMin: Cijk_Alik_Bljk_F8NHS_STA_BH_BiasSH_HAS_SAB_SAV_UserArgs_MT320x80x128_MI16x16x1_SN_LDSB0_GRVWB8_GSU1_GSUAMB_GSUC0_GSUWGMRR0_K1_LBSPPB128_MIWT5_5_NLCA2_SU16_SUM0_SUS256_VWB1_WG64_4_1_WGM8_WGMXCC8_WGMXCCG304
    SolutionIndex: 19
    SolutionNameMin: Cijk_Alik_Bljk_F8NHS_STA_BH_BiasSH_HAS_SAB_SAV_UserArgs_MT192x128x128_MI16x16x1_SN_LDSB1_GRVWB16_GSU1_GSUAMB_GSUC0_GSUWGMRR0_K1_LBSPPB1024_MIWT3_8_NLCA2_SU16_SUM0_SUS256_VWB8_WG64_4_1_WGM8_WGMXCC8_WGMXCCG304
    SolutionIndex: 20
    SolutionNameMin: Cijk_Alik_Bljk_F8NHS_STA_BH_BiasSH_HAS_SAB_SAV_UserArgs_MT192x144x128_MI16x16x1_SN_LDSB1_GRVWB8_GSU1_GSUAMB_GSUC0_GSUWGMRR0_K1_LBSPPB128_MIWT3_9_NLCA2_SU16_SUM0_SUS256_VWB1_WG64_4_1_WGM8_WGMXCC8_WGMXCCG304
    SolutionIndex: 21
    SolutionNameMin: Cijk_Alik_Bljk_F8NHS_STA_BH_BiasSH_HAS_SAB_SAV_UserArgs_MT192x80x128_MI16x16x1_SN_LDSB0_GRVWB8_GSU1_GSUAMB_GSUC0_GSUWGMRR0_K1_LBSPPB128_MIWT3_5_NLCA2_SU16_SUM0_SUS256_VWB1_WG64_4_1_WGM8_WGMXCC8_WGMXCCG304
    SolutionIndex: 22
    SolutionNameMin: Cijk_Alik_Bljk_F8NHS_STA_BH_BiasSH_HAS_SAB_SAV_UserArgs_MT320x112x128_MI16x16x1_SN_LDSB0_GRVWB8_GSU1_GSUAMB_GSUC0_GSUWGMRR0_K1_LBSPPB128_MIWT5_7_NLCA2_SU16_SUM0_SUS256_VWB1_WG64_4_1_WGM8_WGMXCC8_WGMXCCG304
    SolutionIndex: 23
    SolutionNameMin: Cijk_Alik_Bljk_F8NHS_STA_BH_BiasSH_HAS_SAB_SAV_UserArgs_MT192x176x128_MI16x16x1_SN_LDSB0_GRVWB8_GSU1_GSUAMB_GSUC0_GSUWGMRR0_K1_LBSPPB128_MIWT3_11_NLCA2_SU16_SUM0_SUS256_VWB1_WG64_4_1_WGM8_WGMXCC8_WGMXCCG304
    SolutionIndex: 24
    SolutionNameMin: Cijk_Alik_Bljk_F8NHS_STA_BH_BiasSH_HAS_SAB_SAV_UserArgs_MT256x80x128_MI16x16x1_SN_LDSB0_GRVWB8_GSU1_GSUAMB_GSUC0_GSUWGMRR0_K1_LBSPPB128_MIWT4_5_NLCA2_SU16_SUM0_SUS256_VWB1_WG64_4_1_WGM8_WGMXCC8_WGMXCCG304
    SolutionIndex: 25
    SolutionNameMin: Cijk_Alik_Bljk_F8NHS_STA_BH_BiasSH_HAS_SAB_SAV_UserArgs_MT192x208x128_MI16x16x1_SN_LDSB1_GRVWB8_GSU1_GSUAMB_GSUC0_GSUWGMRR0_K1_LBSPPB128_MIWT3_13_NLCA2_SU16_SUM0_SUS256_VWB1_WG64_4_1_WGM8_WGMXCC8_WGMXCCG304
    SolutionIndex: 26
    SolutionNameMin: Cijk_Alik_Bljk_F8NHS_STA_BH_BiasSH_HAS_SAB_SAV_UserArgs_MT256x96x128_MI16x16x1_SN_LDSB0_GRVWB16_GSU1_GSUAMB_GSUC0_GSUWGMRR0_K1_LBSPPB256_MIWT4_6_NLCA2_SU16_SUM0_SUS256_VWB2_WG64_4_1_WGM8_WGMXCC8_WGMXCCG304
    SolutionIndex: 27
    SolutionNameMin: Cijk_Alik_Bljk_F8NHS_STA_BH_BiasSH_HAS_SAB_SAV_UserArgs_MT320x192x128_MI16x16x1_SN_LDSB0_GRVWB16_GSU1_GSUAMB_GSUC0_GSUWGMRR0_K1_LBSPPB512_MIWT5_12_NLCA2_SU16_SUM0_SUS256_VWB4_WG64_4_1_WGM8_WGMXCC8_WGMXCCG304
    SolutionIndex: 28
    SolutionNameMin: Cijk_Alik_Bljk_F8NHS_STA_BH_BiasSH_HAS_SAB_SAV_UserArgs_MT128x160x128_MI16x16x1_SN_LDSB1_GRVWB16_GSU1_GSUAMB_GSUC0_GSUWGMRR0_K1_LBSPPB256_MIWT2_10_NLCA2_SU16_SUM0_SUS256_VWB2_WG64_4_1_WGM8_WGMXCC8_WGMXCCG304
    SolutionIndex: 29
    SolutionNameMin: Cijk_Alik_Bljk_F8NHS_STA_BH_BiasSH_HAS_SAB_SAV_UserArgs_MT256x160x128_MI16x16x1_SN_LDSB0_GRVWB16_GSU1_GSUAMB_GSUC0_GSUWGMRR0_K1_LBSPPB256_MIWT4_10_NLCA2_SU16_SUM0_SUS256_VWB2_WG64_4_1_WGM8_WGMXCC8_WGMXCCG304
    SolutionIndex: 30
    SolutionNameMin: Cijk_Alik_Bljk_F8NHS_STA_BH_BiasSH_HAS_SAB_SAV_UserArgs_MT192x224x128_MI16x16x1_SN_LDSB0_GRVWB16_GSU1_GSUAMB_GSUC0_GSUWGMRR0_K1_LBSPPB256_MIWT3_14_NLCA2_SU16_SUM0_SUS256_VWB2_WG64_4_1_WGM8_WGMXCC8_WGMXCCG304
    SolutionIndex: 31
    SolutionNameMin: Cijk_Alik_Bljk_F8NHS_STA_BH_BiasSH_HAS_SAB_SAV_UserArgs_MT192x160x128_MI16x16x1_SN_LDSB1_GRVWB16_GSU1_GSUAMB_GSUC0_GSUWGMRR0_K1_LBSPPB256_MIWT3_10_NLCA2_SU16_SUM0_SUS256_VWB2_WG64_4_1_WGM8_WGMXCC8_WGMXCCG304
    SolutionIndex: 32
    SolutionNameMin: Cijk_Alik_Bljk_F8NHS_STA_BH_BiasSH_HAS_SAB_SAV_UserArgs_MT256x192x128_MI16x16x1_SN_LDSB0_GRVWB16_GSU1_GSUAMB_GSUC0_GSUWGMRR0_K1_LBSPPB512_MIWT4_12_NLCA2_SU16_SUM0_SUS256_VWB4_WG64_4_1_WGM8_WGMXCC8_WGMXCCG304
    SolutionIndex: 33
    SolutionNameMin: Cijk_Alik_Bljk_F8NHS_STA_BH_BiasSH_HAS_SAB_SAV_UserArgs_MT192x256x128_MI16x16x1_SN_LDSB1_GRVWB16_GSU1_GSUAMB_GSUC0_GSUWGMRR0_K1_LBSPPB2048_MIWT3_16_NLCA2_SU16_SUM0_SUS256_VWB16_WG64_4_1_WGM8_WGMXCC8_WGMXCCG304
    SolutionIndex: 34
    SolutionNameMin: Cijk_Alik_Bljk_F8NHS_STA_BH_BiasSH_HAS_SAB_SAV_UserArgs_MT256x224x128_MI16x16x1_SN_LDSB0_GRVWB16_GSU1_GSUAMB_GSUC0_GSUWGMRR0_K1_LBSPPB256_MIWT4_14_NLCA2_SU16_SUM0_SUS256_VWB2_WG64_4_1_WGM8_WGMXCC8_WGMXCCG304
    SolutionIndex: 35
    SolutionNameMin: Cijk_Alik_Bljk_F8NHS_STA_BH_BiasSH_HAS_SAB_SAV_UserArgs_MT192x192x128_MI16x16x1_SN_LDSB0_GRVWB16_GSU1_GSUAMB_GSUC0_GSUWGMRR0_K1_LBSPPB512_MIWT3_12_NLCA2_SU16_SUM0_SUS256_VWB4_WG64_4_1_WGM8_WGMXCC8_WGMXCCG304
    SolutionIndex: 36
    SolutionNameMin: Cijk_Alik_Bljk_F8NHS_STA_BH_BiasSH_HAS_SAB_SAV_UserArgs_MT256x176x128_MI16x16x1_SN_LDSB0_GRVWB8_GSU1_GSUAMB_GSUC0_GSUWGMRR0_K1_LBSPPB128_MIWT4_11_NLCA2_SU16_SUM0_SUS256_VWB1_WG64_4_1_WGM8_WGMXCC8_WGMXCCG304
    SolutionIndex: 37
    SolutionNameMin: Cijk_Alik_Bljk_F8NHS_STA_BH_BiasSH_HAS_SAB_SAV_UserArgs_MT256x208x128_MI16x16x1_SN_LDSB1_GRVWB8_GSU1_GSUAMB_GSUC0_GSUWGMRR0_K1_LBSPPB128_MIWT4_13_NLCA2_SU16_SUM0_SUS256_VWB1_WG64_4_1_WGM8_WGMXCC8_WGMXCCG304
    SolutionIndex: 38
    SolutionNameMin: Cijk_Alik_Bljk_F8NHS_STA_BH_BiasSH_HAS_SAB_SAV_UserArgs_MT256x224x128_MI16x16x1_SN_LDSB0_GRVWB16_GSU1_GSUAMB_GSUC0_GSUWGMRR0_K1_LBSPPB256_MIWT4_14_NLCA2_SU16_SUM0_SUS256_VWB2_WG64_4_1_WGM8_WGMXCC8_WGMXCCG304
    SolutionIndex: 39
    SolutionNameMin: Cijk_Alik_Bljk_F8NHS_STA_BH_BiasSH_HAS_SAB_SAV_UserArgs_MT320x192x128_MI16x16x1_SN_LDSB0_GRVWB16_GSU1_GSUAMB_GSUC0_GSUWGMRR0_K1_LBSPPB512_MIWT5_12_NLCA2_SU16_SUM0_SUS256_VWB4_WG64_4_1_WGM8_WGMXCC8_WGMXCCG304
    SolutionIndex: 40
    SolutionNameMin: Cijk_Alik_Bljk_F8NHS_STA_BH_BiasSH_HAS_SAB_SAV_UserArgs_MT320x160x128_MI16x16x1_SN_LDSB0_GRVWB16_GSU1_GSUAMB_GSUC0_GSUWGMRR0_K1_LBSPPB256_MIWT5_10_NLCA2_SU16_SUM0_SUS256_VWB2_WG64_4_1_WGM8_WGMXCC8_WGMXCCG304
    SolutionIndex: 41
    SolutionNameMin: Cijk_Alik_Bljk_F8NHS_STA_BH_BiasSH_HAS_SAB_SAV_UserArgs_MT192x224x128_MI16x16x1_SN_LDSB0_GRVWB16_GSU1_GSUAMB_GSUC0_GSUWGMRR0_K1_LBSPPB256_MIWT3_14_NLCA2_SU16_SUM0_SUS256_VWB2_WG64_4_1_WGM8_WGMXCC8_WGMXCCG304
    SolutionIndex: 42
    SolutionNameMin: Cijk_Alik_Bljk_F8NHS_STA_BH_BiasSH_HAS_SAB_SAV_UserArgs_MT384x160x128_MI16x16x1_SN_LDSB0_GRVWB16_GSU1_GSUAMB_GSUC0_GSUWGMRR0_K1_LBSPPB256_MIWT6_10_NLCA2_SU16_SUM0_SUS256_VWB2_WG64_4_1_WGM8_WGMXCC8_WGMXCCG304
    SolutionIndex: 43
    SolutionNameMin: Cijk_Alik_Bljk_F8NHS_STA_BH_BiasSH_HAS_SAB_SAV_UserArgs_MT256x128x128_MI16x16x1_SN_LDSB1_GRVWB16_GSU1_GSUAMB_GSUC0_GSUWGMRR0_K1_LBSPPB1024_MIWT4_8_NLCA2_SU16_SUM0_SUS256_VWB8_WG64_4_1_WGM8_WGMXCC8_WGMXCCG304
    SolutionIndex: 44
    SolutionNameMin: Cijk_Alik_Bljk_F8NHS_STA_BH_BiasSH_HAS_SAB_SAV_UserArgs_MT128x160x128_MI16x16x1_SN_LDSB1_GRVWB16_GSU1_GSUAMB_GSUC0_GSUWGMRR0_K1_LBSPPB256_MIWT2_10_NLCA2_SU16_SUM0_SUS256_VWB2_WG64_4_1_WGM8_WGMXCC8_WGMXCCG304
    SolutionIndex: 45
    SolutionNameMin: Cijk_Alik_Bljk_F8NHS_STA_BH_BiasSH_HAS_SAB_SAV_UserArgs_MT256x192x128_MI16x16x1_SN_LDSB0_GRVWB16_GSU1_GSUAMB_GSUC0_GSUWGMRR0_K1_LBSPPB512_MIWT4_12_NLCA2_SU16_SUM0_SUS256_VWB4_WG64_4_1_WGM8_WGMXCC8_WGMXCCG304
    SolutionIndex: 46
    SolutionNameMin: Cijk_Alik_Bljk_F8NHS_STA_BH_BiasSH_HAS_SAB_SAV_UserArgs_MT16x16x256_MI16x16x1_SN_LDSB0_GRVWB16_GSU1_GSUAMBSK_GSUC0_GSUWGMRR0_K1_LBSPPB256_MIWT1_1_NLCA4_SU16_SUM0_SUS256_VWB1_WG16_4_1_WGM8_WGMXCC8_WGMXCCG304
    SolutionIndex: 47
    SolutionNameMin: Cijk_Alik_Bljk_F8NHS_STA_BH_BiasSH_HAS_SAB_SAV_UserArgs_MT64x16x256_MI16x16x1_SN_LDSB0_GRVWB16_GSU1_GSUAMB_GSUC0_GSUWGMRR0_K1_LBSPPB256_MIWT1_1_NLCA4_SU16_SUM0_SUS256_VWB1_WG64_4_1_WGM8_WGMXCC8_WGMXCCG304
    SolutionIndex: 48
    SolutionNameMin: Cijk_Alik_Bljk_F8NHS_STA_BH_BiasSH_HAS_SAB_SAV_UserArgs_MT64x48x256_MI16x16x1_SN_LDSB0_GRVWB16_GSU1_GSUAMB_GSUC0_GSUWGMRR0_K1_LBSPPB256_MIWT1_3_NLCA4_SU16_SUM0_SUS256_VWB1_WG64_4_1_WGM8_WGMXCC8_WGMXCCG304
    SolutionIndex: 49
    SolutionNameMin: Cijk_Alik_Bljk_F8NHS_STA_BH_BiasSH_HAS_SAB_SAV_UserArgs_MT128x32x256_MI16x16x1_SN_LDSB0_GRVWB16_GSU1_GSUAMB_GSUC0_GSUWGMRR0_K1_LBSPPB512_MIWT2_2_NLCA4_SU16_SUM0_SUS256_VWB2_WG64_4_1_WGM8_WGMXCC8_WGMXCCG304
    SolutionIndex: 50
    SolutionNameMin: Cijk_Alik_Bljk_F8NHS_STA_BH_BiasSH_HAS_SAB_SAV_UserArgs_MT128x32x256_MI16x16x1_SN_LDSB0_GRVWB16_GSU1_GSUAMBSK_GSUC0_GSUWGMRR0_K1_LBSPPB512_MIWT2_2_NLCA4_SU16_SUM0_SUS256_VWB2_WG64_4_1_WGM8_WGMXCC8_WGMXCCG304
    SolutionIndex: 51
    SolutionNameMin: Cijk_Alik_Bljk_F8NHS_STA_BH_BiasSH_HAS_SAB_SAV_UserArgs_MT128x48x256_MI16x16x1_SN_LDSB0_GRVWB16_GSU1_GSUAMBSK_GSUC0_GSUWGMRR0_K1_LBSPPB256_MIWT2_3_NLCA4_SU16_SUM0_SUS256_VWB1_WG64_4_1_WGM8_WGMXCC8_WGMXCCG304
    SolutionIndex: 52
    SolutionNameMin: Cijk_Alik_Bljk_F8NHS_STA_BH_BiasSH_HAS_SAB_SAV_UserArgs_MT128x80x256_MI16x16x1_SN_LDSB1_GRVWB16_GSU1_GSUAMBSK_GSUC0_GSUWGMRR0_K1_LBSPPB256_MIWT2_5_NLCA4_SU16_SUM0_SUS256_VWB1_WG64_4_1_WGM8_WGMXCC8_WGMXCCG304
    SolutionIndex: 53
    SolutionNameMin: Cijk_Alik_Bljk_F8NHS_STA_BH_BiasSH_HAS_SAB_SAV_UserArgs_MT256x64x256_MI16x16x1_SN_LDSB1_GRVWB16_GSU1_GSUAMB_GSUC0_GSUWGMRR0_K1_LBSPPB1024_MIWT4_4_NLCA4_SU16_SUM0_SUS256_VWB4_WG64_4_1_WGM8_WGMXCC8_WGMXCCG304
    SolutionIndex: 54
    SolutionNameMin: Cijk_Alik_Bljk_F8NHS_STA_BH_BiasSH_HAS_SAB_SAV_UserArgs_MT256x64x256_MI16x16x1_SN_LDSB1_GRVWB16_GSU1_GSUAMBSK_GSUC0_GSUWGMRR0_K1_LBSPPB1024_MIWT4_4_NLCA4_SU16_SUM0_SUS256_VWB4_WG64_4_1_WGM8_WGMXCC8_WGMXCCG304
    SolutionIndex: 55
    SolutionNameMin: Cijk_Alik_Bljk_F8NHS_STA_BH_BiasSH_HAS_SAB_SAV_UserArgs_MT320x64x128_MI16x16x1_SN_LDSB0_GRVWB16_GSU1_GSUAMB_GSUC0_GSUWGMRR0_K1_LBSPPB512_MIWT5_4_NLCA2_SU16_SUM0_SUS256_VWB4_WG64_4_1_WGM8_WGMXCC8_WGMXCCG304
    SolutionIndex: 56
    SolutionNameMin: Cijk_Alik_Bljk_F8NHS_STA_BH_BiasSH_HAS_SAB_SAV_UserArgs_MT256x112x128_MI16x16x1_SN_LDSB1_GRVWB8_GSU1_GSUAMB_GSUC0_GSUWGMRR0_K1_LBSPPB128_MIWT4_7_NLCA2_SU16_SUM0_SUS256_VWB1_WG64_4_1_WGM8_WGMXCC8_WGMXCCG304
    SolutionIndex: 57
    SolutionNameMin: Cijk_Alik_Bljk_F8NHS_STA_BH_BiasSH_HAS_SAB_SAV_UserArgs_MT256x128x128_MI16x16x1_SN_LDSB1_GRVWB16_GSU1_GSUAMBSK_GSUC0_GSUWGMRR0_K1_LBSPPB1024_MIWT4_8_NLCA2_SU16_SUM0_SUS256_VWB8_WG64_4_1_WGM8_WGMXCC8_WGMXCCG304
    SolutionIndex: 58
    SolutionNameMin: Cijk_Alik_Bljk_F8NHS_STA_BH_BiasSH_HAS_SAB_SAV_UserArgs_MT256x144x128_MI16x16x1_SN_LDSB0_GRVWB8_GSU1_GSUAMBSK_GSUC0_GSUWGMRR0_K1_LBSPPB128_MIWT4_9_NLCA2_SU16_SUM0_SUS256_VWB1_WG64_4_1_WGM8_WGMXCC8_WGMXCCG304
    SolutionIndex: 59
    SolutionNameMin: Cijk_Alik_Bljk_F8NHS_STA_BH_BiasSH_HAS_SAB_SAV_UserArgs_MT256x144x128_MI16x16x1_SN_LDSB0_GRVWB8_GSU1_GSUAMB_GSUC0_GSUWGMRR0_K1_LBSPPB128_MIWT4_9_NLCA2_SU16_SUM0_SUS256_VWB1_WG64_4_1_WGM8_WGMXCC8_WGMXCCG304
    SolutionIndex: 60
    SolutionNameMin: Cijk_Alik_Bljk_F8NHS_STA_BH_BiasSH_HAS_SAB_SAV_UserArgs_MT256x176x128_MI16x16x1_SN_LDSB0_GRVWB8_GSU1_GSUAMB_GSUC0_GSUWGMRR0_K1_LBSPPB128_MIWT4_11_NLCA2_SU16_SUM0_SUS256_VWB1_WG64_4_1_WGM8_WGMXCC8_WGMXCCG304
    SolutionIndex: 61
    SolutionNameMin: Cijk_Alik_Bljk_F8NHS_STA_BH_BiasSH_HAS_SAB_SAV_UserArgs_MT320x160x128_MI16x16x1_SN_LDSB0_GRVWB16_GSU1_GSUAMB_GSUC0_GSUWGMRR0_K1_LBSPPB256_MIWT5_10_NLCA2_SU16_SUM0_SUS256_VWB2_WG64_4_1_WGM8_WGMXCC8_WGMXCCG304
    SolutionIndex: 62
    SolutionNameMin: Cijk_Alik_Bljk_F8NHS_STA_BH_BiasSH_HAS_SAB_SAV_UserArgs_MT256x208x128_MI16x16x1_SN_LDSB1_GRVWB8_GSU1_GSUAMB_GSUC0_GSUWGMRR0_K1_LBSPPB128_MIWT4_13_NLCA2_SU16_SUM0_SUS256_VWB1_WG64_4_1_WGM8_WGMXCC8_WGMXCCG304
    SolutionIndex: 63
    SolutionNameMin: Cijk_Alik_Bljk_F8NHS_STA_BH_BiasSH_HAS_SAB_SAV_UserArgs_MT512x128x128_MI16x16x1_SN_LDSB0_GRVWB16_GSU1_GSUC0_GSUWGMRR0_K1_LBSPPB1024_MIWT8_8_NLCA2_SU16_SUM0_SUS128_VWB8_WG64_4_1_WGM8_WGMXCC8_WGMXCCG304
    SolutionIndex: 64
    SolutionNameMin: Cijk_Alik_Bljk_F8NHS_STA_BH_BiasSH_HAS_SAB_SAV_UserArgs_MT512x128x128_MI16x16x1_SN_LDSB0_GRVWB16_GSU1_GSUC0_GSUWGMRR0_K1_LBSPPB1024_MIWT8_8_NLCA2_SU8_SUM0_SUS128_VWB8_WG64_4_1_WGM8_WGMXCC8_WGMXCCG304
    SolutionIndex: 65
    SolutionNameMin: Cijk_Alik_Bljk_F8NHS_STA_BH_BiasSH_HAS_SAB_SAV_UserArgs_MT448x128x128_MI16x16x1_SN_LDSB0_GRVWB16_GSU1_GSUC0_GSUWGMRR0_K1_LBSPPB1024_MIWT7_8_NLCA2_SU16_SUM0_SUS128_VWB8_WG64_4_1_WGM8_WGMXCC8_WGMXCCG304
    SolutionIndex: 66
    SolutionNameMin: Cijk_Alik_Bljk_F8NHS_STA_BH_BiasSH_HAS_SAB_SAV_UserArgs_MT320x128x128_MI16x16x1_SN_LDSB0_GRVWB16_GSU1_GSUC0_GSUWGMRR0_K1_LBSPPB1024_MIWT5_8_NLCA2_SU8_SUM0_SUS128_VWB8_WG64_4_1_WGM6_WGMXCC8_WGMXCCG304
    SolutionIndex: 67
    SolutionNameMin: Cijk_Alik_Bljk_F8NHS_STA_BH_BiasSH_HAS_SAB_SAV_UserArgs_MT512x128x128_MI16x16x1_SN_LDSB0_GRVWB16_GSU1_GSUC0_GSUWGMRR0_K1_LBSPPB1024_MIWT8_8_NLCA2_SU16_SUM0_SUS128_VWB8_WG64_4_1_WGM6_WGMXCC8_WGMXCCG304
    SolutionIndex: 68
    SolutionNameMin: Cijk_Alik_Bljk_F8NHS_STA_BH_BiasSH_HAS_SAB_SAV_UserArgs_MT448x128x128_MI16x16x1_SN_LDSB0_GRVWB16_GSU1_GSUC0_GSUWGMRR0_K1_LBSPPB1024_MIWT7_8_NLCA2_SU8_SUM0_SUS128_VWB8_WG64_4_1_WGM8_WGMXCC8_WGMXCCG304
    SolutionIndex: 69
    SolutionNameMin: Cijk_Alik_Bljk_F8NHS_STA_BH_BiasSH_HAS_SAB_SAV_UserArgs_MT192x80x256_MI16x16x1_SN_LDSB1_GRVWB16_GSU1_GSUC0_GSUWGMRR0_K1_LBSPPB256_MIWT3_5_NLCA4_SU16_SUM0_SUS256_VWB1_WG64_4_1_WGM8_WGMXCC8_WGMXCCG304
    SolutionIndex: 70
    SolutionNameMin: Cijk_Alik_Bljk_F8NHS_STA_BH_BiasSH_HAS_SAB_SAV_UserArgs_MT192x96x128_MI16x16x1_SN_LDSB0_GRVWB16_GSU1_GSUC0_GSUWGMRR0_K1_LBSPPB256_MIWT3_6_NLCA2_SU8_SUM0_SUS128_VWB2_WG64_4_1_WGM6_WGMXCC8_WGMXCCG304
    SolutionIndex: 71
    SolutionNameMin: Cijk_Alik_Bljk_F8NHS_STA_BH_BiasSH_HAS_SAB_SAV_UserArgs_MT192x96x128_MI16x16x1_SN_LDSB0_GRVWB16_GSU1_GSUC0_GSUWGMRR0_K1_LBSPPB256_MIWT3_6_NLCA2_SU16_SUM0_SUS128_VWB2_WG64_4_1_WGM8_WGMXCC8_WGMXCCG304
    SolutionIndex: 72
    SolutionNameMin: Cijk_Alik_Bljk_F8NHS_STA_BH_BiasSH_HAS_SAB_SAV_UserArgs_MT192x128x128_MI16x16x1_SN_LDSB1_GRVWB16_GSU1_GSUC0_GSUWGMRR0_K1_LBSPPB1024_MIWT3_8_NLCA2_SU16_SUM0_SUS128_VWB8_WG64_4_1_WGM6_WGMXCC8_WGMXCCG304
    SolutionIndex: 73
    SolutionNameMin: Cijk_Alik_Bljk_F8NHS_STA_BH_BiasSH_HAS_SAB_SAV_UserArgs_MT192x128x128_MI16x16x1_SN_LDSB1_GRVWB16_GSU1_GSUC0_GSUWGMRR0_K1_LBSPPB1024_MIWT3_8_NLCA2_SU8_SUM0_SUS128_VWB8_WG64_4_1_WGM6_WGMXCC8_WGMXCCG304
    SolutionIndex: 74
    SolutionNameMin: Cijk_Alik_Bljk_F8NHS_STA_BH_BiasSH_HAS_SAB_SAV_UserArgs_MT256x96x128_MI16x16x1_SN_LDSB0_GRVWB16_GSU1_GSUC0_GSUWGMRR0_K1_LBSPPB256_MIWT4_6_NLCA2_SU8_SUM0_SUS128_VWB2_WG64_4_1_WGM8_WGMXCC8_WGMXCCG304
    SolutionIndex: 75
    SolutionNameMin: Cijk_Alik_Bljk_F8NHS_STA_BH_BiasSH_HAS_SAB_SAV_UserArgs_MT192x128x128_MI16x16x1_SN_LDSB1_GRVWB16_GSU1_GSUC0_GSUWGMRR0_K1_LBSPPB1024_MIWT3_8_NLCA2_SU16_SUM0_SUS128_VWB8_WG64_4_1_WGM8_WGMXCC8_WGMXCCG304
    SolutionIndex: 76
    SolutionNameMin: Cijk_Alik_Bljk_F8NHS_STA_BH_BiasSH_HAS_SAB_SAV_UserArgs_MT192x128x128_MI16x16x1_SN_LDSB1_GRVWB16_GSU1_GSUC0_GSUWGMRR0_K1_LBSPPB1024_MIWT3_8_NLCA2_SU8_SUM0_SUS128_VWB8_WG64_4_1_WGM8_WGMXCC8_WGMXCCG304
    SolutionIndex: 77
    SolutionNameMin: Cijk_Alik_Bljk_F8NHS_STA_BH_BiasSH_HAS_SAB_SAV_UserArgs_MT192x160x128_MI16x16x1_SN_LDSB1_GRVWB16_GSU1_GSUC0_GSUWGMRR0_K1_LBSPPB256_MIWT3_10_NLCA2_SU16_SUM0_SUS128_VWB2_WG64_4_1_WGM6_WGMXCC8_WGMXCCG304
    SolutionIndex: 78
    SolutionNameMin: Cijk_Alik_Bljk_F8NHS_STA_BH_BiasSH_HAS_SAB_SAV_UserArgs_MT256x112x128_MI16x16x1_SN_LDSB1_GRVWB8_GSU1_GSUC0_GSUWGMRR0_K1_LBSPPB128_MIWT4_7_NLCA2_SU8_SUM0_SUS128_VWB1_WG64_4_1_WGM8_WGMXCC8_WGMXCCG304
    SolutionIndex: 79
    SolutionNameMin: Cijk_Alik_Bljk_F8NHS_STA_BH_BiasSH_HAS_SAB_SAV_UserArgs_MT256x112x128_MI16x16x1_SN_LDSB1_GRVWB8_GSU1_GSUC0_GSUWGMRR0_K1_LBSPPB128_MIWT4_7_NLCA2_SU8_SUM0_SUS128_VWB1_WG64_4_1_WGM6_WGMXCC8_WGMXCCG304
    SolutionIndex: 80
    SolutionNameMin: Cijk_Alik_Bljk_F8NHS_STA_BH_BiasSH_HAS_SAB_SAV_UserArgs_MT256x128x128_MI16x16x1_SN_LDSB1_GRVWB16_GSU1_GSUC0_GSUWGMRR0_K1_LBSPPB1024_MIWT4_8_NLCA2_SU16_SUM0_SUS128_VWB8_WG64_4_1_WGM6_WGMXCC8_WGMXCCG304
    SolutionIndex: 81
    SolutionNameMin: Cijk_Alik_Bljk_F8NHS_STA_BH_BiasSH_HAS_SAB_SAV_UserArgs_MT256x128x128_MI16x16x1_SN_LDSB1_GRVWB16_GSU1_GSUC0_GSUWGMRR0_K1_LBSPPB1024_MIWT4_8_NLCA2_SU16_SUM0_SUS128_VWB8_WG64_4_1_WGM8_WGMXCC8_WGMXCCG304
    SolutionIndex: 82
    SolutionNameMin: Cijk_Alik_Bljk_F8NHS_STA_BH_BiasSH_HAS_SAB_SAV_UserArgs_MT320x112x128_MI16x16x1_SN_LDSB0_GRVWB8_GSU1_GSUC0_GSUWGMRR0_K1_LBSPPB128_MIWT5_7_NLCA2_SU16_SUM0_SUS128_VWB1_WG64_4_1_WGM6_WGMXCC8_WGMXCCG304
    SolutionIndex: 83
    SolutionNameMin: Cijk_Alik_Bljk_F8NHS_STA_BH_BiasSH_HAS_SAB_SAV_UserArgs_MT320x128x128_MI16x16x1_SN_LDSB0_GRVWB16_GSU1_GSUC0_GSUWGMRR0_K1_LBSPPB1024_MIWT5_8_NLCA2_SU8_SUM0_SUS128_VWB8_WG64_4_1_WGM8_WGMXCC8_WGMXCCG304
    SolutionIndex: 84
    SolutionNameMin: Cijk_Alik_Bljk_F8NHS_STA_BH_BiasSH_HAS_SAB_SAV_UserArgs_MT256x176x128_MI16x16x1_SN_LDSB0_GRVWB8_GSU1_GSUC0_GSUWGMRR0_K1_LBSPPB128_MIWT4_11_NLCA2_SU16_SUM0_SUS128_VWB1_WG64_4_1_WGM8_WGMXCC8_WGMXCCG304
    SolutionIndex: 85
    SolutionNameMin: Cijk_Alik_Bljk_F8NHS_STA_BH_BiasSH_HAS_SAB_SAV_UserArgs_MT384x128x128_MI16x16x1_SN_LDSB0_GRVWB16_GSU1_GSUC0_GSUWGMRR0_K1_LBSPPB1024_MIWT6_8_NLCA2_SU16_SUM0_SUS128_VWB8_WG64_4_1_WGM6_WGMXCC8_WGMXCCG304
    SolutionIndex: 86
    SolutionNameMin: Cijk_Alik_Bljk_F8NHS_STA_BH_BiasSH_HAS_SAB_SAV_UserArgs_MT384x128x128_MI16x16x1_SN_LDSB0_GRVWB16_GSU1_GSUC0_GSUWGMRR0_K1_LBSPPB1024_MIWT6_8_NLCA2_SU16_SUM0_SUS128_VWB8_WG64_4_1_WGM8_WGMXCC8_WGMXCCG304
    SolutionIndex: 87
    SolutionNameMin: Cijk_Alik_Bljk_F8NHS_STA_BH_BiasSH_HAS_SAB_SAV_UserArgs_MT256x192x128_MI16x16x1_SN_LDSB0_GRVWB16_GSU1_GSUC0_GSUWGMRR0_K1_LBSPPB512_MIWT4_12_NLCA2_SU16_SUM0_SUS128_VWB4_WG64_4_1_WGM8_WGMXCC8_WGMXCCG304
    SolutionIndex: 88
    SolutionNameMin: Cijk_Alik_Bljk_F8NHS_STA_BH_BiasSH_HAS_SAB_SAV_UserArgs_MT192x256x128_MI16x16x1_SN_LDSB1_GRVWB16_GSU1_GSUC0_GSUWGMRR0_K1_LBSPPB2048_MIWT3_16_NLCA2_SU8_SUM0_SUS128_VWB16_WG64_4_1_WGM6_WGMXCC8_WGMXCCG304
    SolutionIndex: 89
    SolutionNameMin: Cijk_Alik_Bljk_F8NHS_STA_BH_BiasSH_HAS_SAB_SAV_UserArgs_MT256x208x128_MI16x16x1_SN_LDSB1_GRVWB8_GSU1_GSUC0_GSUWGMRR0_K1_LBSPPB128_MIWT4_13_NLCA2_SU16_SUM0_SUS128_VWB1_WG64_4_1_WGM6_WGMXCC8_WGMXCCG304
    SolutionIndex: 90
    SolutionNameMin: Cijk_Alik_Bljk_F8NHS_STA_BH_BiasSH_HAS_SAB_SAV_UserArgs_MT320x128x128_MI16x16x1_SN_LDSB0_GRVWB16_GSU1_GSUC0_GSUWGMRR0_K1_LBSPPB1024_MIWT5_8_NLCA2_SU16_SUM0_SUS128_VWB8_WG64_4_1_WGM8_WGMXCC8_WGMXCCG304
    SolutionIndex: 91
    SolutionNameMin: Cijk_Alik_Bljk_F8NHS_STA_BH_BiasSH_HAS_SAB_SAV_UserArgs_MT384x128x128_MI16x16x1_SN_LDSB0_GRVWB16_GSU1_GSUC0_GSUWGMRR0_K1_LBSPPB1024_MIWT6_8_NLCA2_SU8_SUM0_SUS128_VWB8_WG64_4_1_WGM6_WGMXCC8_WGMXCCG304
    SolutionIndex: 92
    SolutionNameMin: Cijk_Alik_Bljk_F8NHS_STA_BH_BiasSH_HAS_SAB_SAV_UserArgs_MT384x128x128_MI16x16x1_SN_LDSB0_GRVWB16_GSU1_GSUC0_GSUWGMRR0_K1_LBSPPB1024_MIWT6_8_NLCA2_SU8_SUM0_SUS128_VWB8_WG64_4_1_WGM8_WGMXCC8_WGMXCCG304
    SolutionIndex: 93
    SolutionNameMin: Cijk_Alik_Bljk_F8NHS_STA_BH_BiasSH_HAS_SAB_SAV_UserArgs_MT256x192x128_MI16x16x1_SN_LDSB0_GRVWB16_GSU1_GSUC0_GSUWGMRR0_K1_LBSPPB512_MIWT4_12_NLCA2_SU8_SUM0_SUS128_VWB4_WG64_4_1_WGM8_WGMXCC8_WGMXCCG304
    SolutionIndex: 94
    SolutionNameMin: Cijk_Alik_Bljk_F8NHS_STA_BH_BiasSH_HAS_SAB_SAV_UserArgs_MT64x16x512_MI16x16x1_SN_LDSB0_GRVWB16_GSU1_GSUC0_GSUWGMRR0_K1_LBSPPB512_MIWT1_1_NLCA8_SU16_SUM0_SUS512_VWB1_WG64_4_1_WGM6_WGMXCC8_WGMXCCG304
    SolutionIndex: 95
    SolutionNameMin: Cijk_Alik_Bljk_F8NHS_STA_BH_BiasSH_HAS_SAB_SAV_UserArgs_MT64x32x512_MI16x16x1_SN_LDSB1_GRVWB16_GSU1_GSUC0_GSUWGMRR0_K1_LBSPPB1024_MIWT1_2_NLCA8_SU16_SUM0_SUS512_VWB2_WG64_4_1_WGM8_WGMXCC8_WGMXCCG304
    SolutionIndex: 96
    SolutionNameMin: Cijk_Alik_Bljk_F8NHS_STA_BH_BiasSH_HAS_SAB_SAV_UserArgs_MT64x48x256_MI16x16x1_SN_LDSB0_GRVWB16_GSU1_GSUC0_GSUWGMRR0_K1_LBSPPB256_MIWT1_3_NLCA4_SU16_SUM0_SUS256_VWB1_WG64_4_1_WGM8_WGMXCC8_WGMXCCG304
    SolutionIndex: 97
    SolutionNameMin: Cijk_Alik_Bljk_F8NHS_STA_BH_BiasSH_HAS_SAB_SAV_UserArgs_MT64x32x512_MI16x16x1_SN_LDSB1_GRVWB16_GSU1_GSUC0_GSUWGMRR0_K1_LBSPPB1024_MIWT1_2_NLCA8_SU8_SUM0_SUS512_VWB2_WG64_4_1_WGM6_WGMXCC8_WGMXCCG304
    SolutionIndex: 98
    SolutionNameMin: Cijk_Alik_Bljk_F8NHS_STA_BH_BiasSH_HAS_SAB_SAV_UserArgs_MT64x80x256_MI16x16x1_SN_LDSB1_GRVWB16_GSU1_GSUC0_GSUWGMRR0_K1_LBSPPB256_MIWT1_5_NLCA4_SU16_SUM0_SUS256_VWB1_WG64_4_1_WGM6_WGMXCC8_WGMXCCG304
    SolutionIndex: 99
    SolutionNameMin: Cijk_Alik_Bljk_F8NHS_STA_BH_BiasSH_HAS_SAB_SAV_UserArgs_MT128x48x256_MI16x16x1_SN_LDSB0_GRVWB16_GSU1_GSUC0_GSUWGMRR0_K1_LBSPPB256_MIWT2_3_NLCA4_SU8_SUM0_SUS256_VWB1_WG64_4_1_WGM8_WGMXCC8_WGMXCCG304
    SolutionIndex: 100
    SolutionNameMin: Cijk_Alik_Bljk_F8NHS_STA_BH_BiasSH_HAS_SAB_SAV_UserArgs_MT128x32x256_MI16x16x1_SN_LDSB0_GRVWB16_GSU1_GSUC0_GSUWGMRR0_K1_LBSPPB512_MIWT2_2_NLCA4_SU16_SUM0_SUS256_VWB2_WG64_4_1_WGM6_WGMXCC8_WGMXCCG304
    SolutionIndex: 101
    SolutionNameMin: Cijk_Alik_Bljk_F8NHS_STA_BH_BiasSH_HAS_SAB_SAV_UserArgs_MT128x32x256_MI16x16x1_SN_LDSB0_GRVWB16_GSU1_GSUC0_GSUWGMRR0_K1_LBSPPB512_MIWT2_2_NLCA4_SU16_SUM0_SUS256_VWB2_WG64_4_1_WGM8_WGMXCC8_WGMXCCG304
    SolutionIndex: 102
    SolutionNameMin: Cijk_Alik_Bljk_F8NHS_STA_BH_BiasSH_HAS_SAB_SAV_UserArgs_MT128x80x256_MI16x16x1_SN_LDSB1_GRVWB16_GSU1_GSUC0_GSUWGMRR0_K1_LBSPPB256_MIWT2_5_NLCA4_SU8_SUM0_SUS256_VWB1_WG64_4_1_WGM8_WGMXCC8_WGMXCCG304
    SolutionIndex: 103
    SolutionNameMin: Cijk_Alik_Bljk_F8NHS_STA_BH_BiasSH_HAS_SAB_SAV_UserArgs_MT128x48x256_MI16x16x1_SN_LDSB0_GRVWB16_GSU1_GSUC0_GSUWGMRR0_K1_LBSPPB256_MIWT2_3_NLCA4_SU16_SUM0_SUS256_VWB1_WG64_4_1_WGM8_WGMXCC8_WGMXCCG304
    SolutionIndex: 104
    SolutionNameMin: Cijk_Alik_Bljk_F8NHS_STA_BH_BiasSH_HAS_SAB_SAV_UserArgs_MT128x64x256_MI16x16x1_SN_LDSB1_GRVWB16_GSU1_GSUC0_GSUWGMRR0_K1_LBSPPB1024_MIWT2_4_NLCA4_SU8_SUM0_SUS256_VWB4_WG64_4_1_WGM6_WGMXCC8_WGMXCCG304
    SolutionIndex: 105
    SolutionNameMin: Cijk_Alik_Bljk_F8NHS_STA_BH_BiasSH_HAS_SAB_SAV_UserArgs_MT128x80x256_MI16x16x1_SN_LDSB1_GRVWB16_GSU1_GSUC0_GSUWGMRR0_K1_LBSPPB256_MIWT2_5_NLCA4_SU8_SUM0_SUS256_VWB1_WG64_4_1_WGM6_WGMXCC8_WGMXCCG304
    SolutionIndex: 106
    SolutionNameMin: Cijk_Alik_Bljk_F8NHS_STA_BH_BiasSH_HAS_SAB_SAV_UserArgs_MT128x80x256_MI16x16x1_SN_LDSB1_GRVWB16_GSU1_GSUC0_GSUWGMRR0_K1_LBSPPB256_MIWT2_5_NLCA4_SU16_SUM0_SUS256_VWB1_WG64_4_1_WGM6_WGMXCC8_WGMXCCG304
    SolutionIndex: 107
    SolutionNameMin: Cijk_Alik_Bljk_F8NHS_STA_BH_BiasSH_HAS_SAB_SAV_UserArgs_MT128x96x256_MI16x16x1_SN_LDSB1_GRVWB16_GSU1_GSUC0_GSUWGMRR0_K1_LBSPPB512_MIWT2_6_NLCA4_SU8_SUM0_SUS256_VWB2_WG64_4_1_WGM8_WGMXCC8_WGMXCCG304
    SolutionIndex: 108
    SolutionNameMin: Cijk_Alik_Bljk_F8NHS_STA_BH_BiasSH_HAS_SAB_SAV_UserArgs_MT128x112x256_MI16x16x1_SN_LDSB1_GRVWB16_GSU1_GSUC0_GSUWGMRR0_K1_LBSPPB256_MIWT2_7_NLCA4_SU8_SUM0_SUS256_VWB1_WG64_4_1_WGM6_WGMXCC8_WGMXCCG304
    SolutionIndex: 109
    SolutionNameMin: Cijk_Alik_Bljk_F8NHS_STA_BH_BiasSH_HAS_SAB_SAV_UserArgs_MT192x80x256_MI16x16x1_SN_LDSB1_GRVWB16_GSU1_GSUC0_GSUWGMRR0_K1_LBSPPB256_MIWT3_5_NLCA4_SU8_SUM0_SUS256_VWB1_WG64_4_1_WGM6_WGMXCC8_WGMXCCG304
    SolutionIndex: 110
    SolutionNameMin: Cijk_Alik_Bljk_F8NHS_STA_BH_BiasSH_HAS_SAB_SAV_UserArgs_MT128x112x256_MI16x16x1_SN_LDSB1_GRVWB16_GSU1_GSUC0_GSUWGMRR0_K1_LBSPPB256_MIWT2_7_NLCA4_SU16_SUM0_SUS256_VWB1_WG64_4_1_WGM6_WGMXCC8_WGMXCCG304
    SolutionIndex: 111
    SolutionNameMin: Cijk_Alik_Bljk_F8NHS_STA_BH_BiasSH_HAS_SAB_SAV_UserArgs_MT128x112x256_MI16x16x1_SN_LDSB1_GRVWB16_GSU1_GSUC0_GSUWGMRR0_K1_LBSPPB256_MIWT2_7_NLCA4_SU16_SUM0_SUS256_VWB1_WG64_4_1_WGM8_WGMXCC8_WGMXCCG304
    SolutionIndex: 112
    SolutionNameMin: Cijk_Alik_Bljk_F8NHS_STA_BH_BiasSH_HAS_SAB_SAV_UserArgs_MT192x80x128_MI16x16x1_SN_LDSB0_GRVWB8_GSU1_GSUC0_GSUWGMRR0_K1_LBSPPB128_MIWT3_5_NLCA2_SU16_SUM0_SUS128_VWB1_WG64_4_1_WGM8_WGMXCC8_WGMXCCG304
    SolutionIndex: 113
    SolutionNameMin: Cijk_Alik_Bljk_F8NHS_STA_BH_BiasSH_HAS_SAB_SAV_UserArgs_MT256x64x128_MI16x16x1_SN_LDSB0_GRVWB16_GSU1_GSUC0_GSUWGMRR0_K1_LBSPPB512_MIWT4_4_NLCA2_SU8_SUM0_SUS128_VWB4_WG64_4_1_WGM8_WGMXCC8_WGMXCCG304
    SolutionIndex: 114
    SolutionNameMin: Cijk_Alik_Bljk_F8NHS_STA_BH_BiasSH_HAS_SAB_SAV_UserArgs_MT384x160x128_MI16x16x1_SN_LDSB0_GRVWB16_GSU1_GSUC0_GSUWGMRR0_K1_LBSPPB256_MIWT6_10_NLCA2_SU8_SUM0_SUS128_VWB2_WG64_4_1_WGM8_WGMXCC8_WGMXCCG304
    SolutionIndex: 115
    SolutionNameMin: Cijk_Alik_Bljk_F8NHS_STA_BH_BiasSH_HAS_SAB_SAV_UserArgs_MT448x144x128_MI16x16x1_SN_LDSB0_GRVWB8_GSU1_GSUC0_GSUWGMRR0_K1_LBSPPB128_MIWT7_9_NLCA2_SU16_SUM0_SUS128_VWB1_WG64_4_1_WGM8_WGMXCC8_WGMXCCG304
    SolutionIndex: 116
    SolutionNameMin: Cijk_Alik_Bljk_F8NHS_STA_BH_BiasSH_HAS_SAB_SAV_UserArgs_MT256x224x128_MI16x16x1_SN_LDSB0_GRVWB16_GSU1_GSUC0_GSUWGMRR0_K1_LBSPPB256_MIWT4_14_NLCA2_SU16_SUM0_SUS128_VWB2_WG64_4_1_WGM8_WGMXCC8_WGMXCCG304
    SolutionIndex: 117
    SolutionNameMin: Cijk_Alik_Bljk_F8NHS_STA_BH_BiasSH_HAS_SAB_SAV_UserArgs_MT256x192x128_MI16x16x1_SN_LDSB0_GRVWB16_GSU1_GSUC0_GSUWGMRR0_K1_LBSPPB512_MIWT4_12_NLCA2_SU8_SUM0_SUS128_VWB4_WG64_4_1_WGM6_WGMXCC8_WGMXCCG304
    SolutionIndex: 118
    SolutionNameMin: Cijk_Alik_Bljk_F8NHS_STA_BH_BiasSH_HAS_SAB_SAV_UserArgs_MT320x192x128_MI16x16x1_SN_LDSB0_GRVWB16_GSU1_GSUC0_GSUWGMRR0_K1_LBSPPB512_MIWT5_12_NLCA2_SU16_SUM0_SUS128_VWB4_WG64_4_1_WGM8_WGMXCC8_WGMXCCG304
    SolutionIndex: 119
    SolutionNameMin: Cijk_Alik_Bljk_F8NHS_STA_BH_BiasSH_HAS_SAB_SAV_UserArgs_MT256x208x128_MI16x16x1_SN_LDSB1_GRVWB8_GSU1_GSUC0_GSUWGMRR0_K1_LBSPPB128_MIWT4_13_NLCA2_SU16_SUM0_SUS128_VWB1_WG64_4_1_WGM8_WGMXCC8_WGMXCCG304
    SolutionIndex: 120
    SolutionNameMin: Cijk_Alik_Bljk_F8NHS_STA_BH_BiasSH_HAS_SAB_SAV_UserArgs_MT256x192x128_MI16x16x1_SN_LDSB0_GRVWB16_GSU1_GSUC0_GSUWGMRR0_K1_LBSPPB512_MIWT4_12_NLCA2_SU16_SUM0_SUS128_VWB4_WG64_4_1_WGM6_WGMXCC8_WGMXCCG304
    SolutionIndex: 121
    SolutionNameMin: Cijk_Alik_Bljk_F8NHS_STA_BH_BiasSH_HAS_SAB_SAV_UserArgs_MT512x112x128_MI16x16x1_SN_LDSB0_GRVWB8_GSU1_GSUC0_GSUWGMRR0_K1_LBSPPB128_MIWT8_7_NLCA2_SU8_SUM0_SUS128_VWB1_WG64_4_1_WGM8_WGMXCC8_WGMXCCG304
    SolutionIndex: 122
    SolutionNameMin: Cijk_Alik_Bljk_F8NHS_STA_BH_BiasSH_HAS_SAB_SAV_UserArgs_MT320x192x128_MI16x16x1_SN_LDSB0_GRVWB16_GSU1_GSUC0_GSUWGMRR0_K1_LBSPPB512_MIWT5_12_NLCA2_SU8_SUM0_SUS128_VWB4_WG64_4_1_WGM8_WGMXCC8_WGMXCCG304
    SolutionIndex: 123
    SolutionNameMin: Cijk_Alik_Bljk_F8NHS_STA_BH_BiasSH_HAS_SAB_SAV_UserArgs_MT256x208x128_MI16x16x1_SN_LDSB1_GRVWB8_GSU1_GSUC0_GSUWGMRR0_K1_LBSPPB128_MIWT4_13_NLCA2_SU8_SUM0_SUS128_VWB1_WG64_4_1_WGM6_WGMXCC8_WGMXCCG304
    SolutionIndex: 124
    SolutionNameMin: Cijk_Alik_Bljk_F8NHS_STA_BH_BiasSH_HAS_SAB_SAV_UserArgs_MT320x176x128_MI16x16x1_SN_LDSB0_GRVWB8_GSU1_GSUC0_GSUWGMRR0_K1_LBSPPB128_MIWT5_11_NLCA2_SU8_SUM0_SUS128_VWB1_WG64_4_1_WGM6_WGMXCC8_WGMXCCG304
    SolutionIndex: 125
    SolutionNameMin: Cijk_Alik_Bljk_F8NHS_STA_BH_BiasSH_HAS_SAB_SAV_UserArgs_MT448x144x128_MI16x16x1_SN_LDSB0_GRVWB8_GSU1_GSUC0_GSUWGMRR0_K1_LBSPPB128_MIWT7_9_NLCA2_SU8_SUM0_SUS128_VWB1_WG64_4_1_WGM8_WGMXCC8_WGMXCCG304
    SolutionIndex: 126
    SolutionNameMin: Cijk_Alik_Bljk_F8NHS_STA_BH_BiasSH_HAS_SAB_SAV_UserArgs_MT256x224x128_MI16x16x1_SN_LDSB0_GRVWB16_GSU1_GSUC0_GSUWGMRR0_K1_LBSPPB256_MIWT4_14_NLCA2_SU8_SUM0_SUS128_VWB2_WG64_4_1_WGM6_WGMXCC8_WGMXCCG304
    SolutionIndex: 127
    SolutionNameMin: Cijk_Alik_Bljk_F8NHS_STA_BH_BiasSH_HAS_SAB_SAV_UserArgs_MT512x112x128_MI16x16x1_SN_LDSB0_GRVWB8_GSU1_GSUC0_GSUWGMRR0_K1_LBSPPB128_MIWT8_7_NLCA2_SU16_SUM0_SUS128_VWB1_WG64_4_1_WGM8_WGMXCC8_WGMXCCG304
    SolutionIndex: 128
    SolutionNameMin: Cijk_Alik_Bljk_F8NHS_STA_BH_BiasSH_HAS_SAB_SAV_UserArgs_MT256x224x128_MI16x16x1_SN_LDSB0_GRVWB16_GSU1_GSUC0_GSUWGMRR0_K1_LBSPPB256_MIWT4_14_NLCA2_SU8_SUM0_SUS128_VWB2_WG64_4_1_WGM8_WGMXCC8_WGMXCCG304
    SolutionIndex: 129
    SolutionNameMin: Cijk_Alik_Bljk_F8NHS_STA_BH_BiasSH_HAS_SAB_SAV_UserArgs_MT192x80x256_MI16x16x1_SN_LDSB1_GRVWB16_GSU1_GSUC0_GSUWGMRR0_K1_LBSPPB256_MIWT3_5_NLCA4_SU8_SUM0_SUS256_VWB1_WG64_4_1_WGM8_WGMXCC8_WGMXCCG304
    SolutionIndex: 130
    SolutionNameMin: Cijk_Alik_Bljk_F8NHS_STA_BH_BiasSH_HAS_SAB_SAV_UserArgs_MT192x96x128_MI16x16x1_SN_LDSB0_GRVWB16_GSU1_GSUC0_GSUWGMRR0_K1_LBSPPB256_MIWT3_6_NLCA2_SU8_SUM0_SUS128_VWB2_WG64_4_1_WGM8_WGMXCC8_WGMXCCG304
    SolutionIndex: 131
    SolutionNameMin: Cijk_Alik_Bljk_F8NHS_STA_BH_BiasSH_HAS_SAB_SAV_UserArgs_MT256x80x128_MI16x16x1_SN_LDSB0_GRVWB8_GSU1_GSUC0_GSUWGMRR0_K1_LBSPPB128_MIWT4_5_NLCA2_SU16_SUM0_SUS128_VWB1_WG64_4_1_WGM8_WGMXCC8_WGMXCCG304
    SolutionIndex: 132
    SolutionNameMin: Cijk_Alik_Bljk_F8NHS_STA_BH_BiasSH_HAS_SAB_SAV_UserArgs_MT256x80x128_MI16x16x1_SN_LDSB0_GRVWB8_GSU1_GSUC0_GSUWGMRR0_K1_LBSPPB128_MIWT4_5_NLCA2_SU8_SUM0_SUS128_VWB1_WG64_4_1_WGM8_WGMXCC8_WGMXCCG304
    SolutionIndex: 133
    SolutionNameMin: Cijk_Alik_Bljk_F8NHS_STA_BH_BiasSH_HAS_SAB_SAV_UserArgs_MT256x80x128_MI16x16x1_SN_LDSB0_GRVWB8_GSU1_GSUC0_GSUWGMRR0_K1_LBSPPB128_MIWT4_5_NLCA2_SU16_SUM0_SUS128_VWB1_WG64_4_1_WGM6_WGMXCC8_WGMXCCG304
    SolutionIndex: 134
    SolutionNameMin: Cijk_Alik_Bljk_F8NHS_STA_BH_BiasSH_HAS_SAB_SAV_UserArgs_MT256x96x128_MI16x16x1_SN_LDSB0_GRVWB16_GSU1_GSUC0_GSUWGMRR0_K1_LBSPPB256_MIWT4_6_NLCA2_SU16_SUM0_SUS128_VWB2_WG64_4_1_WGM8_WGMXCC8_WGMXCCG304
    SolutionIndex: 135
    SolutionNameMin: Cijk_Alik_Bljk_F8NHS_STA_BH_BiasSH_HAS_SAB_SAV_UserArgs_MT192x160x128_MI16x16x1_SN_LDSB1_GRVWB16_GSU1_GSUC0_GSUWGMRR0_K1_LBSPPB256_MIWT3_10_NLCA2_SU8_SUM0_SUS128_VWB2_WG64_4_1_WGM6_WGMXCC8_WGMXCCG304
    SolutionIndex: 136
    SolutionNameMin: Cijk_Alik_Bljk_F8NHS_STA_BH_BiasSH_HAS_SAB_SAV_UserArgs_MT256x96x128_MI16x16x1_SN_LDSB0_GRVWB16_GSU1_GSUC0_GSUWGMRR0_K1_LBSPPB256_MIWT4_6_NLCA2_SU16_SUM0_SUS128_VWB2_WG64_4_1_WGM6_WGMXCC8_WGMXCCG304
    SolutionIndex: 137
    SolutionNameMin: Cijk_Alik_Bljk_F8NHS_STA_BH_BiasSH_HAS_SAB_SAV_UserArgs_MT256x112x128_MI16x16x1_SN_LDSB1_GRVWB8_GSU1_GSUC0_GSUWGMRR0_K1_LBSPPB128_MIWT4_7_NLCA2_SU16_SUM0_SUS128_VWB1_WG64_4_1_WGM8_WGMXCC8_WGMXCCG304
    SolutionIndex: 138
    SolutionNameMin: Cijk_Alik_Bljk_F8NHS_STA_BH_BiasSH_HAS_SAB_SAV_UserArgs_MT192x160x128_MI16x16x1_SN_LDSB1_GRVWB16_GSU1_GSUC0_GSUWGMRR0_K1_LBSPPB256_MIWT3_10_NLCA2_SU16_SUM0_SUS128_VWB2_WG64_4_1_WGM8_WGMXCC8_WGMXCCG304
    SolutionIndex: 139
    SolutionNameMin: Cijk_Alik_Bljk_F8NHS_STA_BH_BiasSH_HAS_SAB_SAV_UserArgs_MT256x112x128_MI16x16x1_SN_LDSB1_GRVWB8_GSU1_GSUC0_GSUWGMRR0_K1_LBSPPB128_MIWT4_7_NLCA2_SU16_SUM0_SUS128_VWB1_WG64_4_1_WGM6_WGMXCC8_WGMXCCG304
    SolutionIndex: 140
    SolutionNameMin: Cijk_Alik_Bljk_F8NHS_STA_BH_BiasSH_HAS_SAB_SAV_UserArgs_MT256x128x128_MI16x16x1_SN_LDSB1_GRVWB16_GSU1_GSUC0_GSUWGMRR0_K1_LBSPPB1024_MIWT4_8_NLCA2_SU8_SUM0_SUS128_VWB8_WG64_4_1_WGM6_WGMXCC8_WGMXCCG304
    SolutionIndex: 141
    SolutionNameMin: Cijk_Alik_Bljk_F8NHS_STA_BH_BiasSH_HAS_SAB_SAV_UserArgs_MT192x176x128_MI16x16x1_SN_LDSB0_GRVWB8_GSU1_GSUC0_GSUWGMRR0_K1_LBSPPB128_MIWT3_11_NLCA2_SU8_SUM0_SUS128_VWB1_WG64_4_1_WGM8_WGMXCC8_WGMXCCG304
    SolutionIndex: 142
    SolutionNameMin: Cijk_Alik_Bljk_F8NHS_STA_BH_BiasSH_HAS_SAB_SAV_UserArgs_MT256x160x128_MI16x16x1_SN_LDSB0_GRVWB16_GSU1_GSUC0_GSUWGMRR0_K1_LBSPPB256_MIWT4_10_NLCA2_SU16_SUM0_SUS128_VWB2_WG64_4_1_WGM8_WGMXCC8_WGMXCCG304
    SolutionIndex: 143
    SolutionNameMin: Cijk_Alik_Bljk_F8NHS_STA_BH_BiasSH_HAS_SAB_SAV_UserArgs_MT192x192x128_MI16x16x1_SN_LDSB0_GRVWB16_GSU1_GSUC0_GSUWGMRR0_K1_LBSPPB512_MIWT3_12_NLCA2_SU8_SUM0_SUS128_VWB4_WG64_4_1_WGM8_WGMXCC8_WGMXCCG304
    SolutionIndex: 144
    SolutionNameMin: Cijk_Alik_Bljk_F8NHS_STA_BH_BiasSH_HAS_SAB_SAV_UserArgs_MT256x176x128_MI16x16x1_SN_LDSB0_GRVWB8_GSU1_GSUC0_GSUWGMRR0_K1_LBSPPB128_MIWT4_11_NLCA2_SU8_SUM0_SUS128_VWB1_WG64_4_1_WGM8_WGMXCC8_WGMXCCG304
    SolutionIndex: 145
    SolutionNameMin: Cijk_Alik_Bljk_F8NHS_STA_BH_BiasSH_HAS_SAB_SAV_UserArgs_MT448x96x128_MI16x16x1_SN_LDSB0_GRVWB16_GSU1_GSUC0_GSUWGMRR0_K1_LBSPPB256_MIWT7_6_NLCA2_SU16_SUM0_SUS128_VWB2_WG64_4_1_WGM8_WGMXCC8_WGMXCCG304
    SolutionIndex: 146
    SolutionNameMin: Cijk_Alik_Bljk_F8NHS_STA_BH_BiasSH_HAS_SAB_SAV_UserArgs_MT512x96x128_MI16x16x1_SN_LDSB0_GRVWB16_GSU1_GSUC0_GSUWGMRR0_K1_LBSPPB256_MIWT8_6_NLCA2_SU8_SUM0_SUS128_VWB2_WG64_4_1_WGM8_WGMXCC8_WGMXCCG304
    SolutionIndex: 147
    SolutionNameMin: Cijk_Alik_Bljk_F8NHS_STA_BH_BiasSH_HAS_SAB_SAV_UserArgs_MT448x112x128_MI16x16x1_SN_LDSB0_GRVWB8_GSU1_GSUC0_GSUWGMRR0_K1_LBSPPB128_MIWT7_7_NLCA2_SU16_SUM0_SUS128_VWB1_WG64_4_1_WGM8_WGMXCC8_WGMXCCG304
    SolutionIndex: 148
    SolutionNameMin: Cijk_Alik_Bljk_F8NHS_STA_BH_BiasSH_HAS_SAB_SAV_UserArgs_MT320x176x128_MI16x16x1_SN_LDSB0_GRVWB8_GSU1_GSUC0_GSUWGMRR0_K1_LBSPPB128_MIWT5_11_NLCA2_SU16_SUM0_SUS128_VWB1_WG64_4_1_WGM6_WGMXCC8_WGMXCCG304
    SolutionIndex: 149
    SolutionNameMin: Cijk_Alik_Bljk_F8NHS_STA_BH_BiasSH_HAS_SAB_SAV_UserArgs_MT256x224x128_MI16x16x1_SN_LDSB0_GRVWB16_GSU1_GSUC0_GSUWGMRR0_K1_LBSPPB256_MIWT4_14_NLCA2_SU16_SUM0_SUS128_VWB2_WG64_4_1_WGM6_WGMXCC8_WGMXCCG304
    SolutionIndex: 150
    SolutionNameMin: Cijk_Alik_Bljk_F8NHS_STA_BH_BiasSH_HAS_SAB_SAV_UserArgs_MT448x128x128_MI16x16x1_SN_LDSB0_GRVWB16_GSU1_GSUC0_GSUWGMRR0_K1_LBSPPB1024_MIWT7_8_NLCA2_SU8_SUM0_SUS128_VWB8_WG64_4_1_WGM6_WGMXCC8_WGMXCCG304
    SolutionIndex: 151
    SolutionNameMin: Cijk_Alik_Bljk_F8NHS_STA_BH_BiasSH_HAS_SAB_SAV_UserArgs_MT256x144x128_MI16x16x1_SN_LDSB0_GRVWB8_GSU1_GSUC0_GSUWGMRR0_K1_LBSPPB128_MIWT4_9_NLCA2_SU8_SUM0_SUS128_VWB1_WG64_4_1_WGM8_WGMXCC8_WGMXCCG304
    SolutionIndex: 152
    SolutionNameMin: Cijk_Alik_Bljk_F8NHS_STA_BH_BiasSH_HAS_SAB_SAV_UserArgs_MT256x144x128_MI16x16x1_SN_LDSB0_GRVWB8_GSU1_GSUC0_GSUWGMRR0_K1_LBSPPB128_MIWT4_9_NLCA2_SU8_SUM0_SUS128_VWB1_WG64_4_1_WGM6_WGMXCC8_WGMXCCG304
    SolutionIndex: 153
    SolutionNameMin: Cijk_Alik_Bljk_F8NHS_STA_BH_BiasSH_HAS_SAB_SAV_UserArgs_MT448x96x128_MI16x16x1_SN_LDSB0_GRVWB16_GSU1_GSUC0_GSUWGMRR0_K1_LBSPPB256_MIWT7_6_NLCA2_SU8_SUM0_SUS128_VWB2_WG64_4_1_WGM8_WGMXCC8_WGMXCCG304
    SolutionIndex: 154
    SolutionNameMin: Cijk_Alik_Bljk_F8NHS_STA_BH_BiasSH_HAS_SAB_SAV_UserArgs_MT320x176x128_MI16x16x1_SN_LDSB0_GRVWB8_GSU1_GSUC0_GSUWGMRR0_K1_LBSPPB128_MIWT5_11_NLCA2_SU8_SUM0_SUS128_VWB1_WG64_4_1_WGM8_WGMXCC8_WGMXCCG304
    SolutionIndex: 155
    SolutionNameMin: Cijk_Alik_Bljk_F8NHS_STA_BH_BiasSH_HAS_SAB_SAV_UserArgs_MT384x144x128_MI16x16x1_SN_LDSB0_GRVWB8_GSU1_GSUC0_GSUWGMRR0_K1_LBSPPB128_MIWT6_9_NLCA2_SU16_SUM0_SUS128_VWB1_WG64_4_1_WGM8_WGMXCC8_WGMXCCG304
    SolutionIndex: 156
    SolutionNameMin: Cijk_Alik_Bljk_F8NHS_STA_BH_BiasSH_HAS_SAB_SAV_UserArgs_MT320x176x128_MI16x16x1_SN_LDSB0_GRVWB8_GSU1_GSUC0_GSUWGMRR0_K1_LBSPPB128_MIWT5_11_NLCA2_SU16_SUM0_SUS128_VWB1_WG64_4_1_WGM8_WGMXCC8_WGMXCCG304
    SolutionIndex: 157
    SolutionNameMin: Cijk_Alik_Bljk_F8NHS_STA_BH_BiasSH_HAS_SAB_SAV_UserArgs_MT64x16x512_MI16x16x1_SN_LDSB0_GRVWB16_GSU1_GSUC0_GSUWGMRR0_K1_LBSPPB512_MIWT1_1_NTA4_NLCA8_SU8_SUM0_SUS512_VWB1_WG64_4_1_WGM8_WGMXCC8_WGMXCCG304
    SolutionIndex: 158
    SolutionNameMin: Cijk_Alik_Bljk_F8NHS_STA_BH_BiasSH_HAS_SAB_SAV_UserArgs_MT64x16x512_MI16x16x1_SN_LDSB0_GRVWB16_GSU1_GSUC0_GSUWGMRR0_K1_LBSPPB512_MIWT1_1_NTA0_NLCA8_SU8_SUM0_SUS512_VWB1_WG64_4_1_WGM6_WGMXCC8_WGMXCCG304
    SolutionIndex: 159
    SolutionNameMin: Cijk_Alik_Bljk_F8NHS_STA_BH_BiasSH_HAS_SAB_SAV_UserArgs_MT32x48x512_MI16x16x1_SN_LDSB1_GRVWB16_GSU1_GSUC0_GSUWGMRR0_K1_LBSPPB512_MIWT1_3_NTA4_NLCA8_SU16_SUM0_SUS512_VWB1_WG32_4_1_WGM6_WGMXCC8_WGMXCCG304
    SolutionIndex: 160
    SolutionNameMin: Cijk_Alik_Bljk_F8NHS_STA_BH_BiasSH_HAS_SAB_SAV_UserArgs_MT128x48x256_MI16x16x1_SN_LDSB0_GRVWB16_GSU1_GSUC0_GSUWGMRR0_K1_LBSPPB256_MIWT2_3_NTA0_NLCA4_SU16_SUM0_SUS256_VWB1_WG64_4_1_WGM8_WGMXCC8_WGMXCCG304
    SolutionIndex: 161
    SolutionNameMin: Cijk_Alik_Bljk_F8NHS_STA_BH_BiasSH_HAS_SAB_SAV_UserArgs_MT128x80x256_MI16x16x1_SN_LDSB1_GRVWB16_GSU1_GSUC0_GSUWGMRR0_K1_LBSPPB256_MIWT2_5_NTA0_NLCA4_SU16_SUM0_SUS256_VWB1_WG64_4_1_WGM8_WGMXCC8_WGMXCCG304
    SolutionIndex: 162
    SolutionNameMin: Cijk_Alik_Bljk_F8NHS_STA_BH_BiasSH_HAS_SAB_SAV_UserArgs_MT128x64x256_MI16x16x1_SN_LDSB1_GRVWB16_GSU1_GSUC0_GSUWGMRR0_K1_LBSPPB1024_MIWT2_4_NTA0_NLCA4_SU16_SUM0_SUS256_VWB4_WG64_4_1_WGM8_WGMXCC8_WGMXCCG304
    SolutionIndex: 163
    SolutionNameMin: Cijk_Alik_Bljk_F8NHS_STA_BH_BiasSH_HAS_SAB_SAV_UserArgs_MT128x64x256_MI16x16x1_SN_LDSB1_GRVWB16_GSU1_GSUC0_GSUWGMRR0_K1_LBSPPB1024_MIWT2_4_NTA0_NLCA4_SU8_SUM0_SUS256_VWB4_WG64_4_1_WGM6_WGMXCC8_WGMXCCG304
    SolutionIndex: 164
    SolutionNameMin: Cijk_Alik_Bljk_F8NHS_STA_BH_BiasSH_HAS_SAB_SAV_UserArgs_MT128x80x256_MI16x16x1_SN_LDSB1_GRVWB16_GSU1_GSUC0_GSUWGMRR0_K1_LBSPPB256_MIWT2_5_NTA0_NLCA4_SU8_SUM0_SUS256_VWB1_WG64_4_1_WGM8_WGMXCC8_WGMXCCG304
    SolutionIndex: 165
    SolutionNameMin: Cijk_Alik_Bljk_F8NHS_STA_BH_BiasSH_HAS_SAB_SAV_UserArgs_MT128x64x256_MI16x16x1_SN_LDSB1_GRVWB16_GSU1_GSUC0_GSUWGMRR0_K1_LBSPPB1024_MIWT2_4_NTA0_NLCA4_SU8_SUM0_SUS256_VWB4_WG64_4_1_WGM8_WGMXCC8_WGMXCCG304
    SolutionIndex: 166
    SolutionNameMin: Cijk_Alik_Bljk_F8NHS_STA_BH_BiasSH_HAS_SAB_SAV_UserArgs_MT192x48x256_MI16x16x1_SN_LDSB0_GRVWB16_GSU1_GSUC0_GSUWGMRR0_K1_LBSPPB256_MIWT3_3_NTA0_NLCA4_SU8_SUM0_SUS256_VWB1_WG64_4_1_WGM8_WGMXCC8_WGMXCCG304
    SolutionIndex: 167
    SolutionNameMin: Cijk_Alik_Bljk_F8NHS_STA_BH_BiasSH_HAS_SAB_SAV_UserArgs_MT192x48x256_MI16x16x1_SN_LDSB0_GRVWB16_GSU1_GSUC0_GSUWGMRR0_K1_LBSPPB256_MIWT3_3_NTA0_NLCA4_SU8_SUM0_SUS256_VWB1_WG64_4_1_WGM6_WGMXCC8_WGMXCCG304
    SolutionIndex: 168
    SolutionNameMin: Cijk_Alik_Bljk_F8NHS_STA_BH_BiasSH_HAS_SAB_SAV_UserArgs_MT128x80x256_MI16x16x1_SN_LDSB1_GRVWB16_GSU1_GSUC0_GSUWGMRR0_K1_LBSPPB256_MIWT2_5_NTA0_NLCA4_SU8_SUM0_SUS256_VWB1_WG64_4_1_WGM6_WGMXCC8_WGMXCCG304
    SolutionIndex: 169
    SolutionNameMin: Cijk_Alik_Bljk_F8NHS_STA_BH_BiasSH_HAS_SAB_SAV_UserArgs_MT128x96x256_MI16x16x1_SN_LDSB1_GRVWB16_GSU1_GSUC0_GSUWGMRR0_K1_LBSPPB512_MIWT2_6_NTA0_NLCA4_SU8_SUM0_SUS256_VWB2_WG64_4_1_WGM8_WGMXCC8_WGMXCCG304
    SolutionIndex: 170
    SolutionNameMin: Cijk_Alik_Bljk_F8NHS_STA_BH_BiasSH_HAS_SAB_SAV_UserArgs_MT192x80x256_MI16x16x1_SN_LDSB1_GRVWB16_GSU1_GSUC0_GSUWGMRR0_K1_LBSPPB256_MIWT3_5_NTA0_NLCA4_SU16_SUM0_SUS256_VWB1_WG64_4_1_WGM8_WGMXCC8_WGMXCCG304
    SolutionIndex: 171
    SolutionNameMin: Cijk_Alik_Bljk_F8NHS_STA_BH_BiasSH_HAS_SAB_SAV_UserArgs_MT192x64x256_MI16x16x1_SN_LDSB1_GRVWB16_GSU1_GSUC0_GSUWGMRR0_K1_LBSPPB1024_MIWT3_4_NTA0_NLCA4_SU8_SUM0_SUS256_VWB4_WG64_4_1_WGM8_WGMXCC8_WGMXCCG304
    SolutionIndex: 172
    SolutionNameMin: Cijk_Alik_Bljk_F8NHS_STA_BH_BiasSH_HAS_SAB_SAV_UserArgs_MT128x112x256_MI16x16x1_SN_LDSB1_GRVWB16_GSU1_GSUC0_GSUWGMRR0_K1_LBSPPB256_MIWT2_7_NTA0_NLCA4_SU16_SUM0_SUS256_VWB1_WG64_4_1_WGM8_WGMXCC8_WGMXCCG304
    SolutionIndex: 173
    SolutionNameMin: Cijk_Alik_Bljk_F8NHS_STA_BH_BiasSH_HAS_SAB_SAV_UserArgs_MT192x64x256_MI16x16x1_SN_LDSB1_GRVWB16_GSU1_GSUC0_GSUWGMRR0_K1_LBSPPB1024_MIWT3_4_NTA0_NLCA4_SU16_SUM0_SUS256_VWB4_WG64_4_1_WGM8_WGMXCC8_WGMXCCG304
    SolutionIndex: 174
    SolutionNameMin: Cijk_Alik_Bljk_F8NHS_STA_BH_BiasSH_HAS_SAB_SAV_UserArgs_MT192x80x256_MI16x16x1_SN_LDSB1_GRVWB16_GSU1_GSUC0_GSUWGMRR0_K1_LBSPPB256_MIWT3_5_NTA0_NLCA4_SU8_SUM0_SUS256_VWB1_WG64_4_1_WGM8_WGMXCC8_WGMXCCG304
    SolutionIndex: 175
    SolutionNameMin: Cijk_Alik_Bljk_F8NHS_STA_BH_BiasSH_HAS_SAB_SAV_UserArgs_MT192x80x256_MI16x16x1_SN_LDSB1_GRVWB16_GSU1_GSUC0_GSUWGMRR0_K1_LBSPPB256_MIWT3_5_NTA0_NLCA4_SU8_SUM0_SUS256_VWB1_WG64_4_1_WGM6_WGMXCC8_WGMXCCG304
    SolutionIndex: 176
    SolutionNameMin: Cijk_Alik_Bljk_F8NHS_STA_BH_BiasSH_HAS_SAB_SAV_UserArgs_MT256x64x256_MI16x16x1_SN_LDSB1_GRVWB16_GSU1_GSUC0_GSUWGMRR0_K1_LBSPPB1024_MIWT4_4_NTA0_NLCA4_SU16_SUM0_SUS256_VWB4_WG64_4_1_WGM8_WGMXCC8_WGMXCCG304
    SolutionIndex: 177
    SolutionNameMin: Cijk_Alik_Bljk_F8NHS_STA_BH_BiasSH_HAS_SAB_SAV_UserArgs_MT256x64x256_MI16x16x1_SN_LDSB1_GRVWB16_GSU1_GSUC0_GSUWGMRR0_K1_LBSPPB1024_MIWT4_4_NTA0_NLCA4_SU8_SUM0_SUS256_VWB4_WG64_4_1_WGM8_WGMXCC8_WGMXCCG304
    SolutionIndex: 178
    SolutionNameMin: Cijk_Alik_Bljk_F8NHS_STA_BH_BiasSH_HAS_SAB_SAV_UserArgs_MT256x96x128_MI16x16x1_SN_LDSB0_GRVWB16_GSU1_GSUC0_GSUWGMRR0_K1_LBSPPB256_MIWT4_6_NLCA2_SU8_SUM0_SUS128_VWB2_WG64_4_1_WGM6_WGMXCC8_WGMXCCG304
    SolutionIndex: 179
    SolutionNameMin: Cijk_Alik_Bljk_F8NHS_STA_BH_BiasSH_HAS_SAB_SAV_UserArgs_MT320x80x128_MI16x16x1_SN_LDSB0_GRVWB8_GSU1_GSUC0_GSUWGMRR0_K1_LBSPPB128_MIWT5_5_NLCA2_SU16_SUM0_SUS128_VWB1_WG64_4_1_WGM6_WGMXCC8_WGMXCCG304
    SolutionIndex: 180
    SolutionNameMin: Cijk_Alik_Bljk_F8NHS_STA_BH_BiasSH_HAS_SAB_SAV_UserArgs_MT256x128x128_MI16x16x1_SN_LDSB1_GRVWB16_GSU1_GSUC0_GSUWGMRR0_K1_LBSPPB1024_MIWT4_8_NLCA2_SU8_SUM0_SUS128_VWB8_WG64_4_1_WGM8_WGMXCC8_WGMXCCG304
    SolutionIndex: 181
    SolutionNameMin: Cijk_Alik_Bljk_F8NHS_STA_BH_BiasSH_HAS_SAB_SAV_UserArgs_MT192x160x128_MI16x16x1_SN_LDSB1_GRVWB16_GSU1_GSUC0_GSUWGMRR0_K1_LBSPPB256_MIWT3_10_NLCA2_SU8_SUM0_SUS128_VWB2_WG64_4_1_WGM8_WGMXCC8_WGMXCCG304
    SolutionIndex: 182
    SolutionNameMin: Cijk_Alik_Bljk_F8NHS_STA_BH_BiasSH_HAS_SAB_SAV_UserArgs_MT320x96x128_MI16x16x1_SN_LDSB0_GRVWB16_GSU1_GSUC0_GSUWGMRR0_K1_LBSPPB256_MIWT5_6_NLCA2_SU16_SUM0_SUS128_VWB2_WG64_4_1_WGM6_WGMXCC8_WGMXCCG304
    SolutionIndex: 183
    SolutionNameMin: Cijk_Alik_Bljk_F8NHS_STA_BH_BiasSH_HAS_SAB_SAV_UserArgs_MT320x112x128_MI16x16x1_SN_LDSB0_GRVWB8_GSU1_GSUC0_GSUWGMRR0_K1_LBSPPB128_MIWT5_7_NLCA2_SU8_SUM0_SUS128_VWB1_WG64_4_1_WGM8_WGMXCC8_WGMXCCG304
    SolutionIndex: 184
    SolutionNameMin: Cijk_Alik_Bljk_F8NHS_STA_BH_BiasSH_HAS_SAB_SAV_UserArgs_MT384x112x128_MI16x16x1_SN_LDSB0_GRVWB8_GSU1_GSUC0_GSUWGMRR0_K1_LBSPPB128_MIWT6_7_NLCA2_SU16_SUM0_SUS128_VWB1_WG64_4_1_WGM8_WGMXCC8_WGMXCCG304
    SolutionIndex: 185
    SolutionNameMin: Cijk_Alik_Bljk_F8NHS_STA_BH_BiasSH_HAS_SAB_SAV_UserArgs_MT448x128x128_MI16x16x1_SN_LDSB0_GRVWB16_GSU1_GSUC0_GSUWGMRR0_K1_LBSPPB1024_MIWT7_8_NLCA2_SU16_SUM0_SUS128_VWB8_WG64_4_1_WGM6_WGMXCC8_WGMXCCG304
    SolutionIndex: 186
    SolutionNameMin: Cijk_Alik_Bljk_F8NHS_STA_BH_BiasSH_HAS_SAB_SAV_UserArgs_MT320x192x128_MI16x16x1_SN_LDSB0_GRVWB16_GSU1_GSUC0_GSUWGMRR0_K1_LBSPPB512_MIWT5_12_NLCA2_SU16_SUM0_SUS128_VWB4_WG64_4_1_WGM6_WGMXCC8_WGMXCCG304
    SolutionIndex: 187
    SolutionNameMin: Cijk_Alik_Bljk_F8NHS_STA_BH_BiasSH_HAS_SAB_SAV_UserArgs_MT320x112x128_MI16x16x1_SN_LDSB0_GRVWB8_GSU1_GSUC0_GSUWGMRR0_K1_LBSPPB128_MIWT5_7_NLCA2_SU8_SUM0_SUS128_VWB1_WG64_4_1_WGM6_WGMXCC8_WGMXCCG304
    SolutionIndex: 188
    SolutionNameMin: Cijk_Alik_Bljk_F8NHS_STA_BH_BiasSH_HAS_SAB_SAV_UserArgs_MT64x16x512_MI16x16x1_SN_LDSB0_GRVWB16_GSU1_GSUC0_GSUWGMRR0_K1_LBSPPB512_MIWT1_1_NTA4_NLCA8_SU8_SUM0_SUS512_VWB1_WG64_4_1_WGM6_WGMXCC8_WGMXCCG304
    SolutionIndex: 189
    SolutionNameMin: Cijk_Alik_Bljk_F8NHS_STA_BH_BiasSH_HAS_SAB_SAV_UserArgs_MT64x32x256_MI16x16x1_SN_LDSB0_GRVWB16_GSU1_GSUC0_GSUWGMRR0_K1_LBSPPB512_MIWT1_2_NTA4_NLCA4_SU16_SUM0_SUS256_VWB2_WG64_4_1_WGM8_WGMXCC8_WGMXCCG304
    SolutionIndex: 190
    SolutionNameMin: Cijk_Alik_Bljk_F8NHS_STA_BH_BiasSH_HAS_SAB_SAV_UserArgs_MT64x48x256_MI16x16x1_SN_LDSB0_GRVWB16_GSU1_GSUC0_GSUWGMRR0_K1_LBSPPB256_MIWT1_3_NTA4_NLCA4_SU8_SUM0_SUS256_VWB1_WG64_4_1_WGM8_WGMXCC8_WGMXCCG304
    SolutionIndex: 191
    SolutionNameMin: Cijk_Alik_Bljk_F8NHS_STA_BH_BiasSH_HAS_SAB_SAV_UserArgs_MT64x64x256_MI16x16x1_SN_LDSB1_GRVWB16_GSU1_GSUC0_GSUWGMRR0_K1_LBSPPB1024_MIWT1_4_NTA4_NLCA4_SU16_SUM0_SUS256_VWB4_WG64_4_1_WGM6_WGMXCC8_WGMXCCG304
    SolutionIndex: 192
    SolutionNameMin: Cijk_Alik_Bljk_F8NHS_STA_BH_BiasSH_HAS_SAB_SAV_UserArgs_MT128x80x256_MI16x16x1_SN_LDSB1_GRVWB16_GSU1_GSUC0_GSUWGMRR0_K1_LBSPPB256_MIWT2_5_NTA4_NLCA4_SU8_SUM0_SUS256_VWB1_WG64_4_1_WGM8_WGMXCC8_WGMXCCG304
    SolutionIndex: 193
    SolutionNameMin: Cijk_Alik_Bljk_F8NHS_STA_BH_BiasSH_HAS_SAB_SAV_UserArgs_MT128x32x256_MI16x16x1_SN_LDSB0_GRVWB16_GSU1_GSUC0_GSUWGMRR0_K1_LBSPPB512_MIWT2_2_NTA0_NLCA4_SU16_SUM0_SUS256_VWB2_WG64_4_1_WGM8_WGMXCC8_WGMXCCG304
    SolutionIndex: 194
    SolutionNameMin: Cijk_Alik_Bljk_F8NHS_STA_BH_BiasSH_HAS_SAB_SAV_UserArgs_MT64x112x256_MI16x16x1_SN_LDSB1_GRVWB16_GSU1_GSUC0_GSUWGMRR0_K1_LBSPPB256_MIWT1_7_NTA4_NLCA4_SU8_SUM0_SUS256_VWB1_WG64_4_1_WGM6_WGMXCC8_WGMXCCG304
    SolutionIndex: 195
    SolutionNameMin: Cijk_Alik_Bljk_F8NHS_STA_BH_BiasSH_HAS_SAB_SAV_UserArgs_MT128x112x256_MI16x16x1_SN_LDSB1_GRVWB16_GSU1_GSUC0_GSUWGMRR0_K1_LBSPPB256_MIWT2_7_NTA0_NLCA4_SU16_SUM0_SUS256_VWB1_WG64_4_1_WGM6_WGMXCC8_WGMXCCG304
    SolutionIndex: 196
    SolutionNameMin: Cijk_Alik_Bljk_F8NHS_STA_BH_BiasSH_HAS_SAB_SAV_UserArgs_MT128x128x128_MI16x16x1_SN_LDSB1_GRVWB16_GSU1_GSUC0_GSUWGMRR0_K1_LBSPPB1024_MIWT2_8_NTA4_NLCA2_SU16_SUM0_SUS128_VWB8_WG64_4_1_WGM6_WGMXCC8_WGMXCCG304
    SolutionIndex: 197
    SolutionNameMin: Cijk_Alik_Bljk_F8NHS_STA_BH_BiasSH_HAS_SAB_SAV_UserArgs_MT128x96x256_MI16x16x1_SN_LDSB1_GRVWB16_GSU1_GSUC0_GSUWGMRR0_K1_LBSPPB512_MIWT2_6_NTA0_NLCA4_SU16_SUM0_SUS256_VWB2_WG64_4_1_WGM8_WGMXCC8_WGMXCCG304
    SolutionIndex: 198
    SolutionNameMin: Cijk_Alik_Bljk_F8NHS_STA_BH_BiasSH_HAS_SAB_SAV_UserArgs_MT128x96x256_MI16x16x1_SN_LDSB1_GRVWB16_GSU1_GSUC0_GSUWGMRR0_K1_LBSPPB512_MIWT2_6_NTA0_NLCA4_SU8_SUM0_SUS256_VWB2_WG64_4_1_WGM6_WGMXCC8_WGMXCCG304
    SolutionIndex: 199
    SolutionNameMin: Cijk_Alik_Bljk_F8NHS_STA_BH_BiasSH_HAS_SAB_SAV_UserArgs_MT256x64x256_MI16x16x1_SN_LDSB1_GRVWB16_GSU1_GSUC0_GSUWGMRR0_K1_LBSPPB1024_MIWT4_4_NTA0_NLCA4_SU8_SUM0_SUS256_VWB4_WG64_4_1_WGM6_WGMXCC8_WGMXCCG304
    SolutionIndex: 200
    SolutionNameMin: Cijk_Alik_Bljk_F8NHS_STA_BH_BiasSH_HAS_SAB_SAV_UserArgs_MT128x112x256_MI16x16x1_SN_LDSB1_GRVWB16_GSU1_GSUC0_GSUWGMRR0_K1_LBSPPB256_MIWT2_7_NTA0_NLCA4_SU8_SUM0_SUS256_VWB1_WG64_4_1_WGM6_WGMXCC8_WGMXCCG304
    SolutionIndex: 201
    SolutionNameMin: Cijk_Alik_Bljk_F8NHS_STA_BH_BiasSH_HAS_SAB_SAV_UserArgs_MT192x96x128_MI16x16x1_SN_LDSB0_GRVWB16_GSU1_GSUC0_GSUWGMRR0_K1_LBSPPB256_MIWT3_6_NTA0_NLCA2_SU16_SUM0_SUS128_VWB2_WG64_4_1_WGM6_WGMXCC8_WGMXCCG304
    SolutionIndex: 202
    SolutionNameMin: Cijk_Alik_Bljk_F8NHS_STA_BH_BiasSH_HAS_SAB_SAV_UserArgs_MT128x128x128_MI16x16x1_SN_LDSB1_GRVWB16_GSU1_GSUC0_GSUWGMRR0_K1_LBSPPB1024_MIWT2_8_NTA0_NLCA2_SU8_SUM0_SUS128_VWB8_WG64_4_1_WGM6_WGMXCC8_WGMXCCG304
    SolutionIndex: 203
    SolutionNameMin: Cijk_Alik_Bljk_F8NHS_STA_BH_BiasSH_HAS_SAB_SAV_UserArgs_MT192x96x128_MI16x16x1_SN_LDSB0_GRVWB16_GSU1_GSUC0_GSUWGMRR0_K1_LBSPPB256_MIWT3_6_NTA0_NLCA2_SU8_SUM0_SUS128_VWB2_WG64_4_1_WGM8_WGMXCC8_WGMXCCG304
    SolutionIndex: 204
    SolutionNameMin: Cijk_Alik_Bljk_F8NHS_STA_BH_BiasSH_HAS_SAB_SAV_UserArgs_MT192x80x128_MI16x16x1_SN_LDSB0_GRVWB8_GSU1_GSUC0_GSUWGMRR0_K1_LBSPPB128_MIWT3_5_NTA0_NLCA2_SU8_SUM0_SUS128_VWB1_WG64_4_1_WGM8_WGMXCC8_WGMXCCG304
    SolutionIndex: 205
    SolutionNameMin: Cijk_Alik_Bljk_F8NHS_STA_BH_BiasSH_HAS_SAB_SAV_UserArgs_MT256x64x128_MI16x16x1_SN_LDSB0_GRVWB16_GSU1_GSUC0_GSUWGMRR0_K1_LBSPPB512_MIWT4_4_NTA0_NLCA2_SU16_SUM0_SUS128_VWB4_WG64_4_1_WGM8_WGMXCC8_WGMXCCG304
    SolutionIndex: 206
    SolutionNameMin: Cijk_Alik_Bljk_F8NHS_STA_BH_BiasSH_HAS_SAB_SAV_UserArgs_MT192x96x128_MI16x16x1_SN_LDSB0_GRVWB16_GSU1_GSUC0_GSUWGMRR0_K1_LBSPPB256_MIWT3_6_NTA0_NLCA2_SU16_SUM0_SUS128_VWB2_WG64_4_1_WGM8_WGMXCC8_WGMXCCG304
    SolutionIndex: 207
    SolutionNameMin: Cijk_Alik_Bljk_F8NHS_STA_BH_BiasSH_HAS_SAB_SAV_UserArgs_MT192x128x128_MI16x16x1_SN_LDSB1_GRVWB16_GSU1_GSUC0_GSUWGMRR0_K1_LBSPPB1024_MIWT3_8_NTA0_NLCA2_SU16_SUM0_SUS128_VWB8_WG64_4_1_WGM6_WGMXCC8_WGMXCCG304
    SolutionIndex: 208
    SolutionNameMin: Cijk_Alik_Bljk_F8NHS_STA_BH_BiasSH_HAS_SAB_SAV_UserArgs_MT192x128x128_MI16x16x1_SN_LDSB1_GRVWB16_GSU1_GSUC0_GSUWGMRR0_K1_LBSPPB1024_MIWT3_8_NTA0_NLCA2_SU8_SUM0_SUS128_VWB8_WG64_4_1_WGM6_WGMXCC8_WGMXCCG304
    SolutionIndex: 209
    SolutionNameMin: Cijk_Alik_Bljk_F8NHS_STA_BH_BiasSH_HAS_SAB_SAV_UserArgs_MT384x144x128_MI16x16x1_SN_LDSB0_GRVWB8_GSU1_GSUC0_GSUWGMRR0_K1_LBSPPB128_MIWT6_9_NLCA2_SU16_SUM0_SUS128_VWB1_WGM6_WGMXCC8_WGMXCCG304
    SolutionIndex: 210
    SolutionNameMin: Cijk_Alik_Bljk_F8NHS_STA_BH_BiasSH_HAS_SAB_SAV_UserArgs_MT384x160x128_MI16x16x1_SN_LDSB0_GRVWB16_GSU1_GSUC0_GSUWGMRR0_K1_LBSPPB256_MIWT6_10_NLCA2_SU16_SUM0_SUS128_VWB2_WGM8_WGMXCC8_WGMXCCG304
    SolutionIndex: 211
    SolutionNameMin: Cijk_Alik_Bljk_F8NHS_STA_BH_BiasSH_HAS_SAB_SAV_UserArgs_MT384x160x128_MI16x16x1_SN_LDSB0_GRVWB16_GSU1_GSUC0_GSUWGMRR0_K1_LBSPPB256_MIWT6_10_NLCA2_SU8_SUM0_SUS128_VWB2_WGM8_WGMXCC8_WGMXCCG304
    SolutionIndex: 212
    SolutionNameMin: Cijk_Alik_Bljk_F8NHS_STA_BH_BiasSH_HAS_SAB_SAV_UserArgs_MT384x112x128_MI16x16x1_SN_LDSB0_GRVWB8_GSU1_GSUC0_GSUWGMRR0_K1_LBSPPB128_MIWT6_7_NLCA2_SU16_SUM0_SUS128_VWB1_WGM6_WGMXCC8_WGMXCCG304
    SolutionIndex: 213
    SolutionNameMin: Cijk_Alik_Bljk_F8NHS_STA_BH_BiasSH_HAS_SAB_SAV_UserArgs_MT256x176x128_MI16x16x1_SN_LDSB0_GRVWB8_GSU1_GSUC0_GSUWGMRR0_K1_LBSPPB128_MIWT4_11_NLCA2_SU8_SUM0_SUS128_VWB1_WGM6_WGMXCC8_WGMXCCG304
    SolutionIndex: 214
    SolutionNameMin: Cijk_Alik_Bljk_F8NHS_STA_BH_BiasSH_HAS_SAB_SAV_UserArgs_MT384x128x128_MI16x16x1_SN_LDSB0_GRVWB16_GSU1_GSUC0_GSUWGMRR0_K1_LBSPPB1024_MIWT6_8_NLCA2_SU8_SUM0_SUS128_VWB8_WGM6_WGMXCC8_WGMXCCG304
    SolutionIndex: 215
    SolutionNameMin: Cijk_Alik_Bljk_F8NHS_STA_BH_BiasSH_HAS_SAB_SAV_UserArgs_MT192x256x128_MI16x16x1_SN_LDSB1_GRVWB16_GSU1_GSUC0_GSUWGMRR0_K1_LBSPPB2048_MIWT3_16_NLCA2_SU8_SUM0_SUS128_VWB16_WGM6_WGMXCC8_WGMXCCG304
    SolutionIndex: 216
    SolutionNameMin: Cijk_Alik_Bljk_F8NHS_STA_BH_BiasSH_HAS_SAB_SAV_UserArgs_MT320x160x128_MI16x16x1_SN_LDSB0_GRVWB16_GSU1_GSUC0_GSUWGMRR0_K1_LBSPPB256_MIWT5_10_NLCA2_SU8_SUM0_SUS128_VWB2_WGM6_WGMXCC8_WGMXCCG304
    SolutionIndex: 217
    SolutionNameMin: Cijk_Alik_Bljk_F8NHS_STA_BH_BiasSH_HAS_SAB_SAV_UserArgs_MT256x208x128_MI16x16x1_SN_LDSB1_GRVWB8_GSU1_GSUC0_GSUWGMRR0_K1_LBSPPB128_MIWT4_13_NLCA2_SU16_SUM0_SUS128_VWB1_WGM6_WGMXCC8_WGMXCCG304
    SolutionIndex: 218
    SolutionNameMin: Cijk_Alik_Bljk_F8NHS_STA_BH_BiasSH_HAS_SAB_SAV_UserArgs_MT384x144x128_MI16x16x1_SN_LDSB0_GRVWB8_GSU1_GSUC0_GSUWGMRR0_K1_LBSPPB128_MIWT6_9_NLCA2_SU8_SUM0_SUS128_VWB1_WGM6_WGMXCC8_WGMXCCG304
    SolutionIndex: 219
    SolutionNameMin: Cijk_Alik_Bljk_F8NHS_STA_BH_BiasSH_HAS_SAB_SAV_UserArgs_MT448x128x128_MI16x16x1_SN_LDSB0_GRVWB16_GSU1_GSUC0_GSUWGMRR0_K1_LBSPPB1024_MIWT7_8_NLCA2_SU8_SUM0_SUS128_VWB8_WGM8_WGMXCC8_WGMXCCG304
    SolutionIndex: 220
    SolutionNameMin: Cijk_Alik_Bljk_F8NHS_STA_BH_BiasSH_HAS_SAB_SAV_UserArgs_MT384x160x128_MI16x16x1_SN_LDSB0_GRVWB16_GSU1_GSUC0_GSUWGMRR0_K1_LBSPPB256_MIWT6_10_NLCA2_SU8_SUM0_SUS128_VWB2_WGM6_WGMXCC8_WGMXCCG304
    SolutionIndex: 221
    SolutionNameMin: Cijk_Alik_Bljk_F8NHS_STA_BH_BiasSH_HAS_SAB_SAV_UserArgs_MT320x192x128_MI16x16x1_SN_LDSB0_GRVWB16_GSU1_GSUC0_GSUWGMRR0_K1_LBSPPB512_MIWT5_12_NLCA2_SU8_SUM0_SUS128_VWB4_WGM6_WGMXCC8_WGMXCCG304
    SolutionIndex: 222
    SolutionNameMin: Cijk_Alik_Bljk_F8NHS_STA_BH_BiasSH_HAS_SAB_SAV_UserArgs_MT448x144x128_MI16x16x1_SN_LDSB0_GRVWB8_GSU1_GSUC0_GSUWGMRR0_K1_LBSPPB128_MIWT7_9_NLCA2_SU16_SUM0_SUS128_VWB1_WGM8_WGMXCC8_WGMXCCG304
    SolutionIndex: 223
    SolutionNameMin: Cijk_Alik_Bljk_F8NHS_STA_BH_BiasSH_HAS_SAB_SAV_UserArgs_MT512x128x128_MI16x16x1_SN_LDSB0_GRVWB16_GSU1_GSUC0_GSUWGMRR0_K1_LBSPPB1024_MIWT8_8_NLCA2_SU8_SUM0_SUS128_VWB8_WGM8_WGMXCC8_WGMXCCG304
    SolutionIndex: 224
    SolutionNameMin: Cijk_Alik_Bljk_F8NHS_STA_BH_BiasSH_HAS_SAB_SAV_UserArgs_MT256x224x128_MI16x16x1_SN_LDSB0_GRVWB16_GSU1_GSUC0_GSUWGMRR0_K1_LBSPPB256_MIWT4_14_NLCA2_SU16_SUM0_SUS128_VWB2_WGM8_WGMXCC8_WGMXCCG304
    SolutionIndex: 225
    SolutionNameMin: Cijk_Alik_Bljk_F8NHS_STA_BH_BiasSH_HAS_SAB_SAV_UserArgs_MT384x144x128_MI16x16x1_SN_LDSB0_GRVWB8_GSU1_GSUC0_GSUWGMRR0_K1_LBSPPB128_MIWT6_9_NLCA2_SU16_SUM0_SUS128_VWB1_WGM8_WGMXCC8_WGMXCCG304
    SolutionIndex: 226
    SolutionNameMin: Cijk_Alik_Bljk_F8NHS_STA_BH_BiasSH_HAS_SAB_SAV_UserArgs_MT192x224x128_MI16x16x1_SN_LDSB0_GRVWB16_GSU1_GSUC0_GSUWGMRR0_K1_LBSPPB256_MIWT3_14_NLCA2_SU16_SUM0_SUS128_VWB2_WGM8_WGMXCC8_WGMXCCG304
    SolutionIndex: 227
    SolutionNameMin: Cijk_Alik_Bljk_F8NHS_STA_BH_BiasSH_HAS_SAB_SAV_UserArgs_MT320x176x128_MI16x16x1_SN_LDSB0_GRVWB8_GSU1_GSUC0_GSUWGMRR0_K1_LBSPPB128_MIWT5_11_NLCA2_SU16_SUM0_SUS128_VWB1_WGM8_WGMXCC8_WGMXCCG304
    SolutionIndex: 228
    SolutionNameMin: Cijk_Alik_Bljk_F8NHS_STA_BH_BiasSH_HAS_SAB_SAV_UserArgs_MT448x128x128_MI16x16x1_SN_LDSB0_GRVWB16_GSU1_GSUC0_GSUWGMRR0_K1_LBSPPB1024_MIWT7_8_NLCA2_SU16_SUM0_SUS128_VWB8_WGM8_WGMXCC8_WGMXCCG304
    SolutionIndex: 229
    SolutionNameMin: Cijk_Alik_Bljk_F8NHS_STA_BH_BiasSH_HAS_SAB_SAV_UserArgs_MT320x128x128_MI16x16x1_SN_LDSB0_GRVWB16_GSU1_GSUC0_GSUWGMRR0_K1_LBSPPB1024_MIWT5_8_NLCA2_SU8_SUM0_SUS128_VWB8_WGM8_WGMXCC8_WGMXCCG304
    SolutionIndex: 230
    SolutionNameMin: Cijk_Alik_Bljk_F8NHS_STA_BH_BiasSH_HAS_SAB_SAV_UserArgs_MT512x128x128_MI16x16x1_SN_LDSB0_GRVWB16_GSU1_GSUC0_GSUWGMRR0_K1_LBSPPB1024_MIWT8_8_SU16_SUM0_SUS128_VWB8_WGM8_WGMXCC8_WGMXCCG304
    SolutionIndex: 231
    SolutionNameMin: Cijk_Alik_Bljk_F8NHS_STA_BH_BiasSH_HAS_SAB_SAV_UserArgs_MT384x128x128_MI16x16x1_SN_LDSB0_GRVWB16_GSU1_GSUC0_GSUWGMRR0_K1_LBSPPB1024_MIWT6_8_SU8_SUM0_SUS128_VWB8_WGM8_WGMXCC8_WGMXCCG304
    SolutionIndex: 232
    SolutionNameMin: Cijk_Alik_Bljk_F8NHS_STA_BH_BiasSH_HAS_SAB_SAV_UserArgs_MT512x128x128_MI16x16x1_SN_LDSB0_GRVWB16_GSU1_GSUC0_GSUWGMRR0_K1_LBSPPB1024_MIWT8_8_SU8_SUM0_SUS128_VWB8_WGM8_WGMXCC8_WGMXCCG304
    SolutionIndex: 233
    SolutionNameMin: Cijk_Alik_Bljk_F8NHS_STA_BH_BiasSH_HAS_SAB_SAV_UserArgs_MT448x128x128_MI16x16x1_SN_LDSB0_GRVWB16_GSU1_GSUC0_GSUWGMRR0_K1_LBSPPB1024_MIWT7_8_SU8_SUM0_SUS128_VWB8_WGM8_WGMXCC8_WGMXCCG304
    SolutionIndex: 234
    SolutionNameMin: Cijk_Alik_Bljk_F8NHS_STA_BH_BiasSH_HAS_SAB_SAV_UserArgs_MT384x128x128_MI16x16x1_SN_LDSB0_GRVWB16_GSU1_GSUC0_GSUWGMRR0_K1_LBSPPB1024_MIWT6_8_SU16_SUM0_SUS128_VWB8_WGM8_WGMXCC8_WGMXCCG304
    SolutionIndex: 235
    SolutionNameMin: Cijk_Alik_Bljk_F8NHS_STA_BH_BiasSH_HAS_SAB_SAV_UserArgs_MT512x128x128_MI16x16x1_SN_LDSB0_GRVWB16_GSU1_GSUC0_GSUWGMRR0_K1_LBSPPB1024_MIWT8_8_SU16_SUM0_SUS128_VWB8_WGM6_WGMXCC8_WGMXCCG304
    SolutionIndex: 236
    SolutionNameMin: Cijk_Alik_Bljk_F8NHS_STA_BH_BiasSH_HAS_SAB_SAV_UserArgs_MT256x16x256_MI16x16x1_SN_LDSB0_GRVWB16_GSU1_GSUC0_GSUWGMRR0_K1_LBSPPB256_MIWT4_1_NTA4_NLCA4_SU16_SUM0_SUS256_VWB1_WG64_4_1_WGM6_WGMXCC8_WGMXCCG304
    SolutionIndex: 237
    SolutionNameMin: Cijk_Alik_Bljk_F8NHS_STA_BH_BiasSH_HAS_SAB_SAV_UserArgs_MT320x32x256_MI16x16x1_SN_LDSB0_GRVWB16_GSU1_GSUC0_GSUWGMRR0_K1_LBSPPB512_MIWT5_2_NTA4_NLCA4_SU16_SUM0_SUS256_VWB2_WG64_4_1_WGM6_WGMXCC8_WGMXCCG304
    SolutionIndex: 238
    SolutionNameMin: Cijk_Alik_Bljk_F8NHS_STA_BH_BiasSH_HAS_SAB_SAV_UserArgs_MT192x48x256_MI16x16x1_SN_LDSB0_GRVWB16_GSU1_GSUC0_GSUWGMRR0_K1_LBSPPB256_MIWT3_3_NTA4_NLCA4_SU16_SUM0_SUS256_VWB1_WG64_4_1_WGM8_WGMXCC8_WGMXCCG304
    SolutionIndex: 239
    SolutionNameMin: Cijk_Alik_Bljk_F8NHS_STA_BH_BiasSH_HAS_SAB_SAV_UserArgs_MT192x64x256_MI16x16x1_SN_LDSB1_GRVWB16_GSU1_GSUC0_GSUWGMRR0_K1_LBSPPB1024_MIWT3_4_NTA4_NLCA4_SU8_SUM0_SUS256_VWB4_WG64_4_1_WGM6_WGMXCC8_WGMXCCG304
    SolutionIndex: 240
    SolutionNameMin: Cijk_Alik_Bljk_F8NHS_STA_BH_BiasSH_HAS_SAB_SAV_UserArgs_MT192x80x256_MI16x16x1_SN_LDSB1_GRVWB16_GSU1_GSUC0_GSUWGMRR0_K1_LBSPPB256_MIWT3_5_NTA4_NLCA4_SU8_SUM0_SUS256_VWB1_WG64_4_1_WGM6_WGMXCC8_WGMXCCG304
    SolutionIndex: 241
    SolutionNameMin: Cijk_Alik_Bljk_F8NHS_STA_BH_BiasSH_HAS_SAB_SAV_UserArgs_MT256x96x128_MI16x16x1_SN_LDSB0_GRVWB16_GSU1_GSUC0_GSUWGMRR0_K1_LBSPPB256_MIWT4_6_NTA4_NLCA2_SU16_SUM0_SUS128_VWB2_WG64_4_1_WGM8_WGMXCC8_WGMXCCG304
    SolutionIndex: 242
    SolutionNameMin: Cijk_Alik_Bljk_F8NHS_STA_BH_BiasSH_HAS_SAB_SAV_UserArgs_MT192x112x128_MI16x16x1_SN_LDSB1_GRVWB8_GSU1_GSUC0_GSUWGMRR0_K1_LBSPPB128_MIWT3_7_NTA4_NLCA2_SU8_SUM0_SUS128_VWB1_WG64_4_1_WGM6_WGMXCC8_WGMXCCG304
    SolutionIndex: 243
    SolutionNameMin: Cijk_Alik_Bljk_F8NHS_STA_BH_BiasSH_HAS_SAB_SAV_UserArgs_MT192x128x128_MI16x16x1_SN_LDSB1_GRVWB16_GSU1_GSUC0_GSUWGMRR0_K1_LBSPPB1024_MIWT3_8_NTA4_NLCA2_SU8_SUM0_SUS128_VWB8_WG64_4_1_WGM6_WGMXCC8_WGMXCCG304
    SolutionIndex: 244
    SolutionNameMin: Cijk_Alik_Bljk_F8NHS_STA_BH_BiasSH_HAS_SAB_SAV_UserArgs_MT192x144x128_MI16x16x1_SN_LDSB1_GRVWB8_GSU1_GSUC0_GSUWGMRR0_K1_LBSPPB128_MIWT3_9_NTA4_NLCA2_SU8_SUM0_SUS128_VWB1_WG64_4_1_WGM8_WGMXCC8_WGMXCCG304
    SolutionIndex: 245
    SolutionNameMin: Cijk_Alik_Bljk_F8NHS_STA_BH_BiasSH_HAS_SAB_SAV_UserArgs_MT192x160x128_MI16x16x1_SN_LDSB1_GRVWB16_GSU1_GSUC0_GSUWGMRR0_K1_LBSPPB256_MIWT3_10_NTA4_NLCA2_SU16_SUM0_SUS128_VWB2_WG64_4_1_WGM8_WGMXCC8_WGMXCCG304
    SolutionIndex: 246
    SolutionNameMin: Cijk_Alik_Bljk_F8NHS_STA_BH_BiasSH_HAS_SAB_SAV_UserArgs_MT192x176x128_MI16x16x1_SN_LDSB0_GRVWB8_GSU1_GSUC0_GSUWGMRR0_K1_LBSPPB128_MIWT3_11_NTA4_NLCA2_SU16_SUM0_SUS128_VWB1_WG64_4_1_WGM8_WGMXCC8_WGMXCCG304
    SolutionIndex: 247
    SolutionNameMin: Cijk_Alik_Bljk_F8NHS_STA_BH_BiasSH_HAS_SAB_SAV_UserArgs_MT192x192x128_MI16x16x1_SN_LDSB0_GRVWB16_GSU1_GSUC0_GSUWGMRR0_K1_LBSPPB512_MIWT3_12_NTA4_NLCA2_SU16_SUM0_SUS128_VWB4_WG64_4_1_WGM8_WGMXCC8_WGMXCCG304
    SolutionIndex: 248
    SolutionNameMin: Cijk_Alik_Bljk_F8NHS_STA_BH_BiasSH_HAS_SAB_SAV_UserArgs_MT192x208x128_MI16x16x1_SN_LDSB1_GRVWB8_GSU1_GSUC0_GSUWGMRR0_K1_LBSPPB128_MIWT3_13_NTA4_NLCA2_SU8_SUM0_SUS128_VWB1_WG64_4_1_WGM6_WGMXCC8_WGMXCCG304
    SolutionIndex: 249
    SolutionNameMin: Cijk_Alik_Bljk_F8NHS_STA_BH_BiasSH_HAS_SAB_SAV_UserArgs_MT192x224x128_MI16x16x1_SN_LDSB0_GRVWB16_GSU1_GSUC0_GSUWGMRR0_K1_LBSPPB256_MIWT3_14_NTA4_NLCA2_SU8_SUM0_SUS128_VWB2_WG64_4_1_WGM8_WGMXCC8_WGMXCCG304
    SolutionIndex: 250
    SolutionNameMin: Cijk_Alik_Bljk_F8NHS_STA_BH_BiasSH_HAS_SAB_SAV_UserArgs_MT384x128x128_MI16x16x1_SN_LDSB0_GRVWB16_GSU1_GSUC0_GSUWGMRR0_K1_LBSPPB1024_MIWT6_8_NTA0_NLCA2_SU16_SUM0_SUS128_VWB8_WG64_4_1_WGM6_WGMXCC8_WGMXCCG304
    SolutionIndex: 251
    SolutionNameMin: Cijk_Alik_Bljk_F8NHS_STA_BH_BiasSH_HAS_SAB_SAV_UserArgs_MT192x256x128_MI16x16x1_SN_LDSB1_GRVWB16_GSU1_GSUC0_GSUWGMRR0_K1_LBSPPB2048_MIWT3_16_NTA4_NLCA2_SU16_SUM0_SUS128_VWB16_WG64_4_1_WGM8_WGMXCC8_WGMXCCG304
    SolutionIndex: 252
    SolutionNameMin: Cijk_Alik_Bljk_F8NHS_STA_BH_BiasSH_HAS_SAB_SAV_UserArgs_MT384x144x128_MI16x16x1_SN_LDSB0_GRVWB8_GSU1_GSUC0_GSUWGMRR0_K1_LBSPPB128_MIWT6_9_NTA0_NLCA2_SU16_SUM0_SUS128_VWB1_WG64_4_1_WGM8_WGMXCC8_WGMXCCG304
    SolutionIndex: 253
    SolutionNameMin: Cijk_Alik_Bljk_F8NHS_STA_BH_BiasSH_HAS_SAB_SAV_UserArgs_MT384x144x128_MI16x16x1_SN_LDSB0_GRVWB8_GSU1_GSUC0_GSUWGMRR0_K1_LBSPPB128_MIWT6_9_NTA0_NLCA2_SU8_SUM0_SUS128_VWB1_WG64_4_1_WGM8_WGMXCC8_WGMXCCG304
    SolutionIndex: 254
    SolutionNameMin: Cijk_Alik_Bljk_F8NHS_STA_BH_BiasSH_HAS_SAB_SAV_UserArgs_MT384x160x128_MI16x16x1_SN_LDSB0_GRVWB16_GSU1_GSUC0_GSUWGMRR0_K1_LBSPPB256_MIWT6_10_NTA0_NLCA2_SU16_SUM0_SUS128_VWB2_WG64_4_1_WGM6_WGMXCC8_WGMXCCG304
    SolutionIndex: 255
    SolutionNameMin: Cijk_Alik_Bljk_F8NHS_STA_BH_BiasSH_HAS_SAB_SAV_UserArgs_MT384x160x128_MI16x16x1_SN_LDSB0_GRVWB16_GSU1_GSUC0_GSUWGMRR0_K1_LBSPPB256_MIWT6_10_NTA0_NLCA2_SU8_SUM0_SUS128_VWB2_WG64_4_1_WGM6_WGMXCC8_WGMXCCG304
    SolutionIndex: 256
    SolutionNameMin: Cijk_Alik_Bljk_F8NHS_STA_BH_BiasSH_HAS_SAB_SAV_UserArgs_MT320x112x128_MI16x16x1_SN_LDSB0_GRVWB8_GSU1_GSUC0_GSUWGMRR0_K1_LBSPPB128_MIWT5_7_NTA0_NLCA2_SU16_SUM0_SUS128_VWB1_WG64_4_1_WGM8_WGMXCC8_WGMXCCG304
    SolutionIndex: 257
    SolutionNameMin: Cijk_Alik_Bljk_F8NHS_STA_BH_BiasSH_HAS_SAB_SAV_UserArgs_MT192x176x128_MI16x16x1_SN_LDSB0_GRVWB8_GSU1_GSUC0_GSUWGMRR0_K1_LBSPPB128_MIWT3_11_NTA0_NLCA2_SU16_SUM0_SUS128_VWB1_WG64_4_1_WGM6_WGMXCC8_WGMXCCG304
    SolutionIndex: 258
    SolutionNameMin: Cijk_Alik_Bljk_F8NHS_STA_BH_BiasSH_HAS_SAB_SAV_UserArgs_MT320x128x128_MI16x16x1_SN_LDSB0_GRVWB16_GSU1_GSUC0_GSUWGMRR0_K1_LBSPPB1024_MIWT5_8_NTA0_NLCA2_SU16_SUM0_SUS128_VWB8_WG64_4_1_WGM6_WGMXCC8_WGMXCCG304
    SolutionIndex: 259
    SolutionNameMin: Cijk_Alik_Bljk_F8NHS_STA_BH_BiasSH_HAS_SAB_SAV_UserArgs_MT512x80x128_MI16x16x1_SN_LDSB0_GRVWB8_GSU1_GSUC0_GSUWGMRR0_K1_LBSPPB128_MIWT8_5_NTA0_NLCA2_SU16_SUM0_SUS128_VWB1_WG64_4_1_WGM6_WGMXCC8_WGMXCCG304
    SolutionIndex: 260
    SolutionNameMin: Cijk_Alik_Bljk_F8NHS_STA_BH_BiasSH_HAS_SAB_SAV_UserArgs_MT192x208x128_MI16x16x1_SN_LDSB1_GRVWB8_GSU1_GSUC0_GSUWGMRR0_K1_LBSPPB128_MIWT3_13_NTA0_NLCA2_SU16_SUM0_SUS128_VWB1_WG64_4_1_WGM6_WGMXCC8_WGMXCCG304
    SolutionIndex: 261
    SolutionNameMin: Cijk_Alik_Bljk_F8NHS_STA_BH_BiasSH_HAS_SAB_SAV_UserArgs_MT320x144x128_MI16x16x1_SN_LDSB0_GRVWB8_GSU1_GSUC0_GSUWGMRR0_K1_LBSPPB128_MIWT5_9_NTA0_NLCA2_SU16_SUM0_SUS128_VWB1_WG64_4_1_WGM6_WGMXCC8_WGMXCCG304
    SolutionIndex: 262
    SolutionNameMin: Cijk_Alik_Bljk_F8NHS_STA_BH_BiasSH_HAS_SAB_SAV_UserArgs_MT192x224x128_MI16x16x1_SN_LDSB0_GRVWB16_GSU1_GSUC0_GSUWGMRR0_K1_LBSPPB256_MIWT3_14_NTA0_NLCA2_SU16_SUM0_SUS128_VWB2_WG64_4_1_WGM6_WGMXCC8_WGMXCCG304
    SolutionIndex: 263
    SolutionNameMin: Cijk_Alik_Bljk_F8NHS_STA_BH_BiasSH_HAS_SAB_SAV_UserArgs_MT320x160x128_MI16x16x1_SN_LDSB0_GRVWB16_GSU1_GSUC0_GSUWGMRR0_K1_LBSPPB256_MIWT5_10_NTA0_NLCA2_SU8_SUM0_SUS128_VWB2_WG64_4_1_WGM8_WGMXCC8_WGMXCCG304
    SolutionIndex: 264
    SolutionNameMin: Cijk_Alik_Bljk_F8NHS_STA_BH_BiasSH_HAS_SAB_SAV_UserArgs_MT384x128x128_MI16x16x1_SN_LDSB0_GRVWB16_GSU1_GSUC0_GSUWGMRR0_K1_LBSPPB1024_MIWT6_8_NTA0_NLCA2_SU8_SUM0_SUS128_VWB8_WG64_4_1_WGM8_WGMXCC8_WGMXCCG304
    SolutionIndex: 265
    SolutionNameMin: Cijk_Alik_Bljk_F8NHS_STA_BH_BiasSH_HAS_SAB_SAV_UserArgs_MT512x128x128_MI16x16x1_SN_LDSB0_GRVWB16_GSU1_GSUC0_GSUWGMRR0_K1_LBSPPB1024_MIWT8_8_NLCA2_SU16_SUM0_SUS128_VWB8_WGM8_WGMXCC8_WGMXCCG304
    SolutionIndex: 266
    SolutionNameMin: Cijk_Alik_Bljk_F8NHS_STA_BH_BiasSH_HAS_SAB_SAV_UserArgs_MT192x256x128_MI16x16x1_SN_LDSB1_GRVWB16_GSU1_GSUC0_GSUWGMRR0_K1_LBSPPB2048_MIWT3_16_NLCA2_SU16_SUM0_SUS128_VWB16_WGM6_WGMXCC8_WGMXCCG304
    SolutionIndex: 267
    SolutionNameMin: Cijk_Alik_Bljk_F8NHS_STA_BH_BiasSH_HAS_SAB_SAV_UserArgs_MT384x128x128_MI16x16x1_SN_LDSB0_GRVWB16_GSU1_GSUC0_GSUWGMRR0_K1_LBSPPB1024_MIWT6_8_NLCA2_SU16_SUM0_SUS128_VWB8_WGM8_WGMXCC8_WGMXCCG304
    SolutionIndex: 268
    SolutionNameMin: Cijk_Alik_Bljk_F8NHS_STA_BH_BiasSH_HAS_SAB_SAV_UserArgs_MT384x128x128_MI16x16x1_SN_LDSB0_GRVWB16_GSU1_GSUC0_GSUWGMRR0_K1_LBSPPB1024_MIWT6_8_NLCA2_SU8_SUM0_SUS128_VWB8_WGM8_WGMXCC8_WGMXCCG304
    SolutionIndex: 269
    SolutionNameMin: Cijk_Alik_Bljk_F8NHS_STA_BH_BiasSH_HAS_SAB_SAV_UserArgs_MT192x256x128_MI16x16x1_SN_LDSB1_GRVWB16_GSU1_GSUC0_GSUWGMRR0_K1_LBSPPB2048_MIWT3_16_NLCA2_SU16_SUM0_SUS128_VWB16_WGM8_WGMXCC8_WGMXCCG304
    SolutionIndex: 270
    SolutionNameMin: Cijk_Alik_Bljk_F8NHS_STA_BH_BiasSH_HAS_SAB_SAV_UserArgs_MT128x64x256_MI16x16x1_SN_LDSB1_GRVWB16_GSU4_GSUC0_GSUWGMRR0_K1_LBSPPB1024_MIWT2_4_NLCA4_SU16_SUM0_SUS256_VWB4_WG64_4_1_WGM8_WGMXCC8_WGMXCCG304
    SolutionIndex: 271
    SolutionNameMin: Cijk_Alik_Bljk_F8NHS_STA_BH_BiasSH_HAS_SAB_SAV_UserArgs_MT128x80x256_MI16x16x1_SN_LDSB1_GRVWB16_GSU4_GSUC0_GSUWGMRR0_K1_LBSPPB256_MIWT2_5_NLCA4_SU16_SUM0_SUS256_VWB1_WG64_4_1_WGM8_WGMXCC8_WGMXCCG304
    SolutionIndex: 272
    SolutionNameMin: Cijk_Alik_Bljk_F8NHS_STA_BH_BiasSH_HAS_SAB_SAV_UserArgs_MT128x96x256_MI16x16x1_SN_LDSB1_GRVWB16_GSU4_GSUC0_GSUWGMRR0_K1_LBSPPB512_MIWT2_6_NLCA4_SU16_SUM0_SUS256_VWB2_WG64_4_1_WGM8_WGMXCC8_WGMXCCG304
    SolutionIndex: 273
    SolutionNameMin: Cijk_Alik_Bljk_F8NHS_STA_BH_BiasSH_HAS_SAB_SAV_UserArgs_MT128x112x256_MI16x16x1_SN_LDSB1_GRVWB16_GSU4_GSUC0_GSUWGMRR0_K1_LBSPPB256_MIWT2_7_NLCA4_SU16_SUM0_SUS256_VWB1_WG64_4_1_WGM8_WGMXCC8_WGMXCCG304
    SolutionIndex: 274
    SolutionNameMin: Cijk_Alik_Bljk_F8NHS_STA_BH_BiasSH_HAS_SAB_SAV_UserArgs_MT128x128x256_MI16x16x1_SN_LDSB1_GRVWB16_GSU3_GSUC0_GSUWGMRR0_K1_LBSPPB2048_MIWT2_8_NLCA4_SU16_SUM0_SUS256_VWB8_WG64_4_1_WGM8_WGMXCC8_WGMXCCG304
    SolutionIndex: 275
    SolutionNameMin: Cijk_Alik_Bljk_F8NHS_STA_BH_BiasSH_HAS_SAB_SAV_UserArgs_MT256x48x256_MI16x16x1_SN_LDSB0_GRVWB16_GSU2_GSUC0_GSUWGMRR0_K1_LBSPPB256_MIWT4_3_NLCA4_SU16_SUM0_SUS256_VWB1_WG64_4_1_WGM8_WGMXCC8_WGMXCCG304
    SolutionIndex: 276
    SolutionNameMin: Cijk_Alik_Bljk_F8NHS_STA_BH_BiasSH_HAS_SAB_SAV_UserArgs_MT320x80x128_MI16x16x1_SN_LDSB0_GRVWB8_GSU4_GSUC0_GSUWGMRR0_K1_LBSPPB128_MIWT5_5_NLCA2_SU16_SUM0_SUS128_VWB1_WG64_4_1_WGM8_WGMXCC8_WGMXCCG304
    SolutionIndex: 277
    SolutionNameMin: Cijk_Alik_Bljk_F8NHS_STA_BH_BiasSH_HAS_SAB_SAV_UserArgs_MT256x96x128_MI16x16x1_SN_LDSB0_GRVWB16_GSU4_GSUC0_GSUWGMRR0_K1_LBSPPB256_MIWT4_6_NLCA2_SU16_SUM0_SUS128_VWB2_WG64_4_1_WGM8_WGMXCC8_WGMXCCG304
    SolutionIndex: 278
    SolutionNameMin: Cijk_Alik_Bljk_F8NHS_STA_BH_BiasSH_HAS_SAB_SAV_UserArgs_MT192x96x128_MI16x16x1_SN_LDSB0_GRVWB16_GSU3_GSUC0_GSUWGMRR0_K1_LBSPPB256_MIWT3_6_NLCA2_SU16_SUM0_SUS128_VWB2_WG64_4_1_WGM8_WGMXCC8_WGMXCCG304
    SolutionIndex: 279
    SolutionNameMin: Cijk_Alik_Bljk_F8NHS_STA_BH_BiasSH_HAS_SAB_SAV_UserArgs_MT128x112x256_MI16x16x1_SN_LDSB1_GRVWB16_GSU2_GSUC0_GSUWGMRR0_K1_LBSPPB256_MIWT2_7_NLCA4_SU16_SUM0_SUS256_VWB1_WG64_4_1_WGM8_WGMXCC8_WGMXCCG304
    SolutionIndex: 280
    SolutionNameMin: Cijk_Alik_Bljk_F8NHS_STA_BH_BiasSH_HAS_SAB_SAV_UserArgs_MT256x112x128_MI16x16x1_SN_LDSB1_GRVWB8_GSU4_GSUC0_GSUWGMRR0_K1_LBSPPB128_MIWT4_7_NLCA2_SU16_SUM0_SUS128_VWB1_WG64_4_1_WGM8_WGMXCC8_WGMXCCG304
    SolutionIndex: 281
    SolutionNameMin: Cijk_Alik_Bljk_F8NHS_STA_BH_BiasSH_HAS_SAB_SAV_UserArgs_MT256x80x256_MI16x16x1_SN_LDSB1_GRVWB16_GSU3_GSUC0_GSUWGMRR0_K1_LBSPPB256_MIWT4_5_NLCA4_SU16_SUM0_SUS256_VWB1_WG64_4_1_WGM8_WGMXCC8_WGMXCCG304
    SolutionIndex: 282
    SolutionNameMin: Cijk_Alik_Bljk_F8NHS_STA_BH_BiasSH_HAS_SAB_SAV_UserArgs_MT128x64x256_MI16x16x1_SN_LDSB1_GRVWB16_GSU1_GSUC0_GSUWGMRR0_K1_LBSPPB1024_MIWT2_4_NLCA4_SU16_SUM0_SUS256_VWB4_WG64_4_1_WGM8_WGMXCC8_WGMXCCG304
    SolutionIndex: 283
    SolutionNameMin: Cijk_Alik_Bljk_F8NHS_STA_BH_BiasSH_HAS_SAB_SAV_UserArgs_MT192x128x128_MI16x16x1_SN_LDSB1_GRVWB16_GSU1_GSUC0_GSUWGMRR0_K1_LBSPPB1024_MIWT3_8_NLCA2_SU16_SUM0_SUS128_VWB8_WG64_4_1_WGM8_WGMXCC8_WGMXCCGn1
    SolutionIndex: 284
    SolutionNameMin: Cijk_Alik_Bljk_F8NHS_STA_BH_BiasSH_HAS_SAB_SAV_UserArgs_MT192x192x128_MI16x16x1_SN_LDSB0_GRVWB16_GSU1_GSUC0_GSUWGMRR0_K1_LBSPPB512_MIWT3_12_NLCA2_SU16_SUM0_SUS128_VWB4_WG64_4_1_WGM8_WGMXCC8_WGMXCCGn1
    SolutionIndex: 285
    SolutionNameMin: Cijk_Alik_Bljk_F8NHS_STA_BH_BiasSH_HAS_SAB_SAV_UserArgs_MT256x160x128_MI16x16x1_SN_LDSB0_GRVWB16_GSU1_GSUC0_GSUWGMRR0_K1_LBSPPB256_MIWT4_10_NLCA2_SU16_SUM0_SUS128_VWB2_WG64_4_1_WGM8_WGMXCC8_WGMXCCGn1
    SolutionIndex: 286
    SolutionNameMin: Cijk_Alik_Bljk_F8NHS_STA_BH_BiasSH_HAS_SAB_SAV_UserArgs_MT384x128x128_MI16x16x1_SN_LDSB0_GRVWB16_GSU1_GSUC0_GSUWGMRR0_K1_LBSPPB1024_MIWT6_8_NLCA2_SU16_SUM0_SUS128_VWB8_WG64_4_1_WGM8_WGMXCC8_WGMXCCGn1
    SolutionIndex: 287
    SolutionNameMin: Cijk_Alik_Bljk_F8NHS_STA_BH_BiasSH_HAS_SAB_SAV_UserArgs_MT256x208x128_MI16x16x1_SN_LDSB1_GRVWB8_GSU1_GSUC0_GSUWGMRR0_K1_LBSPPB128_MIWT4_13_NLCA2_SU16_SUM0_SUS128_VWB1_WG64_4_1_WGM8_WGMXCC8_WGMXCCGn1
    SolutionIndex: 288
    SolutionNameMin: Cijk_Alik_Bljk_F8NHS_STA_BH_BiasSH_HAS_SAB_SAV_UserArgs_MT384x144x128_MI16x16x1_SN_LDSB0_GRVWB8_GSU1_GSUC0_GSUWGMRR0_K1_LBSPPB128_MIWT6_9_NLCA2_SU16_SUM0_SUS128_VWB1_WG64_4_1_WGM8_WGMXCC8_WGMXCCGn1
    SolutionIndex: 289
    SolutionNameMin: Cijk_Alik_Bljk_F8NHS_STA_BH_BiasSH_HAS_SAB_SAV_UserArgs_MT256x224x128_MI16x16x1_SN_LDSB0_GRVWB16_GSU1_GSUC0_GSUWGMRR0_K1_LBSPPB256_MIWT4_14_NLCA2_SU16_SUM0_SUS128_VWB2_WG64_4_1_WGM8_WGMXCC8_WGMXCCGn1
    SolutionIndex: 290
    SolutionNameMin: Cijk_Alik_Bljk_F8NHS_STA_BH_BiasSH_HAS_SAB_SAV_UserArgs_MT512x128x128_MI16x16x1_SN_LDSB0_GRVWB16_GSU1_GSUC0_GSUWGMRR0_K1_LBSPPB1024_MIWT8_8_NLCA2_SU16_SUM0_SUS128_VWB8_WG64_4_1_WGM8_WGMXCC8_WGMXCCGn1
    SolutionIndex: 291
    SolutionNameMin: Cijk_Alik_Bljk_F8NHS_STA_BH_BiasSH_HAS_SAB_SAV_UserArgs_MT256x128x128_MI16x16x1_SN_LDSB1_GRVWB16_GSU1_GSUC0_GSUWGMRR0_K1_LBSPPB1024_MIWT4_8_NLCA2_SU16_SUM0_SUS128_VWB8_WG64_4_1_WGM8_WGMXCC8_WGMXCCGn1
    SolutionIndex: 292
    SolutionNameMin: Cijk_Alik_Bljk_F8NHS_STA_BH_BiasSH_HAS_SAB_SAV_UserArgs_MT192x256x128_MI16x16x1_SN_LDSB1_GRVWB16_GSU1_GSUC0_GSUWGMRR0_K1_LBSPPB2048_MIWT3_16_NLCA2_SU16_SUM0_SUS128_VWB16_WG64_4_1_WGM8_WGMXCC8_WGMXCCGn1
    SolutionIndex: 293
    SolutionNameMin: Cijk_Alik_Bljk_F8NHS_STA_BH_BiasSH_HAS_SAB_SAV_UserArgs_MT192x96x128_MI16x16x1_SN_LDSB0_GRVWB16_GSU1_GSUC0_GSUWGMRR0_K1_LBSPPB256_MIWT3_6_NLCA2_SU16_SUM0_SUS128_VWB2_WG64_4_1_WGM8_WGMXCC8_WGMXCCGn1
    SolutionIndex: 294
    SolutionNameMin: Cijk_Alik_Bljk_F8NHS_STA_BH_BiasSH_HAS_SAB_SAV_UserArgs_MT256x80x128_MI16x16x1_SN_LDSB0_GRVWB8_GSU1_GSUC0_GSUWGMRR0_K1_LBSPPB128_MIWT4_5_NLCA2_SU16_SUM0_SUS128_VWB1_WG64_4_1_WGM8_WGMXCC8_WGMXCCGn1
    SolutionIndex: 295
    SolutionNameMin: Cijk_Alik_Bljk_F8NHS_STA_BH_BiasSH_HAS_SAB_SAV_UserArgs_MT256x112x128_MI16x16x1_SN_LDSB1_GRVWB8_GSU1_GSUC0_GSUWGMRR0_K1_LBSPPB128_MIWT4_7_NLCA2_SU16_SUM0_SUS128_VWB1_WG64_4_1_WGM8_WGMXCC8_WGMXCCGn1
    SolutionIndex: 296
    SolutionNameMin: Cijk_Alik_Bljk_F8NHS_STA_BH_BiasSH_HAS_SAB_SAV_UserArgs_MT384x96x128_MI16x16x1_SN_LDSB0_GRVWB16_GSU1_GSUC0_GSUWGMRR0_K1_LBSPPB256_MIWT6_6_NLCA2_SU16_SUM0_SUS128_VWB2_WG64_4_1_WGM8_WGMXCC8_WGMXCCGn1
    SolutionIndex: 297
    SolutionNameMin: Cijk_Alik_Bljk_F8NHS_STA_BH_BiasSH_HAS_SAB_SAV_UserArgs_MT320x128x128_MI16x16x1_SN_LDSB0_GRVWB16_GSU1_GSUC0_GSUWGMRR0_K1_LBSPPB1024_MIWT5_8_NLCA2_SU16_SUM0_SUS128_VWB8_WG64_4_1_WGM8_WGMXCC8_WGMXCCGn1
    SolutionIndex: 298
    SolutionNameMin: Cijk_Alik_Bljk_F8NHS_STA_BH_BiasSH_HAS_SAB_SAV_UserArgs_MT384x160x128_MI16x16x1_SN_LDSB0_GRVWB16_GSU1_GSUC0_GSUWGMRR0_K1_LBSPPB256_MIWT6_10_NLCA2_SU16_SUM0_SUS128_VWB2_WG64_4_1_WGM8_WGMXCC8_WGMXCCGn1
    SolutionIndex: 299
    SolutionNameMin: Cijk_Alik_Bljk_F8NHS_STA_BH_BiasSH_HAS_SAB_SAV_UserArgs_MT192x128x128_MI16x16x1_SN_LDSB1_GRVWB16_GSU5_GSUAMB_GSUC0_GSUWGMRR0_K1_LBSPPB1024_MIWT3_8_NLCA2_SU16_SUM0_SUS128_VWB8_WG64_4_1_WGM1_WGMXCC8_WGMXCCGn1
    SolutionIndex: 300
    SolutionNameMin: Cijk_Alik_Bljk_F8NHS_STA_BH_BiasSH_HAS_SAB_SAV_UserArgs_MT32x16x512_MI16x16x1_SN_LDSB0_GRVWB16_GSU4_GSUAMBSK_GSUC0_GSUWGMRR0_K1_LBSPPB512_MIWT1_1_NLCA8_SU16_SUM0_SUS512_VWB1_WG32_4_1_WGM1_WGMXCC8_WGMXCCGn1
    SolutionIndex: 301
    SolutionNameMin: Cijk_Alik_Bljk_F8NHS_STA_BH_BiasSH_HAS_SAB_SAV_UserArgs_MT64x16x512_MI16x16x1_SN_LDSB0_GRVWB16_GSU5_GSUAMBSK_GSUC0_GSUWGMRR0_K1_LBSPPB512_MIWT1_1_NLCA8_SU16_SUM0_SUS512_VWB1_WG64_4_1_WGM1_WGMXCC8_WGMXCCGn1
    SolutionIndex: 302
    SolutionNameMin: Cijk_Alik_Bljk_F8NHS_STA_BH_BiasSH_HAS_SAB_SAV_UserArgs_MT16x16x512_MI16x16x1_SN_LDSB0_GRVWB16_GSU3_GSUAMBSK_GSUC0_GSUWGMRR0_K1_LBSPPB512_MIWT1_1_NLCA8_SU16_SUM0_SUS512_VWB1_WG16_4_1_WGM1_WGMXCC8_WGMXCCGn1
    SolutionIndex: 303
    SolutionNameMin: Cijk_Alik_Bljk_F8NHS_STA_BH_BiasSH_HAS_SAB_SAV_UserArgs_MT16x16x512_MI16x16x1_SN_LDSB0_GRVWB16_GSU4_GSUAMBSK_GSUC0_GSUWGMRR0_K1_LBSPPB512_MIWT1_1_NLCA8_SU16_SUM0_SUS512_VWB1_WG16_4_1_WGM1_WGMXCC8_WGMXCCGn1
    SolutionIndex: 304
    SolutionNameMin: Cijk_Alik_Bljk_F8NHS_STA_BH_BiasSH_HAS_SAB_SAV_UserArgs_MT64x16x512_MI16x16x1_SN_LDSB0_GRVWB16_GSU3_GSUAMBSK_GSUC0_GSUWGMRR0_K1_LBSPPB512_MIWT1_1_NLCA8_SU16_SUM0_SUS512_VWB1_WG64_4_1_WGM1_WGMXCC8_WGMXCCGn1
    SolutionIndex: 305
    SolutionNameMin: Cijk_Alik_Bljk_F8NHS_STA_BH_BiasSH_HAS_SAB_SAV_UserArgs_MT64x16x512_MI16x16x1_SN_LDSB0_GRVWB16_GSU4_GSUAMBSK_GSUC0_GSUWGMRR0_K1_LBSPPB512_MIWT1_1_NLCA8_SU16_SUM0_SUS512_VWB1_WG64_4_1_WGM1_WGMXCC8_WGMXCCGn1
    SolutionIndex: 306
    SolutionNameMin: Cijk_Alik_Bljk_F8NHS_STA_BH_BiasSH_HAS_SAB_SAV_UserArgs_MT32x16x256_MI16x16x1_SN_LDSB0_GRVWB16_GSU5_GSUAMBSK_GSUC0_GSUWGMRR0_K1_LBSPPB256_MIWT1_1_NLCA4_SU16_SUM0_SUS256_VWB1_WG32_4_1_WGM1_WGMXCC8_WGMXCCGn1
    SolutionIndex: 307
    SolutionNameMin: Cijk_Alik_Bljk_F8NHS_STA_BH_BiasSH_HAS_SAB_SAV_UserArgs_MT64x16x512_MI16x16x1_SN_LDSB0_GRVWB16_GSU7_GSUAMBSK_GSUC0_GSUWGMRR0_K1_LBSPPB512_MIWT1_1_NLCA8_SU16_SUM0_SUS512_VWB1_WG64_4_1_WGM1_WGMXCC8_WGMXCCGn1
    SolutionIndex: 308
    SolutionNameMin: Cijk_Alik_Bljk_F8NHS_STA_BH_BiasSH_HAS_SAB_SAV_UserArgs_MT64x16x256_MI16x16x1_SN_LDSB0_GRVWB16_GSU6_GSUAMBSK_GSUC0_GSUWGMRR0_K1_LBSPPB256_MIWT1_1_NLCA4_SU16_SUM0_SUS256_VWB1_WG64_4_1_WGM1_WGMXCC8_WGMXCCGn1
    SolutionIndex: 309
    SolutionNameMin: Cijk_Alik_Bljk_F8NHS_STA_BH_BiasSH_HAS_SAB_SAV_UserArgs_MT64x16x256_MI16x16x1_SN_LDSB0_GRVWB16_GSU5_GSUAMBSK_GSUC0_GSUWGMRR0_K1_LBSPPB256_MIWT1_1_NLCA4_SU16_SUM0_SUS256_VWB1_WG64_4_1_WGM1_WGMXCC8_WGMXCCGn1
    SolutionIndex: 310
    SolutionNameMin: Cijk_Alik_Bljk_F8NHS_STA_BH_BiasSH_HAS_SAB_SAV_UserArgs_MT64x32x512_MI16x16x1_SN_LDSB1_GRVWB16_GSU3_GSUAMBSK_GSUC0_GSUWGMRR0_K1_LBSPPB1024_MIWT1_2_NLCA8_SU16_SUM0_SUS512_VWB2_WG64_4_1_WGM1_WGMXCC8_WGMXCCGn1
    SolutionIndex: 311
    SolutionNameMin: Cijk_Alik_Bljk_F8NHS_STA_BH_BiasSH_HAS_SAB_SAV_UserArgs_MT256x176x128_MI16x16x1_SN_LDSB0_GRVWB8_GSU1_GSUC0_GSUWGMRR0_K1_LBSPPB128_MIWT4_11_NLCA2_SU16_SUM0_SUS128_VWB1_WG64_4_1_WGM8_WGMXCC8_WGMXCCGn1
    SolutionIndex: 312
    SolutionNameMin: Cijk_Alik_Bljk_F8NHS_STA_BH_BiasSH_HAS_SAB_SAV_UserArgs_MT448x128x128_MI16x16x1_SN_LDSB0_GRVWB16_GSU1_GSUC0_GSUWGMRR0_K1_LBSPPB1024_MIWT7_8_NLCA2_SU16_SUM0_SUS128_VWB8_WG64_4_1_WGM8_WGMXCC8_WGMXCCGn1
    SolutionIndex: 313
    SolutionNameMin: Cijk_Alik_Bljk_F8NHS_STA_BH_BiasSH_HAS_SAB_SAV_UserArgs_MT192x176x128_MI16x16x1_SN_LDSB0_GRVWB8_GSU1_GSUC0_GSUWGMRR0_K1_LBSPPB128_MIWT3_11_NLCA2_SU16_SUM0_SUS128_VWB1_WG64_4_1_WGM8_WGMXCC8_WGMXCCGn1
    SolutionIndex: 314
    SolutionNameMin: Cijk_Alik_Bljk_F8NHS_STA_BH_BiasSH_HAS_SAB_SAV_UserArgs_MT320x192x128_MI16x16x1_SN_LDSB0_GRVWB16_GSU1_GSUC0_GSUWGMRR0_K1_LBSPPB512_MIWT5_12_NLCA2_SU16_SUM0_SUS128_VWB4_WG64_4_1_WGM8_WGMXCC8_WGMXCCGn1
    SolutionIndex: 315
    SolutionNameMin: Cijk_Alik_Bljk_F8NHS_STA_BH_BiasSH_HAS_SAB_SAV_UserArgs_MT384x80x128_MI16x16x1_SN_LDSB0_GRVWB8_GSU1_GSUC0_GSUWGMRR0_K1_LBSPPB128_MIWT6_5_NLCA2_SU16_SUM0_SUS128_VWB1_WG64_4_1_WGM8_WGMXCC8_WGMXCCGn1
    SolutionIndex: 316
    SolutionNameMin: Cijk_Alik_Bljk_F8NHS_STA_BH_BiasSH_HAS_SAB_SAV_UserArgs_MT256x144x128_MI16x16x1_SN_LDSB0_GRVWB8_GSU1_GSUC0_GSUWGMRR0_K1_LBSPPB128_MIWT4_9_NLCA2_SU16_SUM0_SUS128_VWB1_WG64_4_1_WGM8_WGMXCC8_WGMXCCGn1
    SolutionIndex: 317
    SolutionNameMin: Cijk_Alik_Bljk_F8NHS_STA_BH_BiasSH_HAS_SAB_SAV_UserArgs_MT64x16x512_MI16x16x1_SN_LDSB0_GRVWB16_GSU2_GSUAMBSK_GSUC0_GSUWGMRR0_K1_LBSPPB512_MIWT1_1_NLCA8_SU16_SUM0_SUS512_VWB1_WG64_4_1_WGM1_WGMXCC8_WGMXCCGn1
    SolutionIndex: 318
    SolutionNameMin: Cijk_Alik_Bljk_F8NHS_STA_BH_BiasSH_HAS_SAB_SAV_UserArgs_MT128x32x256_MI16x16x1_SN_LDSB0_GRVWB16_GSU4_GSUAMB_GSUC0_GSUWGMRR0_K1_LBSPPB512_MIWT2_2_NLCA4_SU16_SUM0_SUS256_VWB2_WG64_4_1_WGM1_WGMXCC8_WGMXCCGn1
    SolutionIndex: 319
    SolutionNameMin: Cijk_Alik_Bljk_F8NHS_STA_BH_BiasSH_HAS_SAB_SAV_UserArgs_MT128x48x256_MI16x16x1_SN_LDSB0_GRVWB16_GSU5_GSUAMB_GSUC0_GSUWGMRR0_K1_LBSPPB256_MIWT2_3_NLCA4_SU16_SUM0_SUS256_VWB1_WG64_4_1_WGM1_WGMXCC8_WGMXCCGn1
    SolutionIndex: 320
    SolutionNameMin: Cijk_Alik_Bljk_F8NHS_STA_BH_BiasSH_HAS_SAB_SAV_UserArgs_MT128x64x256_MI16x16x1_SN_LDSB1_GRVWB16_GSU6_GSUAMB_GSUC0_GSUWGMRR0_K1_LBSPPB1024_MIWT2_4_NLCA4_SU16_SUM0_SUS256_VWB4_WG64_4_1_WGM1_WGMXCC8_WGMXCCGn1
    SolutionIndex: 321
    SolutionNameMin: Cijk_Alik_Bljk_F8NHS_STA_BH_BiasSH_HAS_SAB_SAV_UserArgs_MT128x80x256_MI16x16x1_SN_LDSB1_GRVWB16_GSU6_GSUAMB_GSUC0_GSUWGMRR0_K1_LBSPPB256_MIWT2_5_NLCA4_SU16_SUM0_SUS256_VWB1_WG64_4_1_WGM1_WGMXCC8_WGMXCCGn1
    SolutionIndex: 322
    SolutionNameMin: Cijk_Alik_Bljk_F8NHS_STA_BH_BiasSH_HAS_SAB_SAV_UserArgs_MT128x96x256_MI16x16x1_SN_LDSB1_GRVWB16_GSU5_GSUAMB_GSUC0_GSUWGMRR0_K1_LBSPPB512_MIWT2_6_NLCA4_SU16_SUM0_SUS256_VWB2_WG64_4_1_WGM1_WGMXCC8_WGMXCCGn1
    SolutionIndex: 323
    SolutionNameMin: Cijk_Alik_Bljk_F8NHS_STA_BH_BiasSH_HAS_SAB_SAV_UserArgs_MT128x112x256_MI16x16x1_SN_LDSB1_GRVWB16_GSU5_GSUAMB_GSUC0_GSUWGMRR0_K1_LBSPPB256_MIWT2_7_NLCA4_SU16_SUM0_SUS256_VWB1_WG64_4_1_WGM1_WGMXCC8_WGMXCCGn1
    SolutionIndex: 324
    SolutionNameMin: Cijk_Alik_Bljk_F8NHS_STA_BH_BiasSH_HAS_SAB_SAV_UserArgs_MT128x128x128_MI16x16x1_SN_LDSB1_GRVWB16_GSU5_GSUAMB_GSUC0_GSUWGMRR0_K1_LBSPPB1024_MIWT2_8_NLCA2_SU16_SUM0_SUS128_VWB8_WG64_4_1_WGM1_WGMXCC8_WGMXCCGn1
    SolutionIndex: 325
    SolutionNameMin: Cijk_Alik_Bljk_F8NHS_STA_BH_BiasSH_HAS_SAB_SAV_UserArgs_MT128x144x128_MI16x16x1_SN_LDSB1_GRVWB8_GSU6_GSUAMB_GSUC0_GSUWGMRR0_K1_LBSPPB128_MIWT2_9_NLCA2_SU16_SUM0_SUS128_VWB1_WG64_4_1_WGM1_WGMXCC8_WGMXCCGn1
    SolutionIndex: 326
    SolutionNameMin: Cijk_Alik_Bljk_F8NHS_STA_BH_BiasSH_HAS_SAB_SAV_UserArgs_MT128x160x128_MI16x16x1_SN_LDSB1_GRVWB16_GSU6_GSUAMB_GSUC0_GSUWGMRR0_K1_LBSPPB256_MIWT2_10_NLCA2_SU16_SUM0_SUS128_VWB2_WG64_4_1_WGM1_WGMXCC8_WGMXCCGn1
    SolutionIndex: 327
    SolutionNameMin: Cijk_Alik_Bljk_F8NHS_STA_BH_BiasSH_HAS_SAB_SAV_UserArgs_MT128x176x128_MI16x16x1_SN_LDSB1_GRVWB8_GSU6_GSUAMB_GSUC0_GSUWGMRR0_K1_LBSPPB128_MIWT2_11_NLCA2_SU16_SUM0_SUS128_VWB1_WG64_4_1_WGM1_WGMXCC8_WGMXCCGn1
    SolutionIndex: 328
    SolutionNameMin: Cijk_Alik_Bljk_F8NHS_STA_BH_BiasSH_HAS_SAB_SAV_UserArgs_MT128x192x128_MI16x16x1_SN_LDSB1_GRVWB16_GSU5_GSUAMB_GSUC0_GSUWGMRR0_K1_LBSPPB512_MIWT2_12_NLCA2_SU16_SUM0_SUS128_VWB4_WG64_4_1_WGM1_WGMXCC8_WGMXCCGn1
    SolutionIndex: 329
    SolutionNameMin: Cijk_Alik_Bljk_F8NHS_STA_BH_BiasSH_HAS_SAB_SAV_UserArgs_MT128x224x128_MI16x16x1_SN_LDSB1_GRVWB16_GSU6_GSUAMB_GSUC0_GSUWGMRR0_K1_LBSPPB256_MIWT2_14_NLCA2_SU16_SUM0_SUS128_VWB2_WG64_4_1_WGM1_WGMXCC8_WGMXCCGn1
    SolutionIndex: 330
    SolutionNameMin: Cijk_Alik_Bljk_F8NHS_STA_BH_BiasSH_HAS_SAB_SAV_UserArgs_MT128x128x128_MI16x16x1_SN_LDSB1_GRVWB16_GSU4_GSUAMB_GSUC0_GSUWGMRR0_K1_LBSPPB1024_MIWT2_8_NLCA2_SU16_SUM0_SUS128_VWB8_WG64_4_1_WGM1_WGMXCC8_WGMXCCGn1
    SolutionIndex: 331
    SolutionNameMin: Cijk_Alik_Bljk_F8NHS_STA_BH_BiasSH_HAS_SAB_SAV_UserArgs_MT192x96x128_MI16x16x1_SN_LDSB0_GRVWB16_GSU3_GSUAMB_GSUC0_GSUWGMRR0_K1_LBSPPB256_MIWT3_6_NLCA2_SU16_SUM0_SUS128_VWB2_WG64_4_1_WGM1_WGMXCC8_WGMXCCGn1
    SolutionIndex: 332
    SolutionNameMin: Cijk_Alik_Bljk_F8NHS_STA_BH_BiasSH_HAS_SAB_SAV_UserArgs_MT192x144x128_MI16x16x1_SN_LDSB1_GRVWB8_GSU5_GSUAMB_GSUC0_GSUWGMRR0_K1_LBSPPB128_MIWT3_9_NLCA2_SU16_SUM0_SUS128_VWB1_WG64_4_1_WGM1_WGMXCC8_WGMXCCGn1
    SolutionIndex: 333
    SolutionNameMin: Cijk_Alik_Bljk_F8NHS_STA_BH_BiasSH_HAS_SAB_SAV_UserArgs_MT128x160x128_MI16x16x1_SN_LDSB1_GRVWB16_GSU4_GSUAMB_GSUC0_GSUWGMRR0_K1_LBSPPB256_MIWT2_10_NLCA2_SU16_SUM0_SUS128_VWB2_WG64_4_1_WGM1_WGMXCC8_WGMXCCGn1
    SolutionIndex: 334
    SolutionNameMin: Cijk_Alik_Bljk_F8NHS_STA_BH_BiasSH_HAS_SAB_SAV_UserArgs_MT128x112x256_MI16x16x1_SN_LDSB1_GRVWB16_GSU2_GSUAMB_GSUC0_GSUWGMRR0_K1_LBSPPB256_MIWT2_7_NLCA4_SU16_SUM0_SUS256_VWB1_WG64_4_1_WGM1_WGMXCC8_WGMXCCGn1
    SolutionIndex: 335
    SolutionNameMin: Cijk_Alik_Bljk_F8NHS_STA_BH_BiasSH_HAS_SAB_SAV_UserArgs_MT128x176x128_MI16x16x1_SN_LDSB1_GRVWB8_GSU4_GSUAMB_GSUC0_GSUWGMRR0_K1_LBSPPB128_MIWT2_11_NLCA2_SU16_SUM0_SUS128_VWB1_WG64_4_1_WGM1_WGMXCC8_WGMXCCGn1
    SolutionIndex: 336
    SolutionNameMin: Cijk_Alik_Bljk_F8NHS_STA_BH_BiasSH_HAS_SAB_SAV_UserArgs_MT192x128x128_MI16x16x1_SN_LDSB1_GRVWB16_GSU3_GSUAMB_GSUC0_GSUWGMRR0_K1_LBSPPB1024_MIWT3_8_NLCA2_SU16_SUM0_SUS128_VWB8_WG64_4_1_WGM1_WGMXCC8_WGMXCCGn1
    SolutionIndex: 337
    SolutionNameMin: Cijk_Alik_Bljk_F8NHS_STA_BH_BiasSH_HAS_SAB_SAV_UserArgs_MT192x128x128_MI16x16x1_SN_LDSB1_GRVWB16_GSU4_GSUAMB_GSUC0_GSUWGMRR0_K1_LBSPPB1024_MIWT3_8_NLCA2_SU16_SUM0_SUS128_VWB8_WG64_4_1_WGM1_WGMXCC8_WGMXCCGn1
    SolutionIndex: 338
    SolutionNameMin: Cijk_Alik_Bljk_F8NHS_STA_BH_BiasSH_HAS_SAB_SAV_UserArgs_MT128x224x128_MI16x16x1_SN_LDSB1_GRVWB16_GSU4_GSUAMB_GSUC0_GSUWGMRR0_K1_LBSPPB256_MIWT2_14_NLCA2_SU16_SUM0_SUS128_VWB2_WG64_4_1_WGM1_WGMXCC8_WGMXCCGn1
    SolutionIndex: 339
    SolutionNameMin: Cijk_Alik_Bljk_F8NHS_STA_BH_BiasSH_HAS_SAB_SAV_UserArgs_MT256x160x128_MI16x16x1_SN_LDSB0_GRVWB16_GSU4_GSUAMB_GSUC0_GSUWGMRR0_K1_LBSPPB256_MIWT4_10_NLCA2_SU16_SUM0_SUS128_VWB2_WG64_4_1_WGM1_WGMXCC8_WGMXCCGn1
    SolutionIndex: 340
    SolutionNameMin: Cijk_Alik_Bljk_F8NHS_STA_BH_BiasSH_HAS_SAB_SAV_UserArgs_MT256x128x128_MI16x16x1_SN_LDSB1_GRVWB16_GSU3_GSUAMB_GSUC0_GSUWGMRR0_K1_LBSPPB1024_MIWT4_8_NLCA2_SU16_SUM0_SUS128_VWB8_WG64_4_1_WGM1_WGMXCC8_WGMXCCGn1
    SolutionIndex: 341
    SolutionNameMin: Cijk_Alik_Bljk_F8NHS_STA_BH_BiasSH_HAS_SAB_SAV_UserArgs_MT256x96x128_MI16x16x1_SN_LDSB0_GRVWB16_GSU1_GSUC0_GSUWGMRR0_K1_LBSPPB256_MIWT4_6_NLCA2_SU16_SUM0_SUS128_VWB2_WG64_4_1_WGM8_WGMXCC8_WGMXCCGn1
    SolutionIndex: 342
    SolutionNameMin: Cijk_Alik_Bljk_F8NHS_STA_BH_BiasSH_HAS_SAB_SAV_UserArgs_MT64x16x512_MI16x16x1_SN_LDSB0_GRVWB16_GSU1_GSUC0_GSUWGMRR0_K1_LBSPPB512_MIWT1_1_NLCA8_SU16_SUM0_SUS512_VWB1_WG64_4_1_WGM8_WGMXCC8_WGMXCCGn1
    SolutionIndex: 343
    SolutionNameMin: Cijk_Alik_Bljk_F8NHS_STA_BH_BiasSH_HAS_SAB_SAV_UserArgs_MT32x16x256_MI16x16x1_SN_LDSB0_GRVWB16_GSU1_GSUC0_GSUWGMRR0_K1_LBSPPB256_MIWT1_1_NLCA4_SU16_SUM0_SUS256_VWB1_WG32_4_1_WGM8_WGMXCC8_WGMXCCGn1
    SolutionIndex: 344
    SolutionNameMin: Cijk_Alik_Bljk_F8NHS_STA_BH_BiasSH_HAS_SAB_SAV_UserArgs_MT128x16x512_MI16x16x1_SN_LDSB0_GRVWB16_GSU1_GSUC0_GSUWGMRR0_K1_LBSPPB512_MIWT2_1_NLCA8_SU16_SUM0_SUS512_VWB1_WG64_4_1_WGM8_WGMXCC8_WGMXCCGn1
    SolutionIndex: 345
    SolutionNameMin: Cijk_Alik_Bljk_F8NHS_STA_BH_BiasSH_HAS_SAB_SAV_UserArgs_MT64x16x256_MI16x16x1_SN_LDSB0_GRVWB16_GSU1_GSUC0_GSUWGMRR0_K1_LBSPPB256_MIWT1_1_NLCA4_SU16_SUM0_SUS256_VWB1_WG64_4_1_WGM8_WGMXCC8_WGMXCCGn1
    SolutionIndex: 346
    SolutionNameMin: Cijk_Alik_Bljk_F8NHS_STA_BH_BiasSH_HAS_SAB_SAV_UserArgs_MT64x32x256_MI16x16x1_SN_LDSB0_GRVWB16_GSU1_GSUC0_GSUWGMRR0_K1_LBSPPB512_MIWT1_2_NLCA4_SU16_SUM0_SUS256_VWB2_WG64_4_1_WGM8_WGMXCC8_WGMXCCGn1
    SolutionIndex: 347
    SolutionNameMin: Cijk_Alik_Bljk_F8NHS_STA_BH_BiasSH_HAS_SAB_SAV_UserArgs_MT192x112x128_MI16x16x1_SN_LDSB1_GRVWB8_GSU1_GSUC0_GSUWGMRR0_K1_LBSPPB128_MIWT3_7_NLCA2_SU16_SUM0_SUS128_VWB1_WG64_4_1_WGM8_WGMXCC8_WGMXCCGn1
    SolutionIndex: 348
    SolutionNameMin: Cijk_Alik_Bljk_F8NHS_STA_BH_BiasSH_HAS_SAB_SAV_UserArgs_MT128x128x128_MI16x16x1_SN_LDSB1_GRVWB16_GSU1_GSUC0_GSUWGMRR0_K1_LBSPPB1024_MIWT2_8_NLCA2_SU16_SUM0_SUS128_VWB8_WG64_4_1_WGM8_WGMXCC8_WGMXCCGn1
    SolutionIndex: 349
    SolutionNameMin: Cijk_Alik_Bljk_F8NHS_STA_BH_BiasSH_HAS_SAB_SAV_UserArgs_MT256x192x128_MI16x16x1_SN_LDSB0_GRVWB16_GSU1_GSUC0_GSUWGMRR0_K1_LBSPPB512_MIWT4_12_NLCA2_SU16_SUM0_SUS128_VWB4_WG64_4_1_WGM8_WGMXCC8_WGMXCCGn1
    SolutionIndex: 350
    SolutionNameMin: Cijk_Alik_Bljk_F8NHS_STA_BH_BiasSH_HAS_SAB_SAV_UserArgs_MT256x128x128_MI16x16x1_SN_LDSB1_GRVWB16_GSU1_GSUAMB_GSUC0_GSUWGMRR0_K1_LBSPPB1024_MIWT4_8_NLCA2_SU16_SUM0_SUS128_VWB8_WG64_4_1_WGM1_WGMXCC8_WGMXCCGn1
    SolutionIndex: 351
    SolutionNameMin: Cijk_Alik_Bljk_F8NHS_STA_BH_BiasSH_HAS_SAB_SAV_UserArgs_MT64x16x256_MI16x16x1_SN_LDSB0_GRVWB16_GSU1_GSUAMB_GSUC0_GSUWGMRR0_K1_LBSPPB256_MIWT1_1_NLCA4_SU16_SUM0_SUS256_VWB1_WG64_4_1_WGM1_WGMXCC8_WGMXCCGn1
    SolutionIndex: 352
    SolutionNameMin: Cijk_Alik_Bljk_F8NHS_STA_BH_BiasSH_HAS_SAB_SAV_UserArgs_MT64x16x256_MI16x16x1_SN_LDSB0_GRVWB16_GSU1_GSUAMBSK_GSUC0_GSUWGMRR0_K1_LBSPPB256_MIWT1_1_NLCA4_SU16_SUM0_SUS256_VWB1_WG64_4_1_WGM1_WGMXCC8_WGMXCCGn1
    SolutionIndex: 353
    SolutionNameMin: Cijk_Alik_Bljk_F8NHS_STA_BH_BiasSH_HAS_SAB_SAV_UserArgs_MT64x16x512_MI16x16x1_SN_LDSB0_GRVWB16_GSU1_GSUAMB_GSUC0_GSUWGMRR0_K1_LBSPPB512_MIWT1_1_NLCA8_SU16_SUM0_SUS512_VWB1_WG64_4_1_WGM1_WGMXCC8_WGMXCCGn1
    SolutionIndex: 354
    SolutionNameMin: Cijk_Alik_Bljk_F8NHS_STA_BH_BiasSH_HAS_SAB_SAV_UserArgs_MT32x16x256_MI16x16x1_SN_LDSB0_GRVWB16_GSU1_GSUAMB_GSUC0_GSUWGMRR0_K1_LBSPPB256_MIWT1_1_NLCA4_SU16_SUM0_SUS256_VWB1_WG32_4_1_WGM1_WGMXCC8_WGMXCCGn1
    SolutionIndex: 355
    SolutionNameMin: Cijk_Alik_Bljk_F8NHS_STA_BH_BiasSH_HAS_SAB_SAV_UserArgs_MT64x32x512_MI16x16x1_SN_LDSB1_GRVWB16_GSU1_GSUAMB_GSUC0_GSUWGMRR0_K1_LBSPPB1024_MIWT1_2_NLCA8_SU16_SUM0_SUS512_VWB2_WG64_4_1_WGM1_WGMXCC8_WGMXCCGn1
    SolutionIndex: 356
    SolutionNameMin: Cijk_Alik_Bljk_F8NHS_STA_BH_BiasSH_HAS_SAB_SAV_UserArgs_MT320x160x128_MI16x16x1_SN_LDSB0_GRVWB16_GSU1_GSUC0_GSUWGMRR0_K1_LBSPPB256_MIWT5_10_NLCA2_SU16_SUM0_SUS128_VWB2_WG64_4_1_WGM8_WGMXCC8_WGMXCCGn1
    SolutionIndex: 357
    SolutionNameMin: Cijk_Alik_Bljk_F8NHS_STA_BH_BiasSH_HAS_SAB_SAV_UserArgs_MT128x160x128_MI16x16x1_SN_LDSB1_GRVWB16_GSU1_GSUC0_GSUWGMRR0_K1_LBSPPB256_MIWT2_10_NLCA2_SU16_SUM0_SUS128_VWB2_WG64_4_1_WGM8_WGMXCC8_WGMXCCGn1
    SolutionIndex: 358
    SolutionNameMin: Cijk_Alik_Bljk_F8NHS_STA_BH_BiasSH_HAS_SAB_SAV_UserArgs_MT448x96x128_MI16x16x1_SN_LDSB0_GRVWB16_GSU1_GSUC0_GSUWGMRR0_K1_LBSPPB256_MIWT7_6_NLCA2_SU16_SUM0_SUS128_VWB2_WG64_4_1_WGM8_WGMXCC8_WGMXCCGn1
    SolutionIndex: 359
    SolutionNameMin: Cijk_Alik_Bljk_F8NHS_STA_BH_BiasSH_HAS_SAB_SAV_UserArgs_MT512x96x128_MI16x16x1_SN_LDSB0_GRVWB16_GSU1_GSUC0_GSUWGMRR0_K1_LBSPPB256_MIWT8_6_NLCA2_SU16_SUM0_SUS128_VWB2_WG64_4_1_WGM8_WGMXCC8_WGMXCCGn1
    SolutionIndex: 360
    SolutionNameMin: Cijk_Alik_Bljk_F8NHS_STA_BH_BiasSH_HAS_SAB_SAV_UserArgs_MT128x16x256_MI16x16x1_SN_LDSB0_GRVWB16_GSU1_GSUAMB_GSUC0_GSUWGMRR0_K1_LBSPPB256_MIWT2_1_NLCA4_SU16_SUM0_SUS256_VWB1_WG64_4_1_WGM1_WGMXCC8_WGMXCCGn1
    SolutionIndex: 361
    SolutionNameMin: Cijk_Alik_Bljk_F8NHS_STA_BH_BiasSH_HAS_SAB_SAV_UserArgs_MT128x32x256_MI16x16x1_SN_LDSB0_GRVWB16_GSU1_GSUAMB_GSUC0_GSUWGMRR0_K1_LBSPPB512_MIWT2_2_NLCA4_SU16_SUM0_SUS256_VWB2_WG64_4_1_WGM1_WGMXCC8_WGMXCCGn1
    SolutionIndex: 362
    SolutionNameMin: Cijk_Alik_Bljk_F8NHS_STA_BH_BiasSH_HAS_SAB_SAV_UserArgs_MT64x48x256_MI16x16x1_SN_LDSB0_GRVWB16_GSU1_GSUAMB_GSUC0_GSUWGMRR0_K1_LBSPPB256_MIWT1_3_NLCA4_SU16_SUM0_SUS256_VWB1_WG64_4_1_WGM1_WGMXCC8_WGMXCCGn1
    SolutionIndex: 363
    SolutionNameMin: Cijk_Alik_Bljk_F8NHS_STA_BH_BiasSH_HAS_SAB_SAV_UserArgs_MT128x64x256_MI16x16x1_SN_LDSB1_GRVWB16_GSU1_GSUAMB_GSUC0_GSUWGMRR0_K1_LBSPPB1024_MIWT2_4_NLCA4_SU16_SUM0_SUS256_VWB4_WG64_4_1_WGM1_WGMXCC8_WGMXCCGn1
    SolutionIndex: 364
    SolutionNameMin: Cijk_Alik_Bljk_F8NHS_STA_BH_BiasSH_HAS_SAB_SAV_UserArgs_MT128x80x256_MI16x16x1_SN_LDSB1_GRVWB16_GSU1_GSUAMB_GSUC0_GSUWGMRR0_K1_LBSPPB256_MIWT2_5_NLCA4_SU16_SUM0_SUS256_VWB1_WG64_4_1_WGM1_WGMXCC8_WGMXCCGn1
    SolutionIndex: 365
    SolutionNameMin: Cijk_Alik_Bljk_F8NHS_STA_BH_BiasSH_HAS_SAB_SAV_UserArgs_MT128x96x256_MI16x16x1_SN_LDSB1_GRVWB16_GSU1_GSUAMB_GSUC0_GSUWGMRR0_K1_LBSPPB512_MIWT2_6_NLCA4_SU16_SUM0_SUS256_VWB2_WG64_4_1_WGM1_WGMXCC8_WGMXCCGn1
    SolutionIndex: 366
    SolutionNameMin: Cijk_Alik_Bljk_F8NHS_STA_BH_BiasSH_HAS_SAB_SAV_UserArgs_MT128x112x256_MI16x16x1_SN_LDSB1_GRVWB16_GSU1_GSUAMB_GSUC0_GSUWGMRR0_K1_LBSPPB256_MIWT2_7_NLCA4_SU16_SUM0_SUS256_VWB1_WG64_4_1_WGM1_WGMXCC8_WGMXCCGn1
    SolutionIndex: 367
    SolutionNameMin: Cijk_Alik_Bljk_F8NHS_STA_BH_BiasSH_HAS_SAB_SAV_UserArgs_MT64x128x128_MI16x16x1_SN_LDSB1_GRVWB16_GSU1_GSUAMB_GSUC0_GSUWGMRR0_K1_LBSPPB1024_MIWT1_8_NLCA2_SU16_SUM0_SUS128_VWB8_WG64_4_1_WGM1_WGMXCC8_WGMXCCGn1
    SolutionIndex: 368
    SolutionNameMin: Cijk_Alik_Bljk_F8NHS_STA_BH_BiasSH_HAS_SAB_SAV_UserArgs_MT64x144x256_MI16x16x1_SN_LDSB1_GRVWB16_GSU1_GSUAMB_GSUC0_GSUWGMRR0_K1_LBSPPB256_MIWT1_9_NLCA4_SU16_SUM0_SUS256_VWB1_WG64_4_1_WGM1_WGMXCC8_WGMXCCGn1
    SolutionIndex: 369
    SolutionNameMin: Cijk_Alik_Bljk_F8NHS_STA_BH_BiasSH_HAS_SAB_SAV_UserArgs_MT128x96x128_MI16x16x1_SN_LDSB0_GRVWB16_GSU1_GSUAMB_GSUC0_GSUWGMRR0_K1_LBSPPB256_MIWT2_6_NLCA2_SU16_SUM0_SUS128_VWB2_WG64_4_1_WGM1_WGMXCC8_WGMXCCGn1
    SolutionIndex: 370
    SolutionNameMin: Cijk_Alik_Bljk_F8NHS_STA_BH_BiasSH_HAS_SAB_SAV_UserArgs_MT128x128x128_MI16x16x1_SN_LDSB1_GRVWB16_GSU1_GSUAMB_GSUC0_GSUWGMRR0_K1_LBSPPB1024_MIWT2_8_NLCA2_SU16_SUM0_SUS128_VWB8_WG64_4_1_WGM1_WGMXCC8_WGMXCCGn1
    SolutionIndex: 371
    SolutionNameMin: Cijk_Alik_Bljk_F8NHS_STA_BH_BiasSH_HAS_SAB_SAV_UserArgs_MT128x144x128_MI16x16x1_SN_LDSB1_GRVWB8_GSU1_GSUAMB_GSUC0_GSUWGMRR0_K1_LBSPPB128_MIWT2_9_NLCA2_SU16_SUM0_SUS128_VWB1_WG64_4_1_WGM1_WGMXCC8_WGMXCCGn1
    SolutionIndex: 372
    SolutionNameMin: Cijk_Alik_Bljk_F8NHS_STA_BH_BiasSH_HAS_SAB_SAV_UserArgs_MT192x96x256_MI16x16x1_SN_LDSB1_GRVWB16_GSU1_GSUAMB_GSUC0_GSUWGMRR0_K1_LBSPPB512_MIWT3_6_NLCA4_SU16_SUM0_SUS256_VWB2_WG64_4_1_WGM1_WGMXCC8_WGMXCCGn1
    SolutionIndex: 373
    SolutionNameMin: Cijk_Alik_Bljk_F8NHS_STA_BH_BiasSH_HAS_SAB_SAV_UserArgs_MT128x160x128_MI16x16x1_SN_LDSB1_GRVWB16_GSU1_GSUAMB_GSUC0_GSUWGMRR0_K1_LBSPPB256_MIWT2_10_NLCA2_SU16_SUM0_SUS128_VWB2_WG64_4_1_WGM1_WGMXCC8_WGMXCCGn1
    SolutionIndex: 374
    SolutionNameMin: Cijk_Alik_Bljk_F8NHS_STA_BH_BiasSH_HAS_SAB_SAV_UserArgs_MT192x112x128_MI16x16x1_SN_LDSB1_GRVWB8_GSU1_GSUAMB_GSUC0_GSUWGMRR0_K1_LBSPPB128_MIWT3_7_NLCA2_SU16_SUM0_SUS128_VWB1_WG64_4_1_WGM1_WGMXCC8_WGMXCCGn1
    SolutionIndex: 375
    SolutionNameMin: Cijk_Alik_Bljk_F8NHS_STA_BH_BiasSH_HAS_SAB_SAV_UserArgs_MT128x192x128_MI16x16x1_SN_LDSB1_GRVWB16_GSU1_GSUAMB_GSUC0_GSUWGMRR0_K1_LBSPPB512_MIWT2_12_NLCA2_SU16_SUM0_SUS128_VWB4_WG64_4_1_WGM1_WGMXCC8_WGMXCCGn1
    SolutionIndex: 376
    SolutionNameMin: Cijk_Alik_Bljk_F8NHS_STA_BH_BiasSH_HAS_SAB_SAV_UserArgs_MT192x128x128_MI16x16x1_SN_LDSB1_GRVWB16_GSU1_GSUAMB_GSUC0_GSUWGMRR0_K1_LBSPPB1024_MIWT3_8_NLCA2_SU16_SUM0_SUS128_VWB8_WG64_4_1_WGM1_WGMXCC8_WGMXCCGn1
    SolutionIndex: 377
    SolutionNameMin: Cijk_Alik_Bljk_F8NHS_STA_BH_BiasSH_HAS_SAB_SAV_UserArgs_MT192x160x128_MI16x16x1_SN_LDSB1_GRVWB16_GSU1_GSUAMB_GSUC0_GSUWGMRR0_K1_LBSPPB256_MIWT3_10_NLCA2_SU16_SUM0_SUS128_VWB2_WG64_4_1_WGM1_WGMXCC8_WGMXCCGn1
    SolutionIndex: 378
    SolutionNameMin: Cijk_Alik_Bljk_F8NHS_STA_BH_BiasSH_HAS_SAB_SAV_UserArgs_MT192x144x128_MI16x16x1_SN_LDSB1_GRVWB8_GSU1_GSUAMB_GSUC0_GSUWGMRR0_K1_LBSPPB128_MIWT3_9_NLCA2_SU16_SUM0_SUS128_VWB1_WG64_4_1_WGM1_WGMXCC8_WGMXCCGn1
    SolutionIndex: 379
    SolutionNameMin: Cijk_Alik_Bljk_F8NHS_STA_BH_BiasSH_HAS_SAB_SAV_UserArgs_MT256x240x128_MI16x16x1_SN_LDSB1_GRVWB8_GSU1_GSUC0_GSUWGMRR0_K1_LBSPPB128_MIWT4_15_NLCA2_SU16_SUM0_SUS128_VWB1_WG64_4_1_WGM8_WGMXCC8_WGMXCCGn1
    SolutionIndex: 380
    SolutionNameMin: Cijk_Alik_Bljk_F8NHS_STA_BH_BiasSH_HAS_SAB_SAV_UserArgs_MT512x112x128_MI16x16x1_SN_LDSB0_GRVWB8_GSU1_GSUC0_GSUWGMRR0_K1_LBSPPB128_MIWT8_7_NLCA2_SU16_SUM0_SUS128_VWB1_WG64_4_1_WGM8_WGMXCC8_WGMXCCGn1
    SolutionIndex: 381
    SolutionNameMin: Cijk_Alik_Bljk_F8NHS_STA_BH_BiasSH_HAS_SAB_SAV_UserArgs_MT448x144x128_MI16x16x1_SN_LDSB0_GRVWB8_GSU1_GSUC0_GSUWGMRR0_K1_LBSPPB128_MIWT7_9_NLCA2_SU16_SUM0_SUS128_VWB1_WG64_4_1_WGM8_WGMXCC8_WGMXCCGn1
    SolutionIndex: 382
    SolutionNameMin: Cijk_Alik_Bljk_F8NHS_STA_BH_BiasSH_HAS_SAB_SAV_UserArgs_MT320x176x128_MI16x16x1_SN_LDSB0_GRVWB8_GSU1_GSUC0_GSUWGMRR0_K1_LBSPPB128_MIWT5_11_NLCA2_SU16_SUM0_SUS128_VWB1_WG64_4_1_WGM8_WGMXCC8_WGMXCCGn1
    SolutionIndex: 383
    SolutionNameMin: Cijk_Alik_Bljk_F8NHS_STA_BH_BiasSH_HAS_SAB_SAV_UserArgs_MT320x96x128_MI16x16x1_SN_LDSB0_GRVWB16_GSU1_GSUC0_GSUWGMRR0_K1_LBSPPB256_MIWT5_6_NLCA2_SU16_SUM0_SUS128_VWB2_WG64_4_1_WGM8_WGMXCC8_WGMXCCGn1
    SolutionIndex: 384
    SolutionNameMin: Cijk_Alik_Bljk_F8NHS_STA_BH_BiasSH_HAS_SAB_SAV_UserArgs_MT128x16x256_MI16x16x1_SN_LDSB0_GRVWB16_GSU1_GSUC0_GSUWGMRR0_K1_LBSPPB256_MIWT2_1_NLCA4_SU16_SUM0_SUS256_VWB1_WG64_4_1_WGM8_WGMXCC8_WGMXCCGn1
    SolutionIndex: 385
    SolutionNameMin: Cijk_Alik_Bljk_F8NHS_STA_BH_BiasSH_HAS_SAB_SAV_UserArgs_MT384x112x128_MI16x16x1_SN_LDSB0_GRVWB8_GSU1_GSUC0_GSUWGMRR0_K1_LBSPPB128_MIWT6_7_NLCA2_SU16_SUM0_SUS128_VWB1_WG64_4_1_WGM8_WGMXCC8_WGMXCCGn1
    SolutionIndex: 386
    SolutionNameMin: Cijk_Alik_Bljk_F8NHS_STA_BH_BiasSH_HAS_SAB_SAV_UserArgs_MT448x112x128_MI16x16x1_SN_LDSB0_GRVWB8_GSU1_GSUC0_GSUWGMRR0_K1_LBSPPB128_MIWT7_7_NLCA2_SU16_SUM0_SUS128_VWB1_WG64_4_1_WGM8_WGMXCC8_WGMXCCGn1
    SolutionIndex: 387
    SolutionNameMin: Cijk_Alik_Bljk_F8NHS_STA_BH_BiasSH_HAS_SAB_SAV_UserArgs_MT192x272x128_MI16x16x1_SN_LDSB1_GRVWB8_GSU1_GSUC0_GSUWGMRR0_K1_LBSPPB128_MIWT3_17_NLCA2_SU16_SUM0_SUS128_VWB1_WG64_4_1_WGM8_WGMXCC8_WGMXCCGn1
    SolutionIndex: 388
    SolutionNameMin: Cijk_Alik_Bljk_F8NHS_STA_BH_BiasSH_HAS_SAB_SAV_UserArgs_MT128x48x256_MI16x16x1_SN_LDSB0_GRVWB16_GSU1_GSUC0_GSUWGMRR0_K1_LBSPPB256_MIWT2_3_NLCA4_SU16_SUM0_SUS256_VWB1_WG64_4_1_WGM8_WGMXCC8_WGMXCCGn1
    SolutionIndex: 389
    SolutionNameMin: Cijk_Alik_Bljk_F8NHS_STA_BH_BiasSH_HAS_SAB_SAV_UserArgs_MT128x64x256_MI16x16x1_SN_LDSB1_GRVWB16_GSU1_GSUC0_GSUWGMRR0_K1_LBSPPB1024_MIWT2_4_NLCA4_SU16_SUM0_SUS256_VWB4_WG64_4_1_WGM8_WGMXCC8_WGMXCCGn1
    SolutionIndex: 390
    SolutionNameMin: Cijk_Alik_Bljk_F8NHS_STA_BH_BiasSH_HAS_SAB_SAV_UserArgs_MT128x80x256_MI16x16x1_SN_LDSB1_GRVWB16_GSU1_GSUC0_GSUWGMRR0_K1_LBSPPB256_MIWT2_5_NLCA4_SU16_SUM0_SUS256_VWB1_WG64_4_1_WGM8_WGMXCC8_WGMXCCGn1
    SolutionIndex: 391
    SolutionNameMin: Cijk_Alik_Bljk_F8NHS_STA_BH_BiasSH_HAS_SAB_SAV_UserArgs_MT192x48x256_MI16x16x1_SN_LDSB0_GRVWB16_GSU1_GSUC0_GSUWGMRR0_K1_LBSPPB256_MIWT3_3_NLCA4_SU16_SUM0_SUS256_VWB1_WG64_4_1_WGM8_WGMXCC8_WGMXCCGn1
    SolutionIndex: 392
    SolutionNameMin: Cijk_Alik_Bljk_F8NHS_STA_BH_BiasSH_HAS_SAB_SAV_UserArgs_MT192x64x256_MI16x16x1_SN_LDSB1_GRVWB16_GSU1_GSUC0_GSUWGMRR0_K1_LBSPPB1024_MIWT3_4_NLCA4_SU16_SUM0_SUS256_VWB4_WG64_4_1_WGM8_WGMXCC8_WGMXCCGn1
    SolutionIndex: 393
    SolutionNameMin: Cijk_Alik_Bljk_F8NHS_STA_BH_BiasSH_HAS_SAB_SAV_UserArgs_MT256x48x256_MI16x16x1_SN_LDSB0_GRVWB16_GSU1_GSUC0_GSUWGMRR0_K1_LBSPPB256_MIWT4_3_NLCA4_SU16_SUM0_SUS256_VWB1_WG64_4_1_WGM8_WGMXCC8_WGMXCCGn1
    SolutionIndex: 394
    SolutionNameMin: Cijk_Alik_Bljk_F8NHS_STA_BH_BiasSH_HAS_SAB_SAV_UserArgs_MT128x112x256_MI16x16x1_SN_LDSB1_GRVWB16_GSU1_GSUC0_GSUWGMRR0_K1_LBSPPB256_MIWT2_7_NLCA4_SU16_SUM0_SUS256_VWB1_WG64_4_1_WGM8_WGMXCC8_WGMXCCGn1
    SolutionIndex: 395
    SolutionNameMin: Cijk_Alik_Bljk_F8NHS_STA_BH_BiasSH_HAS_SAB_SAV_UserArgs_MT192x80x256_MI16x16x1_SN_LDSB1_GRVWB16_GSU1_GSUC0_GSUWGMRR0_K1_LBSPPB256_MIWT3_5_NLCA4_SU16_SUM0_SUS256_VWB1_WG64_4_1_WGM8_WGMXCC8_WGMXCCGn1
    SolutionIndex: 396
    SolutionNameMin: Cijk_Alik_Bljk_F8NHS_STA_BH_BiasSH_HAS_SAB_SAV_UserArgs_MT256x64x256_MI16x16x1_SN_LDSB1_GRVWB16_GSU1_GSUC0_GSUWGMRR0_K1_LBSPPB1024_MIWT4_4_NLCA4_SU16_SUM0_SUS256_VWB4_WG64_4_1_WGM8_WGMXCC8_WGMXCCGn1
    SolutionIndex: 397
    SolutionNameMin: Cijk_Alik_Bljk_F8NHS_STA_BH_BiasSH_HAS_SAB_SAV_UserArgs_MT192x96x256_MI16x16x1_SN_LDSB1_GRVWB16_GSU1_GSUC0_GSUWGMRR0_K1_LBSPPB512_MIWT3_6_NLCA4_SU16_SUM0_SUS256_VWB2_WG64_4_1_WGM8_WGMXCC8_WGMXCCGn1
    SolutionIndex: 398
    SolutionNameMin: Cijk_Alik_Bljk_F8NHS_STA_BH_BiasSH_HAS_SAB_SAV_UserArgs_MT320x80x128_MI16x16x1_SN_LDSB0_GRVWB8_GSU1_GSUC0_GSUWGMRR0_K1_LBSPPB128_MIWT5_5_NLCA2_SU16_SUM0_SUS128_VWB1_WG64_4_1_WGM8_WGMXCC8_WGMXCCGn1
    SolutionIndex: 399
    SolutionNameMin: Cijk_Alik_Bljk_F8NHS_STA_BH_BiasSH_HAS_SAB_SAV_UserArgs_MT384x64x128_MI16x16x1_SN_LDSB0_GRVWB16_GSU1_GSUC0_GSUWGMRR0_K1_LBSPPB512_MIWT6_4_NLCA2_SU16_SUM0_SUS128_VWB4_WG64_4_1_WGM8_WGMXCC8_WGMXCCGn1
    SolutionIndex: 400
    SolutionNameMin: Cijk_Alik_Bljk_F8NHS_STA_BH_BiasSH_HAS_SAB_SAV_UserArgs_MT192x160x128_MI16x16x1_SN_LDSB1_GRVWB16_GSU1_GSUC0_GSUWGMRR0_K1_LBSPPB256_MIWT3_10_NLCA2_SU16_SUM0_SUS128_VWB2_WG64_4_1_WGM8_WGMXCC8_WGMXCCGn1
    SolutionIndex: 401
    SolutionNameMin: Cijk_Alik_Bljk_F8NHS_STA_BH_BiasSH_HAS_SAB_SAV_UserArgs_MT192x16x256_MI16x16x1_SN_LDSB0_GRVWB16_GSU1_GSUC0_GSUWGMRR0_K1_LBSPPB256_MIWT3_1_NLCA4_SU16_SUM0_SUS256_VWB1_WG64_4_1_WGM8_WGMXCC8_WGMXCCGn1
    SolutionIndex: 402
    SolutionNameMin: Cijk_Alik_Bljk_F8NHS_STA_BH_BiasSH_HAS_SAB_SAV_UserArgs_MT128x32x512_MI16x16x1_SN_LDSB1_GRVWB16_GSU1_GSUC0_GSUWGMRR0_K1_LBSPPB1024_MIWT2_2_NLCA8_SU16_SUM0_SUS512_VWB2_WG64_4_1_WGM8_WGMXCC8_WGMXCCGn1
    SolutionIndex: 403
    SolutionNameMin: Cijk_Alik_Bljk_F8NHS_STA_BH_BiasSH_HAS_SAB_SAV_UserArgs_MT192x144x128_MI16x16x1_SN_LDSB1_GRVWB8_GSU1_GSUC0_GSUWGMRR0_K1_LBSPPB128_MIWT3_9_NLCA2_SU16_SUM0_SUS128_VWB1_WG64_4_1_WGM8_WGMXCC8_WGMXCCGn1
    SolutionIndex: 404
    SolutionNameMin: Cijk_Alik_Bljk_F8NHS_STA_BH_BiasSH_HAS_SAB_SAV_UserArgs_MT320x112x128_MI16x16x1_SN_LDSB0_GRVWB8_GSU1_GSUC0_GSUWGMRR0_K1_LBSPPB128_MIWT5_7_NLCA2_SU16_SUM0_SUS128_VWB1_WG64_4_1_WGM8_WGMXCC8_WGMXCCGn1
    SolutionIndex: 405
    SolutionNameMin: Cijk_Alik_Bljk_F8NHS_STA_BH_BiasSH_HAS_SAB_SAV_UserArgs_MT512x80x128_MI16x16x1_SN_LDSB0_GRVWB8_GSU1_GSUC0_GSUWGMRR0_K1_LBSPPB128_MIWT8_5_NLCA2_SU16_SUM0_SUS128_VWB1_WG64_4_1_WGM8_WGMXCC8_WGMXCCGn1
    SolutionIndex: 406
    SolutionNameMin: Cijk_Alik_Bljk_F8NHS_STA_BH_BiasSH_HAS_SAB_SAV_UserArgs_MT192x208x128_MI16x16x1_SN_LDSB1_GRVWB8_GSU1_GSUC0_GSUWGMRR0_K1_LBSPPB128_MIWT3_13_NLCA2_SU16_SUM0_SUS128_VWB1_WG64_4_1_WGM8_WGMXCC8_WGMXCCGn1
    SolutionIndex: 407
    SolutionNameMin: Cijk_Alik_Bljk_F8NHS_STA_BH_BiasSH_HAS_SAB_SAV_UserArgs_MT192x224x128_MI16x16x1_SN_LDSB0_GRVWB16_GSU1_GSUC0_GSUWGMRR0_K1_LBSPPB256_MIWT3_14_NLCA2_SU16_SUM0_SUS128_VWB2_WG64_4_1_WGM8_WGMXCC8_WGMXCCGn1
- - - [127, 127, 1, 127]
    - [1, 0.39]
  - - [127, 128, 1, 127]
    - [0, 0.41]
  - - [1, 127, 1, 127]
    - [1, 0.0]
  - - [128, 128, 1, 128]
    - [2, 0.48]
  - - [1248, 2048, 1, 5280]
    - [4, 200.07]
  - - [1920, 2048, 1, 5280]
    - [3, 324.6]
  - - [5280, 2048, 1, 1024]
    - [6, 218.94]
  - - [8320, 2048, 1, 5280]
    - [5, 441.01]
  - - [28672, 16, 1, 4096]
    - [7, 0.0]
  - - [28672, 32, 1, 4096]
    - [8, 0.0]
  - - [28672, 48, 1, 4096]
    - [9, 0.0]
  - - [28672, 64, 1, 4096]
    - [10, 0.0]
  - - [28672, 80, 1, 4096]
    - [11, 0.0]
  - - [28672, 96, 1, 4096]
    - [12, 0.0]
  - - [28672, 112, 1, 4096]
    - [13, 0.0]
  - - [28672, 128, 1, 4096]
    - [14, 0.0]
  - - [28672, 144, 1, 4096]
    - [15, 0.0]
  - - [28672, 160, 1, 4096]
    - [15, 0.0]
  - - [28672, 176, 1, 4096]
    - [16, 0.0]
  - - [28672, 192, 1, 4096]
    - [16, 0.0]
  - - [28672, 208, 1, 4096]
    - [17, 0.0]
  - - [28672, 224, 1, 4096]
    - [17, 0.0]
  - - [28672, 240, 1, 4096]
    - [18, 0.0]
  - - [28672, 256, 1, 4096]
    - [19, 0.0]
  - - [28672, 272, 1, 4096]
    - [20, 0.0]
  - - [28672, 288, 1, 4096]
    - [20, 0.0]
  - - [28672, 304, 1, 4096]
    - [11, 0.0]
  - - [28672, 320, 1, 4096]
    - [21, 0.0]
  - - [28672, 336, 1, 4096]
    - [22, 0.0]
  - - [28672, 352, 1, 4096]
    - [23, 0.0]
  - - [28672, 368, 1, 4096]
    - [16, 0.0]
  - - [28672, 384, 1, 4096]
    - [16, 0.0]
  - - [28672, 400, 1, 4096]
    - [24, 0.0]
  - - [28672, 416, 1, 4096]
    - [25, 0.0]
  - - [28672, 432, 1, 4096]
    - [17, 0.0]
  - - [28672, 448, 1, 4096]
    - [17, 0.0]
  - - [28672, 464, 1, 4096]
    - [26, 0.0]
  - - [28672, 480, 1, 4096]
    - [26, 0.0]
  - - [28672, 496, 1, 4096]
    - [19, 0.0]
  - - [28672, 512, 1, 4096]
    - [19, 0.0]
  - - [28672, 544, 1, 4096]
    - [16, 0.0]
  - - [28672, 576, 1, 4096]
    - [27, 0.0]
  - - [28672, 608, 1, 4096]
    - [28, 0.0]
  - - [28672, 640, 1, 4096]
    - [28, 0.0]
  - - [28672, 672, 1, 4096]
    - [17, 0.0]
  - - [28672, 704, 1, 4096]
    - [23, 0.0]
  - - [28672, 736, 1, 4096]
    - [19, 0.0]
  - - [28672, 768, 1, 4096]
    - [19, 0.0]
  - - [28672, 800, 1, 4096]
    - [29, 0.0]
  - - [28672, 832, 1, 4096]
    - [25, 0.0]
  - - [28672, 864, 1, 4096]
    - [30, 0.0]
  - - [28672, 896, 1, 4096]
    - [30, 0.0]
  - - [28672, 928, 1, 4096]
    - [31, 0.0]
  - - [28672, 960, 1, 4096]
    - [32, 0.0]
  - - [28672, 992, 1, 4096]
    - [33, 0.0]
  - - [28672, 1024, 1, 4096]
    - [33, 0.0]
  - - [28672, 1088, 1, 4096]
    - [34, 0.0]
  - - [28672, 1152, 1, 4096]
    - [35, 0.0]
  - - [28672, 1216, 1, 4096]
    - [26, 0.0]
  - - [28672, 1280, 1, 4096]
    - [29, 0.0]
  - - [28672, 1344, 1, 4096]
    - [30, 0.0]
  - - [28672, 1408, 1, 4096]
    - [36, 0.0]
  - - [28672, 1472, 1, 4096]
    - [19, 0.0]
  - - [28672, 1536, 1, 4096]
    - [32, 0.0]
  - - [28672, 1600, 1, 4096]
    - [29, 0.0]
  - - [28672, 1664, 1, 4096]
    - [37, 0.0]
  - - [28672, 1728, 1, 4096]
    - [38, 0.0]
  - - [28672, 1792, 1, 4096]
    - [38, 0.0]
  - - [28672, 1856, 1, 4096]
    - [27, 0.0]
  - - [28672, 1920, 1, 4096]
    - [39, 0.0]
  - - [28672, 1984, 1, 4096]
    - [40, 0.0]
  - - [28672, 2048, 1, 4096]
    - [33, 0.0]
  - - [28672, 2176, 1, 4096]
    - [41, 0.0]
  - - [28672, 2304, 1, 4096]
    - [35, 0.0]
  - - [28672, 2432, 1, 4096]
    - [27, 0.0]
  - - [28672, 2560, 1, 4096]
    - [29, 0.0]
  - - [28672, 2688, 1, 4096]
    - [30, 0.0]
  - - [28672, 2816, 1, 4096]
    - [36, 0.0]
  - - [28672, 2944, 1, 4096]
    - [32, 0.0]
  - - [28672, 3072, 1, 4096]
    - [32, 0.0]
  - - [28672, 3200, 1, 4096]
    - [42, 0.0]
  - - [28672, 3328, 1, 4096]
    - [37, 0.0]
  - - [28672, 3456, 1, 4096]
    - [43, 0.0]
  - - [28672, 3584, 1, 4096]
    - [38, 0.0]
  - - [28672, 3712, 1, 4096]
    - [37, 0.0]
  - - [28672, 3840, 1, 4096]
    - [44, 0.0]
  - - [28672, 3968, 1, 4096]
    - [32, 0.0]
  - - [28672, 4096, 1, 4096]
    - [38, 0.0]
  - - [28672, 4352, 1, 4096]
    - [37, 0.0]
  - - [28672, 4608, 1, 4096]
    - [38, 0.0]
  - - [28672, 4864, 1, 4096]
    - [43, 0.0]
  - - [28672, 5120, 1, 4096]
    - [33, 0.0]
  - - [28672, 5376, 1, 4096]
    - [38, 0.0]
  - - [28672, 5632, 1, 4096]
    - [33, 0.0]
  - - [28672, 5888, 1, 4096]
    - [19, 0.0]
  - - [28672, 6144, 1, 4096]
    - [32, 0.0]
  - - [28672, 6400, 1, 4096]
    - [38, 0.0]
  - - [28672, 6656, 1, 4096]
    - [37, 0.0]
  - - [28672, 6912, 1, 4096]
    - [35, 0.0]
  - - [28672, 7168, 1, 4096]
    - [33, 0.0]
  - - [28672, 7424, 1, 4096]
    - [36, 0.0]
  - - [28672, 7680, 1, 4096]
    - [45, 0.0]
  - - [28672, 7936, 1, 4096]
    - [33, 0.0]
  - - [28672, 8192, 1, 4096]
    - [32, 0.0]
  - - [28672, 8704, 1, 4096]
    - [32, 0.0]
  - - [28672, 9216, 1, 4096]
    - [32, 0.0]
  - - [28672, 9728, 1, 4096]
    - [32, 0.0]
  - - [28672, 10240, 1, 4096]
    - [32, 0.0]
  - - [28672, 10752, 1, 4096]
    - [32, 0.0]
  - - [28672, 11264, 1, 4096]
    - [33, 0.0]
  - - [28672, 11776, 1, 4096]
    - [33, 0.0]
  - - [28672, 12288, 1, 4096]
    - [32, 0.0]
  - - [28672, 12800, 1, 4096]
    - [33, 0.0]
  - - [28672, 13312, 1, 4096]
    - [32, 0.0]
  - - [28672, 13824, 1, 4096]
    - [38, 0.0]
  - - [28672, 14336, 1, 4096]
    - [33, 0.0]
  - - [28672, 14848, 1, 4096]
    - [38, 0.0]
  - - [28672, 15360, 1, 4096]
    - [34, 0.0]
  - - [28672, 15872, 1, 4096]
    - [38, 0.0]
  - - [28672, 16384, 1, 4096]
    - [30, 0.0]
  - - [28672, 17408, 1, 4096]
    - [35, 0.0]
  - - [28672, 18432, 1, 4096]
    - [33, 0.0]
  - - [28672, 19456, 1, 4096]
    - [38, 0.0]
  - - [28672, 20480, 1, 4096]
    - [35, 0.0]
  - - [28672, 21504, 1, 4096]
    - [33, 0.0]
  - - [28672, 22528, 1, 4096]
    - [33, 0.0]
  - - [28672, 23552, 1, 4096]
    - [35, 0.0]
  - - [28672, 24576, 1, 4096]
    - [30, 0.0]
  - - [28672, 25600, 1, 4096]
    - [33, 0.0]
  - - [28672, 26624, 1, 4096]
    - [30, 0.0]
  - - [28672, 27648, 1, 4096]
    - [33, 0.0]
  - - [28672, 28672, 1, 4096]
    - [33, 0.0]
  - - [28672, 29696, 1, 4096]
    - [32, 0.0]
  - - [28672, 30720, 1, 4096]
    - [30, 0.0]
  - - [28672, 31744, 1, 4096]
    - [30, 0.0]
  - - [28672, 32768, 1, 4096]
    - [33, 0.0]
  - - [28672, 34816, 1, 4096]
    - [33, 0.0]
  - - [28672, 36864, 1, 4096]
    - [33, 0.0]
  - - [28672, 38912, 1, 4096]
    - [30, 0.0]
  - - [28672, 40960, 1, 4096]
    - [32, 0.0]
  - - [28672, 43008, 1, 4096]
    - [38, 0.0]
  - - [28672, 45056, 1, 4096]
    - [33, 0.0]
  - - [28672, 47104, 1, 4096]
    - [38, 0.0]
  - - [28672, 49152, 1, 4096]
    - [33, 0.0]
  - - [28672, 51200, 1, 4096]
    - [38, 0.0]
  - - [28672, 53248, 1, 4096]
    - [30, 0.0]
  - - [28672, 55296, 1, 4096]
    - [30, 0.0]
  - - [28672, 57344, 1, 4096]
    - [30, 0.0]
  - - [28672, 59392, 1, 4096]
    - [33, 0.0]
  - - [28672, 61440, 1, 4096]
    - [33, 0.0]
  - - [28672, 63488, 1, 4096]
    - [33, 0.0]
  - - [28672, 65536, 1, 4096]
    - [38, 0.0]
  - - [4096, 16, 1, 14336]
    - [46, 0.0]
  - - [4096, 32, 1, 14336]
    - [46, 0.0]
  - - [4096, 48, 1, 14336]
    - [47, 0.0]
  - - [4096, 64, 1, 14336]
    - [47, 0.0]
  - - [4096, 80, 1, 14336]
    - [8, 0.0]
  - - [4096, 96, 1, 14336]
    - [8, 0.0]
  - - [4096, 112, 1, 14336]
    - [8, 0.0]
  - - [4096, 128, 1, 14336]
    - [8, 0.0]
  - - [4096, 144, 1, 14336]
    - [48, 0.0]
  - - [4096, 160, 1, 14336]
    - [49, 0.0]
  - - [4096, 176, 1, 14336]
    - [48, 0.0]
  - - [4096, 192, 1, 14336]
    - [48, 0.0]
  - - [4096, 208, 1, 14336]
    - [50, 0.0]
  - - [4096, 224, 1, 14336]
    - [49, 0.0]
  - - [4096, 240, 1, 14336]
    - [51, 0.0]
  - - [4096, 256, 1, 14336]
    - [49, 0.0]
  - - [4096, 272, 1, 14336]
    - [9, 0.0]
  - - [4096, 288, 1, 14336]
    - [9, 0.0]
  - - [4096, 304, 1, 14336]
    - [9, 0.0]
  - - [4096, 320, 1, 14336]
    - [9, 0.0]
  - - [4096, 336, 1, 14336]
    - [9, 0.0]
  - - [4096, 352, 1, 14336]
    - [9, 0.0]
  - - [4096, 368, 1, 14336]
    - [51, 0.0]
  - - [4096, 384, 1, 14336]
    - [9, 0.0]
  - - [4096, 400, 1, 14336]
    - [11, 0.0]
  - - [4096, 416, 1, 14336]
    - [10, 0.0]
  - - [4096, 432, 1, 14336]
    - [10, 0.0]
  - - [4096, 448, 1, 14336]
    - [10, 0.0]
  - - [4096, 464, 1, 14336]
    - [10, 0.0]
  - - [4096, 480, 1, 14336]
    - [10, 0.0]
  - - [4096, 496, 1, 14336]
    - [10, 0.0]
  - - [4096, 512, 1, 14336]
    - [10, 0.0]
  - - [4096, 544, 1, 14336]
    - [11, 0.0]
  - - [4096, 576, 1, 14336]
    - [11, 0.0]
  - - [4096, 608, 1, 14336]
    - [11, 0.0]
  - - [4096, 640, 1, 14336]
    - [11, 0.0]
  - - [4096, 672, 1, 14336]
    - [11, 0.0]
  - - [4096, 704, 1, 14336]
    - [52, 0.0]
  - - [4096, 736, 1, 14336]
    - [12, 0.0]
  - - [4096, 768, 1, 14336]
    - [12, 0.0]
  - - [4096, 800, 1, 14336]
    - [12, 0.0]
  - - [4096, 832, 1, 14336]
    - [13, 0.0]
  - - [4096, 864, 1, 14336]
    - [13, 0.0]
  - - [4096, 896, 1, 14336]
    - [13, 0.0]
  - - [4096, 928, 1, 14336]
    - [13, 0.0]
  - - [4096, 960, 1, 14336]
    - [13, 0.0]
  - - [4096, 992, 1, 14336]
    - [13, 0.0]
  - - [4096, 1024, 1, 14336]
    - [15, 0.0]
  - - [4096, 1088, 1, 14336]
    - [53, 0.0]
  - - [4096, 1152, 1, 14336]
    - [16, 0.0]
  - - [4096, 1216, 1, 14336]
    - [54, 0.0]
  - - [4096, 1280, 1, 14336]
    - [24, 0.0]
  - - [4096, 1344, 1, 14336]
    - [55, 0.0]
  - - [4096, 1408, 1, 14336]
    - [55, 0.0]
  - - [4096, 1472, 1, 14336]
    - [24, 0.0]
  - - [4096, 1536, 1, 14336]
    - [26, 0.0]
  - - [4096, 1600, 1, 14336]
    - [26, 0.0]
  - - [4096, 1664, 1, 14336]
    - [26, 0.0]
  - - [4096, 1728, 1, 14336]
    - [26, 0.0]
  - - [4096, 1792, 1, 14336]
    - [26, 0.0]
  - - [4096, 1856, 1, 14336]
    - [56, 0.0]
  - - [4096, 1920, 1, 14336]
    - [56, 0.0]
  - - [4096, 1984, 1, 14336]
    - [56, 0.0]
  - - [4096, 2048, 1, 14336]
    - [56, 0.0]
  - - [4096, 2176, 1, 14336]
    - [57, 0.0]
  - - [4096, 2304, 1, 14336]
    - [43, 0.0]
  - - [4096, 2432, 1, 14336]
    - [57, 0.0]
  - - [4096, 2560, 1, 14336]
    - [58, 0.0]
  - - [4096, 2688, 1, 14336]
    - [59, 0.0]
  - - [4096, 2816, 1, 14336]
    - [29, 0.0]
  - - [4096, 2944, 1, 14336]
    - [29, 0.0]
  - - [4096, 3072, 1, 14336]
    - [36, 0.0]
  - - [4096, 3200, 1, 14336]
    - [36, 0.0]
  - - [4096, 3328, 1, 14336]
    - [36, 0.0]
  - - [4096, 3456, 1, 14336]
    - [32, 0.0]
  - - [4096, 3584, 1, 14336]
    - [32, 0.0]
  - - [4096, 3712, 1, 14336]
    - [37, 0.0]
  - - [4096, 3840, 1, 14336]
    - [37, 0.0]
  - - [4096, 3968, 1, 14336]
    - [38, 0.0]
  - - [4096, 4096, 1, 14336]
    - [38, 0.0]
  - - [4096, 4352, 1, 14336]
    - [39, 0.0]
  - - [4096, 4608, 1, 14336]
    - [43, 0.0]
  - - [4096, 4864, 1, 14336]
    - [43, 0.0]
  - - [4096, 5120, 1, 14336]
    - [59, 0.0]
  - - [4096, 5376, 1, 14336]
    - [59, 0.0]
  - - [4096, 5632, 1, 14336]
    - [29, 0.0]
  - - [4096, 5888, 1, 14336]
    - [29, 0.0]
  - - [4096, 6144, 1, 14336]
    - [36, 0.0]
  - - [4096, 6400, 1, 14336]
    - [36, 0.0]
  - - [4096, 6656, 1, 14336]
    - [36, 0.0]
  - - [4096, 6912, 1, 14336]
    - [32, 0.0]
  - - [4096, 7168, 1, 14336]
    - [32, 0.0]
  - - [4096, 7424, 1, 14336]
    - [37, 0.0]
  - - [4096, 7680, 1, 14336]
    - [37, 0.0]
  - - [4096, 7936, 1, 14336]
    - [38, 0.0]
  - - [4096, 8192, 1, 14336]
    - [38, 0.0]
  - - [4096, 8704, 1, 14336]
    - [39, 0.0]
  - - [4096, 9216, 1, 14336]
    - [36, 0.0]
  - - [4096, 9728, 1, 14336]
    - [36, 0.0]
  - - [4096, 10240, 1, 14336]
    - [32, 0.0]
  - - [4096, 10752, 1, 14336]
    - [32, 0.0]
  - - [4096, 11264, 1, 14336]
    - [37, 0.0]
  - - [4096, 11776, 1, 14336]
    - [37, 0.0]
  - - [4096, 12288, 1, 14336]
    - [38, 0.0]
  - - [4096, 12800, 1, 14336]
    - [27, 0.0]
  - - [4096, 13312, 1, 14336]
    - [60, 0.0]
  - - [4096, 13824, 1, 14336]
    - [32, 0.0]
  - - [4096, 14336, 1, 14336]
    - [32, 0.0]
  - - [4096, 14848, 1, 14336]
    - [29, 0.0]
  - - [4096, 15360, 1, 14336]
    - [37, 0.0]
  - - [4096, 15872, 1, 14336]
    - [38, 0.0]
  - - [4096, 16384, 1, 14336]
    - [38, 0.0]
  - - [4096, 17408, 1, 14336]
    - [27, 0.0]
  - - [4096, 18432, 1, 14336]
    - [40, 0.0]
  - - [4096, 19456, 1, 14336]
    - [37, 0.0]
  - - [4096, 20480, 1, 14336]
    - [38, 0.0]
  - - [4096, 21504, 1, 14336]
    - [32, 0.0]
  - - [4096, 22528, 1, 14336]
    - [60, 0.0]
  - - [4096, 23552, 1, 14336]
    - [37, 0.0]
  - - [4096, 24576, 1, 14336]
    - [38, 0.0]
  - - [4096, 25600, 1, 14336]
    - [61, 0.0]
  - - [4096, 26624, 1, 14336]
    - [60, 0.0]
  - - [4096, 27648, 1, 14336]
    - [37, 0.0]
  - - [4096, 28672, 1, 14336]
    - [38, 0.0]
  - - [4096, 29696, 1, 14336]
    - [38, 0.0]
  - - [4096, 30720, 1, 14336]
    - [62, 0.0]
  - - [4096, 31744, 1, 14336]
    - [45, 0.0]
  - - [4096, 32768, 1, 14336]
    - [32, 0.0]
  - - [4096, 34816, 1, 14336]
    - [37, 0.0]
  - - [4096, 36864, 1, 14336]
    - [38, 0.0]
  - - [4096, 38912, 1, 14336]
    - [32, 0.0]
  - - [4096, 40960, 1, 14336]
    - [34, 0.0]
  - - [4096, 43008, 1, 14336]
    - [32, 0.0]
  - - [4096, 45056, 1, 14336]
    - [34, 0.0]
  - - [4096, 47104, 1, 14336]
    - [32, 0.0]
  - - [4096, 49152, 1, 14336]
    - [34, 0.0]
  - - [4096, 51200, 1, 14336]
    - [37, 0.0]
  - - [4096, 53248, 1, 14336]
    - [45, 0.0]
  - - [4096, 55296, 1, 14336]
    - [38, 0.0]
  - - [4096, 57344, 1, 14336]
    - [32, 0.0]
  - - [4096, 59392, 1, 14336]
    - [38, 0.0]
  - - [4096, 61440, 1, 14336]
    - [32, 0.0]
  - - [4096, 63488, 1, 14336]
    - [38, 0.0]
  - - [4096, 65536, 1, 14336]
    - [32, 0.0]
  - - [6144, 64854, 1, 4096]
    - [34, 0.0]
  - - [8192, 8704, 1, 8192]
    - [63, 604.18]
  - - [8192, 9216, 1, 8192]
    - [64, 612.5]
  - - [8192, 9728, 1, 8192]
    - [64, 640.95]
  - - [8192, 10240, 1, 8192]
    - [65, 610.38]
  - - [8192, 10752, 1, 8192]
    - [63, 603.19]
  - - [8192, 11264, 1, 8192]
    - [63, 615.05]
  - - [8192, 11776, 1, 8192]
    - [64, 625.51]
  - - [8192, 12288, 1, 8192]
    - [65, 619.82]
  - - [8192, 12800, 1, 8192]
    - [63, 605.92]
  - - [8192, 13312, 1, 8192]
    - [64, 614.0]
  - - [8192, 13824, 1, 8192]
    - [64, 628.4]
  - - [8192, 14336, 1, 8192]
    - [63, 636.22]
  - - [8192, 14848, 1, 8192]
    - [66, 615.06]
  - - [8192, 15360, 1, 8192]
    - [63, 617.06]
  - - [8192, 15872, 1, 8192]
    - [64, 626.83]
  - - [8192, 16384, 1, 8192]
    - [63, 634.23]
  - - [8192, 16896, 1, 8192]
    - [67, 644.8]
  - - [8192, 17408, 1, 8192]
    - [64, 616.91]
  - - [8192, 17920, 1, 8192]
    - [64, 627.81]
  - - [8192, 18432, 1, 8192]
    - [64, 631.01]
  - - [8192, 18944, 1, 8192]
    - [64, 639.68]
  - - [8192, 19456, 1, 8192]
    - [64, 664.7]
  - - [8192, 19968, 1, 8192]
    - [63, 636.01]
  - - [8192, 20480, 1, 8192]
    - [64, 644.87]
  - - [8192, 20992, 1, 8192]
    - [64, 650.39]
  - - [8192, 21504, 1, 8192]
    - [64, 659.02]
  - - [8192, 22016, 1, 8192]
    - [65, 636.05]
  - - [8192, 22528, 1, 8192]
    - [68, 643.32]
  - - [8192, 23040, 1, 8192]
    - [63, 650.49]
  - - [8192, 23552, 1, 8192]
    - [64, 656.71]
  - - [8192, 24064, 1, 8192]
    - [64, 661.22]
  - - [8192, 24576, 1, 8192]
    - [63, 639.91]
  - - [8192, 25088, 1, 8192]
    - [63, 641.6]
  - - [8192, 25600, 1, 8192]
    - [64, 645.84]
  - - [8192, 26112, 1, 8192]
    - [63, 651.83]
  - - [8192, 26624, 1, 8192]
    - [63, 658.14]
  - - [8192, 27136, 1, 8192]
    - [63, 634.71]
  - - [8192, 27648, 1, 8192]
    - [64, 642.82]
  - - [8192, 28160, 1, 8192]
    - [64, 649.67]
  - - [8192, 28672, 1, 8192]
    - [63, 653.2]
  - - [8192, 29184, 1, 8192]
    - [64, 661.19]
  - - [8192, 29696, 1, 8192]
    - [63, 637.88]
  - - [8192, 30208, 1, 8192]
    - [63, 644.91]
  - - [8192, 30720, 1, 8192]
    - [63, 649.53]
  - - [8192, 544, 1, 8192]
    - [69, 412.08]
  - - [8192, 576, 1, 8192]
    - [70, 424.94]
  - - [8192, 608, 1, 8192]
    - [71, 412.98]
  - - [8192, 640, 1, 8192]
    - [71, 431.3]
  - - [8192, 672, 1, 8192]
    - [71, 446.81]
  - - [8192, 704, 1, 8192]
    - [72, 448.1]
  - - [8192, 736, 1, 8192]
    - [73, 460.54]
  - - [8192, 768, 1, 8192]
    - [74, 475.73]
  - - [8192, 800, 1, 8192]
    - [75, 472.63]
  - - [8192, 832, 1, 8192]
    - [73, 483.49]
  - - [8192, 864, 1, 8192]
    - [75, 500.53]
  - - [8192, 896, 1, 8192]
    - [76, 517.36]
  - - [8192, 928, 1, 8192]
    - [77, 481.45]
  - - [8192, 960, 1, 8192]
    - [78, 494.74]
  - - [8192, 992, 1, 8192]
    - [79, 501.58]
  - - [8192, 1024, 1, 8192]
    - [80, 536.9]
  - - [8192, 1088, 1, 8192]
    - [81, 525.18]
  - - [8192, 1152, 1, 8192]
    - [80, 547.59]
  - - [8192, 1216, 1, 8192]
    - [82, 515.08]
  - - [8192, 1280, 1, 8192]
    - [83, 535.83]
  - - [8192, 1344, 1, 8192]
    - [66, 537.15]
  - - [8192, 1408, 1, 8192]
    - [66, 563.57]
  - - [8192, 1472, 1, 8192]
    - [84, 526.72]
  - - [8192, 1536, 1, 8192]
    - [85, 555.37]
  - - [8192, 1600, 1, 8192]
    - [85, 547.1]
  - - [8192, 1664, 1, 8192]
    - [86, 572.09]
  - - [8192, 1728, 1, 8192]
    - [87, 569.04]
  - - [8192, 1792, 1, 8192]
    - [88, 563.59]
  - - [8192, 1856, 1, 8192]
    - [89, 555.08]
  - - [8192, 1920, 1, 8192]
    - [65, 573.98]
  - - [8192, 1984, 1, 8192]
    - [65, 575.66]
  - - [8192, 2048, 1, 8192]
    - [65, 607.97]
  - - [8192, 2176, 1, 8192]
    - [64, 597.05]
  - - [8192, 2304, 1, 8192]
    - [63, 614.7]
  - - [8192, 2432, 1, 8192]
    - [63, 626.58]
  - - [8192, 2560, 1, 8192]
    - [90, 552.3]
  - - [8192, 2688, 1, 8192]
    - [83, 563.65]
  - - [8192, 2816, 1, 8192]
    - [90, 579.16]
  - - [8192, 2944, 1, 8192]
    - [90, 589.54]
  - - [8192, 3072, 1, 8192]
    - [91, 567.22]
  - - [8192, 3200, 1, 8192]
    - [86, 570.49]
  - - [8192, 3328, 1, 8192]
    - [92, 581.43]
  - - [8192, 3456, 1, 8192]
    - [92, 590.54]
  - - [8192, 3584, 1, 8192]
    - [80, 591.05]
  - - [8192, 3712, 1, 8192]
    - [68, 579.8]
  - - [8192, 3840, 1, 8192]
    - [68, 588.01]
  - - [8192, 3968, 1, 8192]
    - [68, 601.37]
  - - [8192, 4096, 1, 8192]
    - [65, 614.63]
  - - [8192, 4352, 1, 8192]
    - [64, 604.06]
  - - [8192, 4608, 1, 8192]
    - [63, 626.13]
  - - [8192, 4864, 1, 8192]
    - [63, 639.34]
  - - [8192, 5120, 1, 8192]
    - [92, 601.13]
  - - [8192, 5376, 1, 8192]
    - [93, 591.22]
  - - [8192, 5632, 1, 8192]
    - [65, 589.8]
  - - [8192, 5888, 1, 8192]
    - [68, 605.3]
  - - [8192, 6144, 1, 8192]
    - [65, 618.89]
  - - [8192, 6400, 1, 8192]
    - [64, 599.6]
  - - [8192, 6656, 1, 8192]
    - [64, 611.29]
  - - [8192, 6912, 1, 8192]
    - [64, 624.3]
  - - [8192, 7168, 1, 8192]
    - [64, 632.17]
  - - [8192, 7424, 1, 8192]
    - [90, 603.68]
  - - [8192, 7680, 1, 8192]
    - [68, 598.26]
  - - [8192, 7936, 1, 8192]
    - [68, 609.77]
  - - [8192, 8192, 1, 8192]
    - [68, 633.52]
  - - [8192, 16, 1, 8192]
    - [94, 50.4]
  - - [8192, 32, 1, 8192]
    - [95, 79.86]
  - - [8192, 48, 1, 8192]
    - [96, 104.96]
  - - [8192, 64, 1, 8192]
    - [97, 122.06]
  - - [8192, 80, 1, 8192]
    - [98, 137.67]
  - - [8192, 96, 1, 8192]
    - [99, 161.92]
  - - [8192, 112, 1, 8192]
    - [100, 169.61]
  - - [8192, 128, 1, 8192]
    - [101, 194.67]
  - - [8192, 144, 1, 8192]
    - [99, 211.77]
  - - [8192, 160, 1, 8192]
    - [102, 218.85]
  - - [8192, 176, 1, 8192]
    - [103, 232.06]
  - - [8192, 192, 1, 8192]
    - [104, 254.68]
  - - [8192, 208, 1, 8192]
    - [105, 246.58]
  - - [8192, 224, 1, 8192]
    - [105, 263.52]
  - - [8192, 240, 1, 8192]
    - [102, 287.08]
  - - [8192, 256, 1, 8192]
    - [104, 299.88]
  - - [8192, 272, 1, 8192]
    - [106, 288.35]
  - - [8192, 288, 1, 8192]
    - [107, 304.72]
  - - [8192, 304, 1, 8192]
    - [106, 311.48]
  - - [8192, 320, 1, 8192]
    - [102, 333.36]
  - - [8192, 336, 1, 8192]
    - [108, 340.45]
  - - [8192, 352, 1, 8192]
    - [107, 327.42]
  - - [8192, 368, 1, 8192]
    - [107, 334.85]
  - - [8192, 384, 1, 8192]
    - [107, 358.51]
  - - [8192, 400, 1, 8192]
    - [109, 341.56]
  - - [8192, 416, 1, 8192]
    - [110, 349.52]
  - - [8192, 432, 1, 8192]
    - [111, 360.28]
  - - [8192, 448, 1, 8192]
    - [111, 381.84]
  - - [8192, 464, 1, 8192]
    - [109, 368.17]
  - - [8192, 480, 1, 8192]
    - [112, 384.92]
  - - [8192, 496, 1, 8192]
    - [71, 381.33]
  - - [8192, 512, 1, 8192]
    - [113, 401.15]
  - - [8192, 8704, 1, 28672]
    - [114, 581.0]
  - - [8192, 9216, 1, 28672]
    - [115, 584.57]
  - - [8192, 9728, 1, 28672]
    - [64, 585.49]
  - - [8192, 10240, 1, 28672]
    - [68, 575.34]
  - - [8192, 10752, 1, 28672]
    - [93, 575.18]
  - - [8192, 11264, 1, 28672]
    - [116, 583.54]
  - - [8192, 11776, 1, 28672]
    - [63, 584.89]
  - - [8192, 12288, 1, 28672]
    - [117, 577.46]
  - - [8192, 12800, 1, 28672]
    - [118, 567.39]
  - - [8192, 13312, 1, 28672]
    - [119, 586.04]
  - - [8192, 13824, 1, 28672]
    - [120, 593.9]
  - - [8192, 14336, 1, 28672]
    - [64, 586.12]
  - - [8192, 14848, 1, 28672]
    - [121, 583.27]
  - - [8192, 15360, 1, 28672]
    - [122, 583.92]
  - - [8192, 15872, 1, 28672]
    - [115, 587.13]
  - - [8192, 16384, 1, 28672]
    - [64, 591.8]
  - - [8192, 16896, 1, 28672]
    - [64, 600.76]
  - - [8192, 17408, 1, 28672]
    - [123, 585.58]
  - - [8192, 17920, 1, 28672]
    - [124, 586.25]
  - - [8192, 18432, 1, 28672]
    - [115, 593.77]
  - - [8192, 18944, 1, 28672]
    - [64, 599.63]
  - - [8192, 19456, 1, 28672]
    - [63, 606.37]
  - - [8192, 19968, 1, 28672]
    - [117, 594.78]
  - - [8192, 20480, 1, 28672]
    - [125, 601.06]
  - - [8192, 20992, 1, 28672]
    - [63, 603.7]
  - - [8192, 21504, 1, 28672]
    - [63, 610.01]
  - - [8192, 22016, 1, 28672]
    - [118, 598.33]
  - - [8192, 22528, 1, 28672]
    - [65, 600.94]
  - - [8192, 23040, 1, 28672]
    - [115, 608.01]
  - - [8192, 23552, 1, 28672]
    - [64, 611.62]
  - - [8192, 24064, 1, 28672]
    - [64, 616.2]
  - - [8192, 24576, 1, 28672]
    - [122, 604.7]
  - - [8192, 25088, 1, 28672]
    - [126, 607.18]
  - - [8192, 25600, 1, 28672]
    - [63, 607.96]
  - - [8192, 26112, 1, 28672]
    - [63, 614.05]
  - - [8192, 26624, 1, 28672]
    - [64, 618.98]
  - - [8192, 27136, 1, 28672]
    - [127, 607.2]
  - - [8192, 27648, 1, 28672]
    - [125, 612.93]
  - - [8192, 28160, 1, 28672]
    - [64, 611.75]
  - - [8192, 28672, 1, 28672]
    - [63, 618.19]
  - - [8192, 29184, 1, 28672]
    - [63, 621.59]
  - - [8192, 29696, 1, 28672]
    - [128, 617.2]
  - - [8192, 30208, 1, 28672]
    - [64, 609.27]
  - - [8192, 30720, 1, 28672]
    - [63, 613.58]
  - - [8192, 544, 1, 28672]
    - [129, 450.42]
  - - [8192, 576, 1, 28672]
    - [130, 459.37]
  - - [8192, 608, 1, 28672]
    - [131, 445.8]
  - - [8192, 640, 1, 28672]
    - [132, 466.74]
  - - [8192, 672, 1, 28672]
    - [71, 487.32]
  - - [8192, 704, 1, 28672]
    - [133, 455.4]
  - - [8192, 736, 1, 28672]
    - [76, 462.97]
  - - [8192, 768, 1, 28672]
    - [134, 486.56]
  - - [8192, 800, 1, 28672]
    - [135, 470.65]
  - - [8192, 832, 1, 28672]
    - [74, 481.35]
  - - [8192, 864, 1, 28672]
    - [136, 494.27]
  - - [8192, 896, 1, 28672]
    - [76, 491.88]
  - - [8192, 928, 1, 28672]
    - [137, 474.79]
  - - [8192, 960, 1, 28672]
    - [138, 494.74]
  - - [8192, 992, 1, 28672]
    - [139, 501.0]
  - - [8192, 1024, 1, 28672]
    - [140, 506.21]
  - - [8192, 1088, 1, 28672]
    - [138, 520.95]
  - - [8192, 1152, 1, 28672]
    - [80, 524.93]
  - - [8192, 1216, 1, 28672]
    - [141, 524.03]
  - - [8192, 1280, 1, 28672]
    - [142, 541.58]
  - - [8192, 1344, 1, 28672]
    - [143, 540.44]
  - - [8192, 1408, 1, 28672]
    - [144, 553.56]
  - - [8192, 1472, 1, 28672]
    - [87, 540.51]
  - - [8192, 1536, 1, 28672]
    - [145, 555.09]
  - - [8192, 1600, 1, 28672]
    - [146, 546.11]
  - - [8192, 1664, 1, 28672]
    - [86, 556.75]
  - - [8192, 1728, 1, 28672]
    - [87, 575.31]
  - - [8192, 1792, 1, 28672]
    - [147, 572.85]
  - - [8192, 1856, 1, 28672]
    - [89, 571.71]
  - - [8192, 1920, 1, 28672]
    - [148, 574.12]
  - - [8192, 1984, 1, 28672]
    - [149, 582.88]
  - - [8192, 2048, 1, 28672]
    - [150, 586.16]
  - - [8192, 2176, 1, 28672]
    - [67, 585.55]
  - - [8192, 2304, 1, 28672]
    - [63, 602.27]
  - - [8192, 2432, 1, 28672]
    - [64, 613.92]
  - - [8192, 2560, 1, 28672]
    - [151, 571.35]
  - - [8192, 2688, 1, 28672]
    - [152, 580.32]
  - - [8192, 2816, 1, 28672]
    - [142, 579.36]
  - - [8192, 2944, 1, 28672]
    - [83, 586.57]
  - - [8192, 3072, 1, 28672]
    - [153, 580.64]
  - - [8192, 3200, 1, 28672]
    - [84, 582.15]
  - - [8192, 3328, 1, 28672]
    - [144, 601.38]
  - - [8192, 3456, 1, 28672]
    - [117, 603.09]
  - - [8192, 3584, 1, 28672]
    - [93, 601.2]
  - - [8192, 3712, 1, 28672]
    - [119, 599.8]
  - - [8192, 3840, 1, 28672]
    - [123, 599.9]
  - - [8192, 3968, 1, 28672]
    - [154, 603.78]
  - - [8192, 4096, 1, 28672]
    - [68, 610.25]
  - - [8192, 4352, 1, 28672]
    - [122, 610.8]
  - - [8192, 4608, 1, 28672]
    - [125, 616.56]
  - - [8192, 4864, 1, 28672]
    - [64, 627.81]
  - - [8192, 5120, 1, 28672]
    - [87, 595.95]
  - - [8192, 5376, 1, 28672]
    - [87, 609.56]
  - - [8192, 5632, 1, 28672]
    - [154, 598.61]
  - - [8192, 5888, 1, 28672]
    - [155, 600.63]
  - - [8192, 6144, 1, 28672]
    - [156, 611.12]
  - - [8192, 6400, 1, 28672]
    - [114, 608.16]
  - - [8192, 6656, 1, 28672]
    - [118, 613.23]
  - - [8192, 6912, 1, 28672]
    - [115, 631.11]
  - - [8192, 7168, 1, 28672]
    - [63, 629.54]
  - - [8192, 7424, 1, 28672]
    - [142, 603.15]
  - - [8192, 7680, 1, 28672]
    - [123, 611.81]
  - - [8192, 7936, 1, 28672]
    - [68, 608.57]
  - - [8192, 8192, 1, 28672]
    - [68, 618.5]
  - - [8192, 16, 1, 28672]
    - [157, 62.4]
  - - [8192, 32, 1, 28672]
    - [158, 103.25]
  - - [8192, 48, 1, 28672]
    - [159, 145.45]
  - - [8192, 64, 1, 28672]
    - [270, 174.87]
  - - [8192, 80, 1, 28672]
    - [271, 202.84]
  - - [8192, 96, 1, 28672]
    - [272, 223.71]
  - - [8192, 112, 1, 28672]
    - [273, 242.05]
  - - [8192, 128, 1, 28672]
    - [274, 263.17]
  - - [8192, 144, 1, 28672]
    - [275, 275.11]
  - - [8192, 160, 1, 28672]
    - [276, 300.71]
  - - [8192, 176, 1, 28672]
    - [277, 306.53]
  - - [8192, 192, 1, 28672]
    - [278, 330.83]
  - - [8192, 208, 1, 28672]
    - [279, 333.27]
  - - [8192, 224, 1, 28672]
    - [280, 355.63]
  - - [8192, 240, 1, 28672]
    - [281, 366.21]
  - - [8192, 256, 1, 28672]
    - [282, 379.89]
  - - [8192, 272, 1, 28672]
    - [166, 353.55]
  - - [8192, 288, 1, 28672]
    - [167, 366.32]
  - - [8192, 304, 1, 28672]
    - [168, 387.88]
  - - [8192, 320, 1, 28672]
    - [164, 395.26]
  - - [8192, 336, 1, 28672]
    - [166, 396.72]
  - - [8192, 352, 1, 28672]
    - [169, 392.3]
  - - [8192, 368, 1, 28672]
    - [169, 398.9]
  - - [8192, 384, 1, 28672]
    - [169, 428.25]
  - - [8192, 400, 1, 28672]
    - [170, 412.23]
  - - [8192, 416, 1, 28672]
    - [171, 419.79]
  - - [8192, 432, 1, 28672]
    - [172, 425.62]
  - - [8192, 448, 1, 28672]
    - [173, 441.16]
  - - [8192, 464, 1, 28672]
    - [174, 436.12]
  - - [8192, 480, 1, 28672]
    - [175, 449.61]
  - - [8192, 496, 1, 28672]
    - [176, 433.92]
  - - [8192, 512, 1, 28672]
    - [177, 451.39]
  - - [10240, 8704, 1, 8192]
    - [63, 605.34]
  - - [10240, 9216, 1, 8192]
    - [63, 632.9]
  - - [10240, 9728, 1, 8192]
    - [63, 633.89]
  - - [10240, 10240, 1, 8192]
    - [90, 607.25]
  - - [10240, 10752, 1, 8192]
    - [64, 621.68]
  - - [10240, 11264, 1, 8192]
    - [64, 634.53]
  - - [10240, 11776, 1, 8192]
    - [68, 631.65]
  - - [10240, 12288, 1, 8192]
    - [64, 621.44]
  - - [10240, 12800, 1, 8192]
    - [64, 633.48]
  - - [10240, 13312, 1, 8192]
    - [63, 645.96]
  - - [10240, 13824, 1, 8192]
    - [64, 616.95]
  - - [10240, 14336, 1, 8192]
    - [86, 628.03]
  - - [10240, 14848, 1, 8192]
    - [64, 638.57]
  - - [10240, 15360, 1, 8192]
    - [64, 648.72]
  - - [10240, 15872, 1, 8192]
    - [63, 637.31]
  - - [10240, 16384, 1, 8192]
    - [63, 647.95]
  - - [10240, 16896, 1, 8192]
    - [64, 659.3]
  - - [10240, 17408, 1, 8192]
    - [63, 664.98]
  - - [10240, 17920, 1, 8192]
    - [63, 643.54]
  - - [10240, 18432, 1, 8192]
    - [64, 653.01]
  - - [10240, 18944, 1, 8192]
    - [63, 659.76]
  - - [10240, 19456, 1, 8192]
    - [64, 669.43]
  - - [10240, 19968, 1, 8192]
    - [65, 647.62]
  - - [10240, 20480, 1, 8192]
    - [64, 651.65]
  - - [10240, 20992, 1, 8192]
    - [64, 663.12]
  - - [10240, 21504, 1, 8192]
    - [68, 649.5]
  - - [10240, 22016, 1, 8192]
    - [64, 651.36]
  - - [10240, 22528, 1, 8192]
    - [63, 657.5]
  - - [10240, 23040, 1, 8192]
    - [63, 661.2]
  - - [10240, 23552, 1, 8192]
    - [68, 648.01]
  - - [10240, 24064, 1, 8192]
    - [63, 645.87]
  - - [10240, 24576, 1, 8192]
    - [64, 654.76]
  - - [10240, 25088, 1, 8192]
    - [64, 662.19]
  - - [10240, 25600, 1, 8192]
    - [64, 644.49]
  - - [10240, 26112, 1, 8192]
    - [64, 649.98]
  - - [10240, 26624, 1, 8192]
    - [64, 654.63]
  - - [10240, 27136, 1, 8192]
    - [64, 660.94]
  - - [10240, 27648, 1, 8192]
    - [64, 643.89]
  - - [10240, 28160, 1, 8192]
    - [64, 651.6]
  - - [10240, 28672, 1, 8192]
    - [64, 655.76]
  - - [10240, 29184, 1, 8192]
    - [63, 661.89]
  - - [10240, 29696, 1, 8192]
    - [64, 644.77]
  - - [10240, 30208, 1, 8192]
    - [63, 652.2]
  - - [10240, 30720, 1, 8192]
    - [63, 658.38]
  - - [10240, 544, 1, 8192]
    - [131, 437.34]
  - - [10240, 576, 1, 8192]
    - [178, 456.34]
  - - [10240, 608, 1, 8192]
    - [76, 463.01]
  - - [10240, 640, 1, 8192]
    - [75, 487.08]
  - - [10240, 672, 1, 8192]
    - [134, 497.9]
  - - [10240, 704, 1, 8192]
    - [179, 466.6]
  - - [10240, 736, 1, 8192]
    - [180, 482.94]
  - - [10240, 768, 1, 8192]
    - [81, 516.27]
  - - [10240, 800, 1, 8192]
    - [181, 492.08]
  - - [10240, 832, 1, 8192]
    - [81, 505.52]
  - - [10240, 864, 1, 8192]
    - [182, 519.18]
  - - [10240, 896, 1, 8192]
    - [81, 556.4]
  - - [10240, 928, 1, 8192]
    - [183, 496.73]
  - - [10240, 960, 1, 8192]
    - [183, 515.6]
  - - [10240, 992, 1, 8192]
    - [83, 521.6]
  - - [10240, 1024, 1, 8192]
    - [90, 548.98]
  - - [10240, 1088, 1, 8192]
    - [83, 547.39]
  - - [10240, 1152, 1, 8192]
    - [83, 573.19]
  - - [10240, 1216, 1, 8192]
    - [184, 538.98]
  - - [10240, 1280, 1, 8192]
    - [85, 556.48]
  - - [10240, 1344, 1, 8192]
    - [93, 560.82]
  - - [10240, 1408, 1, 8192]
    - [92, 581.36]
  - - [10240, 1472, 1, 8192]
    - [150, 549.13]
  - - [10240, 1536, 1, 8192]
    - [185, 571.08]
  - - [10240, 1600, 1, 8192]
    - [65, 571.36]
  - - [10240, 1664, 1, 8192]
    - [68, 592.51]
  - - [10240, 1728, 1, 8192]
    - [186, 577.15]
  - - [10240, 1792, 1, 8192]
    - [63, 603.84]
  - - [10240, 1856, 1, 8192]
    - [63, 588.09]
  - - [10240, 1920, 1, 8192]
    - [63, 623.34]
  - - [10240, 1984, 1, 8192]
    - [187, 545.13]
  - - [10240, 2048, 1, 8192]
    - [83, 561.46]
  - - [10240, 2176, 1, 8192]
    - [66, 574.7]
  - - [10240, 2304, 1, 8192]
    - [90, 592.6]
  - - [10240, 2432, 1, 8192]
    - [90, 605.32]
  - - [10240, 2560, 1, 8192]
    - [86, 572.23]
  - - [10240, 2688, 1, 8192]
    - [86, 589.21]
  - - [10240, 2816, 1, 8192]
    - [92, 600.37]
  - - [10240, 2944, 1, 8192]
    - [68, 577.75]
  - - [10240, 3072, 1, 8192]
    - [185, 589.24]
  - - [10240, 3200, 1, 8192]
    - [65, 598.6]
  - - [10240, 3328, 1, 8192]
    - [150, 612.82]
  - - [10240, 3456, 1, 8192]
    - [63, 604.08]
  - - [10240, 3584, 1, 8192]
    - [64, 612.34]
  - - [10240, 3712, 1, 8192]
    - [64, 623.02]
  - - [10240, 3840, 1, 8192]
    - [63, 635.56]
  - - [10240, 3968, 1, 8192]
    - [92, 591.99]
  - - [10240, 4096, 1, 8192]
    - [86, 605.14]
  - - [10240, 4352, 1, 8192]
    - [83, 582.64]
  - - [10240, 4608, 1, 8192]
    - [83, 598.97]
  - - [10240, 4864, 1, 8192]
    - [90, 614.97]
  - - [10240, 5120, 1, 8192]
    - [64, 600.72]
  - - [10240, 5376, 1, 8192]
    - [63, 615.53]
  - - [10240, 5632, 1, 8192]
    - [63, 631.39]
  - - [10240, 5888, 1, 8192]
    - [90, 608.41]
  - - [10240, 6144, 1, 8192]
    - [68, 599.48]
  - - [10240, 6400, 1, 8192]
    - [68, 606.15]
  - - [10240, 6656, 1, 8192]
    - [65, 626.82]
  - - [10240, 6912, 1, 8192]
    - [92, 615.51]
  - - [10240, 7168, 1, 8192]
    - [64, 623.55]
  - - [10240, 7424, 1, 8192]
    - [63, 632.66]
  - - [10240, 7680, 1, 8192]
    - [63, 647.78]
  - - [10240, 7936, 1, 8192]
    - [65, 616.21]
  - - [10240, 8192, 1, 8192]
    - [65, 626.75]
  - - [10240, 16, 1, 8192]
    - [188, 51.51]
  - - [10240, 32, 1, 8192]
    - [189, 87.35]
  - - [10240, 48, 1, 8192]
    - [190, 113.75]
  - - [10240, 64, 1, 8192]
    - [191, 133.08]
  - - [10240, 80, 1, 8192]
    - [192, 155.75]
  - - [10240, 96, 1, 8192]
    - [193, 177.26]
  - - [10240, 112, 1, 8192]
    - [194, 185.13]
  - - [10240, 128, 1, 8192]
    - [163, 216.43]
  - - [10240, 144, 1, 8192]
    - [160, 230.87]
  - - [10240, 160, 1, 8192]
    - [164, 244.88]
  - - [10240, 176, 1, 8192]
    - [162, 246.24]
  - - [10240, 192, 1, 8192]
    - [165, 278.8]
  - - [10240, 208, 1, 8192]
    - [164, 272.8]
  - - [10240, 224, 1, 8192]
    - [195, 292.02]
  - - [10240, 240, 1, 8192]
    - [161, 317.96]
  - - [10240, 256, 1, 8192]
    - [196, 310.87]
  - - [10240, 272, 1, 8192]
    - [197, 310.01]
  - - [10240, 288, 1, 8192]
    - [198, 337.57]
  - - [10240, 304, 1, 8192]
    - [172, 320.39]
  - - [10240, 320, 1, 8192]
    - [199, 342.74]
  - - [10240, 336, 1, 8192]
    - [200, 357.65]
  - - [10240, 352, 1, 8192]
    - [201, 344.71]
  - - [10240, 368, 1, 8192]
    - [202, 351.64]
  - - [10240, 384, 1, 8192]
    - [203, 378.11]
  - - [10240, 400, 1, 8192]
    - [204, 379.77]
  - - [10240, 416, 1, 8192]
    - [203, 378.15]
  - - [10240, 432, 1, 8192]
    - [205, 391.82]
  - - [10240, 448, 1, 8192]
    - [205, 416.64]
  - - [10240, 464, 1, 8192]
    - [206, 401.54]
  - - [10240, 480, 1, 8192]
    - [206, 425.96]
  - - [10240, 496, 1, 8192]
    - [207, 413.1]
  - - [10240, 512, 1, 8192]
    - [208, 422.37]
  - - [57344, 544, 1, 8192]
    - [209, 536.85]
  - - [57344, 576, 1, 8192]
    - [209, 586.34]
  - - [57344, 608, 1, 8192]
    - [210, 548.6]
  - - [57344, 640, 1, 8192]
    - [211, 598.04]
  - - [57344, 672, 1, 8192]
    - [212, 577.84]
  - - [57344, 704, 1, 8192]
    - [213, 588.07]
  - - [57344, 736, 1, 8192]
    - [214, 553.9]
  - - [57344, 768, 1, 8192]
    - [215, 580.87]
  - - [57344, 800, 1, 8192]
    - [216, 589.62]
  - - [57344, 832, 1, 8192]
    - [217, 587.13]
  - - [57344, 864, 1, 8192]
    - [218, 585.85]
  - - [57344, 896, 1, 8192]
    - [219, 606.72]
  - - [57344, 928, 1, 8192]
    - [220, 561.61]
  - - [57344, 960, 1, 8192]
    - [221, 572.54]
  - - [57344, 992, 1, 8192]
    - [222, 570.85]
  - - [57344, 1024, 1, 8192]
    - [223, 607.37]
  - - [57344, 1088, 1, 8192]
    - [224, 538.91]
  - - [57344, 1152, 1, 8192]
    - [225, 571.38]
  - - [57344, 1216, 1, 8192]
    - [215, 541.28]
  - - [57344, 1280, 1, 8192]
    - [215, 595.16]
  - - [57344, 1344, 1, 8192]
    - [226, 540.89]
  - - [57344, 1408, 1, 8192]
    - [227, 557.8]
  - - [57344, 1472, 1, 8192]
    - [215, 537.69]
  - - [57344, 1536, 1, 8192]
    - [215, 574.78]
  - - [57344, 1600, 1, 8192]
    - [211, 538.23]
  - - [57344, 1664, 1, 8192]
    - [223, 552.67]
  - - [57344, 1728, 1, 8192]
    - [219, 529.15]
  - - [57344, 1792, 1, 8192]
    - [228, 564.32]
  - - [57344, 1856, 1, 8192]
    - [229, 526.85]
  - - [57344, 1920, 1, 8192]
    - [229, 541.76]
  - - [57344, 1984, 1, 8192]
    - [223, 537.09]
  - - [57344, 2048, 1, 8192]
    - [230, 586.38]
  - - [57344, 2176, 1, 8192]
    - [231, 541.95]
  - - [57344, 2304, 1, 8192]
    - [232, 554.25]
  - - [57344, 2432, 1, 8192]
    - [233, 561.25]
  - - [57344, 2560, 1, 8192]
    - [234, 549.06]
  - - [57344, 2688, 1, 8192]
    - [235, 564.33]
  - - [57344, 2816, 1, 8192]
    - [234, 558.01]
  - - [57344, 2944, 1, 8192]
    - [233, 563.25]
  - - [57344, 3072, 1, 8192]
    - [230, 564.16]
  - - [57344, 3200, 1, 8192]
    - [233, 564.73]
  - - [57344, 3328, 1, 8192]
    - [233, 558.22]
  - - [57344, 3456, 1, 8192]
    - [230, 581.13]
  - - [57344, 3584, 1, 8192]
    - [233, 568.68]
  - - [57344, 3712, 1, 8192]
    - [230, 561.09]
  - - [57344, 3840, 1, 8192]
    - [232, 579.01]
  - - [57344, 3968, 1, 8192]
    - [232, 567.81]
  - - [57344, 4096, 1, 8192]
    - [232, 583.44]
  - - [57344, 16, 1, 8192]
    - [236, 64.34]
  - - [57344, 32, 1, 8192]
    - [237, 123.66]
  - - [57344, 48, 1, 8192]
    - [238, 172.04]
  - - [57344, 64, 1, 8192]
    - [239, 220.3]
  - - [57344, 80, 1, 8192]
    - [240, 260.61]
  - - [57344, 96, 1, 8192]
    - [241, 295.95]
  - - [57344, 112, 1, 8192]
    - [242, 317.71]
  - - [57344, 128, 1, 8192]
    - [243, 361.98]
  - - [57344, 144, 1, 8192]
    - [244, 359.78]
  - - [57344, 160, 1, 8192]
    - [245, 389.21]
  - - [57344, 176, 1, 8192]
    - [246, 392.79]
  - - [57344, 192, 1, 8192]
    - [247, 413.06]
  - - [57344, 208, 1, 8192]
    - [248, 410.02]
  - - [57344, 224, 1, 8192]
    - [249, 439.54]
  - - [57344, 240, 1, 8192]
    - [250, 436.54]
  - - [57344, 256, 1, 8192]
    - [251, 464.7]
  - - [57344, 272, 1, 8192]
    - [252, 429.74]
  - - [57344, 288, 1, 8192]
    - [253, 473.71]
  - - [57344, 304, 1, 8192]
    - [254, 454.0]
  - - [57344, 320, 1, 8192]
    - [255, 474.02]
  - - [57344, 336, 1, 8192]
    - [256, 457.27]
  - - [57344, 352, 1, 8192]
    - [257, 471.57]
  - - [57344, 368, 1, 8192]
    - [258, 471.64]
  - - [57344, 384, 1, 8192]
    - [258, 493.34]
  - - [57344, 400, 1, 8192]
    - [259, 472.98]
  - - [57344, 416, 1, 8192]
    - [260, 473.27]
  - - [57344, 432, 1, 8192]
    - [261, 484.94]
  - - [57344, 448, 1, 8192]
    - [262, 504.93]
  - - [57344, 464, 1, 8192]
    - [250, 487.91]
  - - [57344, 480, 1, 8192]
    - [263, 500.31]
  - - [57344, 496, 1, 8192]
    - [264, 528.79]
  - - [57344, 512, 1, 8192]
    - [264, 549.01]
  - - [57344, 4352, 1, 8192]
    - [265, 612.71]
  - - [57344, 4608, 1, 8192]
    - [266, 597.16]
  - - [57344, 4864, 1, 8192]
    - [223, 616.46]
  - - [57344, 5120, 1, 8192]
    - [223, 595.98]
  - - [57344, 5376, 1, 8192]
    - [267, 595.24]
  - - [57344, 5632, 1, 8192]
    - [268, 595.08]
  - - [57344, 5888, 1, 8192]
    - [265, 589.39]
  - - [57344, 6144, 1, 8192]
    - [265, 588.54]
  - - [57344, 6400, 1, 8192]
    - [223, 575.5]
  - - [57344, 6656, 1, 8192]
    - [228, 581.38]
  - - [57344, 6912, 1, 8192]
    - [223, 586.1]
  - - [57344, 7168, 1, 8192]
    - [265, 578.68]
  - - [57344, 7424, 1, 8192]
    - [228, 567.66]
  - - [57344, 7680, 1, 8192]
    - [269, 554.97]
  - - [57344, 7936, 1, 8192]
    - [223, 577.85]
  - - [57344, 8192, 1, 8192]
    - [219, 570.96]
  - - [57344, 8704, 1, 8192]
    - [219, 564.7]
  - - [57344, 9216, 1, 8192]
    - [223, 568.95]
  - - [57344, 9728, 1, 8192]
    - [265, 571.85]
  - - [57344, 10240, 1, 8192]
    - [228, 564.1]
  - - [57344, 10752, 1, 8192]
    - [223, 572.72]
  - - [57344, 11264, 1, 8192]
    - [223, 560.86]
  - - [57344, 11776, 1, 8192]
    - [265, 569.6]
  - - [57344, 12288, 1, 8192]
    - [223, 567.56]
  - - [57344, 12800, 1, 8192]
    - [223, 574.63]
  - - [57344, 13312, 1, 8192]
    - [219, 572.9]
  - - [57344, 13824, 1, 8192]
    - [228, 565.69]
  - - [57344, 14336, 1, 8192]
    - [223, 565.74]
  - - [57344, 14848, 1, 8192]
    - [228, 570.78]
  - - [57344, 15360, 1, 8192]
    - [223, 564.32]
  - - [57344, 15872, 1, 8192]
    - [265, 571.24]
  - - [57344, 16384, 1, 8192]
    - [219, 569.03]
  - - [57344, 16896, 1, 8192]
    - [223, 570.71]
  - - [57344, 17408, 1, 8192]
    - [265, 564.73]
  - - [57344, 17920, 1, 8192]
    - [219, 574.75]
  - - [57344, 18432, 1, 8192]
    - [228, 566.29]
  - - [57344, 18944, 1, 8192]
    - [223, 566.56]
  - - [57344, 19456, 1, 8192]
    - [228, 572.64]
  - - [57344, 19968, 1, 8192]
    - [228, 570.47]
  - - [57344, 20480, 1, 8192]
    - [265, 579.02]
  - - [57344, 20992, 1, 8192]
    - [265, 570.36]
  - - [57344, 21504, 1, 8192]
    - [265, 574.31]
  - - [57344, 22016, 1, 8192]
    - [223, 573.59]
  - - [57344, 22528, 1, 8192]
    - [265, 571.8]
  - - [57344, 23040, 1, 8192]
    - [228, 575.36]
  - - [57344, 23552, 1, 8192]
    - [228, 575.59]
  - - [57344, 24064, 1, 8192]
    - [228, 570.91]
  - - [57344, 24576, 1, 8192]
    - [228, 578.97]
  - - [57344, 25088, 1, 8192]
    - [219, 580.92]
  - - [57344, 25600, 1, 8192]
    - [223, 584.21]
  - - [57344, 26112, 1, 8192]
    - [223, 581.3]
  - - [57344, 26624, 1, 8192]
    - [265, 579.58]
  - - [57344, 27136, 1, 8192]
    - [228, 578.75]
  - - [57344, 27648, 1, 8192]
    - [228, 584.15]
  - - [57344, 28160, 1, 8192]
    - [219, 581.0]
  - - [57344, 28672, 1, 8192]
    - [219, 580.62]
  - - [57344, 29184, 1, 8192]
    - [265, 584.5]
  - - [57344, 29696, 1, 8192]
    - [219, 589.93]
  - - [57344, 30208, 1, 8192]
    - [219, 584.0]
  - - [57344, 30720, 1, 8192]
    - [219, 581.51]
  - - [2304, 8704, 1, 16384]
    - [283, 494.58]
  - - [2304, 9216, 1, 16384]
    - [284, 496.56]
  - - [2304, 9728, 1, 16384]
    - [283, 511.49]
  - - [2304, 10240, 1, 16384]
    - [285, 491.97]
  - - [2304, 10752, 1, 16384]
    - [286, 499.97]
  - - [2304, 11264, 1, 16384]
    - [286, 514.58]
  - - [2304, 11776, 1, 16384]
    - [286, 515.77]
  - - [2304, 12288, 1, 16384]
    - [286, 525.2]
  - - [2304, 12800, 1, 16384]
    - [286, 547.82]
  - - [2304, 13312, 1, 16384]
    - [287, 508.25]
  - - [2304, 13824, 1, 16384]
    - [288, 507.82]
  - - [2304, 14336, 1, 16384]
    - [289, 522.14]
  - - [2304, 14848, 1, 16384]
    - [290, 517.93]
  - - [2304, 15360, 1, 16384]
    - [290, 523.11]
  - - [2304, 15872, 1, 16384]
    - [283, 552.29]
  - - [2304, 16384, 1, 16384]
    - [291, 520.71]
  - - [2304, 16896, 1, 16384]
    - [286, 533.59]
  - - [2304, 17408, 1, 16384]
    - [286, 542.48]
  - - [2304, 17920, 1, 16384]
    - [286, 550.25]
  - - [2304, 18432, 1, 16384]
    - [286, 562.1]
  - - [2304, 18944, 1, 16384]
    - [286, 566.11]
  - - [2304, 19456, 1, 16384]
    - [286, 564.57]
  - - [2304, 19968, 1, 16384]
    - [291, 538.5]
  - - [2304, 20480, 1, 16384]
    - [291, 539.12]
  - - [2304, 20992, 1, 16384]
    - [291, 551.34]
  - - [2304, 21504, 1, 16384]
    - [291, 554.42]
  - - [2304, 22016, 1, 16384]
    - [283, 562.05]
  - - [2304, 22528, 1, 16384]
    - [286, 557.94]
  - - [2304, 23040, 1, 16384]
    - [286, 559.08]
  - - [2304, 23552, 1, 16384]
    - [286, 569.77]
  - - [2304, 24064, 1, 16384]
    - [286, 580.46]
  - - [2304, 24576, 1, 16384]
    - [292, 565.59]
  - - [2304, 25088, 1, 16384]
    - [286, 589.52]
  - - [2304, 25600, 1, 16384]
    - [286, 580.27]
  - - [2304, 26112, 1, 16384]
    - [286, 556.43]
  - - [2304, 26624, 1, 16384]
    - [283, 555.55]
  - - [2304, 27136, 1, 16384]
    - [286, 562.54]
  - - [2304, 27648, 1, 16384]
    - [286, 567.74]
  - - [2304, 28160, 1, 16384]
    - [291, 564.6]
  - - [2304, 131072, 1, 16384]
    - [286, 603.09]
  - - [2304, 2176, 1, 16384]
    - [293, 421.09]
  - - [2304, 2304, 1, 16384]
    - [293, 442.53]
  - - [2304, 2432, 1, 16384]
    - [294, 436.39]
  - - [2304, 2560, 1, 16384]
    - [283, 445.35]
  - - [2304, 2688, 1, 16384]
    - [283, 469.28]
  - - [2304, 2816, 1, 16384]
    - [283, 459.44]
  - - [2304, 2944, 1, 16384]
    - [283, 466.38]
  - - [2304, 3072, 1, 16384]
    - [283, 477.32]
  - - [2304, 3200, 1, 16384]
    - [283, 491.78]
  - - [2304, 3328, 1, 16384]
    - [295, 459.31]
  - - [2304, 3456, 1, 16384]
    - [291, 473.39]
  - - [2304, 3584, 1, 16384]
    - [291, 481.37]
  - - [2304, 3712, 1, 16384]
    - [291, 484.23]
  - - [2304, 3840, 1, 16384]
    - [291, 500.93]
  - - [2304, 3968, 1, 16384]
    - [291, 502.8]
  - - [2304, 4096, 1, 16384]
    - [291, 517.35]
  - - [2304, 4352, 1, 16384]
    - [296, 467.53]
  - - [2304, 4608, 1, 16384]
    - [297, 488.45]
  - - [2304, 4864, 1, 16384]
    - [297, 496.73]
  - - [2304, 5120, 1, 16384]
    - [285, 498.12]
  - - [2304, 5376, 1, 16384]
    - [286, 496.56]
  - - [2304, 5632, 1, 16384]
    - [286, 526.36]
  - - [2304, 5888, 1, 16384]
    - [286, 519.93]
  - - [2304, 6144, 1, 16384]
    - [286, 535.16]
  - - [2304, 6400, 1, 16384]
    - [286, 546.24]
  - - [2304, 6656, 1, 16384]
    - [287, 511.93]
  - - [2304, 6912, 1, 16384]
    - [289, 516.36]
  - - [2304, 7168, 1, 16384]
    - [289, 527.81]
  - - [2304, 7424, 1, 16384]
    - [298, 521.52]
  - - [2304, 7680, 1, 16384]
    - [298, 535.38]
  - - [2304, 7936, 1, 16384]
    - [298, 530.49]
  - - [2304, 8192, 1, 16384]
    - [283, 511.13]
  - - [2304, 476, 1, 16384]
    - [299, 235.39]
  - - [2304, 1, 1, 16384]
    - [300, 2.19]
  - - [2304, 2, 1, 16384]
    - [301, 4.35]
  - - [2304, 3, 1, 16384]
    - [302, 6.8]
  - - [2304, 4, 1, 16384]
    - [303, 8.77]
  - - [2304, 5, 1, 16384]
    - [304, 10.62]
  - - [2304, 6, 1, 16384]
    - [305, 12.98]
  - - [2304, 7, 1, 16384]
    - [306, 14.86]
  - - [2304, 8, 1, 16384]
    - [305, 17.38]
  - - [2304, 9, 1, 16384]
    - [307, 19.52]
  - - [2304, 10, 1, 16384]
    - [305, 21.01]
  - - [2304, 11, 1, 16384]
    - [308, 23.87]
  - - [2304, 12, 1, 16384]
    - [307, 25.62]
  - - [2304, 13, 1, 16384]
    - [308, 27.09]
  - - [2304, 14, 1, 16384]
    - [309, 29.57]
  - - [2304, 15, 1, 16384]
    - [308, 31.37]
  - - [2304, 16, 1, 16384]
    - [301, 33.6]
  - - [2304, 17, 1, 16384]
    - [310, 29.83]
  - - [4608, 8704, 1, 16384]
    - [311, 570.18]
  - - [4608, 9216, 1, 16384]
    - [286, 604.28]
  - - [4608, 9728, 1, 16384]
    - [286, 619.1]
  - - [4608, 10240, 1, 16384]
    - [312, 605.33]
  - - [4608, 10752, 1, 16384]
    - [291, 628.66]
  - - [4608, 11264, 1, 16384]
    - [290, 584.92]
  - - [4608, 11776, 1, 16384]
    - [290, 601.8]
  - - [4608, 12288, 1, 16384]
    - [290, 610.37]
  - - [4608, 12800, 1, 16384]
    - [286, 650.96]
  - - [4608, 13312, 1, 16384]
    - [313, 588.82]
  - - [4608, 13824, 1, 16384]
    - [312, 623.82]
  - - [4608, 14336, 1, 16384]
    - [297, 587.05]
  - - [4608, 14848, 1, 16384]
    - [291, 598.48]
  - - [4608, 15360, 1, 16384]
    - [314, 595.36]
  - - [4608, 15872, 1, 16384]
    - [286, 638.18]
  - - [4608, 16384, 1, 16384]
    - [290, 585.47]
  - - [4608, 16896, 1, 16384]
    - [283, 619.15]
  - - [4608, 17408, 1, 16384]
    - [297, 572.48]
  - - [4608, 17920, 1, 16384]
    - [291, 562.62]
  - - [4608, 18432, 1, 16384]
    - [286, 583.59]
  - - [4608, 18944, 1, 16384]
    - [283, 586.29]
  - - [4608, 19456, 1, 16384]
    - [283, 594.8]
  - - [4608, 19968, 1, 16384]
    - [298, 576.49]
  - - [4608, 20480, 1, 16384]
    - [283, 584.25]
  - - [4608, 20992, 1, 16384]
    - [290, 570.87]
  - - [4608, 21504, 1, 16384]
    - [290, 602.16]
  - - [4608, 22016, 1, 16384]
    - [283, 559.4]
  - - [4608, 22528, 1, 16384]
    - [291, 565.75]
  - - [4608, 23040, 1, 16384]
    - [286, 560.92]
  - - [4608, 23552, 1, 16384]
    - [290, 564.73]
  - - [4608, 24064, 1, 16384]
    - [290, 577.09]
  - - [4608, 24576, 1, 16384]
    - [290, 545.63]
  - - [4608, 25088, 1, 16384]
    - [283, 562.42]
  - - [4608, 25600, 1, 16384]
    - [290, 584.86]
  - - [4608, 26112, 1, 16384]
    - [283, 539.79]
  - - [4608, 26624, 1, 16384]
    - [283, 546.09]
  - - [4608, 27136, 1, 16384]
    - [283, 555.36]
  - - [4608, 27648, 1, 16384]
    - [290, 550.97]
  - - [4608, 28160, 1, 16384]
    - [286, 540.45]
  - - [4608, 28672, 1, 16384]
    - [286, 552.22]
  - - [4608, 29184, 1, 16384]
    - [290, 549.82]
  - - [4608, 29696, 1, 16384]
    - [290, 554.34]
  - - [4608, 30208, 1, 16384]
    - [290, 561.44]
  - - [4608, 30720, 1, 16384]
    - [286, 552.61]
  - - [4608, 31232, 1, 16384]
    - [290, 556.39]
  - - [4608, 31744, 1, 16384]
    - [283, 547.83]
  - - [4608, 32256, 1, 16384]
    - [286, 560.51]
  - - [4608, 32768, 1, 16384]
    - [290, 574.76]
  - - [4608, 33280, 1, 16384]
    - [286, 559.31]
  - - [4608, 33792, 1, 16384]
    - [283, 566.51]
  - - [4608, 34304, 1, 16384]
    - [290, 570.93]
  - - [4608, 34816, 1, 16384]
    - [286, 559.32]
  - - [4608, 35328, 1, 16384]
    - [286, 567.16]
  - - [4608, 35840, 1, 16384]
    - [290, 569.11]
  - - [4608, 36352, 1, 16384]
    - [290, 559.09]
  - - [4608, 36864, 1, 16384]
    - [286, 569.84]
  - - [4608, 37376, 1, 16384]
    - [286, 567.9]
  - - [4608, 37888, 1, 16384]
    - [290, 572.24]
  - - [4608, 38400, 1, 16384]
    - [290, 582.45]
  - - [4608, 38912, 1, 16384]
    - [286, 575.04]
  - - [4608, 39424, 1, 16384]
    - [286, 567.25]
  - - [4608, 39936, 1, 16384]
    - [290, 571.35]
  - - [4608, 40448, 1, 16384]
    - [286, 569.38]
  - - [4608, 40960, 1, 16384]
    - [290, 584.0]
  - - [4608, 41472, 1, 16384]
    - [290, 574.95]
  - - [4608, 41984, 1, 16384]
    - [286, 584.98]
  - - [4608, 42496, 1, 16384]
    - [290, 589.24]
  - - [4608, 43008, 1, 16384]
    - [290, 590.8]
  - - [4608, 43520, 1, 16384]
    - [283, 575.87]
  - - [4608, 44032, 1, 16384]
    - [283, 582.77]
  - - [4608, 44544, 1, 16384]
    - [286, 578.59]
  - - [4608, 45056, 1, 16384]
    - [286, 571.14]
  - - [4608, 45568, 1, 16384]
    - [290, 580.72]
  - - [4608, 46080, 1, 16384]
    - [286, 569.34]
  - - [4608, 46592, 1, 16384]
    - [290, 585.13]
  - - [4608, 47104, 1, 16384]
    - [290, 599.87]
  - - [4608, 47616, 1, 16384]
    - [286, 582.11]
  - - [4608, 48128, 1, 16384]
    - [283, 586.58]
  - - [4608, 48640, 1, 16384]
    - [286, 588.21]
  - - [4608, 49152, 1, 16384]
    - [290, 583.8]
  - - [4608, 49664, 1, 16384]
    - [290, 582.09]
  - - [4608, 50176, 1, 16384]
    - [290, 587.17]
  - - [4608, 50688, 1, 16384]
    - [290, 587.56]
  - - [4608, 51200, 1, 16384]
    - [290, 590.69]
  - - [4608, 51712, 1, 16384]
    - [290, 593.77]
  - - [4608, 52224, 1, 16384]
    - [286, 575.61]
  - - [4608, 52736, 1, 16384]
    - [283, 587.21]
  - - [4608, 53248, 1, 16384]
    - [283, 590.29]
  - - [4608, 53760, 1, 16384]
    - [286, 585.63]
  - - [4608, 54272, 1, 16384]
    - [286, 607.36]
  - - [4608, 54784, 1, 16384]
    - [286, 592.29]
  - - [4608, 55296, 1, 16384]
    - [290, 597.61]
  - - [4608, 55808, 1, 16384]
    - [290, 598.4]
  - - [4608, 56320, 1, 16384]
    - [286, 586.31]
  - - [4608, 56832, 1, 16384]
    - [286, 585.51]
  - - [4608, 57344, 1, 16384]
    - [286, 589.9]
  - - [4608, 57856, 1, 16384]
    - [290, 585.89]
  - - [4608, 58368, 1, 16384]
    - [286, 593.95]
  - - [4608, 58880, 1, 16384]
    - [290, 587.29]
  - - [4608, 59392, 1, 16384]
    - [290, 594.07]
  - - [4608, 59904, 1, 16384]
    - [290, 598.35]
  - - [4608, 60416, 1, 16384]
    - [290, 595.48]
  - - [4608, 60928, 1, 16384]
    - [283, 585.4]
  - - [4608, 61440, 1, 16384]
    - [286, 583.96]
  - - [4608, 61952, 1, 16384]
    - [290, 590.08]
  - - [4608, 62464, 1, 16384]
    - [283, 588.94]
  - - [4608, 62976, 1, 16384]
    - [290, 589.74]
  - - [4608, 63488, 1, 16384]
    - [290, 592.08]
  - - [4608, 64000, 1, 16384]
    - [290, 595.02]
  - - [4608, 64512, 1, 16384]
    - [283, 595.4]
  - - [4608, 65024, 1, 16384]
    - [283, 583.54]
  - - [4608, 65536, 1, 16384]
    - [290, 587.8]
  - - [4608, 66048, 1, 16384]
    - [290, 592.31]
  - - [4608, 66560, 1, 16384]
    - [290, 591.67]
  - - [4608, 67072, 1, 16384]
    - [290, 593.78]
  - - [4608, 67584, 1, 16384]
    - [290, 592.8]
  - - [4608, 68096, 1, 16384]
    - [286, 593.41]
  - - [4608, 68608, 1, 16384]
    - [290, 598.31]
  - - [4608, 69120, 1, 16384]
    - [290, 598.18]
  - - [4608, 69632, 1, 16384]
    - [283, 593.75]
  - - [4608, 70144, 1, 16384]
    - [286, 605.54]
  - - [4608, 70656, 1, 16384]
    - [283, 597.46]
  - - [4608, 71168, 1, 16384]
    - [290, 596.38]
  - - [4608, 71680, 1, 16384]
    - [290, 597.09]
  - - [4608, 72192, 1, 16384]
    - [283, 595.44]
  - - [4608, 72704, 1, 16384]
    - [290, 604.78]
  - - [4608, 73216, 1, 16384]
    - [290, 599.46]
  - - [4608, 73728, 1, 16384]
    - [286, 591.25]
  - - [4608, 74240, 1, 16384]
    - [286, 597.29]
  - - [4608, 74752, 1, 16384]
    - [290, 598.63]
  - - [4608, 75264, 1, 16384]
    - [290, 601.8]
  - - [4608, 75776, 1, 16384]
    - [290, 600.12]
  - - [4608, 76288, 1, 16384]
    - [286, 598.14]
  - - [4608, 76800, 1, 16384]
    - [286, 596.44]
  - - [4608, 77312, 1, 16384]
    - [290, 605.58]
  - - [4608, 77824, 1, 16384]
    - [290, 611.78]
  - - [4608, 78336, 1, 16384]
    - [290, 596.71]
  - - [4608, 78848, 1, 16384]
    - [290, 598.41]
  - - [4608, 79360, 1, 16384]
    - [290, 602.84]
  - - [4608, 79872, 1, 16384]
    - [290, 607.94]
  - - [4608, 80384, 1, 16384]
    - [290, 601.59]
  - - [4608, 80896, 1, 16384]
    - [290, 606.05]
  - - [4608, 81408, 1, 16384]
    - [290, 606.77]
  - - [4608, 81920, 1, 16384]
    - [290, 610.9]
  - - [4608, 82432, 1, 16384]
    - [290, 596.63]
  - - [4608, 82944, 1, 16384]
    - [286, 595.53]
  - - [4608, 83456, 1, 16384]
    - [286, 603.99]
  - - [4608, 83968, 1, 16384]
    - [290, 606.1]
  - - [4608, 84480, 1, 16384]
    - [290, 605.56]
  - - [4608, 84992, 1, 16384]
    - [290, 607.92]
  - - [4608, 85504, 1, 16384]
    - [290, 610.97]
  - - [4608, 86016, 1, 16384]
    - [290, 609.23]
  - - [4608, 86528, 1, 16384]
    - [286, 607.49]
  - - [4608, 87040, 1, 16384]
    - [286, 603.09]
  - - [4608, 87552, 1, 16384]
    - [286, 607.58]
  - - [4608, 88064, 1, 16384]
    - [290, 611.2]
  - - [4608, 88576, 1, 16384]
    - [290, 605.15]
  - - [4608, 89088, 1, 16384]
    - [286, 607.54]
  - - [4608, 89600, 1, 16384]
    - [290, 611.56]
  - - [4608, 90112, 1, 16384]
    - [290, 609.94]
  - - [4608, 90624, 1, 16384]
    - [290, 617.55]
  - - [4608, 91136, 1, 16384]
    - [290, 606.57]
  - - [4608, 91648, 1, 16384]
    - [286, 597.04]
  - - [4608, 92160, 1, 16384]
    - [286, 611.47]
  - - [4608, 92672, 1, 16384]
    - [290, 608.8]
  - - [4608, 93184, 1, 16384]
    - [290, 612.92]
  - - [4608, 93696, 1, 16384]
    - [290, 611.01]
  - - [4608, 94208, 1, 16384]
    - [290, 613.03]
  - - [4608, 94720, 1, 16384]
    - [290, 614.72]
  - - [4608, 95232, 1, 16384]
    - [290, 605.15]
  - - [4608, 95744, 1, 16384]
    - [286, 608.09]
  - - [4608, 96256, 1, 16384]
    - [290, 613.42]
  - - [4608, 96768, 1, 16384]
    - [290, 614.09]
  - - [4608, 97280, 1, 16384]
    - [290, 613.76]
  - - [4608, 97792, 1, 16384]
    - [290, 609.67]
  - - [4608, 98304, 1, 16384]
    - [290, 620.82]
  - - [4608, 98816, 1, 16384]
    - [290, 616.63]
  - - [4608, 99328, 1, 16384]
    - [290, 621.18]
  - - [4608, 99840, 1, 16384]
    - [286, 615.9]
  - - [4608, 100352, 1, 16384]
    - [290, 608.89]
  - - [4608, 100864, 1, 16384]
    - [290, 610.3]
  - - [4608, 101376, 1, 16384]
    - [290, 618.53]
  - - [4608, 101888, 1, 16384]
    - [290, 605.42]
  - - [4608, 102400, 1, 16384]
    - [290, 619.89]
  - - [4608, 102912, 1, 16384]
    - [290, 623.3]
  - - [4608, 103424, 1, 16384]
    - [290, 619.8]
  - - [4608, 103936, 1, 16384]
    - [290, 614.38]
  - - [4608, 104448, 1, 16384]
    - [290, 613.32]
  - - [4608, 104960, 1, 16384]
    - [286, 612.39]
  - - [4608, 105472, 1, 16384]
    - [290, 619.82]
  - - [4608, 105984, 1, 16384]
    - [290, 619.36]
  - - [4608, 106496, 1, 16384]
    - [290, 617.7]
  - - [4608, 107008, 1, 16384]
    - [290, 617.45]
  - - [4608, 107520, 1, 16384]
    - [290, 622.98]
  - - [4608, 108032, 1, 16384]
    - [290, 620.14]
  - - [4608, 108544, 1, 16384]
    - [290, 613.75]
  - - [4608, 109056, 1, 16384]
    - [286, 613.55]
  - - [4608, 109568, 1, 16384]
    - [290, 618.46]
  - - [4608, 110080, 1, 16384]
    - [290, 616.02]
  - - [4608, 110592, 1, 16384]
    - [290, 607.05]
  - - [4608, 111104, 1, 16384]
    - [290, 617.64]
  - - [4608, 111616, 1, 16384]
    - [290, 626.83]
  - - [4608, 112128, 1, 16384]
    - [290, 628.67]
  - - [4608, 112640, 1, 16384]
    - [286, 614.19]
  - - [4608, 113152, 1, 16384]
    - [286, 617.71]
  - - [4608, 113664, 1, 16384]
    - [286, 619.29]
  - - [4608, 114176, 1, 16384]
    - [290, 616.66]
  - - [4608, 114688, 1, 16384]
    - [290, 617.47]
  - - [4608, 115200, 1, 16384]
    - [290, 624.28]
  - - [4608, 115712, 1, 16384]
    - [290, 625.39]
  - - [4608, 116224, 1, 16384]
    - [290, 626.85]
  - - [4608, 116736, 1, 16384]
    - [286, 621.1]
  - - [4608, 117248, 1, 16384]
    - [290, 616.65]
  - - [4608, 117760, 1, 16384]
    - [290, 619.87]
  - - [4608, 118272, 1, 16384]
    - [290, 611.01]
  - - [4608, 118784, 1, 16384]
    - [286, 612.83]
  - - [4608, 119296, 1, 16384]
    - [290, 624.63]
  - - [4608, 119808, 1, 16384]
    - [290, 628.88]
  - - [4608, 120320, 1, 16384]
    - [290, 622.35]
  - - [4608, 120832, 1, 16384]
    - [290, 626.92]
  - - [4608, 121344, 1, 16384]
    - [286, 621.22]
  - - [4608, 121856, 1, 16384]
    - [286, 618.18]
  - - [4608, 122368, 1, 16384]
    - [286, 619.95]
  - - [4608, 122880, 1, 16384]
    - [286, 621.88]
  - - [4608, 123392, 1, 16384]
    - [290, 609.55]
  - - [4608, 123904, 1, 16384]
    - [290, 622.02]
  - - [4608, 124416, 1, 16384]
    - [290, 624.35]
  - - [4608, 124928, 1, 16384]
    - [290, 625.66]
  - - [4608, 125440, 1, 16384]
    - [286, 619.63]
  - - [4608, 125952, 1, 16384]
    - [286, 617.28]
  - - [4608, 126464, 1, 16384]
    - [286, 622.1]
  - - [4608, 126976, 1, 16384]
    - [290, 621.84]
  - - [4608, 127488, 1, 16384]
    - [290, 622.86]
  - - [4608, 128000, 1, 16384]
    - [290, 629.64]
  - - [4608, 128512, 1, 16384]
    - [290, 626.08]
  - - [4608, 129024, 1, 16384]
    - [290, 628.41]
  - - [4608, 129536, 1, 16384]
    - [290, 631.35]
  - - [4608, 130048, 1, 16384]
    - [290, 618.94]
  - - [4608, 130560, 1, 16384]
    - [290, 621.67]
  - - [4608, 131072, 1, 16384]
    - [286, 620.32]
  - - [4608, 1088, 1, 16384]
    - [293, 410.26]
  - - [4608, 1152, 1, 16384]
    - [293, 428.1]
  - - [4608, 1216, 1, 16384]
    - [294, 418.4]
  - - [4608, 1280, 1, 16384]
    - [283, 430.94]
  - - [4608, 1344, 1, 16384]
    - [283, 441.41]
  - - [4608, 1408, 1, 16384]
    - [283, 464.6]
  - - [4608, 1472, 1, 16384]
    - [283, 468.42]
  - - [4608, 1536, 1, 16384]
    - [283, 477.82]
  - - [4608, 1600, 1, 16384]
    - [295, 448.23]
  - - [4608, 1664, 1, 16384]
    - [291, 475.44]
  - - [4608, 1728, 1, 16384]
    - [291, 466.5]
  - - [4608, 1792, 1, 16384]
    - [291, 477.08]
  - - [4608, 1856, 1, 16384]
    - [315, 472.51]
  - - [4608, 1920, 1, 16384]
    - [291, 493.25]
  - - [4608, 1984, 1, 16384]
    - [291, 495.55]
  - - [4608, 2048, 1, 16384]
    - [291, 512.0]
  - - [4608, 2176, 1, 16384]
    - [316, 482.67]
  - - [4608, 2304, 1, 16384]
    - [316, 496.14]
  - - [4608, 2432, 1, 16384]
    - [297, 524.29]
  - - [4608, 2560, 1, 16384]
    - [285, 504.78]
  - - [4608, 2688, 1, 16384]
    - [286, 510.05]
  - - [4608, 2816, 1, 16384]
    - [286, 533.86]
  - - [4608, 2944, 1, 16384]
    - [286, 540.69]
  - - [4608, 3072, 1, 16384]
    - [286, 538.9]
  - - [4608, 3200, 1, 16384]
    - [286, 547.5]
  - - [4608, 3328, 1, 16384]
    - [312, 514.6]
  - - [4608, 3456, 1, 16384]
    - [312, 526.38]
  - - [4608, 3584, 1, 16384]
    - [289, 532.81]
  - - [4608, 3712, 1, 16384]
    - [290, 516.35]
  - - [4608, 3840, 1, 16384]
    - [290, 524.26]
  - - [4608, 3968, 1, 16384]
    - [290, 532.54]
  - - [4608, 4096, 1, 16384]
    - [290, 557.36]
  - - [4608, 4352, 1, 16384]
    - [284, 494.86]
  - - [4608, 4608, 1, 16384]
    - [297, 508.29]
  - - [4608, 4864, 1, 16384]
    - [283, 520.16]
  - - [4608, 5120, 1, 16384]
    - [297, 526.79]
  - - [4608, 5376, 1, 16384]
    - [286, 510.42]
  - - [4608, 5632, 1, 16384]
    - [286, 521.0]
  - - [4608, 5888, 1, 16384]
    - [286, 529.5]
  - - [4608, 6144, 1, 16384]
    - [286, 551.05]
  - - [4608, 6400, 1, 16384]
    - [286, 538.63]
  - - [4608, 6656, 1, 16384]
    - [312, 528.77]
  - - [4608, 6912, 1, 16384]
    - [312, 528.32]
  - - [4608, 7168, 1, 16384]
    - [290, 537.22]
  - - [4608, 7424, 1, 16384]
    - [290, 543.79]
  - - [4608, 7680, 1, 16384]
    - [290, 552.34]
  - - [4608, 7936, 1, 16384]
    - [290, 563.16]
  - - [4608, 8192, 1, 16384]
    - [290, 570.87]
  - - [4608, 16, 1, 16384]
    - [317, 41.34]
  - - [4608, 32, 1, 16384]
    - [318, 71.24]
  - - [4608, 48, 1, 16384]
    - [319, 95.93]
  - - [4608, 64, 1, 16384]
    - [320, 117.35]
  - - [4608, 80, 1, 16384]
    - [321, 134.72]
  - - [4608, 96, 1, 16384]
    - [322, 150.5]
  - - [4608, 112, 1, 16384]
    - [323, 162.87]
  - - [4608, 128, 1, 16384]
    - [324, 181.3]
  - - [4608, 144, 1, 16384]
    - [325, 178.46]
  - - [4608, 160, 1, 16384]
    - [326, 198.22]
  - - [4608, 176, 1, 16384]
    - [327, 198.21]
  - - [4608, 192, 1, 16384]
    - [328, 214.39]
  - - [4608, 208, 1, 16384]
    - [329, 211.26]
  - - [4608, 224, 1, 16384]
    - [329, 229.47]
  - - [4608, 240, 1, 16384]
    - [330, 237.84]
  - - [4608, 256, 1, 16384]
    - [299, 255.14]
  - - [4608, 272, 1, 16384]
    - [331, 239.29]
  - - [4608, 288, 1, 16384]
    - [332, 254.29]
  - - [4608, 304, 1, 16384]
    - [333, 263.85]
  - - [4608, 320, 1, 16384]
    - [333, 275.62]
  - - [4608, 336, 1, 16384]
    - [334, 272.62]
  - - [4608, 352, 1, 16384]
    - [335, 275.27]
  - - [4608, 368, 1, 16384]
    - [336, 289.41]
  - - [4608, 384, 1, 16384]
    - [337, 302.75]
  - - [4608, 400, 1, 16384]
    - [338, 286.39]
  - - [4608, 416, 1, 16384]
    - [338, 295.9]
  - - [4608, 432, 1, 16384]
    - [338, 304.32]
  - - [4608, 448, 1, 16384]
    - [338, 314.87]
  - - [4608, 464, 1, 16384]
    - [336, 304.56]
  - - [4608, 480, 1, 16384]
    - [339, 321.9]
  - - [4608, 496, 1, 16384]
    - [336, 320.87]
  - - [4608, 512, 1, 16384]
    - [340, 334.48]
  - - [13312, 8704, 1, 16384]
    - [290, 560.2]
  - - [13312, 9216, 1, 16384]
    - [314, 549.41]
  - - [13312, 9728, 1, 16384]
    - [290, 550.82]
  - - [13312, 10240, 1, 16384]
    - [290, 573.94]
  - - [13312, 10752, 1, 16384]
    - [290, 562.71]
  - - [13312, 11264, 1, 16384]
    - [290, 564.92]
  - - [13312, 11776, 1, 16384]
    - [290, 570.08]
  - - [13312, 12288, 1, 16384]
    - [286, 572.51]
  - - [13312, 12800, 1, 16384]
    - [290, 577.32]
  - - [13312, 13312, 1, 16384]
    - [290, 593.5]
  - - [13312, 13824, 1, 16384]
    - [290, 582.62]
  - - [13312, 14336, 1, 16384]
    - [290, 585.06]
  - - [13312, 14848, 1, 16384]
    - [290, 599.92]
  - - [13312, 15360, 1, 16384]
    - [312, 588.59]
  - - [13312, 15872, 1, 16384]
    - [290, 590.35]
  - - [13312, 16384, 1, 16384]
    - [290, 595.9]
  - - [13312, 16896, 1, 16384]
    - [290, 586.04]
  - - [13312, 17408, 1, 16384]
    - [290, 595.3]
  - - [13312, 17920, 1, 16384]
    - [290, 603.13]
  - - [13312, 18432, 1, 16384]
    - [290, 591.57]
  - - [13312, 18944, 1, 16384]
    - [290, 607.44]
  - - [13312, 19456, 1, 16384]
    - [290, 602.56]
  - - [13312, 19968, 1, 16384]
    - [290, 588.2]
  - - [13312, 20480, 1, 16384]
    - [290, 600.27]
  - - [13312, 20992, 1, 16384]
    - [286, 590.67]
  - - [13312, 21504, 1, 16384]
    - [290, 589.63]
  - - [13312, 22016, 1, 16384]
    - [312, 596.12]
  - - [13312, 22528, 1, 16384]
    - [290, 578.27]
  - - [13312, 23040, 1, 16384]
    - [290, 598.62]
  - - [13312, 23552, 1, 16384]
    - [290, 605.82]
  - - [13312, 24064, 1, 16384]
    - [312, 588.85]
  - - [13312, 24576, 1, 16384]
    - [312, 592.2]
  - - [13312, 25088, 1, 16384]
    - [286, 591.0]
  - - [13312, 25600, 1, 16384]
    - [290, 597.8]
  - - [13312, 26112, 1, 16384]
    - [312, 590.82]
  - - [13312, 26624, 1, 16384]
    - [290, 607.0]
  - - [13312, 27136, 1, 16384]
    - [312, 600.8]
  - - [13312, 27648, 1, 16384]
    - [290, 609.37]
  - - [13312, 28160, 1, 16384]
    - [290, 612.04]
  - - [13312, 131072, 1, 16384]
    - [290, 616.31]
  - - [13312, 2176, 1, 16384]
    - [286, 528.29]
  - - [13312, 2304, 1, 16384]
    - [312, 519.19]
  - - [13312, 2432, 1, 16384]
    - [312, 569.73]
  - - [13312, 2560, 1, 16384]
    - [312, 534.28]
  - - [13312, 2688, 1, 16384]
    - [297, 529.38]
  - - [13312, 2816, 1, 16384]
    - [290, 544.12]
  - - [13312, 2944, 1, 16384]
    - [290, 548.51]
  - - [13312, 3072, 1, 16384]
    - [286, 511.51]
  - - [13312, 3200, 1, 16384]
    - [286, 539.24]
  - - [13312, 3328, 1, 16384]
    - [286, 534.21]
  - - [13312, 3456, 1, 16384]
    - [297, 529.34]
  - - [13312, 3584, 1, 16384]
    - [297, 526.07]
  - - [13312, 3712, 1, 16384]
    - [283, 518.39]
  - - [13312, 3840, 1, 16384]
    - [312, 536.87]
  - - [13312, 3968, 1, 16384]
    - [290, 551.79]
  - - [13312, 4096, 1, 16384]
    - [290, 536.54]
  - - [13312, 4352, 1, 16384]
    - [290, 557.6]
  - - [13312, 4608, 1, 16384]
    - [297, 543.7]
  - - [13312, 4864, 1, 16384]
    - [312, 540.27]
  - - [13312, 5120, 1, 16384]
    - [312, 557.49]
  - - [13312, 5376, 1, 16384]
    - [290, 554.01]
  - - [13312, 5632, 1, 16384]
    - [290, 561.87]
  - - [13312, 5888, 1, 16384]
    - [290, 557.7]
  - - [13312, 6144, 1, 16384]
    - [312, 556.71]
  - - [13312, 6400, 1, 16384]
    - [297, 561.6]
  - - [13312, 6656, 1, 16384]
    - [286, 568.2]
  - - [13312, 6912, 1, 16384]
    - [290, 568.36]
  - - [13312, 7168, 1, 16384]
    - [290, 584.77]
  - - [13312, 7424, 1, 16384]
    - [290, 591.16]
  - - [13312, 7680, 1, 16384]
    - [286, 584.75]
  - - [13312, 7936, 1, 16384]
    - [297, 572.85]
  - - [13312, 8192, 1, 16384]
    - [297, 579.53]
  - - [13312, 476, 1, 16384]
    - [341, 439.98]
  - - [13312, 1, 1, 16384]
    - [342, 3.36]
  - - [13312, 2, 1, 16384]
    - [343, 6.66]
  - - [13312, 3, 1, 16384]
    - [344, 10.12]
  - - [13312, 4, 1, 16384]
    - [342, 13.51]
  - - [13312, 5, 1, 16384]
    - [343, 16.82]
  - - [13312, 6, 1, 16384]
    - [342, 20.37]
  - - [13312, 7, 1, 16384]
    - [342, 23.12]
  - - [13312, 8, 1, 16384]
    - [344, 26.55]
  - - [13312, 9, 1, 16384]
    - [342, 30.16]
  - - [13312, 10, 1, 16384]
    - [342, 33.26]
  - - [13312, 11, 1, 16384]
    - [342, 36.67]
  - - [13312, 12, 1, 16384]
    - [342, 39.82]
  - - [13312, 13, 1, 16384]
    - [342, 43.08]
  - - [13312, 14, 1, 16384]
    - [342, 46.21]
  - - [13312, 15, 1, 16384]
    - [345, 49.24]
  - - [13312, 16, 1, 16384]
    - [343, 52.33]
  - - [13312, 17, 1, 16384]
    - [346, 53.38]
  - - [16384, 8704, 1, 2048]
    - [341, 462.02]
  - - [16384, 9216, 1, 2048]
    - [283, 470.18]
  - - [16384, 9728, 1, 2048]
    - [283, 471.64]
  - - [16384, 10240, 1, 2048]
    - [341, 467.1]
  - - [16384, 10752, 1, 2048]
    - [283, 469.63]
  - - [16384, 11264, 1, 2048]
    - [347, 464.63]
  - - [16384, 11776, 1, 2048]
    - [347, 452.52]
  - - [16384, 12288, 1, 2048]
    - [341, 445.45]
  - - [16384, 12800, 1, 2048]
    - [283, 450.51]
  - - [16384, 13312, 1, 2048]
    - [283, 448.33]
  - - [16384, 13824, 1, 2048]
    - [283, 451.62]
  - - [16384, 14336, 1, 2048]
    - [283, 451.33]
  - - [16384, 14848, 1, 2048]
    - [283, 467.75]
  - - [16384, 15360, 1, 2048]
    - [283, 466.65]
  - - [16384, 15872, 1, 2048]
    - [341, 462.93]
  - - [16384, 16384, 1, 2048]
    - [341, 456.91]
  - - [16384, 16896, 1, 2048]
    - [341, 460.41]
  - - [16384, 17408, 1, 2048]
    - [341, 471.09]
  - - [16384, 17920, 1, 2048]
    - [283, 473.09]
  - - [16384, 18432, 1, 2048]
    - [283, 458.66]
  - - [16384, 18944, 1, 2048]
    - [341, 462.97]
  - - [16384, 19456, 1, 2048]
    - [283, 465.41]
  - - [16384, 19968, 1, 2048]
    - [341, 465.48]
  - - [16384, 20480, 1, 2048]
    - [341, 464.4]
  - - [16384, 20992, 1, 2048]
    - [283, 459.68]
  - - [16384, 21504, 1, 2048]
    - [283, 467.22]
  - - [16384, 22016, 1, 2048]
    - [341, 469.87]
  - - [16384, 22528, 1, 2048]
    - [283, 468.5]
  - - [16384, 23040, 1, 2048]
    - [341, 468.54]
  - - [16384, 23552, 1, 2048]
    - [341, 469.7]
  - - [16384, 24064, 1, 2048]
    - [341, 468.65]
  - - [16384, 24576, 1, 2048]
    - [283, 473.57]
  - - [16384, 25088, 1, 2048]
    - [341, 469.9]
  - - [16384, 25600, 1, 2048]
    - [341, 472.96]
  - - [16384, 26112, 1, 2048]
    - [341, 468.45]
  - - [16384, 26624, 1, 2048]
    - [341, 472.95]
  - - [16384, 27136, 1, 2048]
    - [283, 474.42]
  - - [16384, 27648, 1, 2048]
    - [341, 476.93]
  - - [16384, 28160, 1, 2048]
    - [341, 473.33]
  - - [16384, 131072, 1, 2048]
    - [283, 482.29]
  - - [16384, 2176, 1, 2048]
    - [283, 411.64]
  - - [16384, 2304, 1, 2048]
    - [293, 395.86]
  - - [16384, 2432, 1, 2048]
    - [348, 405.66]
  - - [16384, 2560, 1, 2048]
    - [283, 416.36]
  - - [16384, 2688, 1, 2048]
    - [349, 407.51]
  - - [16384, 2816, 1, 2048]
    - [283, 416.66]
  - - [16384, 2944, 1, 2048]
    - [341, 415.99]
  - - [16384, 3072, 1, 2048]
    - [347, 411.27]
  - - [16384, 3200, 1, 2048]
    - [283, 414.8]
  - - [16384, 3328, 1, 2048]
    - [283, 408.52]
  - - [16384, 3456, 1, 2048]
    - [283, 426.86]
  - - [16384, 3584, 1, 2048]
    - [294, 413.96]
  - - [16384, 3712, 1, 2048]
    - [283, 406.17]
  - - [16384, 3840, 1, 2048]
    - [341, 425.04]
  - - [16384, 3968, 1, 2048]
    - [283, 415.15]
  - - [16384, 4096, 1, 2048]
    - [283, 415.9]
  - - [16384, 4352, 1, 2048]
    - [347, 423.88]
  - - [16384, 4608, 1, 2048]
    - [283, 416.58]
  - - [16384, 4864, 1, 2048]
    - [290, 422.88]
  - - [16384, 5120, 1, 2048]
    - [349, 417.54]
  - - [16384, 5376, 1, 2048]
    - [349, 435.17]
  - - [16384, 5632, 1, 2048]
    - [283, 428.45]
  - - [16384, 5888, 1, 2048]
    - [341, 426.77]
  - - [16384, 6144, 1, 2048]
    - [341, 434.68]
  - - [16384, 6400, 1, 2048]
    - [294, 433.76]
  - - [16384, 6656, 1, 2048]
    - [283, 436.65]
  - - [16384, 6912, 1, 2048]
    - [341, 443.4]
  - - [16384, 7168, 1, 2048]
    - [341, 443.09]
  - - [16384, 7424, 1, 2048]
    - [341, 445.67]
  - - [16384, 7680, 1, 2048]
    - [283, 449.33]
  - - [16384, 7936, 1, 2048]
    - [341, 451.33]
  - - [16384, 8192, 1, 2048]
    - [341, 448.14]
  - - [16384, 476, 1, 2048]
    - [350, 240.38]
  - - [16384, 1, 1, 2048]
    - [351, 2.59]
  - - [16384, 2, 1, 2048]
    - [351, 5.13]
  - - [16384, 3, 1, 2048]
    - [352, 7.57]
  - - [16384, 4, 1, 2048]
    - [351, 10.14]
  - - [16384, 5, 1, 2048]
    - [352, 12.56]
  - - [16384, 6, 1, 2048]
    - [351, 15.0]
  - - [16384, 7, 1, 2048]
    - [352, 17.39]
  - - [16384, 8, 1, 2048]
    - [351, 19.94]
  - - [16384, 9, 1, 2048]
    - [351, 22.23]
  - - [16384, 10, 1, 2048]
    - [351, 24.92]
  - - [16384, 11, 1, 2048]
    - [351, 27.32]
  - - [16384, 12, 1, 2048]
    - [351, 29.37]
  - - [16384, 13, 1, 2048]
    - [353, 31.42]
  - - [16384, 14, 1, 2048]
    - [354, 34.01]
  - - [16384, 15, 1, 2048]
    - [351, 36.63]
  - - [16384, 16, 1, 2048]
    - [351, 39.29]
  - - [16384, 17, 1, 2048]
    - [355, 37.92]
  - - [16384, 8704, 1, 4096]
    - [314, 515.31]
  - - [16384, 9216, 1, 4096]
    - [356, 521.46]
  - - [16384, 9728, 1, 4096]
    - [290, 548.49]
  - - [16384, 10240, 1, 4096]
    - [289, 544.83]
  - - [16384, 10752, 1, 4096]
    - [290, 541.04]
  - - [16384, 11264, 1, 4096]
    - [283, 536.04]
  - - [16384, 11776, 1, 4096]
    - [283, 550.26]
  - - [16384, 12288, 1, 4096]
    - [290, 530.58]
  - - [16384, 12800, 1, 4096]
    - [283, 563.02]
  - - [16384, 13312, 1, 4096]
    - [286, 535.46]
  - - [16384, 13824, 1, 4096]
    - [283, 571.73]
  - - [16384, 14336, 1, 4096]
    - [283, 552.55]
  - - [16384, 14848, 1, 4096]
    - [341, 563.46]
  - - [16384, 15360, 1, 4096]
    - [283, 546.66]
  - - [16384, 15872, 1, 4096]
    - [357, 523.76]
  - - [16384, 16384, 1, 4096]
    - [314, 519.65]
  - - [16384, 16896, 1, 4096]
    - [290, 525.09]
  - - [16384, 17408, 1, 4096]
    - [357, 557.5]
  - - [16384, 17920, 1, 4096]
    - [357, 522.18]
  - - [16384, 18432, 1, 4096]
    - [293, 524.48]
  - - [16384, 18944, 1, 4096]
    - [283, 503.44]
  - - [16384, 19456, 1, 4096]
    - [283, 521.11]
  - - [16384, 19968, 1, 4096]
    - [348, 523.39]
  - - [16384, 20480, 1, 4096]
    - [283, 513.29]
  - - [16384, 20992, 1, 4096]
    - [312, 535.93]
  - - [16384, 21504, 1, 4096]
    - [293, 521.51]
  - - [16384, 22016, 1, 4096]
    - [283, 487.37]
  - - [16384, 22528, 1, 4096]
    - [341, 503.41]
  - - [16384, 23040, 1, 4096]
    - [341, 525.64]
  - - [16384, 23552, 1, 4096]
    - [341, 530.94]
  - - [16384, 24064, 1, 4096]
    - [283, 508.44]
  - - [16384, 24576, 1, 4096]
    - [341, 492.63]
  - - [16384, 25088, 1, 4096]
    - [283, 501.99]
  - - [16384, 25600, 1, 4096]
    - [314, 491.33]
  - - [16384, 26112, 1, 4096]
    - [290, 479.44]
  - - [16384, 26624, 1, 4096]
    - [341, 489.56]
  - - [16384, 27136, 1, 4096]
    - [341, 511.78]
  - - [16384, 27648, 1, 4096]
    - [293, 493.31]
  - - [16384, 28160, 1, 4096]
    - [341, 493.07]
  - - [16384, 28672, 1, 4096]
    - [341, 487.79]
  - - [16384, 29184, 1, 4096]
    - [290, 481.2]
  - - [16384, 29696, 1, 4096]
    - [341, 490.8]
  - - [16384, 30208, 1, 4096]
    - [298, 484.83]
  - - [16384, 30720, 1, 4096]
    - [289, 495.37]
  - - [16384, 31232, 1, 4096]
    - [290, 495.23]
  - - [16384, 31744, 1, 4096]
    - [283, 496.05]
  - - [16384, 32256, 1, 4096]
    - [356, 491.14]
  - - [16384, 32768, 1, 4096]
    - [341, 489.18]
  - - [16384, 33280, 1, 4096]
    - [298, 496.86]
  - - [16384, 33792, 1, 4096]
    - [290, 498.94]
  - - [16384, 34304, 1, 4096]
    - [283, 502.07]
  - - [16384, 34816, 1, 4096]
    - [283, 497.97]
  - - [16384, 35328, 1, 4096]
    - [283, 503.97]
  - - [16384, 35840, 1, 4096]
    - [341, 505.96]
  - - [16384, 36352, 1, 4096]
    - [283, 502.8]
  - - [16384, 36864, 1, 4096]
    - [283, 498.19]
  - - [16384, 37376, 1, 4096]
    - [298, 503.9]
  - - [16384, 37888, 1, 4096]
    - [285, 506.92]
  - - [16384, 38400, 1, 4096]
    - [290, 507.09]
  - - [16384, 38912, 1, 4096]
    - [290, 507.34]
  - - [16384, 39424, 1, 4096]
    - [341, 512.47]
  - - [16384, 39936, 1, 4096]
    - [290, 514.8]
  - - [16384, 40448, 1, 4096]
    - [298, 513.87]
  - - [16384, 40960, 1, 4096]
    - [289, 508.74]
  - - [16384, 41472, 1, 4096]
    - [341, 510.15]
  - - [16384, 41984, 1, 4096]
    - [341, 506.55]
  - - [16384, 42496, 1, 4096]
    - [283, 519.45]
  - - [16384, 43008, 1, 4096]
    - [283, 514.95]
  - - [16384, 43520, 1, 4096]
    - [341, 515.44]
  - - [16384, 44032, 1, 4096]
    - [341, 509.25]
  - - [16384, 44544, 1, 4096]
    - [341, 515.36]
  - - [16384, 45056, 1, 4096]
    - [283, 514.19]
  - - [16384, 45568, 1, 4096]
    - [283, 516.32]
  - - [16384, 46080, 1, 4096]
    - [341, 513.63]
  - - [16384, 46592, 1, 4096]
    - [341, 514.68]
  - - [16384, 47104, 1, 4096]
    - [283, 515.05]
  - - [16384, 47616, 1, 4096]
    - [283, 513.39]
  - - [16384, 48128, 1, 4096]
    - [341, 523.76]
  - - [16384, 48640, 1, 4096]
    - [341, 518.22]
  - - [16384, 49152, 1, 4096]
    - [283, 520.17]
  - - [16384, 49664, 1, 4096]
    - [341, 521.86]
  - - [16384, 50176, 1, 4096]
    - [341, 519.27]
  - - [16384, 50688, 1, 4096]
    - [289, 524.68]
  - - [16384, 51200, 1, 4096]
    - [341, 521.55]
  - - [16384, 51712, 1, 4096]
    - [283, 519.61]
  - - [16384, 52224, 1, 4096]
    - [341, 521.38]
  - - [16384, 52736, 1, 4096]
    - [283, 535.95]
  - - [16384, 53248, 1, 4096]
    - [341, 518.23]
  - - [16384, 53760, 1, 4096]
    - [341, 520.0]
  - - [16384, 54272, 1, 4096]
    - [283, 523.0]
  - - [16384, 54784, 1, 4096]
    - [341, 523.59]
  - - [16384, 55296, 1, 4096]
    - [341, 522.25]
  - - [16384, 55808, 1, 4096]
    - [341, 529.6]
  - - [16384, 56320, 1, 4096]
    - [341, 525.46]
  - - [16384, 56832, 1, 4096]
    - [285, 520.07]
  - - [16384, 57344, 1, 4096]
    - [341, 518.18]
  - - [16384, 57856, 1, 4096]
    - [341, 522.47]
  - - [16384, 58368, 1, 4096]
    - [341, 519.22]
  - - [16384, 58880, 1, 4096]
    - [283, 523.05]
  - - [16384, 59392, 1, 4096]
    - [341, 519.77]
  - - [16384, 59904, 1, 4096]
    - [341, 524.34]
  - - [16384, 60416, 1, 4096]
    - [341, 522.94]
  - - [16384, 60928, 1, 4096]
    - [341, 522.79]
  - - [16384, 61440, 1, 4096]
    - [341, 524.63]
  - - [16384, 61952, 1, 4096]
    - [341, 523.04]
  - - [16384, 62464, 1, 4096]
    - [341, 523.68]
  - - [16384, 62976, 1, 4096]
    - [341, 520.72]
  - - [16384, 63488, 1, 4096]
    - [283, 518.15]
  - - [16384, 64000, 1, 4096]
    - [341, 527.94]
  - - [16384, 64512, 1, 4096]
    - [341, 522.76]
  - - [16384, 65024, 1, 4096]
    - [341, 522.31]
  - - [16384, 65536, 1, 4096]
    - [341, 523.8]
  - - [16384, 66048, 1, 4096]
    - [341, 523.45]
  - - [16384, 66560, 1, 4096]
    - [341, 527.66]
  - - [16384, 67072, 1, 4096]
    - [341, 520.7]
  - - [16384, 67584, 1, 4096]
    - [341, 523.95]
  - - [16384, 68096, 1, 4096]
    - [341, 523.2]
  - - [16384, 68608, 1, 4096]
    - [283, 518.57]
  - - [16384, 69120, 1, 4096]
    - [283, 519.43]
  - - [16384, 69632, 1, 4096]
    - [341, 523.14]
  - - [16384, 70144, 1, 4096]
    - [341, 527.62]
  - - [16384, 70656, 1, 4096]
    - [341, 519.58]
  - - [16384, 71168, 1, 4096]
    - [341, 526.56]
  - - [16384, 71680, 1, 4096]
    - [341, 522.36]
  - - [16384, 72192, 1, 4096]
    - [341, 520.94]
  - - [16384, 72704, 1, 4096]
    - [341, 523.47]
  - - [16384, 73216, 1, 4096]
    - [341, 522.28]
  - - [16384, 73728, 1, 4096]
    - [341, 522.6]
  - - [16384, 74240, 1, 4096]
    - [341, 525.14]
  - - [16384, 74752, 1, 4096]
    - [341, 523.62]
  - - [16384, 75264, 1, 4096]
    - [341, 520.33]
  - - [16384, 75776, 1, 4096]
    - [341, 520.51]
  - - [16384, 76288, 1, 4096]
    - [283, 523.85]
  - - [16384, 76800, 1, 4096]
    - [283, 524.19]
  - - [16384, 77312, 1, 4096]
    - [290, 520.59]
  - - [16384, 77824, 1, 4096]
    - [341, 521.63]
  - - [16384, 78336, 1, 4096]
    - [341, 522.23]
  - - [16384, 78848, 1, 4096]
    - [283, 521.69]
  - - [16384, 79360, 1, 4096]
    - [298, 527.07]
  - - [16384, 79872, 1, 4096]
    - [290, 523.13]
  - - [16384, 80384, 1, 4096]
    - [290, 520.32]
  - - [16384, 80896, 1, 4096]
    - [290, 523.9]
  - - [16384, 81408, 1, 4096]
    - [283, 521.22]
  - - [16384, 81920, 1, 4096]
    - [341, 524.38]
  - - [16384, 82432, 1, 4096]
    - [289, 523.74]
  - - [16384, 82944, 1, 4096]
    - [341, 524.11]
  - - [16384, 83456, 1, 4096]
    - [290, 525.34]
  - - [16384, 83968, 1, 4096]
    - [298, 523.1]
  - - [16384, 84480, 1, 4096]
    - [341, 524.12]
  - - [16384, 84992, 1, 4096]
    - [290, 524.77]
  - - [16384, 85504, 1, 4096]
    - [298, 520.7]
  - - [16384, 86016, 1, 4096]
    - [290, 525.08]
  - - [16384, 86528, 1, 4096]
    - [341, 523.56]
  - - [16384, 87040, 1, 4096]
    - [298, 525.9]
  - - [16384, 87552, 1, 4096]
    - [290, 527.37]
  - - [16384, 88064, 1, 4096]
    - [341, 520.1]
  - - [16384, 88576, 1, 4096]
    - [289, 522.61]
  - - [16384, 89088, 1, 4096]
    - [290, 527.09]
  - - [16384, 89600, 1, 4096]
    - [312, 524.55]
  - - [16384, 90112, 1, 4096]
    - [290, 528.15]
  - - [16384, 90624, 1, 4096]
    - [290, 524.49]
  - - [16384, 91136, 1, 4096]
    - [298, 525.86]
  - - [16384, 91648, 1, 4096]
    - [289, 522.5]
  - - [16384, 92160, 1, 4096]
    - [290, 530.86]
  - - [16384, 92672, 1, 4096]
    - [289, 525.5]
  - - [16384, 93184, 1, 4096]
    - [341, 533.56]
  - - [16384, 93696, 1, 4096]
    - [341, 522.65]
  - - [16384, 94208, 1, 4096]
    - [298, 529.76]
  - - [16384, 94720, 1, 4096]
    - [290, 528.11]
  - - [16384, 95232, 1, 4096]
    - [290, 529.17]
  - - [16384, 95744, 1, 4096]
    - [290, 530.0]
  - - [16384, 96256, 1, 4096]
    - [290, 527.4]
  - - [16384, 96768, 1, 4096]
    - [289, 525.32]
  - - [16384, 97280, 1, 4096]
    - [298, 526.97]
  - - [16384, 97792, 1, 4096]
    - [290, 534.06]
  - - [16384, 98304, 1, 4096]
    - [290, 530.33]
  - - [16384, 98816, 1, 4096]
    - [290, 530.45]
  - - [16384, 99328, 1, 4096]
    - [290, 529.9]
  - - [16384, 99840, 1, 4096]
    - [312, 529.13]
  - - [16384, 100352, 1, 4096]
    - [289, 528.73]
  - - [16384, 100864, 1, 4096]
    - [290, 529.65]
  - - [16384, 101376, 1, 4096]
    - [290, 534.23]
  - - [16384, 101888, 1, 4096]
    - [290, 532.8]
  - - [16384, 102400, 1, 4096]
    - [298, 531.91]
  - - [16384, 102912, 1, 4096]
    - [290, 528.97]
  - - [16384, 103424, 1, 4096]
    - [290, 536.38]
  - - [16384, 103936, 1, 4096]
    - [289, 533.99]
  - - [16384, 104448, 1, 4096]
    - [290, 528.62]
  - - [16384, 104960, 1, 4096]
    - [290, 531.42]
  - - [16384, 105472, 1, 4096]
    - [290, 531.88]
  - - [16384, 105984, 1, 4096]
    - [290, 531.84]
  - - [16384, 106496, 1, 4096]
    - [290, 529.85]
  - - [16384, 107008, 1, 4096]
    - [290, 531.63]
  - - [16384, 107520, 1, 4096]
    - [290, 532.87]
  - - [16384, 108032, 1, 4096]
    - [290, 535.93]
  - - [16384, 108544, 1, 4096]
    - [341, 527.97]
  - - [16384, 109056, 1, 4096]
    - [298, 535.48]
  - - [16384, 109568, 1, 4096]
    - [290, 531.88]
  - - [16384, 110080, 1, 4096]
    - [298, 535.71]
  - - [16384, 110592, 1, 4096]
    - [290, 534.71]
  - - [16384, 111104, 1, 4096]
    - [290, 537.32]
  - - [16384, 111616, 1, 4096]
    - [290, 536.08]
  - - [16384, 112128, 1, 4096]
    - [289, 532.02]
  - - [16384, 112640, 1, 4096]
    - [290, 533.02]
  - - [16384, 113152, 1, 4096]
    - [290, 536.65]
  - - [16384, 113664, 1, 4096]
    - [289, 530.53]
  - - [16384, 114176, 1, 4096]
    - [298, 535.15]
  - - [16384, 114688, 1, 4096]
    - [290, 532.5]
  - - [16384, 115200, 1, 4096]
    - [290, 532.18]
  - - [16384, 115712, 1, 4096]
    - [298, 533.74]
  - - [16384, 116224, 1, 4096]
    - [290, 533.47]
  - - [16384, 116736, 1, 4096]
    - [290, 534.88]
  - - [16384, 117248, 1, 4096]
    - [290, 533.64]
  - - [16384, 117760, 1, 4096]
    - [290, 540.42]
  - - [16384, 118272, 1, 4096]
    - [298, 535.98]
  - - [16384, 118784, 1, 4096]
    - [290, 537.98]
  - - [16384, 119296, 1, 4096]
    - [290, 533.76]
  - - [16384, 119808, 1, 4096]
    - [290, 537.64]
  - - [16384, 120320, 1, 4096]
    - [298, 533.14]
  - - [16384, 120832, 1, 4096]
    - [289, 539.01]
  - - [16384, 121344, 1, 4096]
    - [290, 538.3]
  - - [16384, 121856, 1, 4096]
    - [298, 534.41]
  - - [16384, 122368, 1, 4096]
    - [290, 539.81]
  - - [16384, 122880, 1, 4096]
    - [290, 538.99]
  - - [16384, 123392, 1, 4096]
    - [289, 536.02]
  - - [16384, 123904, 1, 4096]
    - [290, 534.72]
  - - [16384, 124416, 1, 4096]
    - [290, 538.55]
  - - [16384, 124928, 1, 4096]
    - [290, 537.51]
  - - [16384, 125440, 1, 4096]
    - [290, 533.43]
  - - [16384, 125952, 1, 4096]
    - [298, 534.88]
  - - [16384, 126464, 1, 4096]
    - [290, 535.55]
  - - [16384, 126976, 1, 4096]
    - [290, 540.05]
  - - [16384, 127488, 1, 4096]
    - [290, 541.05]
  - - [16384, 128000, 1, 4096]
    - [290, 537.34]
  - - [16384, 128512, 1, 4096]
    - [290, 538.24]
  - - [16384, 129024, 1, 4096]
    - [290, 540.52]
  - - [16384, 129536, 1, 4096]
    - [298, 539.06]
  - - [16384, 130048, 1, 4096]
    - [289, 536.47]
  - - [16384, 130560, 1, 4096]
    - [290, 534.38]
  - - [16384, 131072, 1, 4096]
    - [290, 538.35]
  - - [16384, 1088, 1, 4096]
    - [290, 418.54]
  - - [16384, 1152, 1, 4096]
    - [290, 455.3]
  - - [16384, 1216, 1, 4096]
    - [341, 435.27]
  - - [16384, 1280, 1, 4096]
    - [283, 421.13]
  - - [16384, 1344, 1, 4096]
    - [341, 429.34]
  - - [16384, 1408, 1, 4096]
    - [294, 427.59]
  - - [16384, 1472, 1, 4096]
    - [293, 423.4]
  - - [16384, 1536, 1, 4096]
    - [358, 448.23]
  - - [16384, 1600, 1, 4096]
    - [341, 432.36]
  - - [16384, 1664, 1, 4096]
    - [286, 443.49]
  - - [16384, 1728, 1, 4096]
    - [341, 464.6]
  - - [16384, 1792, 1, 4096]
    - [286, 469.06]
  - - [16384, 1856, 1, 4096]
    - [287, 450.59]
  - - [16384, 1920, 1, 4096]
    - [312, 446.1]
  - - [16384, 1984, 1, 4096]
    - [288, 444.43]
  - - [16384, 2048, 1, 4096]
    - [298, 464.99]
  - - [16384, 2176, 1, 4096]
    - [298, 458.97]
  - - [16384, 2304, 1, 4096]
    - [290, 473.96]
  - - [16384, 2432, 1, 4096]
    - [290, 465.19]
  - - [16384, 2560, 1, 4096]
    - [341, 460.56]
  - - [16384, 2688, 1, 4096]
    - [359, 464.73]
  - - [16384, 2816, 1, 4096]
    - [289, 464.2]
  - - [16384, 2944, 1, 4096]
    - [289, 460.05]
  - - [16384, 3072, 1, 4096]
    - [358, 473.39]
  - - [16384, 3200, 1, 4096]
    - [286, 463.04]
  - - [16384, 3328, 1, 4096]
    - [298, 484.77]
  - - [16384, 3456, 1, 4096]
    - [290, 477.73]
  - - [16384, 3584, 1, 4096]
    - [290, 486.64]
  - - [16384, 3712, 1, 4096]
    - [297, 482.08]
  - - [16384, 3840, 1, 4096]
    - [341, 473.64]
  - - [16384, 3968, 1, 4096]
    - [289, 479.17]
  - - [16384, 4096, 1, 4096]
    - [312, 488.87]
  - - [16384, 4352, 1, 4096]
    - [286, 484.5]
  - - [16384, 4608, 1, 4096]
    - [290, 503.5]
  - - [16384, 4864, 1, 4096]
    - [290, 511.95]
  - - [16384, 5120, 1, 4096]
    - [312, 497.83]
  - - [16384, 5376, 1, 4096]
    - [286, 498.17]
  - - [16384, 5632, 1, 4096]
    - [341, 503.6]
  - - [16384, 5888, 1, 4096]
    - [290, 509.59]
  - - [16384, 6144, 1, 4096]
    - [312, 507.45]
  - - [16384, 6400, 1, 4096]
    - [298, 505.7]
  - - [16384, 6656, 1, 4096]
    - [298, 509.9]
  - - [16384, 6912, 1, 4096]
    - [290, 504.95]
  - - [16384, 7168, 1, 4096]
    - [290, 519.25]
  - - [16384, 7424, 1, 4096]
    - [283, 506.58]
  - - [16384, 7680, 1, 4096]
    - [298, 517.52]
  - - [16384, 7936, 1, 4096]
    - [290, 515.93]
  - - [16384, 8192, 1, 4096]
    - [290, 522.85]
  - - [16384, 16, 1, 4096]
    - [360, 44.58]
  - - [16384, 32, 1, 4096]
    - [361, 78.08]
  - - [16384, 48, 1, 4096]
    - [362, 99.25]
  - - [16384, 64, 1, 4096]
    - [363, 120.59]
  - - [16384, 80, 1, 4096]
    - [364, 136.32]
  - - [16384, 96, 1, 4096]
    - [365, 153.87]
  - - [16384, 112, 1, 4096]
    - [366, 164.34]
  - - [16384, 128, 1, 4096]
    - [367, 178.69]
  - - [16384, 144, 1, 4096]
    - [368, 183.79]
  - - [16384, 160, 1, 4096]
    - [364, 197.38]
  - - [16384, 176, 1, 4096]
    - [365, 201.33]
  - - [16384, 192, 1, 4096]
    - [369, 218.47]
  - - [16384, 208, 1, 4096]
    - [366, 218.58]
  - - [16384, 224, 1, 4096]
    - [366, 237.69]
  - - [16384, 240, 1, 4096]
    - [370, 238.41]
  - - [16384, 256, 1, 4096]
    - [370, 259.51]
  - - [16384, 272, 1, 4096]
    - [371, 244.08]
  - - [16384, 288, 1, 4096]
    - [372, 259.27]
  - - [16384, 304, 1, 4096]
    - [373, 259.8]
  - - [16384, 320, 1, 4096]
    - [373, 278.75]
  - - [16384, 336, 1, 4096]
    - [374, 270.13]
  - - [16384, 352, 1, 4096]
    - [375, 271.66]
  - - [16384, 368, 1, 4096]
    - [376, 282.53]
  - - [16384, 384, 1, 4096]
    - [375, 296.1]
  - - [16384, 400, 1, 4096]
    - [377, 279.68]
  - - [16384, 416, 1, 4096]
    - [378, 290.85]
  - - [16384, 432, 1, 4096]
    - [378, 305.03]
  - - [16384, 448, 1, 4096]
    - [377, 308.78]
  - - [16384, 464, 1, 4096]
    - [377, 314.38]
  - - [16384, 480, 1, 4096]
    - [377, 325.47]
  - - [16384, 496, 1, 4096]
    - [350, 310.11]
  - - [16384, 512, 1, 4096]
    - [350, 333.9]
  - - [16384, 8704, 1, 6656]
    - [312, 538.34]
  - - [16384, 9216, 1, 6656]
    - [290, 555.0]
  - - [16384, 9728, 1, 6656]
    - [290, 539.49]
  - - [16384, 10240, 1, 6656]
    - [290, 544.35]
  - - [16384, 10752, 1, 6656]
    - [290, 538.65]
  - - [16384, 11264, 1, 6656]
    - [312, 519.56]
  - - [16384, 11776, 1, 6656]
    - [285, 531.03]
  - - [16384, 12288, 1, 6656]
    - [283, 522.56]
  - - [16384, 12800, 1, 6656]
    - [283, 524.37]
  - - [16384, 13312, 1, 6656]
    - [379, 526.48]
  - - [16384, 13824, 1, 6656]
    - [314, 519.24]
  - - [16384, 14336, 1, 6656]
    - [290, 536.36]
  - - [16384, 14848, 1, 6656]
    - [283, 527.6]
  - - [16384, 15360, 1, 6656]
    - [290, 520.16]
  - - [16384, 15872, 1, 6656]
    - [380, 522.32]
  - - [16384, 16384, 1, 6656]
    - [381, 519.45]
  - - [16384, 16896, 1, 6656]
    - [290, 526.81]
  - - [16384, 17408, 1, 6656]
    - [312, 522.72]
  - - [16384, 17920, 1, 6656]
    - [289, 535.43]
  - - [16384, 18432, 1, 6656]
    - [290, 526.12]
  - - [16384, 18944, 1, 6656]
    - [289, 530.07]
  - - [16384, 19456, 1, 6656]
    - [341, 525.3]
  - - [16384, 19968, 1, 6656]
    - [290, 532.83]
  - - [16384, 20480, 1, 6656]
    - [290, 538.88]
  - - [16384, 20992, 1, 6656]
    - [290, 537.14]
  - - [16384, 21504, 1, 6656]
    - [290, 540.09]
  - - [16384, 22016, 1, 6656]
    - [290, 530.17]
  - - [16384, 22528, 1, 6656]
    - [290, 537.42]
  - - [16384, 23040, 1, 6656]
    - [290, 535.4]
  - - [16384, 23552, 1, 6656]
    - [356, 532.26]
  - - [16384, 24064, 1, 6656]
    - [290, 537.9]
  - - [16384, 24576, 1, 6656]
    - [290, 536.86]
  - - [16384, 25088, 1, 6656]
    - [290, 533.29]
  - - [16384, 25600, 1, 6656]
    - [298, 534.67]
  - - [16384, 26112, 1, 6656]
    - [290, 537.49]
  - - [16384, 26624, 1, 6656]
    - [290, 546.03]
  - - [16384, 27136, 1, 6656]
    - [290, 540.42]
  - - [16384, 27648, 1, 6656]
    - [290, 543.12]
  - - [16384, 28160, 1, 6656]
    - [283, 536.11]
  - - [16384, 131072, 1, 6656]
    - [290, 575.38]
  - - [16384, 2176, 1, 6656]
    - [298, 488.33]
  - - [16384, 2304, 1, 6656]
    - [290, 492.29]
  - - [16384, 2432, 1, 6656]
    - [290, 492.28]
  - - [16384, 2560, 1, 6656]
    - [286, 491.58]
  - - [16384, 2688, 1, 6656]
    - [286, 486.55]
  - - [16384, 2816, 1, 6656]
    - [297, 482.18]
  - - [16384, 2944, 1, 6656]
    - [288, 484.92]
  - - [16384, 3072, 1, 6656]
    - [380, 488.19]
  - - [16384, 3200, 1, 6656]
    - [298, 499.31]
  - - [16384, 3328, 1, 6656]
    - [298, 495.19]
  - - [16384, 3456, 1, 6656]
    - [381, 500.19]
  - - [16384, 3584, 1, 6656]
    - [290, 506.41]
  - - [16384, 3712, 1, 6656]
    - [297, 484.46]
  - - [16384, 3840, 1, 6656]
    - [382, 485.27]
  - - [16384, 3968, 1, 6656]
    - [382, 493.31]
  - - [16384, 4096, 1, 6656]
    - [312, 508.61]
  - - [16384, 4352, 1, 6656]
    - [314, 500.8]
  - - [16384, 4608, 1, 6656]
    - [290, 501.69]
  - - [16384, 4864, 1, 6656]
    - [290, 510.48]
  - - [16384, 5120, 1, 6656]
    - [285, 494.88]
  - - [16384, 5376, 1, 6656]
    - [349, 502.87]
  - - [16384, 5632, 1, 6656]
    - [381, 503.55]
  - - [16384, 5888, 1, 6656]
    - [290, 508.54]
  - - [16384, 6144, 1, 6656]
    - [312, 506.26]
  - - [16384, 6400, 1, 6656]
    - [356, 508.31]
  - - [16384, 6656, 1, 6656]
    - [314, 511.7]
  - - [16384, 6912, 1, 6656]
    - [381, 508.9]
  - - [16384, 7168, 1, 6656]
    - [290, 525.6]
  - - [16384, 7424, 1, 6656]
    - [298, 508.26]
  - - [16384, 7680, 1, 6656]
    - [298, 519.65]
  - - [16384, 7936, 1, 6656]
    - [290, 524.76]
  - - [16384, 8192, 1, 6656]
    - [312, 526.44]
  - - [16384, 476, 1, 6656]
    - [383, 420.41]
  - - [16384, 1, 1, 6656]
    - [342, 3.23]
  - - [16384, 2, 1, 6656]
    - [344, 6.47]
  - - [16384, 3, 1, 6656]
    - [384, 9.48]
  - - [16384, 4, 1, 6656]
    - [344, 12.6]
  - - [16384, 5, 1, 6656]
    - [344, 15.77]
  - - [16384, 6, 1, 6656]
    - [344, 18.65]
  - - [16384, 7, 1, 6656]
    - [344, 21.7]
  - - [16384, 8, 1, 6656]
    - [342, 24.61]
  - - [16384, 9, 1, 6656]
    - [344, 27.79]
  - - [16384, 10, 1, 6656]
    - [344, 30.65]
  - - [16384, 11, 1, 6656]
    - [344, 33.56]
  - - [16384, 12, 1, 6656]
    - [344, 36.3]
  - - [16384, 13, 1, 6656]
    - [342, 39.3]
  - - [16384, 14, 1, 6656]
    - [344, 42.34]
  - - [16384, 15, 1, 6656]
    - [344, 45.4]
  - - [16384, 16, 1, 6656]
    - [344, 48.72]
  - - [16384, 17, 1, 6656]
    - [346, 46.93]
  - - [16384, 8704, 1, 13312]
    - [288, 530.39]
  - - [16384, 9216, 1, 13312]
    - [380, 528.67]
  - - [16384, 9728, 1, 13312]
    - [286, 529.63]
  - - [16384, 10240, 1, 13312]
    - [349, 522.8]
  - - [16384, 10752, 1, 13312]
    - [349, 531.77]
  - - [16384, 11264, 1, 13312]
    - [286, 527.41]
  - - [16384, 11776, 1, 13312]
    - [314, 545.6]
  - - [16384, 12288, 1, 13312]
    - [314, 539.7]
  - - [16384, 12800, 1, 13312]
    - [381, 534.02]
  - - [16384, 13312, 1, 13312]
    - [314, 545.24]
  - - [16384, 13824, 1, 13312]
    - [296, 539.93]
  - - [16384, 14336, 1, 13312]
    - [290, 543.65]
  - - [16384, 14848, 1, 13312]
    - [311, 539.96]
  - - [16384, 15360, 1, 13312]
    - [359, 543.18]
  - - [16384, 15872, 1, 13312]
    - [381, 540.89]
  - - [16384, 16384, 1, 13312]
    - [314, 541.49]
  - - [16384, 16896, 1, 13312]
    - [298, 549.04]
  - - [16384, 17408, 1, 13312]
    - [381, 543.53]
  - - [16384, 17920, 1, 13312]
    - [298, 555.07]
  - - [16384, 18432, 1, 13312]
    - [341, 547.59]
  - - [16384, 18944, 1, 13312]
    - [314, 551.57]
  - - [16384, 19456, 1, 13312]
    - [290, 550.51]
  - - [16384, 19968, 1, 13312]
    - [359, 543.88]
  - - [16384, 20480, 1, 13312]
    - [290, 544.63]
  - - [16384, 20992, 1, 13312]
    - [381, 545.5]
  - - [16384, 21504, 1, 13312]
    - [290, 547.46]
  - - [16384, 22016, 1, 13312]
    - [314, 543.63]
  - - [16384, 22528, 1, 13312]
    - [290, 549.69]
  - - [16384, 23040, 1, 13312]
    - [290, 555.37]
  - - [16384, 23552, 1, 13312]
    - [381, 548.95]
  - - [16384, 24064, 1, 13312]
    - [290, 551.56]
  - - [16384, 24576, 1, 13312]
    - [314, 557.96]
  - - [16384, 25088, 1, 13312]
    - [288, 557.12]
  - - [16384, 25600, 1, 13312]
    - [298, 553.71]
  - - [16384, 26112, 1, 13312]
    - [290, 553.16]
  - - [16384, 26624, 1, 13312]
    - [314, 557.69]
  - - [16384, 27136, 1, 13312]
    - [290, 549.68]
  - - [16384, 27648, 1, 13312]
    - [298, 555.38]
  - - [16384, 28160, 1, 13312]
    - [312, 555.63]
  - - [16384, 28672, 1, 13312]
    - [380, 556.76]
  - - [16384, 29184, 1, 13312]
    - [290, 563.4]
  - - [16384, 29696, 1, 13312]
    - [290, 561.41]
  - - [16384, 30208, 1, 13312]
    - [290, 560.59]
  - - [16384, 30720, 1, 13312]
    - [314, 561.39]
  - - [16384, 31232, 1, 13312]
    - [314, 569.06]
  - - [16384, 31744, 1, 13312]
    - [289, 561.04]
  - - [16384, 32256, 1, 13312]
    - [298, 565.61]
  - - [16384, 32768, 1, 13312]
    - [298, 567.26]
  - - [16384, 33280, 1, 13312]
    - [298, 564.34]
  - - [16384, 33792, 1, 13312]
    - [290, 564.87]
  - - [16384, 34304, 1, 13312]
    - [314, 561.75]
  - - [16384, 34816, 1, 13312]
    - [289, 565.47]
  - - [16384, 35328, 1, 13312]
    - [380, 563.41]
  - - [16384, 35840, 1, 13312]
    - [314, 566.14]
  - - [16384, 36352, 1, 13312]
    - [290, 571.08]
  - - [16384, 36864, 1, 13312]
    - [314, 569.81]
  - - [16384, 37376, 1, 13312]
    - [314, 566.4]
  - - [16384, 37888, 1, 13312]
    - [290, 567.72]
  - - [16384, 38400, 1, 13312]
    - [298, 569.49]
  - - [16384, 38912, 1, 13312]
    - [314, 570.91]
  - - [16384, 39424, 1, 13312]
    - [298, 575.02]
  - - [16384, 39936, 1, 13312]
    - [298, 569.56]
  - - [16384, 40448, 1, 13312]
    - [290, 569.34]
  - - [16384, 40960, 1, 13312]
    - [290, 573.22]
  - - [16384, 41472, 1, 13312]
    - [314, 570.6]
  - - [16384, 41984, 1, 13312]
    - [314, 569.66]
  - - [16384, 42496, 1, 13312]
    - [290, 574.79]
  - - [16384, 43008, 1, 13312]
    - [298, 569.15]
  - - [16384, 43520, 1, 13312]
    - [290, 574.39]
  - - [16384, 44032, 1, 13312]
    - [290, 572.98]
  - - [16384, 44544, 1, 13312]
    - [290, 572.99]
  - - [16384, 45056, 1, 13312]
    - [298, 574.2]
  - - [16384, 45568, 1, 13312]
    - [314, 573.27]
  - - [16384, 46080, 1, 13312]
    - [290, 572.61]
  - - [16384, 46592, 1, 13312]
    - [380, 570.37]
  - - [16384, 47104, 1, 13312]
    - [298, 569.59]
  - - [16384, 47616, 1, 13312]
    - [349, 570.5]
  - - [16384, 48128, 1, 13312]
    - [314, 573.61]
  - - [16384, 48640, 1, 13312]
    - [290, 575.2]
  - - [16384, 49152, 1, 13312]
    - [314, 575.38]
  - - [16384, 49664, 1, 13312]
    - [298, 572.24]
  - - [16384, 50176, 1, 13312]
    - [314, 576.2]
  - - [16384, 50688, 1, 13312]
    - [290, 577.6]
  - - [16384, 51200, 1, 13312]
    - [381, 570.01]
  - - [16384, 51712, 1, 13312]
    - [290, 571.14]
  - - [16384, 52224, 1, 13312]
    - [290, 577.49]
  - - [16384, 52736, 1, 13312]
    - [298, 570.52]
  - - [16384, 53248, 1, 13312]
    - [290, 573.06]
  - - [16384, 53760, 1, 13312]
    - [298, 572.0]
  - - [16384, 54272, 1, 13312]
    - [290, 571.22]
  - - [16384, 54784, 1, 13312]
    - [314, 571.35]
  - - [16384, 55296, 1, 13312]
    - [290, 573.9]
  - - [16384, 55808, 1, 13312]
    - [290, 573.56]
  - - [16384, 56320, 1, 13312]
    - [290, 570.13]
  - - [16384, 56832, 1, 13312]
    - [290, 577.12]
  - - [16384, 57344, 1, 13312]
    - [290, 570.27]
  - - [16384, 57856, 1, 13312]
    - [290, 573.66]
  - - [16384, 58368, 1, 13312]
    - [289, 570.13]
  - - [16384, 58880, 1, 13312]
    - [349, 570.5]
  - - [16384, 59392, 1, 13312]
    - [290, 574.4]
  - - [16384, 59904, 1, 13312]
    - [381, 570.18]
  - - [16384, 60416, 1, 13312]
    - [314, 571.04]
  - - [16384, 60928, 1, 13312]
    - [314, 569.34]
  - - [16384, 61440, 1, 13312]
    - [314, 570.15]
  - - [16384, 61952, 1, 13312]
    - [290, 572.69]
  - - [16384, 62464, 1, 13312]
    - [314, 573.07]
  - - [16384, 62976, 1, 13312]
    - [290, 572.79]
  - - [16384, 63488, 1, 13312]
    - [314, 573.62]
  - - [16384, 64000, 1, 13312]
    - [290, 569.88]
  - - [16384, 64512, 1, 13312]
    - [314, 568.66]
  - - [16384, 65024, 1, 13312]
    - [314, 574.65]
  - - [16384, 65536, 1, 13312]
    - [314, 572.38]
  - - [16384, 66048, 1, 13312]
    - [298, 568.67]
  - - [16384, 66560, 1, 13312]
    - [290, 573.98]
  - - [16384, 67072, 1, 13312]
    - [314, 571.44]
  - - [16384, 67584, 1, 13312]
    - [298, 569.58]
  - - [16384, 68096, 1, 13312]
    - [379, 572.51]
  - - [16384, 68608, 1, 13312]
    - [314, 570.97]
  - - [16384, 69120, 1, 13312]
    - [349, 566.49]
  - - [16384, 69632, 1, 13312]
    - [290, 567.24]
  - - [16384, 70144, 1, 13312]
    - [290, 569.18]
  - - [16384, 70656, 1, 13312]
    - [314, 575.7]
  - - [16384, 71168, 1, 13312]
    - [298, 572.23]
  - - [16384, 71680, 1, 13312]
    - [289, 567.59]
  - - [16384, 72192, 1, 13312]
    - [314, 567.98]
  - - [16384, 72704, 1, 13312]
    - [314, 567.8]
  - - [16384, 73216, 1, 13312]
    - [289, 568.5]
  - - [16384, 73728, 1, 13312]
    - [290, 570.08]
  - - [16384, 74240, 1, 13312]
    - [314, 568.32]
  - - [16384, 74752, 1, 13312]
    - [314, 570.86]
  - - [16384, 75264, 1, 13312]
    - [290, 572.1]
  - - [16384, 75776, 1, 13312]
    - [314, 568.37]
  - - [16384, 76288, 1, 13312]
    - [289, 572.94]
  - - [16384, 76800, 1, 13312]
    - [314, 565.76]
  - - [16384, 77312, 1, 13312]
    - [314, 571.95]
  - - [16384, 77824, 1, 13312]
    - [290, 569.74]
  - - [16384, 78336, 1, 13312]
    - [314, 570.74]
  - - [16384, 78848, 1, 13312]
    - [314, 569.03]
  - - [16384, 79360, 1, 13312]
    - [289, 570.04]
  - - [16384, 79872, 1, 13312]
    - [290, 568.26]
  - - [16384, 80384, 1, 13312]
    - [289, 566.93]
  - - [16384, 80896, 1, 13312]
    - [290, 570.31]
  - - [16384, 81408, 1, 13312]
    - [314, 567.95]
  - - [16384, 81920, 1, 13312]
    - [379, 568.11]
  - - [16384, 82432, 1, 13312]
    - [290, 571.74]
  - - [16384, 82944, 1, 13312]
    - [314, 570.64]
  - - [16384, 83456, 1, 13312]
    - [349, 568.48]
  - - [16384, 83968, 1, 13312]
    - [314, 567.37]
  - - [16384, 84480, 1, 13312]
    - [290, 568.5]
  - - [16384, 84992, 1, 13312]
    - [290, 573.25]
  - - [16384, 85504, 1, 13312]
    - [290, 567.42]
  - - [16384, 86016, 1, 13312]
    - [289, 568.32]
  - - [16384, 86528, 1, 13312]
    - [349, 569.9]
  - - [16384, 87040, 1, 13312]
    - [289, 567.59]
  - - [16384, 87552, 1, 13312]
    - [349, 567.54]
  - - [16384, 88064, 1, 13312]
    - [380, 565.59]
  - - [16384, 88576, 1, 13312]
    - [379, 564.3]
  - - [16384, 89088, 1, 13312]
    - [349, 565.81]
  - - [16384, 89600, 1, 13312]
    - [314, 568.34]
  - - [16384, 90112, 1, 13312]
    - [349, 569.26]
  - - [16384, 90624, 1, 13312]
    - [314, 567.8]
  - - [16384, 91136, 1, 13312]
    - [379, 568.1]
  - - [16384, 91648, 1, 13312]
    - [314, 568.22]
  - - [16384, 92160, 1, 13312]
    - [290, 568.17]
  - - [16384, 92672, 1, 13312]
    - [314, 568.11]
  - - [16384, 93184, 1, 13312]
    - [290, 568.81]
  - - [16384, 93696, 1, 13312]
    - [349, 568.25]
  - - [16384, 94208, 1, 13312]
    - [314, 567.91]
  - - [16384, 94720, 1, 13312]
    - [314, 566.97]
  - - [16384, 95232, 1, 13312]
    - [314, 570.21]
  - - [16384, 95744, 1, 13312]
    - [290, 564.74]
  - - [16384, 96256, 1, 13312]
    - [349, 567.83]
  - - [16384, 96768, 1, 13312]
    - [289, 567.33]
  - - [16384, 97280, 1, 13312]
    - [314, 568.07]
  - - [16384, 97792, 1, 13312]
    - [289, 567.59]
  - - [16384, 98304, 1, 13312]
    - [314, 567.24]
  - - [16384, 98816, 1, 13312]
    - [381, 564.6]
  - - [16384, 99328, 1, 13312]
    - [381, 566.98]
  - - [16384, 99840, 1, 13312]
    - [314, 569.85]
  - - [16384, 100352, 1, 13312]
    - [314, 566.85]
  - - [16384, 100864, 1, 13312]
    - [314, 567.58]
  - - [16384, 101376, 1, 13312]
    - [290, 569.3]
  - - [16384, 101888, 1, 13312]
    - [349, 567.34]
  - - [16384, 102400, 1, 13312]
    - [379, 563.52]
  - - [16384, 102912, 1, 13312]
    - [289, 568.3]
  - - [16384, 103424, 1, 13312]
    - [349, 563.55]
  - - [16384, 103936, 1, 13312]
    - [289, 564.13]
  - - [16384, 104448, 1, 13312]
    - [290, 563.18]
  - - [16384, 104960, 1, 13312]
    - [290, 565.61]
  - - [16384, 105472, 1, 13312]
    - [290, 563.53]
  - - [16384, 105984, 1, 13312]
    - [349, 564.34]
  - - [16384, 106496, 1, 13312]
    - [349, 566.58]
  - - [16384, 107008, 1, 13312]
    - [290, 564.49]
  - - [16384, 107520, 1, 13312]
    - [314, 564.24]
  - - [16384, 108032, 1, 13312]
    - [314, 564.9]
  - - [16384, 108544, 1, 13312]
    - [314, 564.83]
  - - [16384, 109056, 1, 13312]
    - [349, 567.96]
  - - [16384, 109568, 1, 13312]
    - [289, 564.85]
  - - [16384, 110080, 1, 13312]
    - [290, 560.68]
  - - [16384, 110592, 1, 13312]
    - [290, 566.88]
  - - [16384, 111104, 1, 13312]
    - [349, 565.49]
  - - [16384, 111616, 1, 13312]
    - [290, 566.74]
  - - [16384, 112128, 1, 13312]
    - [349, 562.86]
  - - [16384, 112640, 1, 13312]
    - [290, 565.36]
  - - [16384, 113152, 1, 13312]
    - [314, 564.06]
  - - [16384, 113664, 1, 13312]
    - [290, 561.24]
  - - [16384, 114176, 1, 13312]
    - [290, 564.41]
  - - [16384, 114688, 1, 13312]
    - [349, 565.74]
  - - [16384, 115200, 1, 13312]
    - [290, 566.47]
  - - [16384, 115712, 1, 13312]
    - [349, 562.79]
  - - [16384, 116224, 1, 13312]
    - [290, 566.58]
  - - [16384, 116736, 1, 13312]
    - [314, 565.3]
  - - [16384, 117248, 1, 13312]
    - [290, 561.5]
  - - [16384, 117760, 1, 13312]
    - [289, 562.27]
  - - [16384, 118272, 1, 13312]
    - [349, 561.98]
  - - [16384, 118784, 1, 13312]
    - [289, 564.51]
  - - [16384, 119296, 1, 13312]
    - [349, 564.63]
  - - [16384, 119808, 1, 13312]
    - [349, 563.68]
  - - [16384, 120320, 1, 13312]
    - [290, 562.76]
  - - [16384, 120832, 1, 13312]
    - [289, 562.79]
  - - [16384, 121344, 1, 13312]
    - [290, 561.9]
  - - [16384, 121856, 1, 13312]
    - [349, 561.5]
  - - [16384, 122368, 1, 13312]
    - [290, 562.26]
  - - [16384, 122880, 1, 13312]
    - [379, 563.12]
  - - [16384, 123392, 1, 13312]
    - [289, 562.9]
  - - [16384, 123904, 1, 13312]
    - [349, 566.12]
  - - [16384, 124416, 1, 13312]
    - [314, 564.18]
  - - [16384, 124928, 1, 13312]
    - [290, 562.23]
  - - [16384, 125440, 1, 13312]
    - [349, 563.47]
  - - [16384, 125952, 1, 13312]
    - [290, 564.37]
  - - [16384, 126464, 1, 13312]
    - [290, 563.79]
  - - [16384, 126976, 1, 13312]
    - [349, 561.12]
  - - [16384, 127488, 1, 13312]
    - [289, 566.5]
  - - [16384, 128000, 1, 13312]
    - [349, 563.99]
  - - [16384, 128512, 1, 13312]
    - [381, 560.64]
  - - [16384, 129024, 1, 13312]
    - [314, 562.25]
  - - [16384, 129536, 1, 13312]
    - [314, 563.63]
  - - [16384, 130048, 1, 13312]
    - [290, 561.86]
  - - [16384, 130560, 1, 13312]
    - [289, 563.32]
  - - [16384, 131072, 1, 13312]
    - [349, 564.05]
  - - [16384, 1088, 1, 13312]
    - [381, 439.15]
  - - [16384, 1152, 1, 13312]
    - [381, 469.19]
  - - [16384, 1216, 1, 13312]
    - [296, 445.4]
  - - [16384, 1280, 1, 13312]
    - [297, 461.48]
  - - [16384, 1344, 1, 13312]
    - [284, 481.41]
  - - [16384, 1408, 1, 13312]
    - [285, 479.72]
  - - [16384, 1472, 1, 13312]
    - [358, 468.76]
  - - [16384, 1536, 1, 13312]
    - [385, 491.44]
  - - [16384, 1600, 1, 13312]
    - [356, 484.21]
  - - [16384, 1664, 1, 13312]
    - [349, 494.31]
  - - [16384, 1728, 1, 13312]
    - [349, 517.81]
  - - [16384, 1792, 1, 13312]
    - [386, 502.21]
  - - [16384, 1856, 1, 13312]
    - [387, 495.8]
  - - [16384, 1920, 1, 13312]
    - [288, 510.61]
  - - [16384, 1984, 1, 13312]
    - [288, 512.03]
  - - [16384, 2048, 1, 13312]
    - [380, 500.15]
  - - [16384, 2176, 1, 13312]
    - [298, 511.96]
  - - [16384, 2304, 1, 13312]
    - [290, 528.84]
  - - [16384, 2432, 1, 13312]
    - [290, 495.04]
  - - [16384, 2560, 1, 13312]
    - [292, 491.05]
  - - [16384, 2688, 1, 13312]
    - [349, 511.59]
  - - [16384, 2816, 1, 13312]
    - [382, 491.21]
  - - [16384, 2944, 1, 13312]
    - [288, 498.12]
  - - [16384, 3072, 1, 13312]
    - [380, 508.4]
  - - [16384, 3200, 1, 13312]
    - [311, 516.49]
  - - [16384, 3328, 1, 13312]
    - [298, 495.82]
  - - [16384, 3456, 1, 13312]
    - [381, 503.95]
  - - [16384, 3584, 1, 13312]
    - [290, 501.57]
  - - [16384, 3712, 1, 13312]
    - [287, 490.3]
  - - [16384, 3840, 1, 13312]
    - [382, 492.17]
  - - [16384, 3968, 1, 13312]
    - [382, 492.23]
  - - [16384, 4096, 1, 13312]
    - [380, 496.91]
  - - [16384, 4352, 1, 13312]
    - [381, 497.3]
  - - [16384, 4608, 1, 13312]
    - [290, 496.15]
  - - [16384, 4864, 1, 13312]
    - [290, 500.35]
  - - [16384, 5120, 1, 13312]
    - [349, 499.54]
  - - [16384, 5376, 1, 13312]
    - [356, 508.0]
  - - [16384, 5632, 1, 13312]
    - [311, 503.65]
  - - [16384, 5888, 1, 13312]
    - [288, 510.5]
  - - [16384, 6144, 1, 13312]
    - [382, 517.87]
  - - [16384, 6400, 1, 13312]
    - [285, 501.02]
  - - [16384, 6656, 1, 13312]
    - [311, 518.12]
  - - [16384, 6912, 1, 13312]
    - [381, 521.93]
  - - [16384, 7168, 1, 13312]
    - [312, 532.88]
  - - [16384, 7424, 1, 13312]
    - [285, 526.57]
  - - [16384, 7680, 1, 13312]
    - [298, 527.67]
  - - [16384, 7936, 1, 13312]
    - [381, 525.92]
  - - [16384, 8192, 1, 13312]
    - [290, 531.27]
  - - [16384, 16, 1, 13312]
    - [342, 55.6]
  - - [16384, 32, 1, 13312]
    - [346, 100.03]
  - - [16384, 48, 1, 13312]
    - [388, 133.08]
  - - [16384, 64, 1, 13312]
    - [389, 164.98]
  - - [16384, 80, 1, 13312]
    - [390, 189.98]
  - - [16384, 96, 1, 13312]
    - [391, 209.91]
  - - [16384, 112, 1, 13312]
    - [392, 221.62]
  - - [16384, 128, 1, 13312]
    - [392, 249.83]
  - - [16384, 144, 1, 13312]
    - [390, 261.24]
  - - [16384, 160, 1, 13312]
    - [390, 281.05]
  - - [16384, 176, 1, 13312]
    - [393, 288.7]
  - - [16384, 192, 1, 13312]
    - [393, 316.86]
  - - [16384, 208, 1, 13312]
    - [394, 307.53]
  - - [16384, 224, 1, 13312]
    - [394, 332.09]
  - - [16384, 240, 1, 13312]
    - [395, 335.78]
  - - [16384, 256, 1, 13312]
    - [396, 367.7]
  - - [16384, 272, 1, 13312]
    - [397, 346.15]
  - - [16384, 288, 1, 13312]
    - [293, 364.81]
  - - [16384, 304, 1, 13312]
    - [294, 359.87]
  - - [16384, 320, 1, 13312]
    - [294, 377.44]
  - - [16384, 336, 1, 13312]
    - [341, 356.08]
  - - [16384, 352, 1, 13312]
    - [341, 375.18]
  - - [16384, 368, 1, 13312]
    - [341, 388.43]
  - - [16384, 384, 1, 13312]
    - [341, 408.23]
  - - [16384, 400, 1, 13312]
    - [398, 403.51]
  - - [16384, 416, 1, 13312]
    - [399, 395.45]
  - - [16384, 432, 1, 13312]
    - [295, 401.23]
  - - [16384, 448, 1, 13312]
    - [295, 419.79]
  - - [16384, 464, 1, 13312]
    - [315, 404.14]
  - - [16384, 480, 1, 13312]
    - [400, 417.6]
  - - [16384, 496, 1, 13312]
    - [291, 410.11]
  - - [16384, 512, 1, 13312]
    - [291, 431.54]
  - - [26624, 8704, 1, 16384]
    - [290, 553.6]
  - - [26624, 9216, 1, 16384]
    - [290, 553.72]
  - - [26624, 9728, 1, 16384]
    - [290, 558.51]
  - - [26624, 10240, 1, 16384]
    - [290, 554.49]
  - - [26624, 10752, 1, 16384]
    - [290, 557.0]
  - - [26624, 11264, 1, 16384]
    - [290, 560.34]
  - - [26624, 11776, 1, 16384]
    - [290, 565.81]
  - - [26624, 12288, 1, 16384]
    - [312, 565.19]
  - - [26624, 12800, 1, 16384]
    - [290, 557.67]
  - - [26624, 13312, 1, 16384]
    - [290, 569.46]
  - - [26624, 13824, 1, 16384]
    - [290, 573.1]
  - - [26624, 14336, 1, 16384]
    - [290, 564.29]
  - - [26624, 14848, 1, 16384]
    - [290, 573.7]
  - - [26624, 15360, 1, 16384]
    - [290, 573.28]
  - - [26624, 15872, 1, 16384]
    - [312, 565.62]
  - - [26624, 16384, 1, 16384]
    - [290, 580.72]
  - - [26624, 16896, 1, 16384]
    - [290, 578.15]
  - - [26624, 17408, 1, 16384]
    - [290, 577.91]
  - - [26624, 17920, 1, 16384]
    - [312, 573.74]
  - - [26624, 18432, 1, 16384]
    - [312, 570.83]
  - - [26624, 18944, 1, 16384]
    - [290, 576.99]
  - - [26624, 19456, 1, 16384]
    - [290, 586.22]
  - - [26624, 19968, 1, 16384]
    - [312, 576.3]
  - - [26624, 20480, 1, 16384]
    - [290, 583.8]
  - - [26624, 20992, 1, 16384]
    - [290, 582.24]
  - - [26624, 21504, 1, 16384]
    - [290, 591.03]
  - - [26624, 22016, 1, 16384]
    - [290, 586.31]
  - - [26624, 22528, 1, 16384]
    - [290, 584.5]
  - - [26624, 23040, 1, 16384]
    - [290, 581.78]
  - - [26624, 23552, 1, 16384]
    - [290, 586.45]
  - - [26624, 24064, 1, 16384]
    - [290, 581.9]
  - - [26624, 24576, 1, 16384]
    - [290, 590.39]
  - - [26624, 25088, 1, 16384]
    - [312, 577.49]
  - - [26624, 25600, 1, 16384]
    - [290, 584.06]
  - - [26624, 26112, 1, 16384]
    - [290, 589.26]
  - - [26624, 26624, 1, 16384]
    - [290, 588.7]
  - - [26624, 27136, 1, 16384]
    - [290, 583.23]
  - - [26624, 27648, 1, 16384]
    - [312, 576.19]
  - - [26624, 28160, 1, 16384]
    - [290, 587.49]
  - - [26624, 28672, 1, 16384]
    - [290, 585.26]
  - - [26624, 29184, 1, 16384]
    - [290, 591.34]
  - - [26624, 29696, 1, 16384]
    - [290, 590.21]
  - - [26624, 30208, 1, 16384]
    - [290, 582.57]
  - - [26624, 30720, 1, 16384]
    - [290, 584.26]
  - - [26624, 31232, 1, 16384]
    - [290, 589.46]
  - - [26624, 31744, 1, 16384]
    - [290, 590.92]
  - - [26624, 32256, 1, 16384]
    - [290, 575.78]
  - - [26624, 32768, 1, 16384]
    - [312, 574.61]
  - - [26624, 33280, 1, 16384]
    - [290, 586.7]
  - - [26624, 33792, 1, 16384]
    - [290, 581.5]
  - - [26624, 34304, 1, 16384]
    - [290, 590.67]
  - - [26624, 34816, 1, 16384]
    - [290, 579.11]
  - - [26624, 35328, 1, 16384]
    - [290, 585.06]
  - - [26624, 35840, 1, 16384]
    - [290, 589.56]
  - - [26624, 36352, 1, 16384]
    - [290, 588.15]
  - - [26624, 36864, 1, 16384]
    - [290, 584.12]
  - - [26624, 37376, 1, 16384]
    - [290, 587.54]
  - - [26624, 37888, 1, 16384]
    - [290, 590.35]
  - - [26624, 38400, 1, 16384]
    - [290, 585.02]
  - - [26624, 38912, 1, 16384]
    - [290, 589.89]
  - - [26624, 39424, 1, 16384]
    - [290, 583.68]
  - - [26624, 39936, 1, 16384]
    - [290, 583.64]
  - - [26624, 40448, 1, 16384]
    - [290, 579.48]
  - - [26624, 40960, 1, 16384]
    - [290, 589.74]
  - - [26624, 41472, 1, 16384]
    - [290, 585.13]
  - - [26624, 41984, 1, 16384]
    - [290, 583.05]
  - - [26624, 42496, 1, 16384]
    - [290, 588.13]
  - - [26624, 43008, 1, 16384]
    - [290, 584.02]
  - - [26624, 43520, 1, 16384]
    - [312, 576.11]
  - - [26624, 44032, 1, 16384]
    - [290, 588.55]
  - - [26624, 44544, 1, 16384]
    - [290, 588.03]
  - - [26624, 45056, 1, 16384]
    - [290, 585.15]
  - - [26624, 45568, 1, 16384]
    - [290, 591.67]
  - - [26624, 46080, 1, 16384]
    - [290, 587.54]
  - - [26624, 46592, 1, 16384]
    - [290, 584.81]
  - - [26624, 47104, 1, 16384]
    - [290, 588.15]
  - - [26624, 47616, 1, 16384]
    - [290, 586.93]
  - - [26624, 48128, 1, 16384]
    - [290, 584.65]
  - - [26624, 48640, 1, 16384]
    - [290, 588.59]
  - - [26624, 49152, 1, 16384]
    - [290, 589.75]
  - - [26624, 49664, 1, 16384]
    - [290, 584.59]
  - - [26624, 50176, 1, 16384]
    - [290, 577.75]
  - - [26624, 50688, 1, 16384]
    - [290, 584.3]
  - - [26624, 51200, 1, 16384]
    - [290, 586.35]
  - - [26624, 51712, 1, 16384]
    - [290, 583.02]
  - - [26624, 52224, 1, 16384]
    - [290, 584.35]
  - - [26624, 52736, 1, 16384]
    - [290, 587.84]
  - - [26624, 53248, 1, 16384]
    - [290, 579.46]
  - - [26624, 53760, 1, 16384]
    - [290, 588.6]
  - - [26624, 54272, 1, 16384]
    - [290, 587.6]
  - - [26624, 54784, 1, 16384]
    - [290, 582.44]
  - - [26624, 55296, 1, 16384]
    - [290, 586.18]
  - - [26624, 55808, 1, 16384]
    - [290, 583.86]
  - - [26624, 56320, 1, 16384]
    - [290, 579.71]
  - - [26624, 56832, 1, 16384]
    - [290, 584.9]
  - - [26624, 57344, 1, 16384]
    - [290, 583.04]
  - - [26624, 57856, 1, 16384]
    - [286, 570.99]
  - - [26624, 58368, 1, 16384]
    - [312, 577.45]
  - - [26624, 58880, 1, 16384]
    - [290, 582.21]
  - - [26624, 59392, 1, 16384]
    - [290, 581.39]
  - - [26624, 59904, 1, 16384]
    - [290, 578.83]
  - - [26624, 60416, 1, 16384]
    - [290, 583.86]
  - - [26624, 60928, 1, 16384]
    - [290, 582.66]
  - - [26624, 61440, 1, 16384]
    - [312, 580.15]
  - - [26624, 61952, 1, 16384]
    - [290, 584.13]
  - - [26624, 62464, 1, 16384]
    - [290, 582.32]
  - - [26624, 62976, 1, 16384]
    - [290, 581.31]
  - - [26624, 63488, 1, 16384]
    - [290, 585.5]
  - - [26624, 64000, 1, 16384]
    - [290, 581.01]
  - - [26624, 64512, 1, 16384]
    - [290, 579.09]
  - - [26624, 65024, 1, 16384]
    - [290, 585.94]
  - - [26624, 65536, 1, 16384]
    - [290, 584.82]
  - - [26624, 66048, 1, 16384]
    - [290, 579.71]
  - - [26624, 66560, 1, 16384]
    - [312, 572.97]
  - - [26624, 67072, 1, 16384]
    - [312, 574.29]
  - - [26624, 67584, 1, 16384]
    - [290, 580.22]
  - - [26624, 68096, 1, 16384]
    - [290, 584.85]
  - - [26624, 68608, 1, 16384]
    - [312, 575.28]
  - - [26624, 69120, 1, 16384]
    - [290, 578.02]
  - - [26624, 69632, 1, 16384]
    - [312, 573.11]
  - - [26624, 70144, 1, 16384]
    - [290, 584.45]
  - - [26624, 70656, 1, 16384]
    - [290, 581.22]
  - - [26624, 71168, 1, 16384]
    - [290, 578.79]
  - - [26624, 71680, 1, 16384]
    - [290, 582.7]
  - - [26624, 72192, 1, 16384]
    - [290, 580.91]
  - - [26624, 72704, 1, 16384]
    - [290, 577.49]
  - - [26624, 73216, 1, 16384]
    - [312, 577.28]
  - - [26624, 73728, 1, 16384]
    - [290, 579.69]
  - - [26624, 74240, 1, 16384]
    - [312, 570.08]
  - - [26624, 74752, 1, 16384]
    - [290, 582.56]
  - - [26624, 75264, 1, 16384]
    - [290, 580.22]
  - - [26624, 75776, 1, 16384]
    - [312, 570.84]
  - - [26624, 76288, 1, 16384]
    - [290, 583.3]
  - - [26624, 76800, 1, 16384]
    - [290, 582.48]
  - - [26624, 77312, 1, 16384]
    - [290, 579.47]
  - - [26624, 77824, 1, 16384]
    - [290, 580.3]
  - - [26624, 78336, 1, 16384]
    - [290, 580.77]
  - - [26624, 78848, 1, 16384]
    - [290, 577.75]
  - - [26624, 79360, 1, 16384]
    - [290, 576.64]
  - - [26624, 79872, 1, 16384]
    - [290, 579.67]
  - - [26624, 80384, 1, 16384]
    - [290, 578.53]
  - - [26624, 80896, 1, 16384]
    - [286, 564.89]
  - - [26624, 81408, 1, 16384]
    - [290, 579.36]
  - - [26624, 81920, 1, 16384]
    - [290, 571.68]
  - - [26624, 82432, 1, 16384]
    - [290, 574.32]
  - - [26624, 82944, 1, 16384]
    - [290, 581.19]
  - - [26624, 83456, 1, 16384]
    - [290, 579.53]
  - - [26624, 83968, 1, 16384]
    - [290, 570.86]
  - - [26624, 84480, 1, 16384]
    - [290, 582.51]
  - - [26624, 84992, 1, 16384]
    - [312, 567.94]
  - - [26624, 85504, 1, 16384]
    - [290, 575.15]
  - - [26624, 86016, 1, 16384]
    - [290, 581.06]
  - - [26624, 86528, 1, 16384]
    - [290, 581.57]
  - - [26624, 87040, 1, 16384]
    - [290, 573.48]
  - - [26624, 87552, 1, 16384]
    - [290, 580.41]
  - - [26624, 88064, 1, 16384]
    - [290, 576.5]
  - - [26624, 88576, 1, 16384]
    - [312, 571.23]
  - - [26624, 89088, 1, 16384]
    - [290, 569.37]
  - - [26624, 89600, 1, 16384]
    - [290, 577.85]
  - - [26624, 90112, 1, 16384]
    - [290, 576.92]
  - - [26624, 90624, 1, 16384]
    - [290, 571.95]
  - - [26624, 91136, 1, 16384]
    - [290, 581.78]
  - - [26624, 91648, 1, 16384]
    - [290, 579.18]
  - - [26624, 92160, 1, 16384]
    - [286, 564.43]
  - - [26624, 92672, 1, 16384]
    - [290, 573.14]
  - - [26624, 93184, 1, 16384]
    - [290, 579.11]
  - - [26624, 93696, 1, 16384]
    - [290, 578.16]
  - - [26624, 94208, 1, 16384]
    - [290, 582.31]
  - - [26624, 94720, 1, 16384]
    - [290, 573.74]
  - - [26624, 95232, 1, 16384]
    - [290, 578.98]
  - - [26624, 95744, 1, 16384]
    - [290, 581.68]
  - - [26624, 96256, 1, 16384]
    - [290, 571.85]
  - - [26624, 96768, 1, 16384]
    - [290, 576.59]
  - - [26624, 97280, 1, 16384]
    - [290, 582.01]
  - - [26624, 97792, 1, 16384]
    - [290, 577.83]
  - - [26624, 98304, 1, 16384]
    - [312, 568.77]
  - - [26624, 98816, 1, 16384]
    - [312, 569.24]
  - - [26624, 99328, 1, 16384]
    - [290, 577.68]
  - - [26624, 99840, 1, 16384]
    - [290, 572.76]
  - - [26624, 100352, 1, 16384]
    - [290, 572.48]
  - - [26624, 100864, 1, 16384]
    - [290, 575.2]
  - - [26624, 101376, 1, 16384]
    - [290, 577.81]
  - - [26624, 101888, 1, 16384]
    - [290, 567.64]
  - - [26624, 102400, 1, 16384]
    - [290, 578.84]
  - - [26624, 102912, 1, 16384]
    - [312, 567.73]
  - - [26624, 103424, 1, 16384]
    - [290, 571.95]
  - - [26624, 103936, 1, 16384]
    - [290, 579.29]
  - - [26624, 104448, 1, 16384]
    - [290, 571.86]
  - - [26624, 104960, 1, 16384]
    - [290, 570.78]
  - - [26624, 105472, 1, 16384]
    - [290, 577.72]
  - - [26624, 105984, 1, 16384]
    - [290, 572.02]
  - - [26624, 106496, 1, 16384]
    - [290, 571.41]
  - - [26624, 107008, 1, 16384]
    - [290, 576.89]
  - - [26624, 107520, 1, 16384]
    - [290, 576.69]
  - - [26624, 108032, 1, 16384]
    - [312, 568.44]
  - - [26624, 108544, 1, 16384]
    - [290, 569.69]
  - - [26624, 109056, 1, 16384]
    - [290, 573.04]
  - - [26624, 109568, 1, 16384]
    - [312, 569.48]
  - - [26624, 110080, 1, 16384]
    - [290, 569.9]
  - - [26624, 110592, 1, 16384]
    - [312, 563.7]
  - - [26624, 111104, 1, 16384]
    - [290, 570.22]
  - - [26624, 111616, 1, 16384]
    - [290, 568.4]
  - - [26624, 112128, 1, 16384]
    - [312, 563.9]
  - - [26624, 112640, 1, 16384]
    - [290, 569.06]
  - - [26624, 113152, 1, 16384]
    - [312, 561.66]
  - - [26624, 113664, 1, 16384]
    - [290, 574.06]
  - - [26624, 114176, 1, 16384]
    - [290, 576.27]
  - - [26624, 114688, 1, 16384]
    - [290, 568.76]
  - - [26624, 115200, 1, 16384]
    - [290, 574.33]
  - - [26624, 115712, 1, 16384]
    - [290, 574.67]
  - - [26624, 116224, 1, 16384]
    - [290, 569.96]
  - - [26624, 116736, 1, 16384]
    - [290, 576.33]
  - - [26624, 117248, 1, 16384]
    - [290, 575.89]
  - - [26624, 117760, 1, 16384]
    - [290, 570.07]
  - - [26624, 118272, 1, 16384]
    - [290, 568.97]
  - - [26624, 118784, 1, 16384]
    - [312, 561.8]
  - - [26624, 119296, 1, 16384]
    - [312, 568.57]
  - - [26624, 119808, 1, 16384]
    - [290, 565.73]
  - - [26624, 120320, 1, 16384]
    - [290, 574.8]
  - - [26624, 120832, 1, 16384]
    - [312, 562.48]
  - - [26624, 121344, 1, 16384]
    - [290, 570.19]
  - - [26624, 121856, 1, 16384]
    - [312, 566.75]
  - - [26624, 122368, 1, 16384]
    - [290, 569.55]
  - - [26624, 122880, 1, 16384]
    - [290, 572.69]
  - - [26624, 123392, 1, 16384]
    - [290, 570.82]
  - - [26624, 123904, 1, 16384]
    - [290, 569.84]
  - - [26624, 124416, 1, 16384]
    - [312, 569.17]
  - - [26624, 124928, 1, 16384]
    - [312, 565.3]
  - - [26624, 125440, 1, 16384]
    - [290, 568.82]
  - - [26624, 125952, 1, 16384]
    - [290, 568.76]
  - - [26624, 126464, 1, 16384]
    - [290, 574.18]
  - - [26624, 126976, 1, 16384]
    - [290, 574.41]
  - - [26624, 127488, 1, 16384]
    - [290, 569.67]
  - - [26624, 128000, 1, 16384]
    - [290, 571.76]
  - - [26624, 128512, 1, 16384]
    - [290, 570.6]
  - - [26624, 129024, 1, 16384]
    - [312, 564.68]
  - - [26624, 129536, 1, 16384]
    - [290, 569.56]
  - - [26624, 130048, 1, 16384]
    - [290, 570.42]
  - - [26624, 130560, 1, 16384]
    - [290, 569.78]
  - - [26624, 131072, 1, 16384]
    - [312, 563.51]
  - - [26624, 1088, 1, 16384]
    - [387, 479.26]
  - - [26624, 1152, 1, 16384]
    - [316, 484.58]
  - - [26624, 1216, 1, 16384]
    - [312, 507.78]
  - - [26624, 1280, 1, 16384]
    - [312, 541.91]
  - - [26624, 1344, 1, 16384]
    - [314, 524.48]
  - - [26624, 1408, 1, 16384]
    - [290, 530.6]
  - - [26624, 1472, 1, 16384]
    - [286, 520.07]
  - - [26624, 1536, 1, 16384]
    - [286, 561.04]
  - - [26624, 1600, 1, 16384]
    - [283, 524.51]
  - - [26624, 1664, 1, 16384]
    - [286, 560.98]
  - - [26624, 1728, 1, 16384]
    - [312, 542.2]
  - - [26624, 1792, 1, 16384]
    - [312, 560.27]
  - - [26624, 1856, 1, 16384]
    - [312, 561.02]
  - - [26624, 1920, 1, 16384]
    - [312, 554.88]
  - - [26624, 1984, 1, 16384]
    - [290, 535.08]
  - - [26624, 2048, 1, 16384]
    - [290, 562.93]
  - - [26624, 2176, 1, 16384]
    - [290, 553.62]
  - - [26624, 2304, 1, 16384]
    - [297, 539.82]
  - - [26624, 2432, 1, 16384]
    - [312, 538.86]
  - - [26624, 2560, 1, 16384]
    - [312, 535.75]
  - - [26624, 2688, 1, 16384]
    - [314, 535.19]
  - - [26624, 2816, 1, 16384]
    - [290, 529.8]
  - - [26624, 2944, 1, 16384]
    - [290, 570.58]
  - - [26624, 3072, 1, 16384]
    - [312, 529.63]
  - - [26624, 3200, 1, 16384]
    - [297, 529.59]
  - - [26624, 3328, 1, 16384]
    - [286, 522.46]
  - - [26624, 3456, 1, 16384]
    - [290, 520.22]
  - - [26624, 3584, 1, 16384]
    - [290, 545.75]
  - - [26624, 3712, 1, 16384]
    - [290, 532.33]
  - - [26624, 3840, 1, 16384]
    - [312, 531.66]
  - - [26624, 3968, 1, 16384]
    - [291, 526.96]
  - - [26624, 4096, 1, 16384]
    - [290, 530.61]
  - - [26624, 4352, 1, 16384]
    - [290, 528.47]
  - - [26624, 4608, 1, 16384]
    - [297, 532.73]
  - - [26624, 4864, 1, 16384]
    - [286, 529.98]
  - - [26624, 5120, 1, 16384]
    - [290, 543.0]
  - - [26624, 5376, 1, 16384]
    - [286, 528.4]
  - - [26624, 5632, 1, 16384]
    - [290, 539.02]
  - - [26624, 5888, 1, 16384]
    - [290, 545.02]
  - - [26624, 6144, 1, 16384]
    - [290, 541.81]
  - - [26624, 6400, 1, 16384]
    - [290, 538.08]
  - - [26624, 6656, 1, 16384]
    - [297, 550.84]
  - - [26624, 6912, 1, 16384]
    - [314, 553.23]
  - - [26624, 7168, 1, 16384]
    - [290, 550.39]
  - - [26624, 7424, 1, 16384]
    - [290, 554.89]
  - - [26624, 7680, 1, 16384]
    - [312, 570.71]
  - - [26624, 7936, 1, 16384]
    - [290, 559.01]
  - - [26624, 8192, 1, 16384]
    - [290, 567.84]
  - - [26624, 16, 1, 16384]
    - [401, 58.47]
  - - [26624, 32, 1, 16384]
    - [402, 104.34]
  - - [26624, 48, 1, 16384]
    - [388, 139.02]
  - - [26624, 64, 1, 16384]
    - [389, 170.48]
  - - [26624, 80, 1, 16384]
    - [390, 191.42]
  - - [26624, 96, 1, 16384]
    - [391, 211.61]
  - - [26624, 112, 1, 16384]
    - [394, 226.74]
  - - [26624, 128, 1, 16384]
    - [348, 256.36]
  - - [26624, 144, 1, 16384]
    - [294, 256.47]
  - - [26624, 160, 1, 16384]
    - [395, 280.13]
  - - [26624, 176, 1, 16384]
    - [397, 279.0]
  - - [26624, 192, 1, 16384]
    - [293, 306.02]
  - - [26624, 208, 1, 16384]
    - [398, 303.85]
  - - [26624, 224, 1, 16384]
    - [291, 330.44]
  - - [26624, 240, 1, 16384]
    - [291, 341.65]
  - - [26624, 256, 1, 16384]
    - [291, 366.96]
  - - [26624, 272, 1, 16384]
    - [400, 341.88]
  - - [26624, 288, 1, 16384]
    - [403, 384.89]
  - - [26624, 304, 1, 16384]
    - [404, 369.73]
  - - [26624, 320, 1, 16384]
    - [400, 414.48]
  - - [26624, 336, 1, 16384]
    - [297, 407.43]
  - - [26624, 352, 1, 16384]
    - [313, 414.36]
  - - [26624, 368, 1, 16384]
    - [297, 422.08]
  - - [26624, 384, 1, 16384]
    - [297, 441.64]
  - - [26624, 400, 1, 16384]
    - [405, 421.84]
  - - [26624, 416, 1, 16384]
    - [406, 430.31]
  - - [26624, 432, 1, 16384]
    - [407, 434.69]
  - - [26624, 448, 1, 16384]
    - [386, 437.95]
  - - [26624, 464, 1, 16384]
    - [286, 445.37]
  - - [26624, 480, 1, 16384]
    - [286, 457.19]
  - - [26624, 496, 1, 16384]
    - [286, 449.48]
  - - [26624, 512, 1, 16384]
    - [286, 485.26]
- null
- null
- DeviceEfficiency
- GridBased
