projects/hipblaslt/library/src/amd_detail/rocblaslt/src/Tensile/Logic/asm_full/gfx1151/Equality-Flux.2-1024x768/gfx1151_Cijk_Ailk_Bljk_BBS_BH_UserArgs.yaml
- {MinimumRequiredVersion: 5.0.0}
- gfx1151
- gfx1151
- [Device 1586]
    SolutionIndex: 0
    SolutionNameMin: Cijk_Ailk_Bljk_BBS_BH_UserArgs_MT256x32x16_MI16x16x1_SN_LDSB0_AFC0_AG0_AFEM1_AFEM1_ASEM1_CLR0_CADS0_DTLA0_DTLB0_DTVA0_DTVB0_EPS1_FDSI0_GRPM1_GRVWA8_GRVWB4_GSU1_GSUAMB_GSUC0_GSUWGMRR0_GLS0_ISA1151_IU1_K1_LDSTI0_LBSPPA0_LBSPPB128_LBSPPM0_LPA0_LPB8_LPM0_LRVW16_LWPMn1_MIAV1_MIWT4_2_MO40_NTn1_NTA0_NTB0_NTC0_NTD0_NTM0_NEPBS0_NLCA1_NLCB1_ONLL1_PGR1_PLR1_PKA0_SIA3_SS1_SU0_SUM0_SUS32_SPO0_SRVW0_SSO0_SVW1_SK0_SKFTR0_SKXCCM0_TLDS0_ULSGRO0_USL1_UIOFGRO0_USFGROn1_VSn1_VWA1_VWB1_WSGRA0_WSGRB0_WS32_WG64_2_1_WGM16_WGMXCC1_WGMXCCGn1
    SolutionIndex: 1
    SolutionNameMin: Cijk_Ailk_Bljk_BBS_BH_UserArgs_MT192x64x16_MI16x16x1_SN_LDSB0_AFC0_AG0_AFEM1_AFEM1_ASEM1_CLR1_CADS0_DTLA0_DTLB0_DTVA0_DTVB0_EPS0_FDSI0_GRPM1_GRVWA8_GRVWB8_GSU1_GSUAMB_GSUC0_GSUWGMRR0_GLS1_ISA1151_IU1_K1_LDSTI0_LBSPPA6144_LBSPPB128_LBSPPM0_LPA8_LPB16_LPM0_LRVW16_LWPMn1_MIAV1_MIWT3_4_MO2_NTn1_NTA0_NTB0_NTC0_NTD0_NTM0_NEPBS0_NLCA3_NLCB1_ONLL1_PGR2_PLR0_PKA0_SIA1_SS1_SU0_SUM0_SUS32_SPO0_SRVW0_SSO0_SVW1_SK0_SKFTR0_SKXCCM0_TLDS1_ULSGRO0_USL1_UIOFGRO0_USFGROn1_VSn1_VWA1_VWB1_WSGRA0_WSGRB0_WS32_WG64_2_1_WGM32_WGMXCC1_WGMXCCGn1
    SolutionIndex: 2
    SolutionNameMin: Cijk_Ailk_Bljk_BBS_BH_UserArgs_MT128x32x16_MI16x16x1_SN_LDSB0_AFC0_AG0_AFEM1_AFEM1_ASEM1_CLR0_CADS0_DTLA0_DTLB0_DTVA0_DTVB0_EPS1_FDSI0_GRPM1_GRVWA4_GRVWB8_GSU1_GSUAMB_GSUC0_GSUWGMRR0_GLS0_ISA1151_IU1_K1_LDSTI0_LBSPPA0_LBSPPB128_LBSPPM0_LPA0_LPB8_LPM0_LRVW16_LWPMn1_MIAV1_MIWT4_2_MO40_NTn1_NTA0_NTB0_NTC0_NTD0_NTM0_NEPBS0_NLCA1_NLCB1_ONLL1_PGR1_PLR0_PKA0_SIA1_SS1_SU32_SUM0_SUS256_SPO0_SRVW0_SSO0_SVW1_SK0_SKFTR0_SKXCCM0_TLDS0_ULSGRO0_USL1_UIOFGRO0_USFGROn1_VSn1_VWA1_VWB1_WSGRA0_WSGRB0_WS32_WG32_2_1_WGM64_WGMXCC1_WGMXCCGn1
    SolutionIndex: 3
    SolutionNameMin: Cijk_Ailk_Bljk_BBS_BH_UserArgs_MT64x32x16_MI16x16x1_SN_LDSB0_AFC0_AG0_AFEM1_AFEM1_ASEM1_CLR0_CADS0_DTLA0_DTLB0_DTVA0_DTVB0_EPS1_FDSI0_GRPM1_GRVWA4_GRVWB4_GSU1_GSUAMB_GSUC0_GSUWGMRR0_GLS0_ISA1151_IU1_K1_LDSTI0_LBSPPA2048_LBSPPB128_LBSPPM0_LPA16_LPB16_LPM0_LRVW16_LWPMn1_MIAV1_MIWT1_2_MO40_NTn1_NTA0_NTB0_NTC0_NTD0_NTM0_NEPBS0_NLCA1_NLCB1_ONLL1_PGR1_PLR0_PKA0_SIA1_SS1_SU64_SUM0_SUS256_SPO0_SRVW0_SSO0_SVW1_SK0_SKFTR0_SKXCCM0_TLDS1_ULSGRO0_USL1_UIOFGRO0_USFGROn1_VSn1_VWA1_VWB1_WSGRA0_WSGRB0_WS32_WG64_2_1_WGM4_WGMXCC1_WGMXCCGn1
    SolutionIndex: 4
    SolutionNameMin: Cijk_Ailk_Bljk_BBS_BH_UserArgs_MT128x32x16_MI16x16x1_SN_LDSB0_AFC0_AG0_AFEM1_AFEM1_ASEM1_CLR0_CADS0_DTLA0_DTLB0_DTVA0_DTVB0_EPS1_FDSI0_GRPM1_GRVWA8_GRVWB4_GSU1_GSUAMB_GSUC0_GSUWGMRR0_GLS0_ISA1151_IU1_K1_LDSTI0_LBSPPA0_LBSPPB128_LBSPPM0_LPA0_LPB8_LPM0_LRVW16_LWPMn1_MIAV1_MIWT4_2_MO40_NTn1_NTA0_NTB0_NTC0_NTD0_NTM0_NEPBS0_NLCA1_NLCB1_ONLL1_PGR1_PLR0_PKA0_SIA3_SS1_SU0_SUM0_SUS32_SPO0_SRVW0_SSO0_SVW1_SK0_SKFTR0_SKXCCM0_TLDS0_ULSGRO0_USL1_UIOFGRO0_USFGROn1_VSn1_VWA1_VWB1_WSGRA0_WSGRB0_WS32_WG32_2_1_WGM8_WGMXCC1_WGMXCCGn1
    SolutionIndex: 5
    SolutionNameMin: Cijk_Ailk_Bljk_BBS_BH_UserArgs_MT192x64x16_MI16x16x1_SN_LDSB0_AFC0_AG0_AFEM1_AFEM1_ASEM1_CLR1_CADS0_DTLA0_DTLB0_DTVA0_DTVB0_EPS0_FDSI0_GRPM1_GRVWA8_GRVWB8_GSU1_GSUAMB_GSUC0_GSUWGMRR0_GLS0_ISA1151_IU1_K1_LDSTI0_LBSPPA6144_LBSPPB128_LBSPPM0_LPA8_LPB16_LPM0_LRVW16_LWPM2_MIAV1_MIWT3_4_MO40_NTn1_NTA0_NTB0_NTC0_NTD0_NTM0_NEPBS0_NLCA3_NLCB1_ONLL1_PGR2_PLR0_PKA0_SIA1_SS1_SU0_SUM0_SUS32_SPO0_SRVW0_SSO0_SVW1_SK0_SKFTR0_SKXCCM0_TLDS1_ULSGRO0_USL1_UIOFGRO0_USFGROn1_VSn1_VWA1_VWB1_WSGRA0_WSGRB0_WS32_WG64_2_1_WGM16_WGMXCC1_WGMXCCGn1
    SolutionIndex: 6
    SolutionNameMin: Cijk_Ailk_Bljk_BBS_BH_UserArgs_MT128x32x16_MI16x16x1_SN_LDSB0_AFC0_AG0_AFEM1_AFEM1_ASEM1_CLR0_CADS0_DTLA0_DTLB0_DTVA0_DTVB0_EPS1_FDSI0_GRPM1_GRVWA4_GRVWB8_GSU1_GSUAMB_GSUC0_GSUWGMRR0_GLS0_ISA1151_IU1_K1_LDSTI0_LBSPPA0_LBSPPB128_LBSPPM0_LPA0_LPB8_LPM0_LRVW16_LWPMn1_MIAV1_MIWT4_2_MO40_NTn1_NTA0_NTB0_NTC0_NTD0_NTM0_NEPBS0_NLCA1_NLCB1_ONLL1_PGR1_PLR0_PKA0_SIA1_SS1_SU32_SUM0_SUS256_SPO0_SRVW0_SSO0_SVW1_SK0_SKFTR0_SKXCCM0_TLDS0_ULSGRO0_USL1_UIOFGRO0_USFGROn1_VSn1_VWA1_VWB1_WSGRA0_WSGRB0_WS32_WG32_2_1_WGM32_WGMXCC1_WGMXCCGn1
    SolutionIndex: 7
    SolutionNameMin: Cijk_Ailk_Bljk_BBS_BH_UserArgs_MT192x64x16_MI16x16x1_SN_LDSB0_AFC0_AG0_AFEM1_AFEM1_ASEM1_CLR1_CADS0_DTLA0_DTLB0_DTVA0_DTVB0_EPS0_FDSI0_GRPM1_GRVWA8_GRVWB8_GSU1_GSUAMB_GSUC0_GSUWGMRR0_GLS1_ISA1151_IU1_K1_LDSTI0_LBSPPA0_LBSPPB128_LBSPPM0_LPA0_LPB16_LPM0_LRVW16_LWPMn1_MIAV1_MIWT3_4_MO2_NTn1_NTA0_NTB0_NTC0_NTD0_NTM0_NEPBS0_NLCA3_NLCB1_ONLL2_PGR2_PLR0_PKA0_SIA1_SS1_SU0_SUM0_SUS32_SPO0_SRVW0_SSO0_SVW1_SK0_SKFTR0_SKXCCM0_TLDS1_ULSGRO0_USL1_UIOFGRO0_USFGROn1_VSn1_VWA1_VWB1_WSGRA0_WSGRB0_WS32_WG64_2_1_WGM16_WGMXCC1_WGMXCCGn1
    SolutionIndex: 8
    SolutionNameMin: Cijk_Ailk_Bljk_BBS_BH_UserArgs_MT128x32x16_MI16x16x1_SN_LDSB0_AFC0_AG0_AFEM1_AFEM1_ASEM1_CLR0_CADS0_DTLA0_DTLB0_DTVA0_DTVB0_EPS1_FDSI0_GRPM1_GRVWA8_GRVWB4_GSU1_GSUAMB_GSUC0_GSUWGMRR0_GLS0_ISA1151_IU1_K1_LDSTI0_LBSPPA0_LBSPPB128_LBSPPM0_LPA0_LPB8_LPM0_LRVW16_LWPMn1_MIAV1_MIWT4_2_MO40_NTn1_NTA0_NTB0_NTC0_NTD0_NTM0_NEPBS0_NLCA1_NLCB1_ONLL1_PGR1_PLR0_PKA0_SIA3_SS1_SU0_SUM0_SUS32_SPO0_SRVW0_SSO0_SVW1_SK0_SKFTR0_SKXCCM0_TLDS0_ULSGRO0_USL1_UIOFGRO0_USFGROn1_VSn1_VWA1_VWB1_WSGRA0_WSGRB0_WS32_WG32_2_1_WGM32_WGMXCC1_WGMXCCGn1
    SolutionIndex: 9
    SolutionNameMin: Cijk_Ailk_Bljk_BBS_BH_UserArgs_MT128x64x16_MI16x16x1_SN_LDSB0_AFC0_AG0_AFEM1_AFEM1_ASEM1_CLR1_CADS0_DTLA0_DTLB0_DTVA0_DTVB0_EPS0_FDSI0_GRPM1_GRVWA8_GRVWB8_GSU1_GSUAMB_GSUC0_GSUWGMRR0_GLS0_ISA1151_IU1_K1_LDSTI0_LBSPPA4096_LBSPPB128_LBSPPM0_LPA16_LPB16_LPM0_LRVW16_LWPMn1_MIAV1_MIWT2_4_MO40_NTn1_NTA0_NTB0_NTC0_NTD0_NTM0_NEPBS0_NLCA1_NLCB1_ONLL1_PGR2_PLR0_PKA0_SIA1_SS1_SU0_SUM0_SUS32_SPO0_SRVW0_SSO0_SVW1_SK0_SKFTR0_SKXCCM0_TLDS1_ULSGRO0_USL1_UIOFGRO0_USFGROn1_VSn1_VWA1_VWB1_WSGRA0_WSGRB0_WS32_WG64_2_1_WGM32_WGMXCC1_WGMXCCGn1
    SolutionIndex: 10
    SolutionNameMin: Cijk_Ailk_Bljk_BBS_BH_UserArgs_MT256x32x16_MI16x16x1_SN_LDSB0_AFC0_AG0_AFEM1_AFEM1_ASEM1_CLR0_CADS0_DTLA0_DTLB0_DTVA0_DTVB0_EPS1_FDSI0_GRPM1_GRVWA8_GRVWB4_GSU1_GSUAMB_GSUC0_GSUWGMRR0_GLS0_ISA1151_IU1_K1_LDSTI0_LBSPPA0_LBSPPB128_LBSPPM0_LPA0_LPB8_LPM0_LRVW16_LWPMn1_MIAV1_MIWT4_2_MO40_NTn1_NTA0_NTB0_NTC0_NTD0_NTM0_NEPBS0_NLCA1_NLCB1_ONLL1_PGR1_PLR1_PKA0_SIA3_SS1_SU0_SUM0_SUS32_SPO0_SRVW0_SSO0_SVW1_SK0_SKFTR0_SKXCCM0_TLDS0_ULSGRO0_USL1_UIOFGRO0_USFGROn1_VSn1_VWA1_VWB1_WSGRA0_WSGRB0_WS32_WG64_2_1_WGM64_WGMXCC1_WGMXCCGn1
    SolutionIndex: 11
    SolutionNameMin: Cijk_Ailk_Bljk_BBS_BH_UserArgs_MT128x32x16_MI16x16x1_SN_LDSB0_AFC0_AG0_AFEM1_AFEM1_ASEM1_CLR0_CADS0_DTLA0_DTLB0_DTVA0_DTVB0_EPS1_FDSI0_GRPM1_GRVWA8_GRVWB4_GSU1_GSUAMB_GSUC0_GSUWGMRR0_GLS0_ISA1151_IU1_K1_LDSTI0_LBSPPA0_LBSPPB128_LBSPPM0_LPA0_LPB8_LPM0_LRVW16_LWPMn1_MIAV1_MIWT4_2_MO40_NTn1_NTA0_NTB0_NTC0_NTD0_NTM0_NEPBS0_NLCA1_NLCB1_ONLL1_PGR1_PLR1_PKA0_SIA3_SS1_SU0_SUM0_SUS32_SPO0_SRVW0_SSO0_SVW1_SK0_SKFTR0_SKXCCM0_TLDS0_ULSGRO0_USL1_UIOFGRO0_USFGROn1_VSn1_VWA1_VWB1_WSGRA0_WSGRB0_WS32_WG32_2_1_WGM64_WGMXCC1_WGMXCCGn1
    SolutionIndex: 12
    SolutionNameMin: Cijk_Ailk_Bljk_BBS_BH_UserArgs_MT128x32x16_MI16x16x1_SN_LDSB0_AFC0_AG0_AFEM1_AFEM1_ASEM1_CLR0_CADS0_DTLA0_DTLB0_DTVA0_DTVB0_EPS1_FDSI0_GRPM1_GRVWA8_GRVWB4_GSU1_GSUAMB_GSUC0_GSUWGMRR0_GLS0_ISA1151_IU1_K1_LDSTI0_LBSPPA0_LBSPPB128_LBSPPM0_LPA0_LPB8_LPM0_LRVW16_LWPMn1_MIAV1_MIWT4_2_MO40_NTn1_NTA0_NTB0_NTC0_NTD0_NTM0_NEPBS0_NLCA1_NLCB1_ONLL1_PGR1_PLR0_PKA0_SIA3_SS1_SU0_SUM0_SUS32_SPO0_SRVW0_SSO0_SVW1_SK0_SKFTR0_SKXCCM0_TLDS0_ULSGRO0_USL1_UIOFGRO0_USFGROn1_VSn1_VWA1_VWB1_WSGRA0_WSGRB0_WS32_WG32_2_1_WGM16_WGMXCC1_WGMXCCGn1
    SolutionIndex: 13
    SolutionNameMin: Cijk_Ailk_Bljk_BBS_BH_UserArgs_MT192x64x16_MI16x16x1_SN_LDSB0_AFC0_AG0_AFEM1_AFEM1_ASEM1_CLR1_CADS0_DTLA0_DTLB0_DTVA0_DTVB0_EPS0_FDSI0_GRPM1_GRVWA8_GRVWB8_GSU1_GSUAMB_GSUC0_GSUWGMRR0_GLS0_ISA1151_IU1_K1_LDSTI0_LBSPPA0_LBSPPB128_LBSPPM0_LPA0_LPB16_LPM0_LRVW16_LWPMn1_MIAV1_MIWT3_4_MO40_NTn1_NTA0_NTB0_NTC0_NTD0_NTM0_NEPBS0_NLCA3_NLCB1_ONLL1_PGR2_PLR0_PKA0_SIA1_SS1_SU0_SUM0_SUS32_SPO0_SRVW0_SSO0_SVW1_SK0_SKFTR0_SKXCCM0_TLDS1_ULSGRO0_USL1_UIOFGRO0_USFGROn1_VSn1_VWA1_VWB1_WSGRA0_WSGRB0_WS32_WG64_2_1_WGM16_WGMXCC1_WGMXCCGn1
    SolutionIndex: 14
    SolutionNameMin: Cijk_Ailk_Bljk_BBS_BH_UserArgs_MT128x32x16_MI16x16x1_SN_LDSB0_AFC0_AG0_AFEM1_AFEM1_ASEM1_CLR0_CADS0_DTLA0_DTLB0_DTVA0_DTVB0_EPS1_FDSI0_GRPM1_GRVWA4_GRVWB8_GSU1_GSUAMB_GSUC0_GSUWGMRR0_GLS0_ISA1151_IU1_K1_LDSTI0_LBSPPA0_LBSPPB128_LBSPPM0_LPA0_LPB8_LPM0_LRVW16_LWPMn1_MIAV1_MIWT4_2_MO40_NTn1_NTA0_NTB0_NTC0_NTD0_NTM0_NEPBS0_NLCA1_NLCB1_ONLL1_PGR1_PLR0_PKA0_SIA1_SS1_SU32_SUM0_SUS256_SPO0_SRVW0_SSO0_SVW1_SK0_SKFTR0_SKXCCM0_TLDS0_ULSGRO0_USL1_UIOFGRO0_USFGROn1_VSn1_VWA1_VWB1_WSGRA0_WSGRB0_WS32_WG32_2_1_WGM4_WGMXCC1_WGMXCCGn1
    SolutionIndex: 15
    SolutionNameMin: Cijk_Ailk_Bljk_BBS_BH_UserArgs_MT192x64x16_MI16x16x1_SN_LDSB0_AFC0_AG0_AFEM1_AFEM1_ASEM1_CLR1_CADS0_DTLA0_DTLB0_DTVA0_DTVB0_EPS0_FDSI0_GRPM1_GRVWA8_GRVWB8_GSU1_GSUAMB_GSUC0_GSUWGMRR0_GLS1_ISA1151_IU1_K1_LDSTI0_LBSPPA6144_LBSPPB128_LBSPPM0_LPA16_LPB16_LPM0_LRVW16_LWPMn1_MIAV1_MIWT3_4_MO2_NTn1_NTA0_NTB0_NTC0_NTD0_NTM0_NEPBS0_NLCA3_NLCB1_ONLL1_PGR2_PLR0_PKA0_SIA1_SS1_SU0_SUM0_SUS32_SPO0_SRVW0_SSO0_SVW1_SK0_SKFTR0_SKXCCM0_TLDS1_ULSGRO0_USL1_UIOFGRO0_USFGROn1_VSn1_VWA1_VWB1_WSGRA0_WSGRB0_WS32_WG64_2_1_WGM16_WGMXCC1_WGMXCCGn1
    SolutionIndex: 16
    SolutionNameMin: Cijk_Ailk_Bljk_BBS_BH_UserArgs_MT128x32x16_MI16x16x1_SN_LDSB0_AFC0_AG0_AFEM1_AFEM1_ASEM1_CLR0_CADS0_DTLA0_DTLB0_DTVA0_DTVB0_EPS0_FDSI0_GRPM1_GRVWA8_GRVWB4_GSU1_GSUAMB_GSUC0_GSUWGMRR0_GLS0_ISA1151_IU1_K1_LDSTI0_LBSPPA0_LBSPPB128_LBSPPM0_LPA0_LPB8_LPM0_LRVW16_LWPMn1_MIAV1_MIWT4_2_MO40_NTn1_NTA0_NTB0_NTC0_NTD0_NTM0_NEPBS0_NLCA1_NLCB1_ONLL1_PGR2_PLR0_PKA0_SIA3_SS1_SU0_SUM0_SUS32_SPO0_SRVW0_SSO0_SVW1_SK0_SKFTR0_SKXCCM0_TLDS0_ULSGRO0_USL1_UIOFGRO0_USFGROn1_VSn1_VWA1_VWB1_WSGRA0_WSGRB0_WS32_WG32_2_1_WGM32_WGMXCC1_WGMXCCGn1
    SolutionIndex: 17
    SolutionNameMin: Cijk_Ailk_Bljk_BBS_BH_UserArgs_MT128x64x16_MI16x16x1_SN_LDSB0_AFC0_AG0_AFEM1_AFEM1_ASEM1_CLR1_CADS0_DTLA0_DTLB0_DTVA0_DTVB0_EPS0_FDSI0_GRPM1_GRVWA8_GRVWB8_GSU1_GSUAMB_GSUC0_GSUWGMRR0_GLS0_ISA1151_IU1_K1_LDSTI0_LBSPPA0_LBSPPB128_LBSPPM0_LPA0_LPB16_LPM0_LRVW16_LWPMn1_MIAV1_MIWT2_4_MO40_NTn1_NTA0_NTB0_NTC0_NTD0_NTM0_NEPBS0_NLCA1_NLCB1_ONLL1_PGR2_PLR0_PKA0_SIA1_SS1_SU0_SUM0_SUS32_SPO0_SRVW0_SSO0_SVW1_SK0_SKFTR0_SKXCCM0_TLDS1_ULSGRO0_USL1_UIOFGRO0_USFGROn1_VSn1_VWA1_VWB1_WSGRA0_WSGRB0_WS32_WG64_2_1_WGM64_WGMXCC1_WGMXCCGn1
    SolutionIndex: 18
    SolutionNameMin: Cijk_Ailk_Bljk_BBS_BH_UserArgs_MT128x64x16_MI16x16x1_SN_LDSB0_AFC0_AG0_AFEM1_AFEM1_ASEM1_CLR1_CADS0_DTLA0_DTLB0_DTVA0_DTVB0_EPS0_FDSI0_GRPM1_GRVWA8_GRVWB8_GSU1_GSUAMB_GSUC0_GSUWGMRR0_GLS0_ISA1151_IU1_K1_LDSTI0_LBSPPA0_LBSPPB128_LBSPPM0_LPA0_LPB16_LPM0_LRVW16_LWPMn1_MIAV1_MIWT2_4_MO40_NTn1_NTA0_NTB0_NTC0_NTD0_NTM0_NEPBS0_NLCA1_NLCB1_ONLL1_PGR2_PLR0_PKA0_SIA1_SS1_SU0_SUM0_SUS32_SPO0_SRVW0_SSO0_SVW1_SK0_SKFTR0_SKXCCM0_TLDS1_ULSGRO0_USL1_UIOFGRO0_USFGROn1_VSn1_VWA1_VWB1_WSGRA0_WSGRB0_WS32_WG64_2_1_WGM16_WGMXCC1_WGMXCCGn1
    SolutionIndex: 19
    SolutionNameMin: Cijk_Ailk_Bljk_BBS_BH_UserArgs_MT128x32x16_MI16x16x1_SN_LDSB1_AFC0_AG0_AFEM1_AFEM1_ASEM1_CLR0_CADS0_DTLA0_DTLB0_DTVA0_DTVB0_EPS1_FDSI0_GRPM1_GRVWA8_GRVWB4_GSU1_GSUAMB_GSUC0_GSUWGMRR0_GLS0_ISA1151_IU1_K1_LDSTI0_LBSPPA4096_LBSPPB128_LBSPPM0_LPA16_LPB16_LPM0_LRVW16_LWPMn1_MIAV1_MIWT4_2_MO40_NTn1_NTA0_NTB0_NTC0_NTD0_NTM0_NEPBS0_NLCA1_NLCB1_ONLL1_PGR1_PLR0_PKA0_SIA3_SS1_SU0_SUM0_SUS32_SPO0_SRVW0_SSO0_SVW1_SK0_SKFTR0_SKXCCM0_TLDS1_ULSGRO0_USL1_UIOFGRO0_USFGROn1_VSn1_VWA1_VWB1_WSGRA0_WSGRB0_WS32_WG32_2_1_WGM16_WGMXCC1_WGMXCCGn1
    SolutionIndex: 20
    SolutionNameMin: Cijk_Ailk_Bljk_BBS_BH_UserArgs_MT192x64x16_MI16x16x1_SN_LDSB0_AFC0_AG0_AFEM1_AFEM1_ASEM1_CLR1_CADS0_DTLA0_DTLB0_DTVA0_DTVB0_EPS0_FDSI0_GRPM1_GRVWA8_GRVWB8_GSU1_GSUAMB_GSUC0_GSUWGMRR0_GLS1_ISA1151_IU1_K1_LDSTI0_LBSPPA6144_LBSPPB128_LBSPPM0_LPA8_LPB16_LPM0_LRVW16_LWPMn1_MIAV1_MIWT3_4_MO2_NTn1_NTA0_NTB0_NTC0_NTD0_NTM0_NEPBS0_NLCA3_NLCB1_ONLL2_PGR2_PLR0_PKA0_SIA1_SS1_SU0_SUM0_SUS32_SPO0_SRVW0_SSO0_SVW1_SK0_SKFTR0_SKXCCM0_TLDS1_ULSGRO0_USL1_UIOFGRO0_USFGROn1_VSn1_VWA1_VWB1_WSGRA0_WSGRB0_WS32_WG64_2_1_WGM16_WGMXCC1_WGMXCCGn1
    SolutionIndex: 21
    SolutionNameMin: Cijk_Ailk_Bljk_BBS_BH_UserArgs_MT192x64x16_MI16x16x1_SN_LDSB0_AFC0_AG0_AFEM1_AFEM1_ASEM1_CLR1_CADS0_DTLA0_DTLB0_DTVA0_DTVB0_EPS0_FDSI0_GRPM1_GRVWA8_GRVWB8_GSU1_GSUAMB_GSUC0_GSUWGMRR0_GLS0_ISA1151_IU1_K1_LDSTI0_LBSPPA6144_LBSPPB128_LBSPPM0_LPA8_LPB16_LPM0_LRVW16_LWPMn1_MIAV1_MIWT3_4_MO40_NTn1_NTA0_NTB0_NTC0_NTD0_NTM0_NEPBS0_NLCA3_NLCB1_ONLL1_PGR2_PLR0_PKA0_SIA1_SS1_SU0_SUM0_SUS32_SPO0_SRVW0_SSO0_SVW1_SK0_SKFTR0_SKXCCM0_TLDS1_ULSGRO0_USL1_UIOFGRO0_USFGROn1_VSn1_VWA1_VWB1_WSGRA0_WSGRB0_WS32_WG64_2_1_WGM16_WGMXCC1_WGMXCCGn1
    SolutionIndex: 22
    SolutionNameMin: Cijk_Ailk_Bljk_BBS_BH_UserArgs_MT256x32x16_MI16x16x1_SN_LDSB0_AFC0_AG0_AFEM1_AFEM1_ASEM1_CLR0_CADS0_DTLA0_DTLB0_DTVA0_DTVB0_EPS1_FDSI0_GRPM1_GRVWA8_GRVWB4_GSU1_GSUAMB_GSUC0_GSUWGMRR0_GLS0_ISA1151_IU1_K1_LDSTI0_LBSPPA0_LBSPPB128_LBSPPM0_LPA0_LPB8_LPM0_LRVW16_LWPMn1_MIAV1_MIWT4_2_MO40_NTn1_NTA0_NTB0_NTC0_NTD0_NTM0_NEPBS0_NLCA1_NLCB1_ONLL1_PGR1_PLR0_PKA0_SIA3_SS1_SU0_SUM0_SUS32_SPO0_SRVW0_SSO0_SVW1_SK0_SKFTR0_SKXCCM0_TLDS0_ULSGRO0_USL1_UIOFGRO0_USFGROn1_VSn1_VWA1_VWB1_WSGRA0_WSGRB0_WS32_WG64_2_1_WGM32_WGMXCC1_WGMXCCGn1
    SolutionIndex: 23
    SolutionNameMin: Cijk_Ailk_Bljk_BBS_BH_UserArgs_MT128x32x16_MI16x16x1_SN_LDSB1_AFC0_AG0_AFEM1_AFEM1_ASEM1_CLR0_CADS0_DTLA0_DTLB0_DTVA0_DTVB0_EPS1_FDSI0_GRPM1_GRVWA8_GRVWB4_GSU1_GSUAMB_GSUC0_GSUWGMRR0_GLS0_ISA1151_IU1_K1_LDSTI0_LBSPPA4096_LBSPPB128_LBSPPM0_LPA16_LPB16_LPM0_LRVW16_LWPMn1_MIAV1_MIWT4_2_MO40_NTn1_NTA0_NTB0_NTC0_NTD0_NTM0_NEPBS0_NLCA1_NLCB1_ONLL1_PGR1_PLR0_PKA0_SIA3_SS1_SU0_SUM0_SUS32_SPO0_SRVW0_SSO0_SVW1_SK0_SKFTR0_SKXCCM0_TLDS1_ULSGRO0_USL1_UIOFGRO0_USFGROn1_VSn1_VWA1_VWB1_WSGRA0_WSGRB0_WS32_WG32_2_1_WGM32_WGMXCC1_WGMXCCGn1
    SolutionIndex: 24
    SolutionNameMin: Cijk_Ailk_Bljk_BBS_BH_UserArgs_MT128x32x16_MI16x16x1_SN_LDSB0_AFC0_AG0_AFEM1_AFEM1_ASEM1_CLR0_CADS0_DTLA0_DTLB0_DTVA0_DTVB0_EPS0_FDSI0_GRPM1_GRVWA4_GRVWB4_GSU1_GSUAMB_GSUC0_GSUWGMRR0_GLS0_ISA1151_IU1_K1_LDSTI0_LBSPPA0_LBSPPB128_LBSPPM0_LPA0_LPB8_LPM0_LRVW16_LWPMn1_MIAV1_MIWT4_2_MO40_NTn1_NTA0_NTB0_NTC0_NTD0_NTM0_NEPBS0_NLCA1_NLCB1_ONLL1_PGR2_PLR0_PKA0_SIA3_SS1_SU0_SUM0_SUS32_SPO0_SRVW0_SSO0_SVW1_SK0_SKFTR0_SKXCCM0_TLDS0_ULSGRO0_USL1_UIOFGRO0_USFGROn1_VSn1_VWA1_VWB1_WSGRA0_WSGRB0_WS32_WG32_2_1_WGM8_WGMXCC1_WGMXCCGn1
    SolutionIndex: 25
    SolutionNameMin: Cijk_Ailk_Bljk_BBS_BH_UserArgs_MT128x32x16_MI16x16x1_SN_LDSB0_AFC0_AG0_AFEM1_AFEM1_ASEM1_CLR0_CADS0_DTLA0_DTLB0_DTVA0_DTVB0_EPS0_FDSI0_GRPM1_GRVWA8_GRVWB4_GSU1_GSUAMB_GSUC0_GSUWGMRR0_GLS0_ISA1151_IU1_K1_LDSTI0_LBSPPA0_LBSPPB128_LBSPPM0_LPA0_LPB8_LPM0_LRVW16_LWPMn1_MIAV1_MIWT4_2_MO40_NTn1_NTA0_NTB0_NTC0_NTD0_NTM0_NEPBS0_NLCA1_NLCB1_ONLL1_PGR2_PLR1_PKA0_SIA3_SS1_SU0_SUM0_SUS32_SPO0_SRVW0_SSO0_SVW1_SK0_SKFTR0_SKXCCM0_TLDS0_ULSGRO0_USL1_UIOFGRO0_USFGROn1_VSn1_VWA1_VWB1_WSGRA0_WSGRB0_WS32_WG32_2_1_WGM64_WGMXCC1_WGMXCCGn1
    SolutionIndex: 26
    SolutionNameMin: Cijk_Ailk_Bljk_BBS_BH_UserArgs_MT128x64x16_MI16x16x1_SN_LDSB0_AFC0_AG0_AFEM1_AFEM1_ASEM1_CLR1_CADS0_DTLA0_DTLB0_DTVA0_DTVB0_EPS0_FDSI0_GRPM1_GRVWA8_GRVWB8_GSU1_GSUAMB_GSUC0_GSUWGMRR0_GLS0_ISA1151_IU1_K1_LDSTI0_LBSPPA4096_LBSPPB128_LBSPPM0_LPA8_LPB16_LPM0_LRVW16_LWPMn1_MIAV1_MIWT2_4_MO40_NTn1_NTA0_NTB0_NTC0_NTD0_NTM0_NEPBS0_NLCA1_NLCB1_ONLL1_PGR2_PLR0_PKA0_SIA1_SS1_SU0_SUM0_SUS32_SPO0_SRVW0_SSO0_SVW1_SK0_SKFTR0_SKXCCM0_TLDS1_ULSGRO0_USL1_UIOFGRO0_USFGROn1_VSn1_VWA1_VWB1_WSGRA0_WSGRB0_WS32_WG64_2_1_WGM64_WGMXCC1_WGMXCCGn1
- - - [10000, 512, 1, 4608]
    - [0, 7.31]
  - - [10000, 64, 1, 4608]
    - [1, 4.49]
  - - [10000, 64, 1, 64]
    - [2, 0.13]
  - - [1024, 512, 1, 4608]
    - [0, 4.31]
  - - [1024, 64, 1, 64]
    - [2, 0.21]
  - - [12288, 32, 1, 32]
    - [3, 0.05]
  - - [12288, 512, 1, 288]
    - [4, 4.33]
  - - [12288, 64, 1, 4608]
    - [1, 4.22]
  - - [12288, 64, 1, 64]
    - [2, 1.65]
  - - [13312, 512, 1, 4608]
    - [0, 8.14]
  - - [13312, 64, 1, 64]
    - [2, 0.0]
  - - [147456, 256, 1, 1152]
    - [5, 10.06]
  - - [147456, 256, 1, 128]
    - [6, 3.88]
  - - [147456, 256, 1, 2304]
    - [7, 10.62]
  - - [160000, 256, 1, 1152]
    - [8, 7.98]
  - - [160000, 256, 1, 128]
    - [6, 3.98]
  - - [160000, 256, 1, 2304]
    - [9, 9.24]
  - - [16384, 256, 1, 1152]
    - [8, 2.66]
  - - [16384, 256, 1, 128]
    - [6, 2.96]
  - - [16384, 256, 1, 2304]
    - [10, 5.66]
  - - [16384, 32, 1, 32]
    - [3, 0.7]
  - - [16384, 512, 1, 2304]
    - [11, 7.84]
  - - [16384, 512, 1, 256]
    - [12, 1.06]
  - - [16384, 512, 1, 288]
    - [4, 1.96]
  - - [16384, 64, 1, 64]
    - [2, 1.57]
  - - [17280, 256, 1, 2304]
    - [10, 5.66]
  - - [17280, 512, 1, 2304]
    - [11, 6.37]
  - - [17280, 512, 1, 256]
    - [12, 4.69]
  - - [17280, 512, 1, 4608]
    - [10, 8.42]
  - - [1856, 256, 1, 2304]
    - [7, 1.9]
  - - [1856, 512, 1, 2304]
    - [13, 6.34]
  - - [1856, 512, 1, 256]
    - [14, 3.35]
  - - [1856, 512, 1, 4608]
    - [0, 4.65]
  - - [1920, 256, 1, 2304]
    - [7, 4.05]
  - - [1920, 512, 1, 2304]
    - [13, 6.51]
  - - [1920, 512, 1, 256]
    - [14, 2.79]
  - - [1920, 512, 1, 4608]
    - [15, 6.75]
  - - [196608, 256, 1, 1152]
    - [5, 10.28]
  - - [196608, 256, 1, 128]
    - [6, 3.56]
  - - [196608, 256, 1, 2304]
    - [7, 10.41]
  - - [196608, 256, 1, 512]
    - [16, 7.38]
  - - [196608, 512, 1, 4608]
    - [15, 8.8]
  - - [212992, 256, 1, 1152]
    - [8, 7.85]
  - - [212992, 256, 1, 128]
    - [6, 4.61]
  - - [22320, 512, 1, 2304]
    - [11, 8.08]
  - - [22320, 512, 1, 256]
    - [12, 1.98]
  - - [22320, 512, 1, 4608]
    - [10, 8.36]
  - - [24128, 256, 1, 2304]
    - [10, 3.79]
  - - [24128, 512, 1, 2304]
    - [11, 7.59]
  - - [24128, 512, 1, 256]
    - [12, 2.11]
  - - [24128, 512, 1, 4608]
    - [10, 8.56]
  - - [24960, 256, 1, 2304]
    - [10, 5.88]
  - - [24960, 512, 1, 2304]
    - [11, 7.91]
  - - [24960, 512, 1, 256]
    - [12, 2.19]
  - - [24960, 512, 1, 4608]
    - [10, 8.52]
  - - [262144, 128, 1, 1152]
    - [17, 7.63]
  - - [262144, 128, 1, 2304]
    - [18, 7.53]
  - - [262144, 128, 1, 256]
    - [19, 2.06]
  - - [262144, 256, 1, 1152]
    - [8, 7.08]
  - - [262144, 256, 1, 128]
    - [6, 3.36]
  - - [262144, 3, 1, 1152]
    - [17, 0.22]
  - - [276480, 128, 1, 1152]
    - [17, 8.07]
  - - [29696, 128, 1, 1152]
    - [17, 2.86]
  - - [30720, 128, 1, 1152]
    - [17, 2.83]
  - - [357120, 128, 1, 1152]
    - [17, 8.33]
  - - [36864, 256, 1, 2304]
    - [20, 9.98]
  - - [36864, 512, 1, 2304]
    - [13, 10.51]
  - - [36864, 512, 1, 256]
    - [14, 4.22]
  - - [36864, 512, 1, 4608]
    - [21, 11.18]
  - - [386048, 128, 1, 1152]
    - [17, 8.63]
  - - [399360, 128, 1, 1152]
    - [17, 8.27]
  - - [40000, 256, 1, 2304]
    - [20, 7.66]
  - - [40000, 512, 1, 2304]
    - [13, 11.18]
  - - [40000, 512, 1, 256]
    - [14, 5.29]
  - - [40000, 512, 1, 4608]
    - [21, 10.84]
  - - [4096, 256, 1, 2304]
    - [9, 2.36]
  - - [4096, 32, 1, 32]
    - [3, 0.02]
  - - [4096, 512, 1, 2304]
    - [11, 4.66]
  - - [4096, 512, 1, 256]
    - [14, 3.96]
  - - [4096, 512, 1, 288]
    - [4, 1.25]
  - - [4096, 512, 1, 4608]
    - [22, 5.64]
  - - [4096, 64, 1, 64]
    - [23, 0.06]
  - - [4320, 512, 1, 4608]
    - [22, 5.69]
  - - [4320, 64, 1, 64]
    - [23, 0.05]
  - - [464, 512, 1, 4608]
    - [0, 3.98]
  - - [464, 64, 1, 64]
    - [2, 0.15]
  - - [480, 512, 1, 4608]
    - [0, 1.45]
  - - [480, 64, 1, 64]
    - [2, 0.08]
  - - [49152, 256, 1, 2304]
    - [20, 9.5]
  - - [49152, 512, 1, 2304]
    - [13, 10.82]
  - - [49152, 512, 1, 256]
    - [14, 5.06]
  - - [49152, 512, 1, 4608]
    - [20, 11.17]
  - - [53248, 256, 1, 2304]
    - [9, 9.36]
  - - [53248, 512, 1, 2304]
    - [11, 8.22]
  - - [53248, 512, 1, 256]
    - [14, 4.39]
  - - [5580, 64, 1, 4608]
    - [1, 1.8]
  - - [5580, 64, 1, 64]
    - [23, 1.38]
  - - [589824, 128, 1, 1152]
    - [17, 8.45]
  - - [6032, 512, 1, 4608]
    - [22, 7.42]
  - - [6032, 64, 1, 4608]
    - [1, 4.49]
  - - [6032, 64, 1, 64]
    - [23, 1.46]
  - - [6240, 512, 1, 4608]
    - [22, 6.15]
  - - [6240, 64, 1, 4608]
    - [1, 4.43]
  - - [6240, 64, 1, 64]
    - [23, 0.09]
  - - [640000, 128, 1, 1152]
    - [17, 9.0]
  - - [65536, 128, 1, 1152]
    - [17, 5.82]
  - - [65536, 256, 1, 1152]
    - [8, 6.4]
  - - [65536, 256, 1, 128]
    - [24, 1.43]
  - - [65536, 256, 1, 2304]
    - [25, 4.35]
  - - [65536, 256, 1, 512]
    - [16, 5.53]
  - - [65536, 512, 1, 2304]
    - [11, 6.3]
  - - [65536, 512, 1, 256]
    - [14, 4.42]
  - - [69120, 256, 1, 1152]
    - [8, 6.74]
  - - [69120, 256, 1, 128]
    - [24, 3.86]
  - - [69120, 256, 1, 2304]
    - [25, 7.93]
  - - [7424, 256, 1, 1152]
    - [8, 4.55]
  - - [7424, 256, 1, 128]
    - [6, 2.55]
  - - [7424, 256, 1, 2304]
    - [9, 4.66]
  - - [7680, 256, 1, 1152]
    - [5, 2.46]
  - - [7680, 256, 1, 128]
    - [6, 2.89]
  - - [7680, 256, 1, 2304]
    - [7, 2.91]
  - - [786432, 128, 1, 1152]
    - [26, 8.06]
  - - [786432, 128, 1, 256]
    - [19, 5.25]
  - - [851968, 128, 1, 1152]
    - [26, 5.99]
  - - [89280, 256, 1, 1152]
    - [8, 7.91]
  - - [89280, 256, 1, 128]
    - [24, 1.63]
  - - [89280, 256, 1, 2304]
    - [25, 7.84]
  - - [9216, 512, 1, 4608]
    - [21, 8.09]
  - - [9216, 64, 1, 64]
    - [2, 0.09]
  - - [96512, 256, 1, 1152]
    - [8, 7.96]
  - - [96512, 256, 1, 128]
    - [24, 3.4]
  - - [96512, 256, 1, 2304]
    - [25, 7.95]
  - - [99840, 256, 1, 1152]
    - [8, 7.72]
  - - [99840, 256, 1, 128]
    - [24, 1.49]
  - - [99840, 256, 1, 2304]
    - [25, 7.63]
- null
- null
- DeviceEfficiency
- Equality
