projects/hipblaslt/library/src/amd_detail/rocblaslt/src/Tensile/Logic/asm_full/gfx950/GridBased/gfx950_Cijk_Alik_Bljk_BBS_BH_Bias_HAS_SAV_UserArgs.yaml
- {MinimumRequiredVersion: 4.33.0}
- gfx950
- gfx950
- [Device 75a0]
    SolutionIndex: 0
    SolutionNameMin: Cijk_Alik_Bljk_BBS_BH_Bias_AS_SAV_UserArgs_MT256x256x32_MI16x16x1_SN_LDSB0_CLR0_GSU0_GSUC0_GSUWGMRR0_K1_LBSPPA512_LBSPPB512_MIWT8_8_PLR0_SU0_SUM0_SUS0_VWA8_VWB8_WGM1_WGMXCC1_WGMXCCGn1
    SolutionIndex: 1
    SolutionNameMin: Cijk_Alik_Bljk_BBS_BH_Bias_AS_SAV_UserArgs_MT256x256x32_MI16x16x1_SN_LDSB0_CLR0_GSU0_GSUC0_GSUWGMRR0_K1_LBSPPA512_LBSPPB512_MIWT8_8_PLR0_SU0_SUM0_SUS0_VWA8_VWB8_WGM1_WGMXCC1_WGMXCCGn1
    SolutionIndex: 2
    SolutionNameMin: Cijk_Alik_Bljk_BBS_BH_Bias_AS_SAV_UserArgs_MT256x256x32_MI16x16x1_SN_LDSB0_CLR0_GSU0_GSUC0_GSUWGMRR0_K1_LBSPPA512_LBSPPB512_MIWT8_8_PLR0_SU0_SUM0_SUS0_VWA8_VWB8_WGM1_WGMXCC1_WGMXCCGn1
    SolutionIndex: 3
    SolutionNameMin: Cijk_Alik_Bljk_BBS_BH_Bias_AS_SAV_UserArgs_MT256x256x32_MI16x16x1_SN_LDSB0_CLR0_GSU0_GSUC0_GSUWGMRR0_K1_LBSPPA512_LBSPPB512_MIWT8_8_PLR0_SU0_SUM0_SUS0_VWA8_VWB8_WGM1_WGMXCC1_WGMXCCGn1
    SolutionIndex: 4
    SolutionNameMin: Cijk_Alik_Bljk_BBS_BH_Bias_AS_SAV_UserArgs_MT256x256x32_MI16x16x1_SN_LDSB0_CLR0_GSU0_GSUC0_GSUWGMRR0_K1_LBSPPA512_LBSPPB512_MIWT8_8_PLR0_SU0_SUM0_SUS0_VWA8_VWB8_WGM1_WGMXCC1_WGMXCCGn1
    SolutionIndex: 5
    SolutionNameMin: Cijk_Alik_Bljk_BBS_BH_Bias_AS_SAV_UserArgs_MT256x256x32_MI16x16x1_SN_LDSB0_CLR0_GSU0_GSUC0_GSUWGMRR0_K1_LBSPPA512_LBSPPB512_MIWT8_8_PLR0_SU0_SUM0_SUS0_VWA8_VWB8_WGM6_WGMXCC1_WGMXCCGn1
    SolutionIndex: 6
    SolutionNameMin: Cijk_Alik_Bljk_BBS_BH_Bias_AS_SAV_UserArgs_MT256x256x32_MI16x16x1_SN_LDSB0_CLR0_GSU0_GSUC0_GSUWGMRR0_K1_LBSPPA512_LBSPPB512_MIWT8_8_PLR0_SU0_SUM0_SUS0_VWA8_VWB8_WGM8_WGMXCC1_WGMXCCGn1
    SolutionIndex: 7
    SolutionNameMin: Cijk_Alik_Bljk_BBS_BH_Bias_AS_SAV_UserArgs_MT256x256x32_MI16x16x1_SN_LDSB0_CLR0_GSU0_GSUC0_GSUWGMRR0_K1_LBSPPA512_LBSPPB512_MIWT8_8_PLR0_SU0_SUM0_SUS0_VWA8_VWB8_WGM8_WGMXCC1_WGMXCCGn1
    SolutionIndex: 8
    SolutionNameMin: Cijk_Alik_Bljk_BBS_BH_Bias_AS_SAV_UserArgs_MT256x128x32_MI16x16x1_SN_LDSB1_CLR0_GSU0_GSUC0_GSUWGMRR0_K1_LBSPPA512_LBSPPB256_MIWT8_4_PLR0_SU0_SUM0_SUS0_VWA8_VWB4_WGM1_WGMXCC1_WGMXCCGn1
    SolutionIndex: 9
    SolutionNameMin: Cijk_Alik_Bljk_BBS_BH_Bias_AS_SAV_UserArgs_MT256x128x32_MI16x16x1_SN_LDSB1_CLR0_GSU0_GSUC0_GSUWGMRR0_K1_LBSPPA512_LBSPPB256_MIWT8_4_PLR0_SU0_SUM0_SUS0_VWA8_VWB4_WGM6_WGMXCC1_WGMXCCGn1
    SolutionIndex: 10
    SolutionNameMin: Cijk_Alik_Bljk_BBS_BH_Bias_AS_SAV_UserArgs_MT256x128x32_MI16x16x1_SN_LDSB1_CLR0_GSU0_GSUC0_GSUWGMRR0_K1_LBSPPA512_LBSPPB256_MIWT8_4_PLR0_SU0_SUM0_SUS0_VWA8_VWB4_WGM6_WGMXCC1_WGMXCCGn1
    SolutionIndex: 11
    SolutionNameMin: Cijk_Alik_Bljk_BBS_BH_Bias_AS_SAV_UserArgs_MT256x128x32_MI16x16x1_SN_LDSB1_CLR0_GSU0_GSUC0_GSUWGMRR0_K1_LBSPPA512_LBSPPB256_MIWT8_4_PLR0_SU0_SUM0_SUS0_VWA8_VWB4_WGM8_WGMXCC1_WGMXCCGn1
    SolutionIndex: 12
    SolutionNameMin: Cijk_Alik_Bljk_BBS_BH_Bias_AS_SAV_UserArgs_MT256x128x32_MI16x16x1_SN_LDSB1_CLR0_GSU0_GSUC0_GSUWGMRR0_K1_LBSPPA512_LBSPPB256_MIWT8_4_PLR0_SU0_SUM0_SUS0_VWA8_VWB4_WGM8_WGMXCC1_WGMXCCGn1
    SolutionIndex: 13
    SolutionNameMin: Cijk_Alik_Bljk_BBS_BH_Bias_AS_SAV_UserArgs_MT128x128x32_MI16x16x1_SN_LDSB1_CLR0_GSU0_GSUC0_GSUWGMRR0_K1_LBSPPA256_LBSPPB256_MIWT4_4_PLR0_SU0_SUM0_SUS0_VWA4_VWB4_WGM1_WGMXCC1_WGMXCCGn1
    SolutionIndex: 14
    SolutionNameMin: Cijk_Alik_Bljk_BBS_BH_Bias_AS_SAV_UserArgs_MT128x128x32_MI16x16x1_SN_LDSB1_CLR0_GSU0_GSUC0_GSUWGMRR0_K1_LBSPPA256_LBSPPB256_MIWT4_4_PLR0_SU0_SUM0_SUS0_VWA4_VWB4_WGM1_WGMXCC1_WGMXCCGn1
    SolutionIndex: 15
    SolutionNameMin: Cijk_Alik_Bljk_BBS_BH_Bias_AS_SAV_UserArgs_MT256x256x64_MI16x16x1_SN_LDSB1_CLR1_GSU0_GSUC0_GSUWGMRR0_K1_LBSPPA1024_LBSPPB1024_MIWT8_8_PLR1_SU0_SUM0_SUS0_VWA8_VWB8_WGM1_WGMXCC1_WGMXCCGn1
    SolutionIndex: 16
    SolutionNameMin: Cijk_Alik_Bljk_BBS_BH_Bias_AS_SAV_UserArgs_MT256x256x64_MI16x16x1_SN_LDSB1_CLR1_GSU0_GSUC0_GSUWGMRR0_K1_LBSPPA1024_LBSPPB1024_MIWT8_8_PLR1_SU0_SUM0_SUS0_VWA8_VWB8_WGM1_WGMXCC1_WGMXCCGn1
    SolutionIndex: 17
    SolutionNameMin: Cijk_Alik_Bljk_BBS_BH_Bias_AS_SAV_UserArgs_MT256x256x64_MI16x16x1_SN_LDSB1_CLR1_GSU0_GSUC0_GSUWGMRR0_K1_LBSPPA1024_LBSPPB1024_MIWT8_8_PLR1_SU0_SUM0_SUS0_VWA8_VWB8_WGM1_WGMXCC1_WGMXCCGn1
    SolutionIndex: 18
    SolutionNameMin: Cijk_Alik_Bljk_BBS_BH_Bias_AS_SAV_UserArgs_MT256x256x64_MI16x16x1_SN_LDSB1_CLR1_GSU0_GSUC0_GSUWGMRR0_K1_LBSPPA1024_LBSPPB1024_MIWT8_8_PLR1_SU0_SUM0_SUS0_VWA8_VWB8_WGM6_WGMXCC1_WGMXCCGn1
    SolutionIndex: 19
    SolutionNameMin: Cijk_Alik_Bljk_BBS_BH_Bias_AS_SAV_UserArgs_MT256x256x64_MI16x16x1_SN_LDSB1_CLR1_GSU0_GSUC0_GSUWGMRR0_K1_LBSPPA1024_LBSPPB1024_MIWT8_8_PLR1_SU0_SUM0_SUS0_VWA8_VWB8_WGM6_WGMXCC1_WGMXCCGn1
    SolutionIndex: 20
    SolutionNameMin: Cijk_Alik_Bljk_BBS_BH_Bias_AS_SAV_UserArgs_MT256x256x64_MI16x16x1_SN_LDSB1_CLR1_GSU0_GSUC0_GSUWGMRR0_K1_LBSPPA1024_LBSPPB1024_MIWT8_8_PLR1_SU0_SUM0_SUS0_VWA8_VWB8_WGM6_WGMXCC1_WGMXCCGn1
    SolutionIndex: 21
    SolutionNameMin: Cijk_Alik_Bljk_BBS_BH_Bias_AS_SAV_UserArgs_MT256x256x64_MI16x16x1_SN_LDSB1_CLR1_GSU0_GSUC0_GSUWGMRR0_K1_LBSPPA1024_LBSPPB1024_MIWT8_8_PLR1_SU0_SUM0_SUS0_VWA8_VWB8_WGM6_WGMXCC1_WGMXCCGn1
    SolutionIndex: 22
    SolutionNameMin: Cijk_Alik_Bljk_BBS_BH_Bias_AS_SAV_UserArgs_MT256x256x64_MI16x16x1_SN_LDSB1_CLR1_GSU0_GSUC0_GSUWGMRR0_K1_LBSPPA1024_LBSPPB1024_MIWT8_8_PLR1_SU0_SUM0_SUS0_VWA8_VWB8_WGM6_WGMXCC1_WGMXCCGn1
    SolutionIndex: 23
    SolutionNameMin: Cijk_Alik_Bljk_BBS_BH_Bias_AS_SAV_UserArgs_MT256x256x64_MI16x16x1_SN_LDSB1_CLR1_GSU0_GSUC0_GSUWGMRR0_K1_LBSPPA1024_LBSPPB1024_MIWT8_8_PLR1_SU0_SUM0_SUS0_VWA8_VWB8_WGM6_WGMXCC1_WGMXCCGn1
    SolutionIndex: 24
    SolutionNameMin: Cijk_Alik_Bljk_BBS_BH_Bias_AS_SAV_UserArgs_MT256x256x64_MI16x16x1_SN_LDSB1_CLR1_GSU0_GSUC0_GSUWGMRR0_K1_LBSPPA1024_LBSPPB1024_MIWT8_8_PLR1_SU0_SUM0_SUS0_VWA8_VWB8_WGM6_WGMXCC1_WGMXCCGn1
    SolutionIndex: 25
    SolutionNameMin: Cijk_Alik_Bljk_BBS_BH_Bias_AS_SAV_UserArgs_MT256x256x64_MI16x16x1_SN_LDSB1_CLR1_GSU0_GSUC0_GSUWGMRR0_K1_LBSPPA1024_LBSPPB1024_MIWT8_8_PLR1_SU0_SUM0_SUS0_VWA8_VWB8_WGM6_WGMXCC1_WGMXCCGn1
    SolutionIndex: 26
    SolutionNameMin: Cijk_Alik_Bljk_BBS_BH_Bias_AS_SAV_UserArgs_MT256x256x64_MI16x16x1_SN_LDSB1_CLR1_GSU0_GSUC0_GSUWGMRR0_K1_LBSPPA1024_LBSPPB1024_MIWT8_8_PLR1_SU0_SUM0_SUS0_VWA8_VWB8_WGM8_WGMXCC1_WGMXCCGn1
    SolutionIndex: 27
    SolutionNameMin: Cijk_Alik_Bljk_BBS_BH_Bias_AS_SAV_UserArgs_MT256x256x64_MI16x16x1_SN_LDSB1_CLR1_GSU0_GSUC0_GSUWGMRR0_K1_LBSPPA1024_LBSPPB1024_MIWT8_8_PLR1_SU0_SUM0_SUS0_VWA8_VWB8_WGM8_WGMXCC1_WGMXCCGn1
    SolutionIndex: 28
    SolutionNameMin: Cijk_Alik_Bljk_BBS_BH_Bias_AS_SAV_UserArgs_MT256x256x64_MI16x16x1_SN_LDSB1_CLR1_GSU0_GSUC0_GSUWGMRR0_K1_LBSPPA1024_LBSPPB1024_MIWT8_8_PLR1_SU0_SUM0_SUS0_VWA8_VWB8_WGM8_WGMXCC1_WGMXCCGn1
    SolutionIndex: 29
    SolutionNameMin: Cijk_Alik_Bljk_BBS_BH_Bias_AS_SAV_UserArgs_MT128x256x64_MI16x16x1_SN_LDSB1_CLR1_GSU0_GSUC0_GSUWGMRR0_K1_LBSPPA512_LBSPPB1024_MIWT4_8_PLR1_SU0_SUM0_SUS0_VWA4_VWB8_WGM6_WGMXCC1_WGMXCCGn1
    SolutionIndex: 30
    SolutionNameMin: Cijk_Alik_Bljk_BBS_BH_Bias_AS_SAV_UserArgs_MT128x256x64_MI16x16x1_SN_LDSB1_CLR1_GSU0_GSUC0_GSUWGMRR0_K1_LBSPPA512_LBSPPB1024_MIWT4_8_PLR1_SU0_SUM0_SUS0_VWA4_VWB8_WGM6_WGMXCC1_WGMXCCGn1
    SolutionIndex: 31
    SolutionNameMin: Cijk_Alik_Bljk_BBS_BH_Bias_AS_SAV_UserArgs_MT128x256x64_MI16x16x1_SN_LDSB1_CLR1_GSU0_GSUC0_GSUWGMRR0_K1_LBSPPA512_LBSPPB1024_MIWT4_8_PLR1_SU0_SUM0_SUS0_VWA4_VWB8_WGM8_WGMXCC1_WGMXCCGn1
    SolutionIndex: 32
    SolutionNameMin: Cijk_Alik_Bljk_BBS_BH_Bias_AS_SAV_UserArgs_MT256x128x64_MI16x16x1_SN_LDSB1_CLR1_GSU0_GSUC0_GSUWGMRR0_K1_LBSPPA1024_LBSPPB512_MIWT8_4_PLR1_SU0_SUM0_SUS0_VWA8_VWB4_WGM1_WGMXCC1_WGMXCCGn1
    SolutionIndex: 33
    SolutionNameMin: Cijk_Alik_Bljk_BBS_BH_Bias_AS_SAV_UserArgs_MT256x128x64_MI16x16x1_SN_LDSB1_CLR1_GSU0_GSUC0_GSUWGMRR0_K1_LBSPPA1024_LBSPPB512_MIWT8_4_PLR1_SU0_SUM0_SUS0_VWA8_VWB4_WGM6_WGMXCC1_WGMXCCGn1
    SolutionIndex: 34
    SolutionNameMin: Cijk_Alik_Bljk_BBS_BH_Bias_AS_SAV_UserArgs_MT256x128x64_MI16x16x1_SN_LDSB1_CLR1_GSU0_GSUC0_GSUWGMRR0_K1_LBSPPA1024_LBSPPB512_MIWT8_4_PLR1_SU0_SUM0_SUS0_VWA8_VWB4_WGM8_WGMXCC1_WGMXCCGn1
    SolutionIndex: 35
    SolutionNameMin: Cijk_Alik_Bljk_BBS_BH_Bias_AS_SAV_UserArgs_MT128x128x64_MI16x16x1_SN_LDSB1_CLR1_GSU0_GSUC0_GSUWGMRR0_K1_LBSPPA512_LBSPPB512_MIWT4_4_PLR1_SU0_SUM0_SUS0_VWA4_VWB4_WGM1_WGMXCC1_WGMXCCGn1
    SolutionIndex: 36
    SolutionNameMin: Cijk_Alik_Bljk_BBS_BH_Bias_AS_SAV_UserArgs_MT128x128x64_MI16x16x1_SN_LDSB1_CLR1_GSU0_GSUC0_GSUWGMRR0_K1_LBSPPA512_LBSPPB512_MIWT4_4_PLR1_SU0_SUM0_SUS0_VWA4_VWB4_WGM1_WGMXCC1_WGMXCCGn1
    SolutionIndex: 37
    SolutionNameMin: Cijk_Alik_Bljk_BBS_BH_Bias_AS_SAV_UserArgs_MT128x128x64_MI16x16x1_SN_LDSB1_CLR1_GSU0_GSUC0_GSUWGMRR0_K1_LBSPPA512_LBSPPB512_MIWT4_4_PLR1_SU0_SUM0_SUS0_VWA4_VWB4_WGM8_WGMXCC1_WGMXCCGn1
    SolutionIndex: 38
    SolutionNameMin: Cijk_Alik_Bljk_BBS_BH_Bias_AS_SAV_UserArgs_MT256x256x64_MI32x32x1_SN_LDSB1_CLR1_GSU0_GSUC0_GSUWGMRR0_K1_LBSPPA512_LBSPPB512_MIWT4_4_PLR1_SU0_SUM0_SUS0_VWA4_VWB4_WGM6_WGMXCC1_WGMXCCGn1
    SolutionIndex: 39
    SolutionNameMin: Cijk_Alik_Bljk_BBS_BH_Bias_AS_SAV_UserArgs_MT256x256x64_MI32x32x1_SN_LDSB1_CLR1_GSU0_GSUC0_GSUWGMRR0_K1_LBSPPA512_LBSPPB512_MIWT4_4_PLR1_SU0_SUM0_SUS0_VWA4_VWB4_WGM6_WGMXCC1_WGMXCCGn1
    SolutionIndex: 40
    SolutionNameMin: Cijk_Alik_Bljk_BBS_BH_Bias_AS_SAV_UserArgs_MT256x256x64_MI32x32x1_SN_LDSB1_CLR1_GSU0_GSUC0_GSUWGMRR0_K1_LBSPPA512_LBSPPB512_MIWT4_4_PLR1_SU0_SUM0_SUS0_VWA4_VWB4_WGM8_WGMXCC1_WGMXCCGn1
    SolutionIndex: 41
    SolutionNameMin: Cijk_Alik_Bljk_BBS_BH_Bias_AS_SAV_UserArgs_MT256x256x64_MI32x32x1_SN_LDSB1_CLR1_GSU0_GSUC0_GSUWGMRR0_K1_LBSPPA512_LBSPPB512_MIWT4_4_PLR1_SU0_SUM0_SUS0_VWA4_VWB4_WGM8_WGMXCC1_WGMXCCGn1
    SolutionIndex: 42
    SolutionNameMin: Cijk_Alik_Bljk_BBS_BH_Bias_AS_SAV_UserArgs_MT256x256x64_MI32x32x1_SN_LDSB1_CLR1_GSU0_GSUC0_GSUWGMRR0_K1_LBSPPA512_LBSPPB512_MIWT4_4_PLR1_SU0_SUM0_SUS0_VWA4_VWB4_WGM8_WGMXCC1_WGMXCCGn1
    SolutionIndex: 43
    SolutionNameMin: Cijk_Alik_Bljk_BBS_BH_Bias_AS_SAV_UserArgs_MT128x256x64_MI32x32x1_SN_LDSB1_CLR1_GSU0_GSUC0_GSUWGMRR0_K1_LBSPPA256_LBSPPB512_MIWT2_4_PLR1_SU0_SUM0_SUS0_VWA2_VWB4_WGM8_WGMXCC1_WGMXCCGn1
    SolutionIndex: 44
    SolutionNameMin: Cijk_Alik_Bljk_BBS_BH_Bias_AS_SAV_UserArgs_MT128x128x128_MI16x16x1_SN_LDSB1_CLR1_GSU0_GSUC0_GSUWGMRR0_K1_LBSPPA1024_LBSPPB1024_MIWT4_4_PLR1_SU0_SUM0_SUS0_VWA4_VWB4_WGM1_WGMXCC1_WGMXCCGn1
    SolutionIndex: 45
    SolutionNameMin: Cijk_Alik_Bljk_BBS_BH_Bias_AS_SAV_UserArgs_MT128x128x128_MI16x16x1_SN_LDSB1_CLR1_GSU0_GSUC0_GSUWGMRR0_K1_LBSPPA1024_LBSPPB1024_MIWT4_4_PLR1_SU0_SUM0_SUS0_VWA4_VWB4_WGM1_WGMXCC1_WGMXCCGn1
    SolutionIndex: 46
    SolutionNameMin: Cijk_Alik_Bljk_BBS_BH_Bias_AS_SAV_UserArgs_MT128x128x128_MI16x16x1_SN_LDSB1_CLR1_GSU0_GSUC0_GSUWGMRR0_K1_LBSPPA1024_LBSPPB1024_MIWT4_4_PLR1_SU0_SUM0_SUS0_VWA4_VWB4_WGM1_WGMXCC1_WGMXCCGn1
    SolutionIndex: 47
    SolutionNameMin: Cijk_Alik_Bljk_BBS_BH_Bias_AS_SAV_UserArgs_MT128x128x128_MI16x16x1_SN_LDSB1_CLR1_GSU0_GSUC0_GSUWGMRR0_K1_LBSPPA1024_LBSPPB1024_MIWT4_4_PLR1_SU0_SUM0_SUS0_VWA4_VWB4_WGM1_WGMXCC1_WGMXCCGn1
    SolutionIndex: 48
    SolutionNameMin: Cijk_Alik_Bljk_BBS_BH_Bias_AS_SAV_UserArgs_MT128x128x128_MI16x16x1_SN_LDSB1_CLR1_GSU0_GSUC0_GSUWGMRR0_K1_LBSPPA1024_LBSPPB1024_MIWT4_4_PLR1_SU0_SUM0_SUS0_VWA4_VWB4_WGM6_WGMXCC1_WGMXCCGn1
    SolutionIndex: 49
    SolutionNameMin: Cijk_Alik_Bljk_BBS_BH_Bias_AS_SAV_UserArgs_MT128x128x128_MI16x16x1_SN_LDSB1_CLR1_GSU0_GSUC0_GSUWGMRR0_K1_LBSPPA1024_LBSPPB1024_MIWT4_4_PLR1_SU0_SUM0_SUS0_VWA4_VWB4_WGM6_WGMXCC1_WGMXCCGn1
    SolutionIndex: 50
    SolutionNameMin: Cijk_Alik_Bljk_BBS_BH_Bias_AS_SAV_UserArgs_MT128x128x128_MI16x16x1_SN_LDSB1_CLR1_GSU0_GSUC0_GSUWGMRR0_K1_LBSPPA1024_LBSPPB1024_MIWT4_4_PLR1_SU0_SUM0_SUS0_VWA4_VWB4_WGM6_WGMXCC1_WGMXCCGn1
    SolutionIndex: 51
    SolutionNameMin: Cijk_Alik_Bljk_BBS_BH_Bias_AS_SAV_UserArgs_MT128x128x128_MI16x16x1_SN_LDSB1_CLR1_GSU0_GSUC0_GSUWGMRR0_K1_LBSPPA1024_LBSPPB1024_MIWT4_4_PLR1_SU0_SUM0_SUS0_VWA4_VWB4_WGM6_WGMXCC1_WGMXCCGn1
    SolutionIndex: 52
    SolutionNameMin: Cijk_Alik_Bljk_BBS_BH_Bias_AS_SAV_UserArgs_MT128x128x128_MI16x16x1_SN_LDSB1_CLR1_GSU0_GSUC0_GSUWGMRR0_K1_LBSPPA1024_LBSPPB1024_MIWT4_4_PLR1_SU0_SUM0_SUS0_VWA4_VWB4_WGM6_WGMXCC1_WGMXCCGn1
    SolutionIndex: 53
    SolutionNameMin: Cijk_Alik_Bljk_BBS_BH_Bias_AS_SAV_UserArgs_MT128x128x128_MI16x16x1_SN_LDSB1_CLR1_GSU0_GSUC0_GSUWGMRR0_K1_LBSPPA1024_LBSPPB1024_MIWT4_4_PLR1_SU0_SUM0_SUS0_VWA4_VWB4_WGM8_WGMXCC1_WGMXCCGn1
    SolutionIndex: 54
    SolutionNameMin: Cijk_Alik_Bljk_BBS_BH_Bias_AS_SAV_UserArgs_MT128x128x128_MI16x16x1_SN_LDSB1_CLR1_GSU0_GSUC0_GSUWGMRR0_K1_LBSPPA1024_LBSPPB1024_MIWT4_4_PLR1_SU0_SUM0_SUS0_VWA4_VWB4_WGM8_WGMXCC1_WGMXCCGn1
    SolutionIndex: 55
    SolutionNameMin: Cijk_Alik_Bljk_BBS_BH_Bias_AS_SAV_UserArgs_MT128x128x128_MI16x16x1_SN_LDSB1_CLR1_GSU0_GSUC0_GSUWGMRR0_K1_LBSPPA1024_LBSPPB1024_MIWT4_4_PLR1_SU0_SUM0_SUS0_VWA4_VWB4_WGM8_WGMXCC1_WGMXCCGn1
    SolutionIndex: 56
    SolutionNameMin: Cijk_Alik_Bljk_BBS_BH_Bias_AS_SAV_UserArgs_MT128x128x128_MI16x16x1_SN_LDSB1_CLR1_GSU0_GSUC0_GSUWGMRR0_K1_LBSPPA1024_LBSPPB1024_MIWT4_4_PLR1_SU0_SUM0_SUS0_VWA4_VWB4_WGM8_WGMXCC1_WGMXCCGn1
    SolutionIndex: 57
    SolutionNameMin: Cijk_Alik_Bljk_BBS_BH_Bias_AS_SAV_UserArgs_MT128x128x128_MI16x16x1_SN_LDSB1_CLR1_GSU0_GSUC0_GSUWGMRR0_K1_LBSPPA1024_LBSPPB1024_MIWT4_4_PLR1_SU0_SUM0_SUS0_VWA4_VWB4_WGM8_WGMXCC1_WGMXCCGn1
    SolutionIndex: 58
    SolutionNameMin: Cijk_Alik_Bljk_BBS_BH_Bias_AS_SAV_UserArgs_MT64x128x128_MI16x16x1_SN_LDSB1_CLR1_GSU0_GSUC0_GSUWGMRR0_K1_LBSPPA512_LBSPPB1024_MIWT2_4_PLR1_SU0_SUM0_SUS0_VWA2_VWB4_WGM1_WGMXCC1_WGMXCCGn1
    SolutionIndex: 59
    SolutionNameMin: Cijk_Alik_Bljk_BBS_BH_Bias_AS_SAV_UserArgs_MT64x128x128_MI16x16x1_SN_LDSB1_CLR1_GSU0_GSUC0_GSUWGMRR0_K1_LBSPPA512_LBSPPB1024_MIWT2_4_PLR1_SU0_SUM0_SUS0_VWA2_VWB4_WGM1_WGMXCC1_WGMXCCGn1
    SolutionIndex: 60
    SolutionNameMin: Cijk_Alik_Bljk_BBS_BH_Bias_AS_SAV_UserArgs_MT64x128x128_MI16x16x1_SN_LDSB1_CLR1_GSU0_GSUC0_GSUWGMRR0_K1_LBSPPA512_LBSPPB1024_MIWT2_4_PLR1_SU0_SUM0_SUS0_VWA2_VWB4_WGM1_WGMXCC1_WGMXCCGn1
    SolutionIndex: 61
    SolutionNameMin: Cijk_Alik_Bljk_BBS_BH_Bias_AS_SAV_UserArgs_MT64x128x128_MI16x16x1_SN_LDSB1_CLR1_GSU0_GSUC0_GSUWGMRR0_K1_LBSPPA512_LBSPPB1024_MIWT2_4_PLR1_SU0_SUM0_SUS0_VWA2_VWB4_WGM1_WGMXCC1_WGMXCCGn1
    SolutionIndex: 62
    SolutionNameMin: Cijk_Alik_Bljk_BBS_BH_Bias_AS_SAV_UserArgs_MT64x128x128_MI16x16x1_SN_LDSB1_CLR1_GSU0_GSUC0_GSUWGMRR0_K1_LBSPPA512_LBSPPB1024_MIWT2_4_PLR1_SU0_SUM0_SUS0_VWA2_VWB4_WGM6_WGMXCC1_WGMXCCGn1
    SolutionIndex: 63
    SolutionNameMin: Cijk_Alik_Bljk_BBS_BH_Bias_AS_SAV_UserArgs_MT64x128x128_MI16x16x1_SN_LDSB1_CLR1_GSU0_GSUC0_GSUWGMRR0_K1_LBSPPA512_LBSPPB1024_MIWT2_4_PLR1_SU0_SUM0_SUS0_VWA2_VWB4_WGM6_WGMXCC1_WGMXCCGn1
    SolutionIndex: 64
    SolutionNameMin: Cijk_Alik_Bljk_BBS_BH_Bias_AS_SAV_UserArgs_MT64x128x128_MI16x16x1_SN_LDSB1_CLR1_GSU0_GSUC0_GSUWGMRR0_K1_LBSPPA512_LBSPPB1024_MIWT2_4_PLR1_SU0_SUM0_SUS0_VWA2_VWB4_WGM8_WGMXCC1_WGMXCCGn1
    SolutionIndex: 65
    SolutionNameMin: Cijk_Alik_Bljk_BBS_BH_Bias_AS_SAV_UserArgs_MT64x128x128_MI16x16x1_SN_LDSB1_CLR1_GSU0_GSUC0_GSUWGMRR0_K1_LBSPPA512_LBSPPB1024_MIWT2_4_PLR1_SU0_SUM0_SUS0_VWA2_VWB4_WGM8_WGMXCC1_WGMXCCGn1
    SolutionIndex: 66
    SolutionNameMin: Cijk_Alik_Bljk_BBS_BH_Bias_AS_SAV_UserArgs_MT64x128x128_MI16x16x1_SN_LDSB1_CLR1_GSU0_GSUC0_GSUWGMRR0_K1_LBSPPA512_LBSPPB1024_MIWT2_4_PLR1_SU0_SUM0_SUS0_VWA2_VWB4_WGM8_WGMXCC1_WGMXCCGn1
    SolutionIndex: 67
    SolutionNameMin: Cijk_Alik_Bljk_BBS_BH_Bias_AS_SAV_UserArgs_MT128x64x128_MI16x16x1_SN_LDSB1_CLR1_GSU0_GSUC0_GSUWGMRR0_K1_LBSPPA1024_LBSPPB512_MIWT4_2_PLR1_SU0_SUM0_SUS0_VWA4_VWB2_WGM1_WGMXCC1_WGMXCCGn1
    SolutionIndex: 68
    SolutionNameMin: Cijk_Alik_Bljk_BBS_BH_Bias_AS_SAV_UserArgs_MT128x64x128_MI16x16x1_SN_LDSB1_CLR1_GSU0_GSUC0_GSUWGMRR0_K1_LBSPPA1024_LBSPPB512_MIWT4_2_PLR1_SU0_SUM0_SUS0_VWA4_VWB2_WGM1_WGMXCC1_WGMXCCGn1
    SolutionIndex: 69
    SolutionNameMin: Cijk_Alik_Bljk_BBS_BH_Bias_AS_SAV_UserArgs_MT128x64x128_MI16x16x1_SN_LDSB1_CLR1_GSU0_GSUC0_GSUWGMRR0_K1_LBSPPA1024_LBSPPB512_MIWT4_2_PLR1_SU0_SUM0_SUS0_VWA4_VWB2_WGM1_WGMXCC1_WGMXCCGn1
    SolutionIndex: 70
    SolutionNameMin: Cijk_Alik_Bljk_BBS_BH_Bias_AS_SAV_UserArgs_MT128x64x128_MI16x16x1_SN_LDSB1_CLR1_GSU0_GSUC0_GSUWGMRR0_K1_LBSPPA1024_LBSPPB512_MIWT4_2_PLR1_SU0_SUM0_SUS0_VWA4_VWB2_WGM1_WGMXCC1_WGMXCCGn1
    SolutionIndex: 71
    SolutionNameMin: Cijk_Alik_Bljk_BBS_BH_Bias_AS_SAV_UserArgs_MT128x64x128_MI16x16x1_SN_LDSB1_CLR1_GSU0_GSUC0_GSUWGMRR0_K1_LBSPPA1024_LBSPPB512_MIWT4_2_PLR1_SU0_SUM0_SUS0_VWA4_VWB2_WGM6_WGMXCC1_WGMXCCGn1
    SolutionIndex: 72
    SolutionNameMin: Cijk_Alik_Bljk_BBS_BH_Bias_AS_SAV_UserArgs_MT128x64x128_MI16x16x1_SN_LDSB1_CLR1_GSU0_GSUC0_GSUWGMRR0_K1_LBSPPA1024_LBSPPB512_MIWT4_2_PLR1_SU0_SUM0_SUS0_VWA4_VWB2_WGM6_WGMXCC1_WGMXCCGn1
    SolutionIndex: 73
    SolutionNameMin: Cijk_Alik_Bljk_BBS_BH_Bias_AS_SAV_UserArgs_MT128x64x128_MI16x16x1_SN_LDSB1_CLR1_GSU0_GSUC0_GSUWGMRR0_K1_LBSPPA1024_LBSPPB512_MIWT4_2_PLR1_SU0_SUM0_SUS0_VWA4_VWB2_WGM6_WGMXCC1_WGMXCCGn1
    SolutionIndex: 74
    SolutionNameMin: Cijk_Alik_Bljk_BBS_BH_Bias_AS_SAV_UserArgs_MT128x64x128_MI16x16x1_SN_LDSB1_CLR1_GSU0_GSUC0_GSUWGMRR0_K1_LBSPPA1024_LBSPPB512_MIWT4_2_PLR1_SU0_SUM0_SUS0_VWA4_VWB2_WGM6_WGMXCC1_WGMXCCGn1
    SolutionIndex: 75
    SolutionNameMin: Cijk_Alik_Bljk_BBS_BH_Bias_AS_SAV_UserArgs_MT128x64x128_MI16x16x1_SN_LDSB1_CLR1_GSU0_GSUC0_GSUWGMRR0_K1_LBSPPA1024_LBSPPB512_MIWT4_2_PLR1_SU0_SUM0_SUS0_VWA4_VWB2_WGM8_WGMXCC1_WGMXCCGn1
    SolutionIndex: 76
    SolutionNameMin: Cijk_Alik_Bljk_BBS_BH_Bias_AS_SAV_UserArgs_MT128x64x128_MI16x16x1_SN_LDSB1_CLR1_GSU0_GSUC0_GSUWGMRR0_K1_LBSPPA1024_LBSPPB512_MIWT4_2_PLR1_SU0_SUM0_SUS0_VWA4_VWB2_WGM8_WGMXCC1_WGMXCCGn1
    SolutionIndex: 77
    SolutionNameMin: Cijk_Alik_Bljk_BBS_BH_Bias_AS_SAV_UserArgs_MT64x64x128_MI16x16x1_SN_LDSB1_CLR1_GSU0_GSUC0_GSUWGMRR0_K1_LBSPPA512_LBSPPB512_MIWT2_2_PLR1_SU0_SUM0_SUS0_VWA2_VWB2_WGM1_WGMXCC1_WGMXCCGn1
    SolutionIndex: 78
    SolutionNameMin: Cijk_Alik_Bljk_BBS_BH_Bias_AS_SAV_UserArgs_MT64x64x128_MI16x16x1_SN_LDSB1_CLR1_GSU0_GSUC0_GSUWGMRR0_K1_LBSPPA512_LBSPPB512_MIWT2_2_PLR1_SU0_SUM0_SUS0_VWA2_VWB2_WGM1_WGMXCC1_WGMXCCGn1
    SolutionIndex: 79
    SolutionNameMin: Cijk_Alik_Bljk_BBS_BH_Bias_AS_SAV_UserArgs_MT64x64x128_MI16x16x1_SN_LDSB1_CLR1_GSU0_GSUC0_GSUWGMRR0_K1_LBSPPA512_LBSPPB512_MIWT2_2_PLR1_SU0_SUM0_SUS0_VWA2_VWB2_WGM1_WGMXCC1_WGMXCCGn1
    SolutionIndex: 80
    SolutionNameMin: Cijk_Alik_Bljk_BBS_BH_Bias_AS_SAV_UserArgs_MT64x64x128_MI16x16x1_SN_LDSB1_CLR1_GSU0_GSUC0_GSUWGMRR0_K1_LBSPPA512_LBSPPB512_MIWT2_2_PLR1_SU0_SUM0_SUS0_VWA2_VWB2_WGM1_WGMXCC1_WGMXCCGn1
    SolutionIndex: 81
    SolutionNameMin: Cijk_Alik_Bljk_BBS_BH_Bias_AS_SAV_UserArgs_MT64x64x128_MI16x16x1_SN_LDSB1_CLR1_GSU0_GSUC0_GSUWGMRR0_K1_LBSPPA512_LBSPPB512_MIWT2_2_PLR1_SU0_SUM0_SUS0_VWA2_VWB2_WGM6_WGMXCC1_WGMXCCGn1
    SolutionIndex: 82
    SolutionNameMin: Cijk_Alik_Bljk_BBS_BH_Bias_AS_SAV_UserArgs_MT64x64x128_MI16x16x1_SN_LDSB1_CLR1_GSU0_GSUC0_GSUWGMRR0_K1_LBSPPA512_LBSPPB512_MIWT2_2_PLR1_SU0_SUM0_SUS0_VWA2_VWB2_WGM6_WGMXCC1_WGMXCCGn1
    SolutionIndex: 83
    SolutionNameMin: Cijk_Alik_Bljk_BBS_BH_Bias_AS_SAV_UserArgs_MT64x64x128_MI16x16x1_SN_LDSB1_CLR1_GSU0_GSUC0_GSUWGMRR0_K1_LBSPPA512_LBSPPB512_MIWT2_2_PLR1_SU0_SUM0_SUS0_VWA2_VWB2_WGM8_WGMXCC1_WGMXCCGn1
    SolutionIndex: 84
    SolutionNameMin: Cijk_Alik_Bljk_BBS_BH_Bias_AS_SAV_UserArgs_MT64x64x128_MI16x16x1_SN_LDSB1_CLR1_GSU0_GSUC0_GSUWGMRR0_K1_LBSPPA512_LBSPPB512_MIWT2_2_PLR1_SU0_SUM0_SUS0_VWA2_VWB2_WGM8_WGMXCC1_WGMXCCGn1
    SolutionIndex: 85
    SolutionNameMin: Cijk_Alik_Bljk_BBS_BH_Bias_AS_SAV_UserArgs_MT64x64x128_MI16x16x1_SN_LDSB1_CLR1_GSU0_GSUC0_GSUWGMRR0_K1_LBSPPA512_LBSPPB512_MIWT2_2_PLR1_SU0_SUM0_SUS0_VWA2_VWB2_WGM8_WGMXCC1_WGMXCCGn1
    SolutionIndex: 86
    SolutionNameMin: Cijk_Alik_Bljk_BBS_BH_Bias_AS_SAV_UserArgs_MT32x64x128_MI16x16x1_SN_LDSB1_CLR1_GSU0_GSUC0_GSUWGMRR0_K1_LBSPPA256_LBSPPB512_MIWT1_2_PLR1_SU0_SUM0_SUS0_VWA1_VWB2_WGM1_WGMXCC1_WGMXCCGn1
    SolutionIndex: 87
    SolutionNameMin: Cijk_Alik_Bljk_BBS_BH_Bias_AS_SAV_UserArgs_MT32x64x128_MI16x16x1_SN_LDSB1_CLR1_GSU0_GSUC0_GSUWGMRR0_K1_LBSPPA256_LBSPPB512_MIWT1_2_PLR1_SU0_SUM0_SUS0_VWA1_VWB2_WGM6_WGMXCC1_WGMXCCGn1
    SolutionIndex: 88
    SolutionNameMin: Cijk_Alik_Bljk_BBS_BH_Bias_AS_SAV_UserArgs_MT32x64x128_MI16x16x1_SN_LDSB1_CLR1_GSU0_GSUC0_GSUWGMRR0_K1_LBSPPA256_LBSPPB512_MIWT1_2_PLR1_SU0_SUM0_SUS0_VWA1_VWB2_WGM8_WGMXCC1_WGMXCCGn1
    SolutionIndex: 89
    SolutionNameMin: Cijk_Alik_Bljk_BBS_BH_Bias_AS_SAV_UserArgs_MT64x32x128_MI16x16x1_SN_LDSB1_CLR1_GSU0_GSUC0_GSUWGMRR0_K1_LBSPPA512_LBSPPB256_MIWT2_1_PLR1_SU0_SUM0_SUS0_VWA2_VWB1_WGM1_WGMXCC1_WGMXCCGn1
    SolutionIndex: 90
    SolutionNameMin: Cijk_Alik_Bljk_BBS_BH_Bias_AS_SAV_UserArgs_MT64x32x128_MI16x16x1_SN_LDSB1_CLR1_GSU0_GSUC0_GSUWGMRR0_K1_LBSPPA512_LBSPPB256_MIWT2_1_PLR1_SU0_SUM0_SUS0_VWA2_VWB1_WGM1_WGMXCC1_WGMXCCGn1
    SolutionIndex: 91
    SolutionNameMin: Cijk_Alik_Bljk_BBS_BH_Bias_AS_SAV_UserArgs_MT32x32x128_MI16x16x1_SN_LDSB1_CLR1_GSU0_GSUC0_GSUWGMRR0_K1_LBSPPA256_LBSPPB256_MIWT1_1_PLR1_SU0_SUM0_SUS0_VWA1_VWB1_WGM1_WGMXCC1_WGMXCCGn1
    SolutionIndex: 92
    SolutionNameMin: Cijk_Alik_Bljk_BBS_BH_Bias_AS_SAV_UserArgs_MT32x32x128_MI16x16x1_SN_LDSB1_CLR1_GSU0_GSUC0_GSUWGMRR0_K1_LBSPPA256_LBSPPB256_MIWT1_1_PLR1_SU0_SUM0_SUS0_VWA1_VWB1_WGM1_WGMXCC1_WGMXCCGn1
    SolutionIndex: 93
    SolutionNameMin: Cijk_Alik_Bljk_BBS_BH_Bias_AS_SAV_UserArgs_MT32x32x128_MI16x16x1_SN_LDSB1_CLR1_GSU0_GSUC0_GSUWGMRR0_K1_LBSPPA256_LBSPPB256_MIWT1_1_PLR1_SU0_SUM0_SUS0_VWA1_VWB1_WGM1_WGMXCC1_WGMXCCGn1
    SolutionIndex: 94
    SolutionNameMin: Cijk_Alik_Bljk_BBS_BH_Bias_AS_SAV_UserArgs_MT32x32x128_MI16x16x1_SN_LDSB1_CLR1_GSU0_GSUC0_GSUWGMRR0_K1_LBSPPA256_LBSPPB256_MIWT1_1_PLR1_SU0_SUM0_SUS0_VWA1_VWB1_WGM8_WGMXCC1_WGMXCCGn1
    SolutionIndex: 95
    SolutionNameMin: Cijk_Alik_Bljk_BBS_BH_Bias_AS_SAV_UserArgs_MT32x32x128_MI16x16x1_SN_LDSB1_CLR1_GSU0_GSUC0_GSUWGMRR0_K1_LBSPPA256_LBSPPB256_MIWT1_1_PLR1_SU0_SUM0_SUS0_VWA1_VWB1_WGM8_WGMXCC1_WGMXCCGn1
    SolutionIndex: 96
    SolutionNameMin: Cijk_Alik_Bljk_BBS_BH_Bias_AS_SAV_UserArgs_MT128x128x128_MI32x32x1_SN_LDSB1_CLR1_GSU0_GSUC0_GSUWGMRR0_K1_LBSPPA512_LBSPPB512_MIWT2_2_PLR1_SU0_SUM0_SUS0_VWA2_VWB2_WGM1_WGMXCC1_WGMXCCGn1
    SolutionIndex: 97
    SolutionNameMin: Cijk_Alik_Bljk_BBS_BH_Bias_AS_SAV_UserArgs_MT128x64x128_MI32x32x1_SN_LDSB1_CLR1_GSU0_GSUC0_GSUWGMRR0_K1_LBSPPA512_LBSPPB256_MIWT2_1_PLR1_SU0_SUM0_SUS0_VWA2_VWB1_WGM8_WGMXCC1_WGMXCCGn1
    SolutionIndex: 98
    SolutionNameMin: Cijk_Alik_Bljk_BBS_BH_Bias_AS_SAV_UserArgs_MT64x64x128_MI32x32x1_SN_LDSB1_CLR1_GSU0_GSUC0_GSUWGMRR0_K1_LBSPPA256_LBSPPB256_MIWT1_1_PLR1_SU0_SUM0_SUS0_VWA1_VWB1_WGM1_WGMXCC1_WGMXCCGn1
    SolutionIndex: 99
    SolutionNameMin: Cijk_Alik_Bljk_BBS_BH_Bias_AS_SAV_UserArgs_MT64x64x256_MI16x16x1_SN_LDSB1_CLR1_GSU0_GSUC0_GSUWGMRR0_K1_LBSPPA1024_LBSPPB1024_MIWT2_2_PLR1_SU0_SUM0_SUS0_VWA2_VWB2_WGM1_WGMXCC1_WGMXCCGn1
    SolutionIndex: 100
    SolutionNameMin: Cijk_Alik_Bljk_BBS_BH_Bias_AS_SAV_UserArgs_MT64x64x256_MI16x16x1_SN_LDSB1_CLR1_GSU0_GSUC0_GSUWGMRR0_K1_LBSPPA1024_LBSPPB1024_MIWT2_2_PLR1_SU0_SUM0_SUS0_VWA2_VWB2_WGM1_WGMXCC1_WGMXCCGn1
    SolutionIndex: 101
    SolutionNameMin: Cijk_Alik_Bljk_BBS_BH_Bias_AS_SAV_UserArgs_MT64x64x256_MI16x16x1_SN_LDSB1_CLR1_GSU0_GSUC0_GSUWGMRR0_K1_LBSPPA1024_LBSPPB1024_MIWT2_2_PLR1_SU0_SUM0_SUS0_VWA2_VWB2_WGM1_WGMXCC1_WGMXCCGn1
    SolutionIndex: 102
    SolutionNameMin: Cijk_Alik_Bljk_BBS_BH_Bias_AS_SAV_UserArgs_MT64x64x256_MI16x16x1_SN_LDSB1_CLR1_GSU0_GSUC0_GSUWGMRR0_K1_LBSPPA1024_LBSPPB1024_MIWT2_2_PLR1_SU0_SUM0_SUS0_VWA2_VWB2_WGM1_WGMXCC1_WGMXCCGn1
    SolutionIndex: 103
    SolutionNameMin: Cijk_Alik_Bljk_BBS_BH_Bias_AS_SAV_UserArgs_MT64x64x256_MI16x16x1_SN_LDSB1_CLR1_GSU0_GSUC0_GSUWGMRR0_K1_LBSPPA1024_LBSPPB1024_MIWT2_2_PLR1_SU0_SUM0_SUS0_VWA2_VWB2_WGM1_WGMXCC1_WGMXCCGn1
    SolutionIndex: 104
    SolutionNameMin: Cijk_Alik_Bljk_BBS_BH_Bias_AS_SAV_UserArgs_MT64x64x256_MI16x16x1_SN_LDSB1_CLR1_GSU0_GSUC0_GSUWGMRR0_K1_LBSPPA1024_LBSPPB1024_MIWT2_2_PLR1_SU0_SUM0_SUS0_VWA2_VWB2_WGM1_WGMXCC1_WGMXCCGn1
    SolutionIndex: 105
    SolutionNameMin: Cijk_Alik_Bljk_BBS_BH_Bias_AS_SAV_UserArgs_MT64x64x256_MI16x16x1_SN_LDSB1_CLR1_GSU0_GSUC0_GSUWGMRR0_K1_LBSPPA1024_LBSPPB1024_MIWT2_2_PLR1_SU0_SUM0_SUS0_VWA2_VWB2_WGM1_WGMXCC1_WGMXCCGn1
    SolutionIndex: 106
    SolutionNameMin: Cijk_Alik_Bljk_BBS_BH_Bias_AS_SAV_UserArgs_MT64x64x256_MI16x16x1_SN_LDSB1_CLR1_GSU0_GSUC0_GSUWGMRR0_K1_LBSPPA1024_LBSPPB1024_MIWT2_2_PLR1_SU0_SUM0_SUS0_VWA2_VWB2_WGM1_WGMXCC1_WGMXCCGn1
    SolutionIndex: 107
    SolutionNameMin: Cijk_Alik_Bljk_BBS_BH_Bias_AS_SAV_UserArgs_MT64x64x256_MI16x16x1_SN_LDSB1_CLR1_GSU0_GSUC0_GSUWGMRR0_K1_LBSPPA1024_LBSPPB1024_MIWT2_2_PLR1_SU0_SUM0_SUS0_VWA2_VWB2_WGM6_WGMXCC1_WGMXCCGn1
    SolutionIndex: 108
    SolutionNameMin: Cijk_Alik_Bljk_BBS_BH_Bias_AS_SAV_UserArgs_MT64x64x256_MI16x16x1_SN_LDSB1_CLR1_GSU0_GSUC0_GSUWGMRR0_K1_LBSPPA1024_LBSPPB1024_MIWT2_2_PLR1_SU0_SUM0_SUS0_VWA2_VWB2_WGM6_WGMXCC1_WGMXCCGn1
    SolutionIndex: 109
    SolutionNameMin: Cijk_Alik_Bljk_BBS_BH_Bias_AS_SAV_UserArgs_MT64x64x256_MI16x16x1_SN_LDSB1_CLR1_GSU0_GSUC0_GSUWGMRR0_K1_LBSPPA1024_LBSPPB1024_MIWT2_2_PLR1_SU0_SUM0_SUS0_VWA2_VWB2_WGM6_WGMXCC1_WGMXCCGn1
    SolutionIndex: 110
    SolutionNameMin: Cijk_Alik_Bljk_BBS_BH_Bias_AS_SAV_UserArgs_MT64x64x256_MI16x16x1_SN_LDSB1_CLR1_GSU0_GSUC0_GSUWGMRR0_K1_LBSPPA1024_LBSPPB1024_MIWT2_2_PLR1_SU0_SUM0_SUS0_VWA2_VWB2_WGM6_WGMXCC1_WGMXCCGn1
    SolutionIndex: 111
    SolutionNameMin: Cijk_Alik_Bljk_BBS_BH_Bias_AS_SAV_UserArgs_MT64x64x256_MI16x16x1_SN_LDSB1_CLR1_GSU0_GSUC0_GSUWGMRR0_K1_LBSPPA1024_LBSPPB1024_MIWT2_2_PLR1_SU0_SUM0_SUS0_VWA2_VWB2_WGM6_WGMXCC1_WGMXCCGn1
    SolutionIndex: 112
    SolutionNameMin: Cijk_Alik_Bljk_BBS_BH_Bias_AS_SAV_UserArgs_MT64x64x256_MI16x16x1_SN_LDSB1_CLR1_GSU0_GSUC0_GSUWGMRR0_K1_LBSPPA1024_LBSPPB1024_MIWT2_2_PLR1_SU0_SUM0_SUS0_VWA2_VWB2_WGM6_WGMXCC1_WGMXCCGn1
    SolutionIndex: 113
    SolutionNameMin: Cijk_Alik_Bljk_BBS_BH_Bias_AS_SAV_UserArgs_MT64x64x256_MI16x16x1_SN_LDSB1_CLR1_GSU0_GSUC0_GSUWGMRR0_K1_LBSPPA1024_LBSPPB1024_MIWT2_2_PLR1_SU0_SUM0_SUS0_VWA2_VWB2_WGM6_WGMXCC1_WGMXCCGn1
    SolutionIndex: 114
    SolutionNameMin: Cijk_Alik_Bljk_BBS_BH_Bias_AS_SAV_UserArgs_MT64x64x256_MI16x16x1_SN_LDSB1_CLR1_GSU0_GSUC0_GSUWGMRR0_K1_LBSPPA1024_LBSPPB1024_MIWT2_2_PLR1_SU0_SUM0_SUS0_VWA2_VWB2_WGM8_WGMXCC1_WGMXCCGn1
    SolutionIndex: 115
    SolutionNameMin: Cijk_Alik_Bljk_BBS_BH_Bias_AS_SAV_UserArgs_MT64x64x256_MI16x16x1_SN_LDSB1_CLR1_GSU0_GSUC0_GSUWGMRR0_K1_LBSPPA1024_LBSPPB1024_MIWT2_2_PLR1_SU0_SUM0_SUS0_VWA2_VWB2_WGM8_WGMXCC1_WGMXCCGn1
    SolutionIndex: 116
    SolutionNameMin: Cijk_Alik_Bljk_BBS_BH_Bias_AS_SAV_UserArgs_MT64x64x256_MI16x16x1_SN_LDSB1_CLR1_GSU0_GSUC0_GSUWGMRR0_K1_LBSPPA1024_LBSPPB1024_MIWT2_2_PLR1_SU0_SUM0_SUS0_VWA2_VWB2_WGM8_WGMXCC1_WGMXCCGn1
    SolutionIndex: 117
    SolutionNameMin: Cijk_Alik_Bljk_BBS_BH_Bias_AS_SAV_UserArgs_MT64x64x256_MI16x16x1_SN_LDSB1_CLR1_GSU0_GSUC0_GSUWGMRR0_K1_LBSPPA1024_LBSPPB1024_MIWT2_2_PLR1_SU0_SUM0_SUS0_VWA2_VWB2_WGM8_WGMXCC1_WGMXCCGn1
    SolutionIndex: 118
    SolutionNameMin: Cijk_Alik_Bljk_BBS_BH_Bias_AS_SAV_UserArgs_MT32x64x256_MI16x16x1_SN_LDSB1_CLR1_GSU0_GSUC0_GSUWGMRR0_K1_LBSPPA512_LBSPPB1024_MIWT1_2_PLR1_SU0_SUM0_SUS0_VWA1_VWB2_WGM1_WGMXCC1_WGMXCCGn1
    SolutionIndex: 119
    SolutionNameMin: Cijk_Alik_Bljk_BBS_BH_Bias_AS_SAV_UserArgs_MT32x64x256_MI16x16x1_SN_LDSB1_CLR1_GSU0_GSUC0_GSUWGMRR0_K1_LBSPPA512_LBSPPB1024_MIWT1_2_PLR1_SU0_SUM0_SUS0_VWA1_VWB2_WGM1_WGMXCC1_WGMXCCGn1
    SolutionIndex: 120
    SolutionNameMin: Cijk_Alik_Bljk_BBS_BH_Bias_AS_SAV_UserArgs_MT32x64x256_MI16x16x1_SN_LDSB1_CLR1_GSU0_GSUC0_GSUWGMRR0_K1_LBSPPA512_LBSPPB1024_MIWT1_2_PLR1_SU0_SUM0_SUS0_VWA1_VWB2_WGM6_WGMXCC1_WGMXCCGn1
    SolutionIndex: 121
    SolutionNameMin: Cijk_Alik_Bljk_BBS_BH_Bias_AS_SAV_UserArgs_MT32x64x256_MI16x16x1_SN_LDSB1_CLR1_GSU0_GSUC0_GSUWGMRR0_K1_LBSPPA512_LBSPPB1024_MIWT1_2_PLR1_SU0_SUM0_SUS0_VWA1_VWB2_WGM6_WGMXCC1_WGMXCCGn1
    SolutionIndex: 122
    SolutionNameMin: Cijk_Alik_Bljk_BBS_BH_Bias_AS_SAV_UserArgs_MT64x32x256_MI16x16x1_SN_LDSB1_CLR1_GSU0_GSUC0_GSUWGMRR0_K1_LBSPPA1024_LBSPPB512_MIWT2_1_PLR1_SU0_SUM0_SUS0_VWA2_VWB1_WGM1_WGMXCC1_WGMXCCGn1
    SolutionIndex: 123
    SolutionNameMin: Cijk_Alik_Bljk_BBS_BH_Bias_AS_SAV_UserArgs_MT64x32x256_MI16x16x1_SN_LDSB1_CLR1_GSU0_GSUC0_GSUWGMRR0_K1_LBSPPA1024_LBSPPB512_MIWT2_1_PLR1_SU0_SUM0_SUS0_VWA2_VWB1_WGM1_WGMXCC1_WGMXCCGn1
    SolutionIndex: 124
    SolutionNameMin: Cijk_Alik_Bljk_BBS_BH_Bias_AS_SAV_UserArgs_MT64x32x256_MI16x16x1_SN_LDSB1_CLR1_GSU0_GSUC0_GSUWGMRR0_K1_LBSPPA1024_LBSPPB512_MIWT2_1_PLR1_SU0_SUM0_SUS0_VWA2_VWB1_WGM6_WGMXCC1_WGMXCCGn1
    SolutionIndex: 125
    SolutionNameMin: Cijk_Alik_Bljk_BBS_BH_Bias_AS_SAV_UserArgs_MT64x32x256_MI16x16x1_SN_LDSB1_CLR1_GSU0_GSUC0_GSUWGMRR0_K1_LBSPPA1024_LBSPPB512_MIWT2_1_PLR1_SU0_SUM0_SUS0_VWA2_VWB1_WGM6_WGMXCC1_WGMXCCGn1
    SolutionIndex: 126
    SolutionNameMin: Cijk_Alik_Bljk_BBS_BH_Bias_AS_SAV_UserArgs_MT64x32x256_MI16x16x1_SN_LDSB1_CLR1_GSU0_GSUC0_GSUWGMRR0_K1_LBSPPA1024_LBSPPB512_MIWT2_1_PLR1_SU0_SUM0_SUS0_VWA2_VWB1_WGM8_WGMXCC1_WGMXCCGn1
    SolutionIndex: 127
    SolutionNameMin: Cijk_Alik_Bljk_BBS_BH_Bias_AS_SAV_UserArgs_MT64x32x256_MI16x16x1_SN_LDSB1_CLR1_GSU0_GSUC0_GSUWGMRR0_K1_LBSPPA1024_LBSPPB512_MIWT2_1_PLR1_SU0_SUM0_SUS0_VWA2_VWB1_WGM8_WGMXCC1_WGMXCCGn1
    SolutionIndex: 128
    SolutionNameMin: Cijk_Alik_Bljk_BBS_BH_Bias_AS_SAV_UserArgs_MT32x32x256_MI16x16x1_SN_LDSB1_CLR1_GSU0_GSUC0_GSUWGMRR0_K1_LBSPPA512_LBSPPB512_MIWT1_1_PLR1_SU0_SUM0_SUS0_VWA1_VWB1_WGM1_WGMXCC1_WGMXCCGn1
    SolutionIndex: 129
    SolutionNameMin: Cijk_Alik_Bljk_BBS_BH_Bias_AS_SAV_UserArgs_MT32x32x256_MI16x16x1_SN_LDSB1_CLR1_GSU0_GSUC0_GSUWGMRR0_K1_LBSPPA512_LBSPPB512_MIWT1_1_PLR1_SU0_SUM0_SUS0_VWA1_VWB1_WGM1_WGMXCC1_WGMXCCGn1
    SolutionIndex: 130
    SolutionNameMin: Cijk_Alik_Bljk_BBS_BH_Bias_AS_SAV_UserArgs_MT32x32x256_MI16x16x1_SN_LDSB1_CLR1_GSU0_GSUC0_GSUWGMRR0_K1_LBSPPA512_LBSPPB512_MIWT1_1_PLR1_SU0_SUM0_SUS0_VWA1_VWB1_WGM1_WGMXCC1_WGMXCCGn1
    SolutionIndex: 131
    SolutionNameMin: Cijk_Alik_Bljk_BBS_BH_Bias_AS_SAV_UserArgs_MT32x32x256_MI16x16x1_SN_LDSB1_CLR1_GSU0_GSUC0_GSUWGMRR0_K1_LBSPPA512_LBSPPB512_MIWT1_1_PLR1_SU0_SUM0_SUS0_VWA1_VWB1_WGM6_WGMXCC1_WGMXCCGn1
    SolutionIndex: 132
    SolutionNameMin: Cijk_Alik_Bljk_BBS_BH_Bias_AS_SAV_UserArgs_MT32x32x256_MI16x16x1_SN_LDSB1_CLR1_GSU0_GSUC0_GSUWGMRR0_K1_LBSPPA512_LBSPPB512_MIWT1_1_PLR1_SU0_SUM0_SUS0_VWA1_VWB1_WGM6_WGMXCC1_WGMXCCGn1
    SolutionIndex: 133
    SolutionNameMin: Cijk_Alik_Bljk_BBS_BH_Bias_AS_SAV_UserArgs_MT32x32x256_MI16x16x1_SN_LDSB1_CLR1_GSU0_GSUC0_GSUWGMRR0_K1_LBSPPA512_LBSPPB512_MIWT1_1_PLR1_SU0_SUM0_SUS0_VWA1_VWB1_WGM6_WGMXCC1_WGMXCCGn1
    SolutionIndex: 134
    SolutionNameMin: Cijk_Alik_Bljk_BBS_BH_Bias_AS_SAV_UserArgs_MT32x32x256_MI16x16x1_SN_LDSB1_CLR1_GSU0_GSUC0_GSUWGMRR0_K1_LBSPPA512_LBSPPB512_MIWT1_1_PLR1_SU0_SUM0_SUS0_VWA1_VWB1_WGM8_WGMXCC1_WGMXCCGn1
    SolutionIndex: 135
    SolutionNameMin: Cijk_Alik_Bljk_BBS_BH_Bias_AS_SAV_UserArgs_MT32x32x256_MI16x16x1_SN_LDSB1_CLR1_GSU0_GSUC0_GSUWGMRR0_K1_LBSPPA512_LBSPPB512_MIWT1_1_PLR1_SU0_SUM0_SUS0_VWA1_VWB1_WGM8_WGMXCC1_WGMXCCGn1
    SolutionIndex: 136
    SolutionNameMin: Cijk_Alik_Bljk_BBS_BH_Bias_AS_SAV_UserArgs_MT32x32x256_MI16x16x1_SN_LDSB1_CLR1_GSU0_GSUC0_GSUWGMRR0_K1_LBSPPA512_LBSPPB512_MIWT1_1_PLR1_SU0_SUM0_SUS0_VWA1_VWB1_WGM8_WGMXCC1_WGMXCCGn1
    SolutionIndex: 137
    SolutionNameMin: Cijk_Alik_Bljk_BBS_BH_Bias_AS_SAV_UserArgs_MT64x64x256_MI32x32x1_SN_LDSB1_CLR1_GSU0_GSUC0_GSUWGMRR0_K1_LBSPPA512_LBSPPB512_MIWT1_1_PLR1_SU0_SUM0_SUS0_VWA1_VWB1_WGM1_WGMXCC1_WGMXCCGn1
    SolutionIndex: 138
    SolutionNameMin: Cijk_Alik_Bljk_BBS_BH_Bias_AS_SAV_UserArgs_MT64x64x256_MI32x32x1_SN_LDSB1_CLR1_GSU0_GSUC0_GSUWGMRR0_K1_LBSPPA512_LBSPPB512_MIWT1_1_PLR1_SU0_SUM0_SUS0_VWA1_VWB1_WGM6_WGMXCC1_WGMXCCGn1
    SolutionIndex: 139
    SolutionNameMin: Cijk_Alik_Bljk_BBS_BH_Bias_AS_SAV_UserArgs_MT64x64x256_MI32x32x1_SN_LDSB1_CLR1_GSU0_GSUC0_GSUWGMRR0_K1_LBSPPA512_LBSPPB512_MIWT1_1_PLR1_SU0_SUM0_SUS0_VWA1_VWB1_WGM8_WGMXCC1_WGMXCCGn1
    SolutionIndex: 140
    SolutionNameMin: Cijk_Alik_Bljk_BBS_BH_Bias_AS_SAV_UserArgs_MT64x32x128_MI16x16x1_SN_LDSB1_CLR1_GSU0_GSUC0_GSUWGMRR0_K1_LBSPPA256_LBSPPB256_MIWT2_1_PLR1_SU32_SUM0_SUS256_VWA1_VWB1_WGM1_WGMXCC1_WGMXCCGn1
- - - [128, 128, 1, 128, 128, 128, 128, 128]
    - [93, 0.042]
  - - [128, 128, 1, 256, 128, 128, 256, 256]
    - [130, 0.076]
  - - [128, 128, 1, 512, 128, 128, 512, 512]
    - [128, 0.129]
  - - [128, 128, 1, 1024, 128, 128, 1024, 1024]
    - [130, 0.214]
  - - [128, 128, 1, 2048, 128, 128, 2048, 2048]
    - [130, 0.321]
  - - [128, 128, 1, 4096, 128, 128, 4096, 4096]
    - [130, 0.435]
  - - [128, 128, 1, 8192, 128, 128, 8192, 8192]
    - [130, 0.529]
  - - [128, 256, 1, 128, 128, 128, 128, 128]
    - [91, 0.082]
  - - [128, 256, 1, 256, 128, 128, 256, 256]
    - [130, 0.15]
  - - [128, 256, 1, 512, 128, 128, 512, 512]
    - [133, 0.251]
  - - [128, 256, 1, 1024, 128, 128, 1024, 1024]
    - [130, 0.423]
  - - [128, 256, 1, 2048, 128, 128, 2048, 2048]
    - [128, 0.635]
  - - [128, 256, 1, 4096, 128, 128, 4096, 4096]
    - [128, 0.857]
  - - [128, 256, 1, 8192, 128, 128, 8192, 8192]
    - [136, 1.054]
  - - [128, 512, 1, 128, 128, 128, 128, 128]
    - [91, 0.16]
  - - [128, 512, 1, 256, 128, 128, 256, 256]
    - [130, 0.29]
  - - [128, 512, 1, 512, 128, 128, 512, 512]
    - [128, 0.497]
  - - [128, 512, 1, 1024, 128, 128, 1024, 1024]
    - [128, 0.83]
  - - [128, 512, 1, 2048, 128, 128, 2048, 2048]
    - [128, 1.252]
  - - [128, 512, 1, 4096, 128, 128, 4096, 4096]
    - [128, 1.678]
  - - [128, 512, 1, 8192, 128, 128, 8192, 8192]
    - [136, 2.077]
  - - [128, 1024, 1, 128, 128, 128, 128, 128]
    - [91, 0.31]
  - - [128, 1024, 1, 256, 128, 128, 256, 256]
    - [130, 0.575]
  - - [128, 1024, 1, 512, 128, 128, 512, 512]
    - [128, 0.971]
  - - [128, 1024, 1, 1024, 128, 128, 1024, 1024]
    - [130, 1.609]
  - - [128, 1024, 1, 2048, 128, 128, 2048, 2048]
    - [130, 2.431]
  - - [128, 1024, 1, 4096, 128, 128, 4096, 4096]
    - [128, 3.28]
  - - [128, 1024, 1, 8192, 128, 128, 8192, 8192]
    - [130, 4.115]
  - - [128, 2048, 1, 128, 128, 128, 128, 128]
    - [91, 0.61]
  - - [128, 2048, 1, 256, 128, 128, 256, 256]
    - [129, 1.082]
  - - [128, 2048, 1, 512, 128, 128, 512, 512]
    - [130, 1.872]
  - - [128, 2048, 1, 1024, 128, 128, 1024, 1024]
    - [128, 3.103]
  - - [128, 2048, 1, 2048, 128, 128, 2048, 2048]
    - [130, 4.257]
  - - [128, 2048, 1, 4096, 128, 128, 4096, 4096]
    - [136, 5.819]
  - - [128, 2048, 1, 8192, 128, 128, 8192, 8192]
    - [130, 6.915]
  - - [128, 4096, 1, 128, 128, 128, 128, 128]
    - [89, 1.121]
  - - [128, 4096, 1, 256, 128, 128, 256, 256]
    - [119, 1.951]
  - - [128, 4096, 1, 512, 128, 128, 512, 512]
    - [123, 3.261]
  - - [128, 4096, 1, 1024, 128, 128, 1024, 1024]
    - [106, 4.682]
  - - [128, 4096, 1, 2048, 128, 128, 2048, 2048]
    - [106, 6.544]
  - - [128, 4096, 1, 4096, 128, 128, 4096, 4096]
    - [139, 7.931]
  - - [128, 4096, 1, 8192, 128, 128, 8192, 8192]
    - [137, 9.566]
  - - [128, 8192, 1, 128, 128, 128, 128, 128]
    - [98, 2.002]
  - - [128, 8192, 1, 256, 128, 128, 256, 256]
    - [106, 3.385]
  - - [128, 8192, 1, 512, 128, 128, 512, 512]
    - [77, 4.882]
  - - [128, 8192, 1, 1024, 128, 128, 1024, 1024]
    - [83, 6.919]
  - - [128, 8192, 1, 2048, 128, 128, 2048, 2048]
    - [78, 8.009]
  - - [128, 8192, 1, 4096, 128, 128, 4096, 4096]
    - [105, 10.136]
  - - [128, 8192, 1, 8192, 128, 128, 8192, 8192]
    - [112, 12.206]
  - - [256, 128, 1, 128, 256, 256, 128, 128]
    - [93, 0.083]
  - - [256, 128, 1, 256, 256, 256, 256, 256]
    - [128, 0.149]
  - - [256, 128, 1, 512, 256, 256, 512, 512]
    - [130, 0.257]
  - - [256, 128, 1, 1024, 256, 256, 1024, 1024]
    - [130, 0.428]
  - - [256, 128, 1, 2048, 256, 256, 2048, 2048]
    - [128, 0.643]
  - - [256, 128, 1, 4096, 256, 256, 4096, 4096]
    - [130, 0.864]
  - - [256, 128, 1, 8192, 256, 256, 8192, 8192]
    - [130, 1.057]
  - - [256, 256, 1, 128, 256, 256, 128, 128]
    - [92, 0.157]
  - - [256, 256, 1, 256, 256, 256, 256, 256]
    - [130, 0.296]
  - - [256, 256, 1, 512, 256, 256, 512, 512]
    - [130, 0.502]
  - - [256, 256, 1, 1024, 256, 256, 1024, 1024]
    - [133, 0.811]
  - - [256, 256, 1, 2048, 256, 256, 2048, 2048]
    - [130, 1.268]
  - - [256, 256, 1, 4096, 256, 256, 4096, 4096]
    - [130, 1.697]
  - - [256, 256, 1, 8192, 256, 256, 8192, 8192]
    - [130, 2.096]
  - - [256, 512, 1, 128, 256, 256, 128, 128]
    - [93, 0.315]
  - - [256, 512, 1, 256, 256, 256, 256, 256]
    - [136, 0.56]
  - - [256, 512, 1, 512, 256, 256, 512, 512]
    - [130, 0.968]
  - - [256, 512, 1, 1024, 256, 256, 1024, 1024]
    - [130, 1.626]
  - - [256, 512, 1, 2048, 256, 256, 2048, 2048]
    - [130, 2.481]
  - - [256, 512, 1, 4096, 256, 256, 4096, 4096]
    - [130, 3.323]
  - - [256, 512, 1, 8192, 256, 256, 8192, 8192]
    - [136, 4.155]
  - - [256, 1024, 1, 128, 256, 256, 128, 128]
    - [91, 0.619]
  - - [256, 1024, 1, 256, 256, 256, 256, 256]
    - [130, 1.098]
  - - [256, 1024, 1, 512, 256, 256, 512, 512]
    - [128, 1.857]
  - - [256, 1024, 1, 1024, 256, 256, 1024, 1024]
    - [128, 3.15]
  - - [256, 1024, 1, 2048, 256, 256, 2048, 2048]
    - [130, 4.368]
  - - [256, 1024, 1, 4096, 256, 256, 4096, 4096]
    - [130, 5.979]
  - - [256, 1024, 1, 8192, 256, 256, 8192, 8192]
    - [130, 7.281]
  - - [256, 2048, 1, 128, 256, 256, 128, 128]
    - [90, 1.112]
  - - [256, 2048, 1, 256, 256, 256, 256, 256]
    - [119, 1.98]
  - - [256, 2048, 1, 512, 256, 256, 512, 512]
    - [118, 3.318]
  - - [256, 2048, 1, 1024, 256, 256, 1024, 1024]
    - [137, 4.831]
  - - [256, 2048, 1, 2048, 256, 256, 2048, 2048]
    - [137, 6.814]
  - - [256, 2048, 1, 4096, 256, 256, 4096, 4096]
    - [137, 8.738]
  - - [256, 2048, 1, 8192, 256, 256, 8192, 8192]
    - [123, 10.141]
  - - [256, 4096, 1, 128, 256, 256, 128, 128]
    - [80, 2.024]
  - - [256, 4096, 1, 256, 256, 256, 256, 256]
    - [106, 3.454]
  - - [256, 4096, 1, 512, 256, 256, 512, 512]
    - [103, 5.423]
  - - [256, 4096, 1, 1024, 256, 256, 1024, 1024]
    - [99, 7.367]
  - - [256, 4096, 1, 2048, 256, 256, 2048, 2048]
    - [101, 9.491]
  - - [256, 4096, 1, 4096, 256, 256, 4096, 4096]
    - [102, 11.206]
  - - [256, 4096, 1, 8192, 256, 256, 8192, 8192]
    - [103, 13.83]
  - - [256, 8192, 1, 128, 256, 256, 128, 128]
    - [70, 3.263]
  - - [256, 8192, 1, 256, 256, 256, 256, 256]
    - [76, 5.179]
  - - [256, 8192, 1, 512, 256, 256, 512, 512]
    - [58, 7.295]
  - - [256, 8192, 1, 1024, 256, 256, 1024, 1024]
    - [60, 9.45]
  - - [256, 8192, 1, 2048, 256, 256, 2048, 2048]
    - [70, 11.52]
  - - [256, 8192, 1, 4096, 256, 256, 4096, 4096]
    - [76, 13.695]
  - - [256, 8192, 1, 8192, 256, 256, 8192, 8192]
    - [117, 15.712]
  - - [512, 128, 1, 128, 512, 512, 128, 128]
    - [93, 0.161]
  - - [512, 128, 1, 256, 512, 512, 256, 256]
    - [130, 0.293]
  - - [512, 128, 1, 512, 512, 512, 512, 512]
    - [130, 0.501]
  - - [512, 128, 1, 1024, 512, 512, 1024, 1024]
    - [130, 0.838]
  - - [512, 128, 1, 2048, 512, 512, 2048, 2048]
    - [134, 1.247]
  - - [512, 128, 1, 4096, 512, 512, 4096, 4096]
    - [130, 1.703]
  - - [512, 128, 1, 8192, 512, 512, 8192, 8192]
    - [128, 2.086]
  - - [512, 256, 1, 128, 512, 512, 128, 128]
    - [93, 0.316]
  - - [512, 256, 1, 256, 512, 512, 256, 256]
    - [136, 0.568]
  - - [512, 256, 1, 512, 512, 512, 512, 512]
    - [128, 0.959]
  - - [512, 256, 1, 1024, 512, 512, 1024, 1024]
    - [130, 1.631]
  - - [512, 256, 1, 2048, 512, 512, 2048, 2048]
    - [133, 2.478]
  - - [512, 256, 1, 4096, 512, 512, 4096, 4096]
    - [132, 3.308]
  - - [512, 256, 1, 8192, 512, 512, 8192, 8192]
    - [136, 4.147]
  - - [512, 512, 1, 128, 512, 512, 128, 128]
    - [94, 0.613]
  - - [512, 512, 1, 256, 512, 512, 256, 256]
    - [128, 1.091]
  - - [512, 512, 1, 512, 512, 512, 512, 512]
    - [136, 1.9]
  - - [512, 512, 1, 1024, 512, 512, 1024, 1024]
    - [136, 3.153]
  - - [512, 512, 1, 2048, 512, 512, 2048, 2048]
    - [131, 4.363]
  - - [512, 512, 1, 4096, 512, 512, 4096, 4096]
    - [136, 5.919]
  - - [512, 512, 1, 8192, 512, 512, 8192, 8192]
    - [135, 7.276]
  - - [512, 1024, 1, 128, 512, 512, 128, 128]
    - [89, 1.111]
  - - [512, 1024, 1, 256, 512, 512, 256, 256]
    - [119, 1.991]
  - - [512, 1024, 1, 512, 512, 512, 512, 512]
    - [122, 3.352]
  - - [512, 1024, 1, 1024, 512, 512, 1024, 1024]
    - [138, 4.769]
  - - [512, 1024, 1, 2048, 512, 512, 2048, 2048]
    - [137, 6.682]
  - - [512, 1024, 1, 4096, 512, 512, 4096, 4096]
    - [138, 8.58]
  - - [512, 1024, 1, 8192, 512, 512, 8192, 8192]
    - [137, 10.559]
  - - [512, 2048, 1, 128, 512, 512, 128, 128]
    - [80, 2.031]
  - - [512, 2048, 1, 256, 512, 512, 256, 256]
    - [137, 3.524]
  - - [512, 2048, 1, 512, 512, 512, 512, 512]
    - [103, 5.68]
  - - [512, 2048, 1, 1024, 512, 512, 1024, 1024]
    - [77, 7.453]
  - - [512, 2048, 1, 2048, 512, 512, 2048, 2048]
    - [100, 9.702]
  - - [512, 2048, 1, 4096, 512, 512, 4096, 4096]
    - [84, 11.628]
  - - [512, 2048, 1, 8192, 512, 512, 8192, 8192]
    - [104, 14.061]
  - - [512, 4096, 1, 128, 512, 512, 128, 128]
    - [70, 3.296]
  - - [512, 4096, 1, 256, 512, 512, 256, 256]
    - [61, 5.117]
  - - [512, 4096, 1, 512, 512, 512, 512, 512]
    - [67, 7.667]
  - - [512, 4096, 1, 1024, 512, 512, 1024, 1024]
    - [68, 10.335]
  - - [512, 4096, 1, 2048, 512, 512, 2048, 2048]
    - [75, 12.255]
  - - [512, 4096, 1, 4096, 512, 512, 4096, 4096]
    - [76, 14.407]
  - - [512, 4096, 1, 8192, 512, 512, 8192, 8192]
    - [76, 16.442]
  - - [512, 8192, 1, 128, 512, 512, 128, 128]
    - [13, 4.719]
  - - [512, 8192, 1, 256, 512, 512, 256, 256]
    - [45, 7.305]
  - - [512, 8192, 1, 512, 512, 512, 512, 512]
    - [96, 9.468]
  - - [512, 8192, 1, 1024, 512, 512, 1024, 1024]
    - [44, 12.242]
  - - [512, 8192, 1, 2048, 512, 512, 2048, 2048]
    - [57, 15.958]
  - - [512, 8192, 1, 4096, 512, 512, 4096, 4096]
    - [55, 19.888]
  - - [512, 8192, 1, 8192, 512, 512, 8192, 8192]
    - [47, 21.824]
  - - [1024, 128, 1, 128, 1024, 1024, 128, 128]
    - [91, 0.32]
  - - [1024, 128, 1, 256, 1024, 1024, 256, 256]
    - [128, 0.571]
  - - [1024, 128, 1, 512, 1024, 1024, 512, 512]
    - [130, 0.97]
  - - [1024, 128, 1, 1024, 1024, 1024, 1024, 1024]
    - [128, 1.612]
  - - [1024, 128, 1, 2048, 1024, 1024, 2048, 2048]
    - [130, 2.432]
  - - [1024, 128, 1, 4096, 1024, 1024, 4096, 4096]
    - [133, 3.277]
  - - [1024, 128, 1, 8192, 1024, 1024, 8192, 8192]
    - [133, 4.119]
  - - [1024, 256, 1, 128, 1024, 1024, 128, 128]
    - [95, 0.605]
  - - [1024, 256, 1, 256, 1024, 1024, 256, 256]
    - [134, 1.091]
  - - [1024, 256, 1, 512, 1024, 1024, 512, 512]
    - [134, 1.867]
  - - [1024, 256, 1, 1024, 1024, 1024, 1024, 1024]
    - [132, 3.098]
  - - [1024, 256, 1, 2048, 1024, 1024, 2048, 2048]
    - [131, 4.325]
  - - [1024, 256, 1, 4096, 1024, 1024, 4096, 4096]
    - [133, 5.864]
  - - [1024, 256, 1, 8192, 1024, 1024, 8192, 8192]
    - [136, 7.346]
  - - [1024, 512, 1, 128, 1024, 1024, 128, 128]
    - [90, 1.12]
  - - [1024, 512, 1, 256, 1024, 1024, 256, 256]
    - [120, 1.965]
  - - [1024, 512, 1, 512, 1024, 1024, 512, 512]
    - [127, 3.36]
  - - [1024, 512, 1, 1024, 1024, 1024, 1024, 1024]
    - [113, 4.712]
  - - [1024, 512, 1, 2048, 1024, 1024, 2048, 2048]
    - [138, 6.621]
  - - [1024, 512, 1, 4096, 1024, 1024, 4096, 4096]
    - [138, 8.399]
  - - [1024, 512, 1, 8192, 1024, 1024, 8192, 8192]
    - [125, 9.954]
  - - [1024, 1024, 1, 128, 1024, 1024, 128, 128]
    - [79, 2.01]
  - - [1024, 1024, 1, 256, 1024, 1024, 256, 256]
    - [116, 3.515]
  - - [1024, 1024, 1, 512, 1024, 1024, 512, 512]
    - [116, 5.672]
  - - [1024, 1024, 1, 1024, 1024, 1024, 1024, 1024]
    - [80, 7.542]
  - - [1024, 1024, 1, 2048, 1024, 1024, 2048, 2048]
    - [80, 9.715]
  - - [1024, 1024, 1, 4096, 1024, 1024, 4096, 4096]
    - [85, 11.816]
  - - [1024, 1024, 1, 8192, 1024, 1024, 8192, 8192]
    - [117, 14.241]
  - - [1024, 2048, 1, 128, 1024, 1024, 128, 128]
    - [69, 3.301]
  - - [1024, 2048, 1, 256, 1024, 1024, 256, 256]
    - [66, 5.088]
  - - [1024, 2048, 1, 512, 1024, 1024, 512, 512]
    - [68, 7.627]
  - - [1024, 2048, 1, 1024, 1024, 1024, 1024, 1024]
    - [75, 10.259]
  - - [1024, 2048, 1, 2048, 1024, 1024, 2048, 2048]
    - [59, 12.559]
  - - [1024, 2048, 1, 4096, 1024, 1024, 4096, 4096]
    - [76, 14.699]
  - - [1024, 2048, 1, 8192, 1024, 1024, 8192, 8192]
    - [74, 16.677]
  - - [1024, 4096, 1, 128, 1024, 1024, 128, 128]
    - [14, 4.734]
  - - [1024, 4096, 1, 256, 1024, 1024, 256, 256]
    - [45, 7.548]
  - - [1024, 4096, 1, 512, 1024, 1024, 512, 512]
    - [45, 11.063]
  - - [1024, 4096, 1, 1024, 1024, 1024, 1024, 1024]
    - [45, 13.822]
  - - [1024, 4096, 1, 2048, 1024, 1024, 2048, 2048]
    - [47, 16.753]
  - - [1024, 4096, 1, 4096, 1024, 1024, 4096, 4096]
    - [47, 19.967]
  - - [1024, 4096, 1, 8192, 1024, 1024, 8192, 8192]
    - [47, 22.07]
  - - [1024, 8192, 1, 128, 1024, 1024, 128, 128]
    - [43, 5.53]
  - - [1024, 8192, 1, 256, 1024, 1024, 256, 256]
    - [32, 9.078]
  - - [1024, 8192, 1, 512, 1024, 1024, 512, 512]
    - [29, 11.425]
  - - [1024, 8192, 1, 1024, 1024, 1024, 1024, 1024]
    - [57, 14.668]
  - - [1024, 8192, 1, 2048, 1024, 1024, 2048, 2048]
    - [57, 19.104]
  - - [1024, 8192, 1, 4096, 1024, 1024, 4096, 4096]
    - [57, 21.714]
  - - [1024, 8192, 1, 8192, 1024, 1024, 8192, 8192]
    - [57, 24.021]
  - - [2048, 128, 1, 128, 2048, 2048, 128, 128]
    - [93, 0.604]
  - - [2048, 128, 1, 256, 2048, 2048, 256, 256]
    - [133, 1.081]
  - - [2048, 128, 1, 512, 2048, 2048, 512, 512]
    - [133, 1.846]
  - - [2048, 128, 1, 1024, 2048, 2048, 1024, 1024]
    - [133, 3.096]
  - - [2048, 128, 1, 2048, 2048, 2048, 2048, 2048]
    - [135, 4.29]
  - - [2048, 128, 1, 4096, 2048, 2048, 4096, 4096]
    - [134, 5.796]
  - - [2048, 128, 1, 8192, 2048, 2048, 8192, 8192]
    - [136, 6.814]
  - - [2048, 256, 1, 128, 2048, 2048, 128, 128]
    - [88, 1.105]
  - - [2048, 256, 1, 256, 2048, 2048, 256, 256]
    - [121, 1.983]
  - - [2048, 256, 1, 512, 2048, 2048, 512, 512]
    - [126, 3.323]
  - - [2048, 256, 1, 1024, 2048, 2048, 1024, 1024]
    - [87, 4.671]
  - - [2048, 256, 1, 2048, 2048, 2048, 2048, 2048]
    - [138, 6.477]
  - - [2048, 256, 1, 4096, 2048, 2048, 4096, 4096]
    - [139, 8.517]
  - - [2048, 256, 1, 8192, 2048, 2048, 8192, 8192]
    - [120, 9.835]
  - - [2048, 512, 1, 128, 2048, 2048, 128, 128]
    - [85, 2.012]
  - - [2048, 512, 1, 256, 2048, 2048, 256, 256]
    - [113, 3.486]
  - - [2048, 512, 1, 512, 2048, 2048, 512, 512]
    - [116, 5.64]
  - - [2048, 512, 1, 1024, 2048, 2048, 1024, 1024]
    - [81, 7.463]
  - - [2048, 512, 1, 2048, 2048, 2048, 2048, 2048]
    - [84, 9.628]
  - - [2048, 512, 1, 4096, 2048, 2048, 4096, 4096]
    - [111, 11.7]
  - - [2048, 512, 1, 8192, 2048, 2048, 8192, 8192]
    - [116, 14.171]
  - - [2048, 1024, 1, 128, 2048, 2048, 128, 128]
    - [76, 3.3]
  - - [2048, 1024, 1, 256, 2048, 2048, 256, 256]
    - [62, 5.127]
  - - [2048, 1024, 1, 512, 2048, 2048, 512, 512]
    - [71, 7.66]
  - - [2048, 1024, 1, 1024, 2048, 2048, 1024, 1024]
    - [75, 10.273]
  - - [2048, 1024, 1, 2048, 2048, 2048, 2048, 2048]
    - [75, 12.482]
  - - [2048, 1024, 1, 4096, 2048, 2048, 4096, 4096]
    - [74, 14.68]
  - - [2048, 1024, 1, 8192, 2048, 2048, 8192, 8192]
    - [76, 16.782]
  - - [2048, 2048, 1, 128, 2048, 2048, 128, 128]
    - [36, 4.783]
  - - [2048, 2048, 1, 256, 2048, 2048, 256, 256]
    - [53, 7.517]
  - - [2048, 2048, 1, 512, 2048, 2048, 512, 512]
    - [49, 10.838]
  - - [2048, 2048, 1, 1024, 2048, 2048, 1024, 1024]
    - [49, 13.899]
  - - [2048, 2048, 1, 2048, 2048, 2048, 2048, 2048]
    - [56, 16.941]
  - - [2048, 2048, 1, 4096, 2048, 2048, 4096, 4096]
    - [57, 20.061]
  - - [2048, 2048, 1, 8192, 2048, 2048, 8192, 8192]
    - [55, 22.614]
  - - [2048, 4096, 1, 128, 2048, 2048, 128, 128]
    - [12, 5.784]
  - - [2048, 4096, 1, 256, 2048, 2048, 256, 256]
    - [33, 8.391]
  - - [2048, 4096, 1, 512, 2048, 2048, 512, 512]
    - [29, 11.716]
  - - [2048, 4096, 1, 1024, 2048, 2048, 1024, 1024]
    - [45, 14.707]
  - - [2048, 4096, 1, 2048, 2048, 2048, 2048, 2048]
    - [55, 19.486]
  - - [2048, 4096, 1, 4096, 2048, 2048, 4096, 4096]
    - [55, 22.762]
  - - [2048, 4096, 1, 8192, 2048, 2048, 8192, 8192]
    - [57, 24.154]
  - - [2048, 8192, 1, 128, 2048, 2048, 128, 128]
    - [10, 6.756]
  - - [2048, 8192, 1, 256, 2048, 2048, 256, 256]
    - [3, 9.995]
  - - [2048, 8192, 1, 512, 2048, 2048, 512, 512]
    - [17, 14.349]
  - - [2048, 8192, 1, 1024, 2048, 2048, 1024, 1024]
    - [20, 18.998]
  - - [2048, 8192, 1, 2048, 2048, 2048, 2048, 2048]
    - [20, 21.115]
  - - [2048, 8192, 1, 4096, 2048, 2048, 4096, 4096]
    - [40, 24.054]
  - - [2048, 8192, 1, 8192, 2048, 2048, 8192, 8192]
    - [57, 25.993]
  - - [4096, 128, 1, 128, 4096, 4096, 128, 128]
    - [86, 1.107]
  - - [4096, 128, 1, 256, 4096, 4096, 256, 256]
    - [118, 1.94]
  - - [4096, 128, 1, 512, 4096, 4096, 512, 512]
    - [121, 3.231]
  - - [4096, 128, 1, 1024, 4096, 4096, 1024, 1024]
    - [138, 4.536]
  - - [4096, 128, 1, 2048, 4096, 4096, 2048, 2048]
    - [138, 6.34]
  - - [4096, 128, 1, 4096, 4096, 4096, 4096, 4096]
    - [139, 7.539]
  - - [4096, 128, 1, 8192, 4096, 4096, 8192, 8192]
    - [124, 9.282]
  - - [4096, 256, 1, 128, 4096, 4096, 128, 128]
    - [85, 1.993]
  - - [4096, 256, 1, 256, 4096, 4096, 256, 256]
    - [138, 3.414]
  - - [4096, 256, 1, 512, 4096, 4096, 512, 512]
    - [109, 5.468]
  - - [4096, 256, 1, 1024, 4096, 4096, 1024, 1024]
    - [83, 7.375]
  - - [4096, 256, 1, 2048, 4096, 4096, 2048, 2048]
    - [114, 9.394]
  - - [4096, 256, 1, 4096, 4096, 4096, 4096, 4096]
    - [108, 11.399]
  - - [4096, 256, 1, 8192, 4096, 4096, 8192, 8192]
    - [116, 14.142]
  - - [4096, 512, 1, 128, 4096, 4096, 128, 128]
    - [97, 3.284]
  - - [4096, 512, 1, 256, 4096, 4096, 256, 256]
    - [63, 4.955]
  - - [4096, 512, 1, 512, 4096, 4096, 512, 512]
    - [75, 7.504]
  - - [4096, 512, 1, 1024, 4096, 4096, 1024, 1024]
    - [75, 10.09]
  - - [4096, 512, 1, 2048, 4096, 4096, 2048, 2048]
    - [72, 12.149]
  - - [4096, 512, 1, 4096, 4096, 4096, 4096, 4096]
    - [63, 14.581]
  - - [4096, 512, 1, 8192, 4096, 4096, 8192, 8192]
    - [66, 16.223]
  - - [4096, 1024, 1, 128, 4096, 4096, 128, 128]
    - [35, 4.7]
  - - [4096, 1024, 1, 256, 4096, 4096, 256, 256]
    - [49, 7.368]
  - - [4096, 1024, 1, 512, 4096, 4096, 512, 512]
    - [49, 10.872]
  - - [4096, 1024, 1, 1024, 4096, 4096, 1024, 1024]
    - [49, 13.884]
  - - [4096, 1024, 1, 2048, 4096, 4096, 2048, 2048]
    - [52, 16.984]
  - - [4096, 1024, 1, 4096, 4096, 4096, 4096, 4096]
    - [52, 19.497]
  - - [4096, 1024, 1, 8192, 4096, 4096, 8192, 8192]
    - [51, 21.448]
  - - [4096, 2048, 1, 128, 4096, 4096, 128, 128]
    - [11, 5.71]
  - - [4096, 2048, 1, 256, 4096, 4096, 256, 256]
    - [31, 8.483]
  - - [4096, 2048, 1, 512, 4096, 4096, 512, 512]
    - [30, 11.607]
  - - [4096, 2048, 1, 1024, 4096, 4096, 1024, 1024]
    - [49, 14.99]
  - - [4096, 2048, 1, 2048, 4096, 4096, 2048, 2048]
    - [57, 19.504]
  - - [4096, 2048, 1, 4096, 4096, 4096, 4096, 4096]
    - [52, 22.309]
  - - [4096, 2048, 1, 8192, 4096, 4096, 8192, 8192]
    - [57, 24.007]
  - - [4096, 4096, 1, 128, 4096, 4096, 128, 128]
    - [8, 6.659]
  - - [4096, 4096, 1, 256, 4096, 4096, 256, 256]
    - [0, 10.059]
  - - [4096, 4096, 1, 512, 4096, 4096, 512, 512]
    - [22, 13.821]
  - - [4096, 4096, 1, 1024, 4096, 4096, 1024, 1024]
    - [19, 19.669]
  - - [4096, 4096, 1, 2048, 4096, 4096, 2048, 2048]
    - [38, 21.343]
  - - [4096, 8192, 1, 128, 4096, 4096, 128, 128]
    - [5, 7.445]
  - - [4096, 8192, 1, 256, 4096, 4096, 256, 256]
    - [4, 11.493]
  - - [4096, 8192, 1, 512, 4096, 4096, 512, 512]
    - [24, 17.36]
  - - [4096, 8192, 1, 1024, 4096, 4096, 1024, 1024]
    - [26, 21.447]
  - - [4096, 8192, 1, 2048, 4096, 4096, 2048, 2048]
    - [38, 24.63]
  - - [8192, 128, 1, 128, 8192, 8192, 128, 128]
    - [82, 1.942]
  - - [8192, 128, 1, 256, 8192, 8192, 256, 256]
    - [113, 3.253]
  - - [8192, 128, 1, 512, 8192, 8192, 512, 512]
    - [108, 4.953]
  - - [8192, 128, 1, 1024, 8192, 8192, 1024, 1024]
    - [115, 6.886]
  - - [8192, 128, 1, 2048, 8192, 8192, 2048, 2048]
    - [107, 8.427]
  - - [8192, 128, 1, 4096, 8192, 8192, 4096, 4096]
    - [108, 10.21]
  - - [8192, 128, 1, 8192, 8192, 8192, 8192, 8192]
    - [110, 12.36]
  - - [8192, 256, 1, 128, 8192, 8192, 128, 128]
    - [73, 3.248]
  - - [8192, 256, 1, 256, 8192, 8192, 256, 256]
    - [64, 4.923]
  - - [8192, 256, 1, 512, 8192, 8192, 512, 512]
    - [75, 7.378]
  - - [8192, 256, 1, 1024, 8192, 8192, 1024, 1024]
    - [60, 9.549]
  - - [8192, 256, 1, 2048, 8192, 8192, 2048, 2048]
    - [64, 11.812]
  - - [8192, 256, 1, 4096, 8192, 8192, 4096, 4096]
    - [64, 13.648]
  - - [8192, 256, 1, 8192, 8192, 8192, 8192, 8192]
    - [65, 15.46]
  - - [8192, 512, 1, 128, 8192, 8192, 128, 128]
    - [37, 4.656]
  - - [8192, 512, 1, 256, 8192, 8192, 256, 256]
    - [49, 7.311]
  - - [8192, 512, 1, 512, 8192, 8192, 512, 512]
    - [53, 10.065]
  - - [8192, 512, 1, 1024, 8192, 8192, 1024, 1024]
    - [48, 13.268]
  - - [8192, 512, 1, 2048, 8192, 8192, 2048, 2048]
    - [54, 16.313]
  - - [8192, 512, 1, 4096, 8192, 8192, 4096, 4096]
    - [57, 18.662]
  - - [8192, 512, 1, 8192, 8192, 8192, 8192, 8192]
    - [57, 20.481]
  - - [8192, 1024, 1, 128, 8192, 8192, 128, 128]
    - [9, 5.651]
  - - [8192, 1024, 1, 256, 8192, 8192, 256, 256]
    - [34, 8.49]
  - - [8192, 1024, 1, 512, 8192, 8192, 512, 512]
    - [30, 11.301]
  - - [8192, 1024, 1, 1024, 8192, 8192, 1024, 1024]
    - [50, 14.566]
  - - [8192, 1024, 1, 2048, 8192, 8192, 2048, 2048]
    - [57, 17.815]
  - - [8192, 1024, 1, 4096, 8192, 8192, 4096, 4096]
    - [46, 19.68]
  - - [8192, 1024, 1, 8192, 8192, 8192, 8192, 8192]
    - [47, 21.7]
  - - [8192, 2048, 1, 128, 8192, 8192, 128, 128]
    - [7, 6.792]
  - - [8192, 2048, 1, 256, 8192, 8192, 256, 256]
    - [1, 9.94]
  - - [8192, 2048, 1, 512, 8192, 8192, 512, 512]
    - [16, 13.908]
  - - [8192, 2048, 1, 1024, 8192, 8192, 1024, 1024]
    - [24, 18.371]
  - - [8192, 2048, 1, 2048, 8192, 8192, 2048, 2048]
    - [21, 19.95]
  - - [8192, 2048, 1, 4096, 8192, 8192, 4096, 4096]
    - [38, 24.239]
  - - [8192, 2048, 1, 8192, 8192, 8192, 8192, 8192]
    - [28, 25.588]
  - - [8192, 4096, 1, 128, 8192, 8192, 128, 128]
    - [2, 7.554]
  - - [8192, 4096, 1, 256, 8192, 8192, 256, 256]
    - [18, 11.629]
  - - [8192, 4096, 1, 512, 8192, 8192, 512, 512]
    - [15, 15.176]
  - - [8192, 4096, 1, 1024, 8192, 8192, 1024, 1024]
    - [21, 20.322]
  - - [8192, 4096, 1, 2048, 8192, 8192, 2048, 2048]
    - [42, 23.797]
  - - [8192, 8192, 1, 128, 8192, 8192, 128, 128]
    - [6, 8.279]
  - - [8192, 8192, 1, 256, 8192, 8192, 256, 256]
    - [23, 13.696]
  - - [8192, 8192, 1, 512, 8192, 8192, 512, 512]
    - [39, 18.92]
  - - [8192, 8192, 1, 1024, 8192, 8192, 1024, 1024]
    - [24, 24.465]
  - - [8192, 8192, 1, 2048, 8192, 8192, 2048, 2048]
    - [19, 26.313]
  - - [4096, 4096, 1, 4096, 4096, 4096, 4096, 4096]
    - [38, 23.711]
  - - [4096, 4096, 1, 8192, 4096, 4096, 8192, 8192]
    - [41, 25.921]
  - - [4096, 8192, 1, 4096, 4096, 4096, 4096, 4096]
    - [38, 26.344]
  - - [4096, 8192, 1, 8192, 4096, 4096, 8192, 8192]
    - [27, 28.963]
  - - [8192, 4096, 1, 4096, 8192, 8192, 4096, 4096]
    - [40, 26.854]
  - - [8192, 4096, 1, 8192, 8192, 8192, 8192, 8192]
    - [25, 29.154]
  - - [8192, 8192, 1, 4096, 8192, 8192, 4096, 4096]
    - [16, 26.22]
  - - [8192, 8192, 1, 8192, 8192, 8192, 8192, 8192]
    - [25, 33.262]
  - - [1, 1, 1, 32, 1, 1, 32, 32]
    - [140, 0.0]
- null
- null
- DeviceEfficiency
- GridBased
